index,url,valid,domain,title,description,image,published,archive,content,quote,language,keyword
https://www.journaldugeek.com/2024/05/14/megalopolis-a-enfin-un-teaser-francis-ford-coppola-veut-charmer-hollywood/,https://www.journaldugeek.com/2024/05/14/megalopolis-a-enfin-un-teaser-francis-ford-coppola-veut-charmer-hollywood/,0,www.journaldugeek.com,Megalopolis a enfin un teaser ! Francis Ford Coppola veut charmer Hollywood,"Toujours en quête de distributeurs, Francis Ford Coppola offre un premier aperçu de son colossal Megalopolis. De quoi rassurer Hollywood ?",https://www.journaldugeek.com/app/uploads/2024/05/megalopolis-teaser-francis-ford-coppola.jpg,2024-05-14T08:04:44Z,,"Quelques jours avant son avant-première à Cannes, Megalopolis s’offre un teaser. Cela fait maintenant quarante ans que le cinéaste tente de faire éclore cette épopée à mi-chemin entre le péplum et la… [+2738 chars]",,fr,'Francis Ford Coppola'
https://www.huffingtonpost.fr/culture/article/megalopolis-de-francis-ford-coppola-casting-bande-annonce-tout-ce-qu-on-sait-sur-le-film-evenement-clx1_233365.html,https://www.huffingtonpost.fr/culture/article/megalopolis-de-francis-ford-coppola-casting-bande-annonce-tout-ce-qu-on-sait-sur-le-film-evenement-clx1_233365.html,0,www.huffingtonpost.fr,"« Megalopolis » de Francis Ford Coppola : casting, bande-annonce… tout ce qu’on sait sur le film évènement","Avec ce projet à 120 millions de dollars, Francis Ford Coppola marque son grand retour. Son long-métrage « Megalopolis » est l’un des films les plus attendus du festival de Cannes de 2024.",https://huffpost-focus.sirius.press/2024/05/14/0/0/1920/1080/1820/1023/75/0/27cd493_1715675013742-vignette-front-ba-megalopolis.jpg,2024-05-14T08:49:30Z,,"La lecture de ce contenu est susceptible dentraîner un dépôt de cookies de la part de lopérateur tiers qui lhéberge. Compte-tenu des choix que vous avez exprimés en matière de dépôt de cookies, nous … [+3645 chars]",,fr,'Francis Ford Coppola'
https://www.madmoizelle.com/cannes-2024-les-5-films-reperes-par-la-redac-quon-a-hate-de-voir-1755819,https://www.madmoizelle.com/cannes-2024-les-5-films-reperes-par-la-redac-quon-a-hate-de-voir-1755819,0,www.madmoizelle.com,Cannes 2024 : les 5 films repérés par la rédac qu’on a hâte de voir,"Le retour de Francis Ford Coppola avec Megalopolis, de David Cronenberg avec Les Linceuls ou encore de Yórgos Lánthimos (déjà !) avec Kinds of Kindness… De nombreux films sélectionnés au Festival de Cannes 2024 sont attendus comme de véritables évènements dan…",https://www.madmoizelle.com/wp-content/uploads/2024/05/copie-de-image-de-une-horizontale-2024-05-14t095549571.jpg,2024-05-14T09:50:00Z,,"Du 14 au 25 mai, le Festival de Cannes fera la part belle à des noms historiques du cinéma. Mais ce sont surtout les jeunes créations qui ont attiré notre attention.
Le retour de Francis Ford Coppol… [+5110 chars]",,fr,'Francis Ford Coppola'
https://www.presse-citron.net/megalopolis-tout-savoir-sur-le-film-qui-signe-le-grand-retour-de-francis-ford-coppola/,https://www.presse-citron.net/megalopolis-tout-savoir-sur-le-film-qui-signe-le-grand-retour-de-francis-ford-coppola/,0,www.presse-citron.net,Megalopolis : tout savoir sur le film qui signe le grand retour de Francis Ford Coppola,La bande-annonce du très attendu Megalopolis de Francis Ford Coppola vient de sortir. On fait le point.,https://www.presse-citron.net/app/uploads/2024/05/megalopolis-coppola.jpg,2024-05-14T11:33:59Z,,"Francis Ford Coppola est lheureux détenteur de deux Palmes dor, pour Conversation secrète et Apocalypse Now. Comme on dit, jamais deux sans trois. Le cinéaste présente son nouveau long métrage, Megal… [+2779 chars]",,fr,'Francis Ford Coppola'
https://korben.info/megalopolis-epopee-cinematographique-francis-ford-coppola.html,https://korben.info/megalopolis-epopee-cinematographique-francis-ford-coppola.html,0,korben.info,Megalopolis – La bande annonce de l’épopée cinématographique de Francis Ford Coppola,"Megalopolis, le projet de rêve de Francis Ford Coppola, va enfin voir le jour après 40 ans de préparation. Ce film de science-fiction au casting stellaire, mené par Adam Driver, s'annonce comme une épopée visionnaire. Malgré les défis rencontrés, Coppola est …",https://korben.info/app/uploads/2024/05/SCR-20240514-kaz.webp,2024-05-14T12:40:47Z,,"Megalopolis. Un nom qui résonne dans l’esprit des cinéphiles depuis plus de 40 ans. Le projet de rêve, l’uvre totale, la quête ultime de Francis Ford Coppola, le légendaire réalisateur du Parrain et … [+4433 chars]",,fr,'Francis Ford Coppola'
https://www.lesnumeriques.com/film/megalopolis-francis-ford-coppola-devoile-son-nouveau-film-dans-un-teaser-renversant-n221699.html,https://www.lesnumeriques.com/film/megalopolis-francis-ford-coppola-devoile-son-nouveau-film-dans-un-teaser-renversant-n221699.html,0,www.lesnumeriques.com,Actualité : Megalopolis : Francis Ford Coppola dévoile son nouveau film dans un teaser renversant,"Le long-métrage Megalopolis, au casting tout aussi éblouissant que ses images, sera présenté au Festival de Cannes le 17 mai 2024.",https://cdn.lesnumeriques.com/optim/news/22/221699/47409e81-megalopolis-le-nouveau-film-de-francis-ford-coppola-se-devoile-dans-un-teaser-renversant__1200_678__0-155-908-631.jpg,2024-05-14T12:57:00Z,,"Megalopolis sortira prochainement en France.
© American Zoetrope
Francis Ford Coppola, réalisateur de films cultes du cinéma étasunien tels que Le Parrain et Apocalypse Now, en montre toujours dava… [+2311 chars]",,fr,'Francis Ford Coppola'
