index,url,valid,domain,title,description,image,published,archive,content,quote,language,keyword
https://www.rtbf.be/article/menaces-contre-alexander-de-croo-la-defense-du-militaire-demande-la-surveillance-electronique-11235429,https://www.rtbf.be/article/menaces-contre-alexander-de-croo-la-defense-du-militaire-demande-la-surveillance-electronique-11235429,0,www.rtbf.be,Menaces contre Alexander De Croo : la défense du militaire demande la surveillance électronique,L’ex-militaire belge arrêté en Norvège pour menaces de mort envers le Premier ministre Alexander De Croo a comparu...,https://ds.static.rtbf.be/article/image/1920x1080/c/9/0/6e661bb0388f651cf1168fa0f0eb624f-1690881547.jpg,2023-08-01T09:24:50Z,,Lex-militaire belge arrêté en Norvège pour menaces de mort envers le Premier ministre Alexander De Croo a comparu mardi devant la chambre du conseil de Bruxelles. Sa défense a plaidé pour quil soit p… [+1622 chars],,fr,'Alexander De Croo'
https://www.lalibre.be/belgique/judiciaire/2023/08/01/la-chambre-du-conseil-prolonge-la-detention-de-lex-militaire-qui-a-menace-de-croo-MJXECJ56ZJBNDELINFNTN4TQ4A/,https://www.lalibre.be/belgique/judiciaire/2023/08/01/la-chambre-du-conseil-prolonge-la-detention-de-lex-militaire-qui-a-menace-de-croo-MJXECJ56ZJBNDELINFNTN4TQ4A/,0,www.lalibre.be,La chambre du conseil prolonge la détention de l'ex-militaire qui a menacé De Croo,"La chambre du conseil de Bruxelles a décidé mardi de prolonger d'un mois la détention préventive de l'ex-militaire belge arrêté en Norvège pour menaces de mort envers le Premier ministre Alexander De Croo, a indiqué le parquet fédéral.","https://www.lalibre.be/resizer/maVP4WcxKmgFUH2uI_F44Xfydvw=/1200x630/filters:format(jpeg):focal(368.5x254:378.5x244):watermark(cloudfront-eu-central-1.images.arcpublishing.com/ipmgroup/OIO44DUUUNC2DB5T3FIJECBT5U.png,0,-0,0,100)/cloudfront-eu-central-1.images.arcpublishing.com/ipmgroup/MZNY2T4ATJAV3NYKPVZROX2JUQ.jpg",2023-08-01T13:51:16Z,,"Le 7 juillet dernier, Sam H. avait diffusé sur les réseaux sociaux une vidéo où on le voyait tirer quatre coups de feu sur une photo du Premier ministre. Le parquet du Limbourg, où réside l'intéressé… [+1310 chars]",,fr,'Alexander De Croo'
https://www.francetvinfo.fr/culture/cinema/infographies-oppenheimer-mission-impossible-indiana-jones-pourquoi-les-plus-gros-succes-au-box-office-sont-ils-de-plus-en-plus-longs_5976917.html,https://www.francetvinfo.fr/culture/cinema/infographies-oppenheimer-mission-impossible-indiana-jones-pourquoi-les-plus-gros-succes-au-box-office-sont-ils-de-plus-en-plus-longs_5976917.html,0,www.francetvinfo.fr,"INFOGRAPHIES. ""Oppenheimer"", ""Mission : Impossible"", ""Indiana Jones""… Pourquoi les plus gros succès au box-office sont-ils de plus en plus longs ?","Le dernier film de Christopher Nolan dure trois heures. Et vous ne rêvez pas : d'une manière générale, la durée des films qui cumulent le plus d'entrées au box-office français a tendance à s'allonger.",https://www.francetvinfo.fr/pictures/PvDUDK-yq1ESsjOZc8E7tvpE0hk/1500x843/2023/06/20/6491a8a9a68a9_080-hl-mtirler-2085042.jpg,2023-08-02T04:00:32Z,,"""Mais que c'est long !"" Si vous êtes allé au cinéma ces derniers temps, il est fort probable que ces mots vous soient passés par la tête. Les longs-métrages n'ont jamais aussi bien porté leur nom. Un… [+7106 chars]",,fr,'Christopher Nolan'
https://www.lexpress.fr/monde/europe/giorgia-meloni-en-afrique-une-percee-diplomatique-tous-azimuts-P2O7TSU2MVCDTD7O3WK34MNAQU/,https://www.lexpress.fr/monde/europe/giorgia-meloni-en-afrique-une-percee-diplomatique-tous-azimuts-P2O7TSU2MVCDTD7O3WK34MNAQU/,0,www.lexpress.fr,"Giorgia Meloni : en Afrique, une percée diplomatique tous azimuts","Giorgia Meloni : en Afrique, une percée diplomatique tous azimuts",https://www.lexpress.fr/resizer/sP-xEfDusfrlIjfMwDD0bJAZJys=/1200x630/filters:focal(1162x467:1172x477)/cloudfront-eu-central-1.images.arcpublishing.com/lexpress/L5ZZ2SU7G5AVNOSSKKIBLUBTRI.jpg,2023-08-02T06:20:00Z,,"Cheffe de lopposition, Giorgia Meloni adoptait des accents guerriers pour réclamer un blocus naval des côtes nord-africaines. Cheffe du gouvernement, elle use désormais dune voix feutrée pour se prés… [+5923 chars]",,fr,'Matteo Salvini'
https://www.lepoint.fr/people/la-blague-de-brad-pitt-qui-a-rendu-furieux-george-clooney-02-08-2023-2530397_2116.php,https://www.lepoint.fr/people/la-blague-de-brad-pitt-qui-a-rendu-furieux-george-clooney-02-08-2023-2530397_2116.php,0,www.lepoint.fr,La blague de Brad Pitt qui a rendu furieux George Clooney,Matt Damon a raconte comment Brad Pitt avait un jour piege son pote George Clooney sur un tournage. Les represailles n'ont pas tarde...,https://static.lpnt.fr/images/2023/08/02/25013763lpw-25013922-mega-une-jpg_9683472.jpg,2023-08-02T10:16:00Z,,Ils ont tourné plusieurs films ensemble et s'entendent comme larrons en foire Quitte à rivaliser pour savoir qui remportera le prix de la meilleure blague. Ce fut notamment le cas sur le tournage de … [+2908 chars],,fr,'George Clooney'
https://www.fark.com/comments/12944904/Oh-lord-now-MTG-is-trying-to-out-holy-Lauren-Boebert,https://www.fark.com/comments/12944904/Oh-lord-now-MTG-is-trying-to-out-holy-Lauren-Boebert,0,www.fark.com,"Oh lord, now MTG is trying to out-holy Lauren Boebert [Facepalm]",<table> <tr><td> </td><td> [link] [19 comments] </td></tr></table>,https://usrimg-full.fark.net/B/BG/fark_BGaUeRM_YOY_-AXRtITB_WZRnW4.png?AWSAccessKeyId=UKDINQXVGV49TCSSKJLK&Expires=1691380800&Signature=MeYqCL9zhAu%2B7usXz5LdIpWgvlY%3D,2023-08-02T17:20:12Z,,"Well, that's fine, because God isn't going to do anything.OTOH, there are SO many people who think God tells them to do something, and there is always the possibility that one of these nutcases will â€¦ [+355 chars]",,fr,'Lauren Boebert'
https://www.liberation.fr/politique/confidences-dans-lavion-emmanuel-macron-promet-une-initiative-politique-dampleur-avant-la-fin-aout-20230802_T45T5CFFYBGGJM5Z52FY4AQSJM/,https://www.liberation.fr/politique/confidences-dans-lavion-emmanuel-macron-promet-une-initiative-politique-dampleur-avant-la-fin-aout-20230802_T45T5CFFYBGGJM5Z52FY4AQSJM/,0,www.liberation.fr,Confidences dans l’avion : Emmanuel Macron promet «une initiative politique d’ampleur» avant la fin août,"Le «Figaro Magazine» publie ce mercredi 2 août les propos du Président recueillis dans l’avion au retour de sa virée dans le Pacifique. Il revient sur les émeutes, appelle à ne pas faire d’amalgame entre immigration et intégration et précise les contours de l…",https://www.liberation.fr/resizer/wL1sPJK5C7ATsdwNSmZPilgfzFs=/1200x630/filters:format(jpg):quality(70):focal(1111x1000:1121x1010)/cloudfront-eu-central-1.images.arcpublishing.com/liberation/YAFDW2XDURAAPGN4RMWWBN7LFQ.jpg,2023-08-02T18:03:48Z,,"Entre Nouméa et Paris, le président de la République a livré à bord de lAirbus A 320 ses analyses au journaliste du Fig Mag, qui les publie ce mercredi 2 août. Malgré des «zones de turbulence», quelq… [+5790 chars]",,fr,'Emmanuel Macron'
https://www.dhnet.be/medias/cinema/2023/08/03/greve-a-hollywood-des-stars-donnent-chacune-au-moins-un-million-de-dollars-aux-acteurs-3LGAEHF6WZA5FKNGEWB2RWLXTA/,https://www.dhnet.be/medias/cinema/2023/08/03/greve-a-hollywood-des-stars-donnent-chacune-au-moins-un-million-de-dollars-aux-acteurs-3LGAEHF6WZA5FKNGEWB2RWLXTA/,0,www.dhnet.be,Grève à Hollywood: des stars donnent chacune au moins un million de dollars aux acteurs,"Une dizaine de stars parmi les plus célèbres et fortunées d'Hollywood, de George Clooney à Meryl Streep, ont donné chacune un million de dollars ou davantage pour soutenir les acteurs américains en grève, a indiqué le fonds de solidarité de leur syndicat merc…","https://www.dhnet.be/resizer/n4c3ARp89_QFOoznFxnHiCOC_a8=/1200x630/filters:format(jpeg):focal(1495x999.5:1505x989.5):watermark(cloudfront-eu-central-1.images.arcpublishing.com/ipmgroup/KSYODHLMNBBMDA7B5YPJPTFVNY.png,0,-0,0,100)/cloudfront-eu-central-1.images.arcpublishing.com/ipmgroup/ZUV7CB2KMJASJMGZNIYQ2RKHYU.jpg",2023-08-03T07:52:00Z,,"Avec ce double mouvement social, inédit depuis 1960, la quasi-totalité des productions de films et de séries sont à l'arrêt aux Etats-Unis.
Outre George Clooney et Meryl Streep, d'autres célébrités … [+1256 chars]",,fr,'George Clooney'
https://www.lavenir.net/actu/monde/2023/08/03/des-stars-donnent-chacune-au-moins-un-million-de-dollars-aux-acteurs-en-greve-a-hollywood-T373YJ5KTNBUPH2HKCVUTOPGGU/,https://www.lavenir.net/actu/monde/2023/08/03/des-stars-donnent-chacune-au-moins-un-million-de-dollars-aux-acteurs-en-greve-a-hollywood-T373YJ5KTNBUPH2HKCVUTOPGGU/,0,www.lavenir.net,Des stars donnent chacune au moins un million de dollars aux acteurs en grève à Hollywood,"Une dizaine de stars parmi les plus célèbres et fortunées d'Hollywood, de George Clooney à Meryl Streep, ont donné chacune un million de dollars ou davantage pour soutenir les acteurs américains en grève, a indiqué le fonds de solidarité de leur syndicat merc…","https://www.lavenir.net/resizer/LWMNgtNMCUr6485u-4M6XRlc6u8=/1200x630/filters:format(jpeg):focal(2366x1753.5:2376x1743.5):watermark(cloudfront-eu-central-1.images.arcpublishing.com/ipmgroup/UFVD77VYQZHRHBUO5OR7E7I6TY.png,0,-0,0,100)/cloudfront-eu-central-1.images.arcpublishing.com/ipmgroup/4AACQSSHTREGXGYQNN6NXO277U.jpg",2023-08-03T08:54:04Z,,"Avec ce double mouvement social, inédit depuis 1960, la quasi-totalité des productions de films et de séries sont à l'arrêt aux États-Unis.
Outre George Clooney et Meryl Streep, d'autres célébrités … [+1211 chars]",,fr,'Matt Damon'
https://www.huffingtonpost.fr/politique/article/les-cotes-de-popularite-de-macron-et-borne-font-jeu-egal-apres-le-remaniement-une-premiere-exclusif_221413.html,https://www.huffingtonpost.fr/politique/article/les-cotes-de-popularite-de-macron-et-borne-font-jeu-egal-apres-le-remaniement-une-premiere-exclusif_221413.html,0,www.huffingtonpost.fr,"Les cotes de popularité de Macron et Borne font jeu égal après le remaniement, une première - EXCLUSIF","La cote de popularité du président de la République se stabilise dans le baromètre « YouGov » pour « Le HuffPost », alors que celle de la Première ministre connaît une forte embellie.",https://huffpost-focus.sirius.press/2023/08/04/40/0/3552/1998/1820/1023/75/0/77d1b13_1691145033420-000-33em8pn-1.jpg,2023-08-04T11:11:51Z,,"POLITIQUE - Un bulletin de notes satisfaisant avant les vacances. La popularité dEmmanuel Macron se stabilise ce début août, deux semaines après les menus ajustements au sein du gouvernement, dont la… [+4636 chars]",,fr,président de la République
