index,url,valid,domain,title,description,image,published,archive,content,quote,language,keyword
https://www.presse-citron.net/elon-devrait-rentrer-dans-son-pays-donald-trump-assassine-elon-musk-avec-cette-verite-qui-derange/,https://www.presse-citron.net/elon-devrait-rentrer-dans-son-pays-donald-trump-assassine-elon-musk-avec-cette-verite-qui-derange/,0,www.presse-citron.net,« Elon devrait rentrer dans son pays » : Donald Trump assassine Elon Musk avec cette vérité qui dérange,"C’est confirmé, Donald Trump et Elon Musk ne passeront pas leurs vacances ensemble.",https://www.presse-citron.net/app/uploads/2024/11/elon-musk-donald-trump-spaceX-1500x900.jpg,2025-07-01T06:41:54Z,,"On les avait quittés fâchés et, malgré le relatif calme qui régnait depuis quelques semaines, le torchon brûle toujours entre Donald Trump et Elon Musk. Un des motifs (il y en a dautres) de dispute e… [+2856 chars]",,fr,'Donald Trump'
https://www.lesnumeriques.com/societe-numerique/america-party-elon-musk-menace-trump-de-lancer-son-propre-parti-politique-n238982.html,https://www.lesnumeriques.com/societe-numerique/america-party-elon-musk-menace-trump-de-lancer-son-propre-parti-politique-n238982.html,0,www.lesnumeriques.com,"Actualité : “America Party” : après les voitures, l’IA et les fusées, Elon Musk veut lancer son propre parti politique","Il ne se contente plus de la tech, des fusées et des voitures électriques. Elon Musk menace désormais de créer son propre parti politique. Derrière cette déclaration choc, une rupture frontale avec Trump, une vision radicale de la démocratie… et un glissement…",https://cdn.lesnumeriques.com/optim/news/23/238982/36bcb645-america-party-elon-musk-menace-trump-de-lancer-son-propre-parti-politique__1200_678__0-85-9216-4923.jpg,2025-07-01T07:02:00Z,,"Elon Musk brandit la menace de créer son propre parti, lAmerica Party, pour redonner une voix au peuple face au système bipartisan quil juge obsolète.
© Shutterstock
Cest un tweet, comme souvent ch… [+3520 chars]",,fr,'Elon Musk'
https://www.huffingtonpost.fr/politique/article/jordan-bardella-recu-par-nicolas-sarkozy-dans-ses-bureaux-parisiens_252060.html,https://www.huffingtonpost.fr/politique/article/jordan-bardella-recu-par-nicolas-sarkozy-dans-ses-bureaux-parisiens_252060.html,0,www.huffingtonpost.fr,Jordan Bardella reçu par Nicolas Sarkozy dans ses bureaux parisiens,Cela fait plusieurs mois que le dauphin de Marine Le Pen multiplie les clins d’œil à l’endroit de l’ancien chef de l’État.,https://focus.huffingtonpost.fr/2025/07/01/542/0/5206/2928/1820/1023/75/0/6aeea3a_upload-1-ya4qwddsm2y9-000-644u499.jpg,2025-07-01T12:37:22Z,,"POLITIQUE - La digue entre la droite et son extrême saffaisse un peu plus. Selon les informations du Parisien confirmées au HuffPost dans la foulée, Jordan Bardella a été reçu ce mardi 1er juillet pa… [+2412 chars]",,fr,'Marine Le Pen'
https://www.journaldunet.com/business/action-publique/1542803-elon-musk-menace-de-fonder-un-parti-donald-trump-repond-en-visant-ses-subventions/,https://www.journaldunet.com/business/action-publique/1542803-elon-musk-menace-de-fonder-un-parti-donald-trump-repond-en-visant-ses-subventions/,0,www.journaldunet.com,"Elon Musk menace de fonder un parti, Donald Trump répond en visant ses subventions","Le débat autour du nouveau projet de loi budgétaire américain a provoqué une escalade entre le chef de l'Etat et le patron de Tesla, sur fond de coupes fiscales et d'accusations de dépendance aux aides publiques.",https://img-0.journaldunet.com/NMpPKktbTr8ymOWNTY7T6UbH_ig=/1500x/smart/2833025e85224de78dc5cfecd0d306ac/ccmcms-jdn/39523634.jpg,2025-07-01T14:03:08Z,,"Le débat autour du nouveau projet de loi budgétaire américain a provoqué une escalade entre le chef de l'Etat et le patron de Tesla, sur fond de coupes fiscales et d'accusations de dépendance aux aid… [+3743 chars]",,fr,'Elon Musk'
https://www.cathobel.be/2025/07/la-faim-ne-doit-pas-etre-utilisee-comme-une-arme-de-guerre-tel-est-le-premier-message-en-espagnol-du-pape-leon-xiv/,https://www.cathobel.be/2025/07/la-faim-ne-doit-pas-etre-utilisee-comme-une-arme-de-guerre-tel-est-le-premier-message-en-espagnol-du-pape-leon-xiv/,0,www.cathobel.be,"« La faim ne doit pas être utilisée comme une arme de guerre », tel est le premier message en espagnol du pape Léon XIV","Dans son message aux participants à la 44e session de la Conférence de la FAO, le pape Léon XIV condamne le fait que de nombreuses personnes succombent au fléau de la faim.",https://cathobel.cdnartwhere.eu/wp-content/uploads/2025/07/faim-c-CCO-Pxhere.png,2025-07-01T14:17:06Z,,"Dans son message aux participants à la 44e session de la Conférence de la FAO, le pape Léon XIV condamne le fait que de nombreuses personnes succombent au fléau de la faim. ""Tandis que les civils son… [+7820 chars]",,fr,'Léon XIV'
https://www.lalibre.be/international/amerique/2025/07/01/expulser-musk-trump-va-examiner-la-possibilite-AN5BXHGDKNF6XI3SWUPPMYR3DA/,https://www.lalibre.be/international/amerique/2025/07/01/expulser-musk-trump-va-examiner-la-possibilite-AN5BXHGDKNF6XI3SWUPPMYR3DA/,0,www.lalibre.be,"Expulser Musk? Trump va ""examiner"" la possibilité","Donald Trump a déclaré mardi qu'il allait ""examiner"" la possibilité d'expulser Elon Musk après les déclarations incendiaires de l'homme le plus riche du monde contre le mégaprojet de loi budgétaire que le président américain cherche à faire adopter par le Con…",https://www.lalibre.be/resizer/v2/G6NFSDNIV5GZDGU4W7QDHFJGP4.jpg?auth=9c2b5cedc46d42d47db8d8edcb046ba24c2f1c3970a0c359b0f3dc950d4ae172&width=1200&height=630&quality=85&focal=2259%2C1506&watermark=https%3A%2F%2Fcloudfront-eu-central-1.images.arcpublishing.com%2Fipmgroup%2F3R4IDPARFVEO3L2LC5OCCXQ5RM.png%3A100%3A0%2C557,2025-07-01T14:27:57Z,,"""On pourrait mettre Doge sur Elon. Vous savez ce qu'est Doge? Doge est le monstre qui pourrait se retourner et croquer Elon"", a ajouté le président américain.
Doge est chargée de sabrer dans les dép… [+1672 chars]",,fr,'Donald Trump'
https://www.generation-nt.com/actualites/tesla-vehicule-electrique-occasion-baisse-prix-effet-musk-2059715,https://www.generation-nt.com/actualites/tesla-vehicule-electrique-occasion-baisse-prix-effet-musk-2059715,0,www.generation-nt.com,"Les prix des véhicules Tesla d'occasion continuent de baisser, avec ou sans effet Musk",Tesla affronte toujours une baisse de ses ventes en Europe et le marché de l'occasion ne lui est toujours pas favorable. L'image sulfureuse d'Elon Musk ne suffit pas à expliquer le phénomène.,https://img.generation-nt.com/tesla-model-3-highland-03_04B002A301691478.webp,2025-07-01T14:50:01Z,,Les ventes de véhicules électriques Tesla sont en baisse en Europe depuis fin 2024 et le passage de son dirigeant Elon Musk au sein du DOGE n'a probablement pas aidé à freiner les chutes de volumes.,,,
https://www.20minutes.fr/arts-stars/people/4161360-20250701-brooklyn-beckham-joint-nicola-peltz-celebrer-anniversaire-pere,https://www.20minutes.fr/arts-stars/people/4161360-20250701-brooklyn-beckham-joint-nicola-peltz-celebrer-anniversaire-pere,0,www.20minutes.fr,Brooklyn Beckham se joint à Nicola Peltz pour célébrer l’anniversaire de son père,L’hommage du couple à l’octogénaire contraste avec leur absence aux célébrations récentes des 50 ans de David Beckham,https://img.20mn.fr/fJtY3Dv1TfCym0CZFK0uZCk/1444x920_brooklyn-beckham,2025-07-01T14:50:28Z,,"Brooklyn Beckham sest joint à Nicola Peltz pour célébrer les 83 ans du père de lactrice américaine. Cette dernière, mariée à laîné de la fratrie Beckham depuis 2022, a partagé sur son compte Instagra… [+1837 chars]",,fr,'David Beckham'
https://www.lalibre.be/international/moyen-orient/2025/07/01/liran-est-il-sur-le-point-de-divulguer-des-centaines-de-mails-des-proches-de-trump-des-hackers-affirment-posseder-100-go-de-messages-a-diffuser-FHPAEHG6I5CHTPJY5YV6KUGV2E/,https://www.lalibre.be/international/moyen-orient/2025/07/01/liran-est-il-sur-le-point-de-divulguer-des-centaines-de-mails-des-proches-de-trump-des-hackers-affirment-posseder-100-go-de-messages-a-diffuser-FHPAEHG6I5CHTPJY5YV6KUGV2E/,0,www.lalibre.be,L’Iran est-il sur le point de divulguer des centaines d’e-mails des proches de Trump ? Des hackers affirment posséder 100 Go de messages à diffuser,"Sous le pseudo de “Robert”, ces hackers déclarent posséder de nombreux messages appartenant aux proches de Donald Trump. ...",https://www.lalibre.be/resizer/v2/5GZ2F2EOYNADZGRKQ5LLB7V7WA.jpg?auth=752118507f64c465eebc36152ca18dfbd01ae97d51537d8f77eb3d889825c116&width=1200&height=630&quality=85&focal=4128%2C2752&watermark=https%3A%2F%2Fcloudfront-eu-central-1.images.arcpublishing.com%2Fipmgroup%2F3R4IDPARFVEO3L2LC5OCCXQ5RM.png%3A100%3A0%2C557,2025-07-01T14:51:46Z,,"Le 12 août 2024, à l'approche des élections américaines, la BBC révélait que la messagerie de l'équipe de campagne de Trump avait été hackée par des agents iraniens. Cette fois-ci, c'est Reuters qui … [+914 chars]",,fr,'Donald Trump'
https://www.dhnet.be/actu/monde/2025/07/01/liran-est-il-sur-le-point-de-divulguer-des-centaines-de-mails-des-proches-de-trump-des-hackers-affirment-posseder-100-go-de-messages-a-diffuser-QCNNUB5JTVCI5KYTCH7DPER3YY/,https://www.dhnet.be/actu/monde/2025/07/01/liran-est-il-sur-le-point-de-divulguer-des-centaines-de-mails-des-proches-de-trump-des-hackers-affirment-posseder-100-go-de-messages-a-diffuser-QCNNUB5JTVCI5KYTCH7DPER3YY/,0,www.dhnet.be,L’Iran est-il sur le point de divulguer des centaines d’e-mails des proches de Trump ? Des hackers affirment posséder 100 Go de messages à diffuser,"Sous le pseudo de “Robert”, ces hackers déclarent posséder de nombreux messages appartenant aux proches de Donald Trump. ...",https://www.dhnet.be/resizer/v2/5GZ2F2EOYNADZGRKQ5LLB7V7WA.jpg?auth=752118507f64c465eebc36152ca18dfbd01ae97d51537d8f77eb3d889825c116&width=1200&height=630&quality=85&focal=4128%2C2752&watermark=https%3A%2F%2Fcloudfront-eu-central-1.images.arcpublishing.com%2Fipmgroup%2FDZNGDE46VVGXRGHD3TEI5RB3GM.png%3A100%3A0%2C559,2025-07-01T15:00:07Z,,"Le 12 août 2024, à l'approche des élections américaines, la BBC révélait que la messagerie de l'équipe de campagne de Trump avait été hackée par des agents iraniens. Cette fois-ci, c'est Reuters qui … [+914 chars]",,fr,'Donald Trump'
https://www.nouvelobs.com/monde/20250701.OBS105501/la-grande-et-belle-loi-budgetaire-de-trump-s-eternise-au-senat-et-ravive-les-tensions-avec-musk.html,https://www.nouvelobs.com/monde/20250701.OBS105501/la-grande-et-belle-loi-budgetaire-de-trump-s-eternise-au-senat-et-ravive-les-tensions-avec-musk.html,0,www.nouvelobs.com,La « grande et belle » loi budgétaire de Trump s’éternise au Sénat et ravive les tensions avec Musk,"Même si les républicains disposent d’une majorité aux deux chambres du Congrès américain, l’issue du vote de la « One Big Beautiful Bill » de Donald Trump est incertaine. Certains conservateurs critiquent la hausse de la dette publique déclenchée par ces bais…",https://focus.nouvelobs.com/2025/07/01/0/0/5641/3760/1200/800/0/0/b35ee41_upload-1-conq1wqpsykn-sipa-shutterstock41296450-000011.jpg,2025-07-01T15:04:17Z,,"Donald J. Trump devant la Maison Blanche le 1er juillet 2025.  SHUTTERSTOCK/SIPA
Commenter
 Lire plus tard 
Google Actualités
Partager
 Sabonner
Après une nuit de débats intenses, les sénateurs… [+5257 chars]",,fr,'Donald Trump'
https://www.dhnet.be/actu/belgique/2025/07/01/entre-trump-et-musk-rien-ne-va-plus-le-patron-de-tesla-menace-de-creer-un-nouveau-parti-le-president-lui-propose-de-rentrer-en-afrique-du-sud-ZACCZE43MFBO3JWGSHKN6VO75I/,https://www.dhnet.be/actu/belgique/2025/07/01/entre-trump-et-musk-rien-ne-va-plus-le-patron-de-tesla-menace-de-creer-un-nouveau-parti-le-president-lui-propose-de-rentrer-en-afrique-du-sud-ZACCZE43MFBO3JWGSHKN6VO75I/,0,www.dhnet.be,"Entre Trump et Musk, rien ne va plus : le patron de Tesla menace de créer un nouveau parti, le président lui propose de rentrer en Afrique du Sud","La bromance entre Elon Musk et Donald Trump a définitivement tourné au vinaigre. Après des mois de tensions croissantes, les deux milliardaires aux ego surdimensionnés s’affrontent désormais publiquement sur la “One Big Beautiful Bill Act”, le projet de loi p…",https://www.dhnet.be/resizer/v2/XHLQSDBEEVHDTG3AESX3BPWQ7U.jpg?auth=0cee18c807dd229a70b18074579a25bf219ba0b06e7906017ac8b6e8ca04c1d6&width=1200&height=630&quality=85&focal=2237%2C1491&watermark=https%3A%2F%2Fcloudfront-eu-central-1.images.arcpublishing.com%2Fipmgroup%2FDZNGDE46VVGXRGHD3TEI5RB3GM.png%3A100%3A0%2C559,2025-07-01T15:29:05Z,,"Leurs récents échanges acides sur la ""One Big Beautiful Bill Act"" ne sont que les derniers développements d'une déchirure qui ne cesse de s'étirer depuis plusieurs mois. Le divorce avait été prédit d… [+3836 chars]",,fr,'Donald Trump'
https://www.frandroid.com/culture-tech/politique/2716777_menace-de-deportation-nouveau-parti-politique-doge-vs-tesla-le-torchon-brule-entre-elon-musk-et-donald-trump,https://www.frandroid.com/culture-tech/politique/2716777_menace-de-deportation-nouveau-parti-politique-doge-vs-tesla-le-torchon-brule-entre-elon-musk-et-donald-trump,0,www.frandroid.com,"Menace de déportation, nouveau parti politique, DOGE vs Tesla : le torchon brûle entre Elon Musk et Donald Trump","L'idylle entre Donald Trump et Elon Musk semble déjà un lointain passé. Les deux milliardaires se déchirent autour de la loi proposée par Donald Trump. Ce dernier menace Elon Musk de déportation, et Elon Musk menace de se lancer lui-même en politique.","https://c0.lestechnophiles.com/images.frandroid.com/wp-content/uploads/2025/04/54381120223-92b07861be-o-1200x800-1.jpg?resize=1600,900&key=40a36a77&watermark",2025-07-01T15:32:00Z,,"L’idylle entre Donald Trump et Elon Musk semble déjà un lointain passé. Les deux milliardaires se déchirent autour de la loi proposée par Donald Trump. Ce dernier menace Elon Musk de déportation, et … [+4289 chars]",,fr,'Elon Musk'
https://www.lexpress.fr/monde/amerique/elon-musk-bientot-expulse-des-etats-unis-donald-trump-va-examiner-la-possibilite-VUQTNPNHNREFBN7ZCTYLGLKFYU/,https://www.lexpress.fr/monde/amerique/elon-musk-bientot-expulse-des-etats-unis-donald-trump-va-examiner-la-possibilite-VUQTNPNHNREFBN7ZCTYLGLKFYU/,0,www.lexpress.fr,"Elon Musk bientôt expulsé des Etats-Unis ? Donald Trump va ""examiner"" la possibilité","Donald Trump a une nouvelle fois attaqué de manière virulente, ce mardi, son ancien allié Elon Musk.",https://www.lexpress.fr/resizer/v2/XKQQ4IN5K5GGBDX7IT3ENM6OPY.jpg?auth=bd7e34e164dad2928009ad6ed7bfd7eb17d6ba3c0c9397d45fc2ee33f468394e&width=1200&height=630&quality=85&smart=true,2025-07-01T15:45:50Z,,"Donald Trump a déclaré, ce mardi 1er juillet, qu'il allait ""examiner"" la possibilité d'expulser Elon Musk après les déclarations incendiaires de l'homme le plus riche du monde contre le mégaprojet de… [+2217 chars]",,fr,'Donald Trump'
https://www.huffingtonpost.fr/politique/article/en-pleine-canicule-la-clim-s-invite-dans-le-debat-politique-et-s-erige-en-nouveau-clivage_252059.html,https://www.huffingtonpost.fr/politique/article/en-pleine-canicule-la-clim-s-invite-dans-le-debat-politique-et-s-erige-en-nouveau-clivage_252059.html,0,www.huffingtonpost.fr,"En pleine canicule, la clim s’invite dans le débat politique et s’érige en nouveau clivage","L’idée soumise par Marine Le Pen de lancer « un grand plan pour la climatisation » ne convainc ni le gouvernement ni les Écologistes, qui lui opposent plusieurs arguments.",https://focus.huffingtonpost.fr/2025/07/01/215/0/6453/3629/1820/1023/75/0/a34f41a_upload-1-pfrgovil5kau-000-49u73b9.jpg,2025-07-01T15:47:54Z,,"POLITIQUE - De lair ! La France voit rouge. Des températures jamais enregistrées sont en train dêtre mesurées partout dans le pays. 39 degrés à Paris, 38 à Tours, 37 à Limoges... Dans les écoles, au … [+4498 chars]",,fr,'Marine Le Pen'
https://www.huffingtonpost.fr/international/video/donald-trump-se-lache-encore-contre-elon-musk-et-n-exclut-pas-de-l-expulser-des-etats-unis_252068.html,https://www.huffingtonpost.fr/international/video/donald-trump-se-lache-encore-contre-elon-musk-et-n-exclut-pas-de-l-expulser-des-etats-unis_252068.html,0,www.huffingtonpost.fr,Donald Trump se lâche encore contre Elon Musk et n’exclut pas de l’expulser des États-Unis,"Le président américain menace aussi le patron de Tesla, avec lequel il est en guerre ouverte, de faire couper ses subventions fédérales.",https://focus.huffingtonpost.fr/2025/03/07/102/0/8256/4644/1820/1023/75/0/a744dee_sirius-fs-upload-1-pf8xl7wdgrvr-1741336043650-000-36xm28g.jpg,2025-07-01T16:00:34Z,,"ÉTATS-UNIS - Après leur rupture ultra-médiatisée, Donald Trump et Elon Musk continuent de sétriper par déclarations interposées. La dispute entre les deux anciens alliés semble même aller toujours pl… [+5191 chars]",,fr,'Elon Musk'
https://www.20minutes.fr/monde/4161409-20250701-etats-unis-trump-va-examiner-possibilite-expulser-musk-tesla-devisse-bourse,https://www.20minutes.fr/monde/4161409-20250701-etats-unis-trump-va-examiner-possibilite-expulser-musk-tesla-devisse-bourse,0,www.20minutes.fr,"Etats-Unis : Trump va « examiner » la possibilité d’expulser Musk, Tesla dévisse en Bourse","Donald Trump a déclaré qu’il allait examiner la possibilité d’expulser Elon Musk suite aux critiques de ce dernier sur son projet de loi budgétaire, ajoutant que Doge, qui traque les dépenses budgétaires, pourrait se retourner contre le milliardaire",https://img.20mn.fr/VDFiI2PEQu-s3r45oi0DeSk/1444x920_elon-musk-is-still-vehemently-opposed-to-the-mega-budget-law-wanted-by-donald-trump-currently-being-examined-in-the-us-senate-donald-trump-and-elon-musk-have-once-again-insulted-each-other-via-social-networks-in-recent-days-on-july-01-2025-yassine-mahjoub-sipa-mahjoubyassine-by2f9672-credit-yassine-mahjoub-sipa-2507011739,2025-07-01T16:11:11Z,,Donald Trump a déclaré mardi quil allait « examiner » la possibilité dexpulser Elon Musk. Une déclaration qui fait suite à celles - incendiaires - de lhomme le plus riche du monde contre le mégaproje… [+2721 chars],,fr,'Donald Trump'
https://www.lepoint.fr/monde/comment-donald-trump-veut-utiliser-le-doge-contre-elon-musk-01-07-2025-2593442_24.php,https://www.lepoint.fr/monde/comment-donald-trump-veut-utiliser-le-doge-contre-elon-musk-01-07-2025-2593442_24.php,0,www.lepoint.fr,Comment Donald Trump veut utiliser le Doge contre Elon Musk,L'arme du milliardaire va-t-elle se retourner contre lui ? Donald Trump pourrait user de l'organisme pour couper les subventions aux entreprises du patron de Tesla et SpaceX.,https://static.lpnt.fr/images/2025/07/01/27648324lpw-27648482-mega-une-jpg_11216973.jpg,2025-07-01T16:22:00Z,,"Le département de l'efficacité gouvernementale (Doge) va-t-il se retourner contre celui qui en a longtemps profité ? En tout cas, Donald Trump n'exclut pas d'utiliser l'organisme, dédié à trouver des… [+3212 chars]",,fr,'Elon Musk'
https://www.journaldugeek.com/2025/07/02/donald-trump-menace-dexpulser-elon-musk-des-etats-unis/,https://www.journaldugeek.com/2025/07/02/donald-trump-menace-dexpulser-elon-musk-des-etats-unis/,0,www.journaldugeek.com,Donald Trump menace d’expulser Elon Musk des États-Unis !,"La guéguerre entre les deux ex-meilleurs amis du monde a repris de plus belle, à peine un mois après une trêve fragile. Cette fois, le président américain menace de retourner contre Elon Musk les outils de régulation qu’il a lui-même mis en place… et laisse m…",https://www.journaldugeek.com/app/uploads/2024/11/elon-musk.jpg,2025-07-02T06:01:15Z,,"Elon Musk aime se présenter comme un self-made man, un génie visionnaire qui a bâti ses entreprises à la seule force de son gros cerveau. En réalité, le milliardaire a largement bénéficié des subside… [+2483 chars]",,fr,'Elon Musk'
https://www.lalibre.be/international/amerique/2025/07/02/nous-navons-pas-besoin-de-communistes-dans-ce-pays-trump-menace-darreter-un-candidat-a-la-mairie-de-new-york-Y362U32S75DEHAJERHBZZVJGXU/,https://www.lalibre.be/international/amerique/2025/07/02/nous-navons-pas-besoin-de-communistes-dans-ce-pays-trump-menace-darreter-un-candidat-a-la-mairie-de-new-york-Y362U32S75DEHAJERHBZZVJGXU/,0,www.lalibre.be,”Nous n’avons pas besoin de communistes dans ce pays” : Trump menace d’arrêter un candidat à la mairie de New York,"Donald Trump a menacé ce lundi Zohran Mamdani, candidat démocrate à la mairie de New York, de l’arrêter s’il bloque les actions de l’agence fédérale de l’immigration en cas d’élection. ...",https://www.lalibre.be/resizer/v2/HZWAV6D5N5HAVIQR3BFBFJFHZE.jpg?auth=2cca25a82e90dadbb14b36b39a018eb42d73cc45b8f3ccea9eddbf9a87546c25&width=1200&height=630&quality=85&focal=1500%2C1000&watermark=https%3A%2F%2Fcloudfront-eu-central-1.images.arcpublishing.com%2Fipmgroup%2F3R4IDPARFVEO3L2LC5OCCXQ5RM.png%3A100%3A0%2C557,2025-07-02T06:40:31Z,,"Zohran Mamdani, 33 ans, élu à l'assemblée de l'État de New York depuis 2021, propose de transformer la ville en zone sanctuaire renforcée : fin de toute coopération avec l'ICE, gel des loyers, gratui… [+2111 chars]",,fr,'Zohran Mamdani'
https://www.dhnet.be/actu/monde/2025/07/02/il-a-menace-de-menfermer-dans-un-camp-de-detention-et-de-me-deporter-la-tension-monte-entre-donald-trump-et-un-candidat-a-la-mairie-de-new-york-KHK5RZZI7JHNLDHWDMRBB4FJZQ/,https://www.dhnet.be/actu/monde/2025/07/02/il-a-menace-de-menfermer-dans-un-camp-de-detention-et-de-me-deporter-la-tension-monte-entre-donald-trump-et-un-candidat-a-la-mairie-de-new-york-KHK5RZZI7JHNLDHWDMRBB4FJZQ/,0,www.dhnet.be,”Il a menacé de m’enfermer dans un camp de détention et de me déporter” : la tension monte entre Donald Trump et un candidat à la mairie de New York,"Donald Trump a menacé ce lundi Zohran Mamdani, candidat démocrate à la mairie de New York, de l’arrêter s’il bloque les actions de l’agence fédérale de l’immigration en cas d’élection. ...",https://www.dhnet.be/resizer/v2/2KCQLFPZOFECPPCZC4WYLHGFHM.jpg?auth=78c741f3c90ab6d2e149cb1e98943674fc3017c32368cb01f82fe3d2018f2322&width=1200&height=630&quality=85&focal=3966%2C2644&watermark=https%3A%2F%2Fcloudfront-eu-central-1.images.arcpublishing.com%2Fipmgroup%2FDZNGDE46VVGXRGHD3TEI5RB3GM.png%3A100%3A0%2C559,2025-07-02T06:51:02Z,,"Zohran Mamdani, 33 ans, élu à l'assemblée de l'État de New York depuis 2021, propose de transformer la ville en zone sanctuaire renforcée : fin de toute coopération avec l'ICE, gel des loyers, gratui… [+2109 chars]",,fr,'Donald Trump'
https://www.frandroid.com/marques/xiaomi/2717411_tesla-est-vraiment-incroyable-le-patron-de-xiaomi-reagit-a-une-nouvelle-fonction-des-voitures-electriques-delon-musk,https://www.frandroid.com/marques/xiaomi/2717411_tesla-est-vraiment-incroyable-le-patron-de-xiaomi-reagit-a-une-nouvelle-fonction-des-voitures-electriques-delon-musk,0,www.frandroid.com,« Tesla est vraiment incroyable » : le patron de Xiaomi réagit à une nouvelle fonction des voitures électriques d’Elon Musk,"Si Xiaomi et Tesla sont désormais rivaux, le patron de la marque chinoise n’hésite pas à faire l’éloge de la firme américaine. Et tout particulièrement au sujet de la conduite autonome des voitures électriques d’Elon Musk.","https://c0.lestechnophiles.com/images.frandroid.com/wp-content/uploads/2024/07/xiaomi-su7-lei-jun-00002-scaled.jpg?resize=1600,900&key=71cd2950&watermark",2025-07-02T08:10:59Z,,"Si Xiaomi et Tesla sont désormais rivaux, le patron de la marque chinoise n’hésite pas à faire l’éloge de la firme américaine. Et tout particulièrement au sujet de la conduite autonome des voitures é… [+4040 chars]",,fr,'Elon Musk'
https://www.huffingtonpost.fr/international/article/zohran-mamdani-ne-se-laisse-pas-faire-face-a-donald-trump-qui-menace-de-l-expulser_252105.html,https://www.huffingtonpost.fr/international/article/zohran-mamdani-ne-se-laisse-pas-faire-face-a-donald-trump-qui-menace-de-l-expulser_252105.html,0,www.huffingtonpost.fr,Zohran Mamdani ne se laisse pas faire face à Donald Trump qui menace de l’expulser,Le candidat démocrate à la mairie de New York est l’objet de menaces et d’insultes de la part du président américain.,https://focus.huffingtonpost.fr/2025/06/25/0/0/4821/2711/1820/1023/75/0/8d179db_upload-1-hvee6twtqzbb-063-2221992160.jpg,2025-07-02T08:50:38Z,,"INTERNATIONAL - Pour Trump, un « communiste » à la tête de New York, cest hors de question. Depuis quil a remporté la primaire démocrate pour la mairie de New York fin juin, le candidat Zohran Mamdan… [+3235 chars]",,fr,'Donald Trump'
https://www.huffingtonpost.fr/tech-futurs/video/justin-bieber-en-larmes-les-revelations-de-taylor-swift-sur-le-proces-de-p-diddy-les-mensonges-par-ia-font-un-carton_252102.html,https://www.huffingtonpost.fr/tech-futurs/video/justin-bieber-en-larmes-les-revelations-de-taylor-swift-sur-le-proces-de-p-diddy-les-mensonges-par-ia-font-un-carton_252102.html,0,www.huffingtonpost.fr,"Justin Bieber en larmes, les révélations de Taylor Swift... Sur le procès de P. Diddy, les mensonges par IA font un carton",Un flot mensonger de vidéos sensationnalistes sur le procès P. Diddy inonde YouTube depuis plusieurs semaines.,https://focus.huffingtonpost.fr/2025/07/02/0/0/1920/1080/1820/1023/75/0/d268b30_upload-1-9ur17g3petgo-h10.jpg,2025-07-02T09:58:10Z,,"La lecture de ce contenu est susceptible dentraîner un dépôt de cookies de la part de lopérateur tiers qui lhéberge. Compte-tenu des choix que vous avez exprimés en matière de dépôt de cookies, nous … [+3500 chars]",,fr,'Justin Bieber'
