index,url,valid,domain,title,description,image,published,archive,content,quote,language,keyword
https://www.ouest-france.fr/politique/la-cote-de-popularite-demmanuel-macron-et-gabriel-attal-en-legere-hausse-apres-les-legislatives-cc93ec8e-5010-11ef-a7c4-aadce4c8cac1,https://www.ouest-france.fr/politique/la-cote-de-popularite-demmanuel-macron-et-gabriel-attal-en-legere-hausse-apres-les-legislatives-cc93ec8e-5010-11ef-a7c4-aadce4c8cac1,0,www.ouest-france.fr,La cote de popularité d’Emmanuel Macron et Gabriel Attal en légère hausse après les législatives,"La popularité du président de la République et de son Premier ministre démissionnaire s’établit à respectivement 27 % et 33 % d’opinions positives, selon un sondage publié ce jeudi 1er août.",https://media.ouest-france.fr/v1/pictures/MjAyNDA4OTExOTk0ZDgxYWNkMTYyMDk2ZGY5YzY4MWI4OGQ3OWM?width=1260&height=708&focuspoint=50%2C25&cropresize=1&client_id=bpeditorial&sign=3e282ec8d586d882f2254a025d67f3417d1e61e7f147b2488eac5b71aee45c56,2024-08-01T15:14:26Z,,"Trois semaines après les élections législatives, les cotes de confiance dEmmanuel Macron et de son Premier ministre démissionnaire, Gabriel Attal, ont gagné deux points pour sétablir respectivement à… [+1534 chars]",,fr,'président de la République'
https://www.liberation.fr/international/amerique/le-journaliste-evan-gershkovich-et-deux-autres-anciens-prisonniers-en-russie-arrives-aux-etats-unis-20240802_C7CVPUK6Z5BM7DDT24PNNCCPPQ/,https://www.liberation.fr/international/amerique/le-journaliste-evan-gershkovich-et-deux-autres-anciens-prisonniers-en-russie-arrives-aux-etats-unis-20240802_C7CVPUK6Z5BM7DDT24PNNCCPPQ/,0,www.liberation.fr,Le journaliste Evan Gershkovich et deux autres anciens prisonniers en Russie arrivés aux Etats-Unis,"Joe Biden et Kamala Harris ont accueilli dans la nuit de jeudi 1er août les trois anciens détenus, dont l’ex-Marine Paul Whelan et la journaliste russo-américaine Alsu Kurmasheva, de retour sur le sol américain après des mois, voire des années de détention ar…",https://www.liberation.fr/resizer/ot3FfNXyTv1y1lN2qCS_xXy7RKk=/1200x630/filters:format(jpg):quality(70)/cloudfront-eu-central-1.images.arcpublishing.com/liberation/U4VOANTE35F3VDMO6AT3ZLJ5AA.jpg,2024-08-02T06:14:41Z,,"Le président américain Joe Biden a accueilli dans la nuit de jeudi aux Etats-Unis trois des détenus libérés par la Russie, parmi lesquels le journaliste américain Evan Gershkovich, au terme du plus g… [+2776 chars]",,fr,'Joe Biden'
https://www.huffingtonpost.fr/jo-paris-2024/video/jo-de-paris-2024-gerald-darmanin-dresse-le-bilan-securitaire-positif-de-la-premiere-semaine-des-jeux_237837.html,https://www.huffingtonpost.fr/jo-paris-2024/video/jo-de-paris-2024-gerald-darmanin-dresse-le-bilan-securitaire-positif-de-la-premiere-semaine-des-jeux_237837.html,0,www.huffingtonpost.fr,JO de Paris 2024 : Gérald Darmanin dresse le bilan sécuritaire (positif) de la première semaine des Jeux,"Satisfait du travail des forces de l’ordre dans la capitale et autour des sites olympiques, le ministre démissionnaire de l’Intérieur évoque d’« excellents chiffres ».",https://huffpost-focus.sirius.press/2024/08/02/212/0/4890/2750/1820/1023/75/0/55bcfbf_1722585407171-000-364w96u.jpg,2024-08-02T08:10:43Z,,"JO PARIS 2024 - Sept jours à haut risque. Une semaine après le coup denvoi des JO de Paris 2024, symbolisé par la grandiose cérémonie douverture sur la Seine, le ministre de lIntérieur démissionnaire… [+4287 chars]",,fr,'Gérald Darmanin'
https://www.francetvinfo.fr/les-jeux-olympiques/judo/reportage-judo-aux-jo-de-paris-2024-le-heros-teddy-riner-omar-sy-en-maitre-de-ceremonie-l-arena-champ-de-mars-s-est-enflammee-pour-les-francais_6702231.html,https://www.francetvinfo.fr/les-jeux-olympiques/judo/reportage-judo-aux-jo-de-paris-2024-le-heros-teddy-riner-omar-sy-en-maitre-de-ceremonie-l-arena-champ-de-mars-s-est-enflammee-pour-les-francais_6702231.html,0,www.francetvinfo.fr,"REPORTAGE. Judo aux JO de Paris 2024 : le ""héros"" Teddy Riner, Omar Sy en maître de cérémonie... L'Arena Champ-de-Mars s'est enflammée pour les Français",8 000 personnes étaient présentes à l'Arena Champ-de-Mars pour supporter Teddy Riner et Romane Dicko pour le dernier jour de compétition de judo en individuel.,https://www.francetvinfo.fr/pictures/qIgL3OHCeGnDYFj8TZiTMT7RI60/0x53:1024x629/1500x843/2024/08/02/000-368v6j7-66acf6a34836c149501841.jpg,2024-08-02T16:54:08Z,,"Il est 11h30 quand le sol tremble. Pas de séisme en vue mais un homme en kimono blanc vient de faire son apparition dans l'Arena Champ-de-Mars pour son entrée en lice aux Jeux olympiques de Paris, ve… [+4018 chars]",,fr,'Omar Sy'
https://www.huffingtonpost.fr/jo-paris-2024/video/jo-de-paris-2024-teddy-riner-et-le-judo-ont-trouve-l-ambianceur-parfait-pour-cette-journee-cruciale_237866.html,https://www.huffingtonpost.fr/jo-paris-2024/video/jo-de-paris-2024-teddy-riner-et-le-judo-ont-trouve-l-ambianceur-parfait-pour-cette-journee-cruciale_237866.html,0,www.huffingtonpost.fr,JO de Paris 2024 : Teddy Riner et le judo ont trouvé l’ambianceur parfait pour cette journée cruciale,"Omar Sy n’a pas fait les choses à moitié, à l’Arena Champ-de-Mars de Paris, où il a été invité à lancer la journée de compétition ce 2 août.",https://huffpost-focus.sirius.press/2024/08/02/0/0/1920/1080/1820/1023/75/0/7a49353_1722618120906-home-2.jpg,2024-08-02T17:45:42Z,,"La lecture de ce contenu est susceptible dentraîner un dépôt de cookies de la part de lopérateur tiers qui lhéberge. Compte-tenu des choix que vous avez exprimés en matière de dépôt de cookies, nous … [+2612 chars]",,fr,'Omar Sy'
https://www.liberation.fr/international/europe/russie-lechange-historique-de-prisonniers-incite-poutine-a-prendre-dautres-otages-avertit-un-opposant-russe-libere-20240802_B6IMJQG7UZFKPE3PIZHWLAEZYI/,https://www.liberation.fr/international/europe/russie-lechange-historique-de-prisonniers-incite-poutine-a-prendre-dautres-otages-avertit-un-opposant-russe-libere-20240802_B6IMJQG7UZFKPE3PIZHWLAEZYI/,0,www.liberation.fr,"Russie : l’échange historique de prisonniers «incite Poutine à prendre d’autres otages», avertit un opposant russe libéré","Des opposants russes remis en liberté dans le cadre de l’opération entre Moscou et les Occidentaux ont expliqué vendredi 2 août lors d’une conférence de presse en Allemagne, n’avoir jamais demandé à être renvoyés de Russie et jugé que le compromis pourrait en…",https://www.liberation.fr/resizer/CHyRtPjz8HQI09oPTFv12liopr4=/1200x630/filters:format(jpg):quality(70):focal(1650x1373:1660x1383)/cloudfront-eu-central-1.images.arcpublishing.com/liberation/EVSXK7FDNRHYNO4KT2OUTMSIIU.jpg,2024-08-02T19:21:18Z,,Ce qui apparaît comme léchange de prisonniers le plus important depuis la guerre froide a été largement salué par de nombreux dirigeants et organisations internationales. Vingt-six prisonniers ont ét… [+3796 chars],,fr,'Poutine'
https://www.bfmtv.com/international/amerique-nord/etats-unis/elections-americaines/etats-unis-a-pres-de-100-ans-l-ancien-president-jimmy-carter-s-accroche-pour-pouvoir-voter-kamala-harris_AN-202408030338.html,https://www.bfmtv.com/international/amerique-nord/etats-unis/elections-americaines/etats-unis-a-pres-de-100-ans-l-ancien-president-jimmy-carter-s-accroche-pour-pouvoir-voter-kamala-harris_AN-202408030338.html,0,www.bfmtv.com,"États-Unis: à près de 100 ans, l'ancien président Jimmy Carter ""s'accroche"" pour pouvoir voter Kamala Harris","L'ancien président démocrate Jimmy Carter, qui soufflera ses 100 bougies le 1er octobre, explique que l'espoir de pouvoir voter pour Kamala Harris en novembre est la ""seule"" chose qui le fait tenir.",https://images.bfmtv.com/fb4lTjIoKnEUtbHH3NCDuCGscs8=/0x137:2048x1289/2048x0/images/Jimmy-Carter-39eme-president-des-Etats-Unis-le-2-mai-2015-1209626.jpg,2024-08-03T17:16:51Z,,"L'ancien président démocrate Jimmy Carter, qui soufflera ses 100 bougies le 1er octobre, explique que l'espoir de pouvoir voter pour Kamala Harris en novembre est la ""seule"" chose qui le fait tenir.… [+1615 chars]",,fr,'Jimmy Carter'
https://www.ledauphine.com/elections/2024/08/03/jimmy-carter-en-soins-palliatifs-veut-tenir-pour-voter-kamala-harris,https://www.ledauphine.com/elections/2024/08/03/jimmy-carter-en-soins-palliatifs-veut-tenir-pour-voter-kamala-harris,0,www.ledauphine.com,"Etats-Unis. Jimmy Carter, en soins palliatifs, veut « tenir » pour voter Kamala Harris","L'ex président démocrate américain, quasi centenaire et qui reçoit des soins de fin de vie depuis février 2023, montre un regain d'intérêt pour la politique et pour se maintenir depuis l'annonce de la candidature de Kamala Harris à la présidentielle de novemb…",https://cdn-s-www.ledauphine.com/images/7AC464B6-3C10-4943-B92A-A88F19F93F3E/FB1200/photo-1722713389.jpg,2024-08-03T19:40:00Z,,"L'ancien président américain de 99 ans Jimmy Carter, qui reçoit des soins de fin de vie à domicile depuis février 2023, espère vivre encore assez longtemps pour pouvoir voter pour Kamala Harris à la … [+1234 chars]",,fr,'Rosalynn Carter'
https://www.huffingtonpost.fr/politique/article/xavier-bertrand-comme-premier-ministre-pourquoi-cette-option-fait-son-chemin-en-macronie-clx1_237732.html,https://www.huffingtonpost.fr/politique/article/xavier-bertrand-comme-premier-ministre-pourquoi-cette-option-fait-son-chemin-en-macronie-clx1_237732.html,0,www.huffingtonpost.fr,Xavier Bertrand comme Premier ministre ? Pourquoi cette option fait son chemin en Macronie,Plusieurs ministres dont Bruno Le Maire et Gérald Darmanin trouvent des qualités au président LR des Hauts-de-France. Au point de le voir succéder à Gabriel Attal ?,https://huffpost-focus.sirius.press/2024/07/31/312/0/6000/3375/1820/1023/75/0/1e51678_1722428180643-000-34hy3tv.jpg,2024-08-04T05:30:34Z,,"POLITIQUE - Une option qui tient la corde? En trois jours, trois membres du gouvernement démissionnaires ont été interrogés dans les médias sur lhypothèse Xavier Bertrand à Matignon. Tous prennent so… [+5550 chars]",,fr,'Bruno Le Maire'
https://www.marianne.net/culture/cinema/mauvais-plan-a-trois-pour-jack-nicholson-the-two-jakes-la-suite-de-chinatown-qui-fit-un-flop,https://www.marianne.net/culture/cinema/mauvais-plan-a-trois-pour-jack-nicholson-the-two-jakes-la-suite-de-chinatown-qui-fit-un-flop,0,www.marianne.net,"Mauvais plan à trois pour Jack Nicholson : ""The Two Jakes"", la suite de ""Chinatown"" qui fit un flop","Elles avaient tout pour elles. Elles sont les suites de chefs-d’œuvre du cinéma et, elles-mêmes, sont d’excellents films, portés par de grands noms. Et personne, ou presque, ne sait qu’elles existent. Cette semaine, « The Two Jakes », la suite du « Chinatown …",https://media.marianne.net/assets/as6oDLz4g7MrhhICT.jpg?w=1540&h=924&r=fill,2024-08-04T13:27:58Z,,"Elles avaient tout pour elles. Elles sont les suites de chefs-duvre du cinéma et, elles-mêmes, sont dexcellents films, portés par de grands noms. Et personne, ou presque, ne sait quelles existent. Ce… [+1148 chars]",,fr,'Jack Ma'
https://www.ledauphine.com/culture-loisirs/2024/08/04/grace-a-leurs-portraits-en-perles-elles-rencontrent-plein-de-stars,https://www.ledauphine.com/culture-loisirs/2024/08/04/grace-a-leurs-portraits-en-perles-elles-rencontrent-plein-de-stars,0,www.ledauphine.com,"Drôme. Dua Lipa, Pierre Niney, Sting... Grâce à leurs portraits en perles, elles rencontrent plein de stars","Corinne et Léna, mère et fille, sont devenues les pros pour rencontrer des célébrités et leur offrir leurs portraits en perles. À leur palmarès : déjà Sting, Dua Lipa ou Chris Martin.",https://cdn-s-www.ledauphine.com/images/5A40FD9E-D76D-4DBB-91B3-5CD072B15D39/FB1200/photo-1722777589.jpg,2024-08-04T13:30:00Z,,"Quont en commun Sting, Chris Martin, Anya Taylor-Joy, Dua Lipa, Pierre Niney ou encore Catherine Jacob ? Un portrait deux en perles, réalisé par deux Valentinoises, Corinne et Léna, la mère et la fil… [+419 chars]",,fr,'Dua Lipa'
https://www.20minutes.fr/arts-stars/people/4104556-20240805-jo-omar-sy-ryan-gosling-eva-mendes-mariska-hargitay-tony-hawk-patrick-bruel-artus,https://www.20minutes.fr/arts-stars/people/4104556-20240805-jo-omar-sy-ryan-gosling-eva-mendes-mariska-hargitay-tony-hawk-patrick-bruel-artus,0,www.20minutes.fr,"Ils étaient aux JO : Omar Sy, Ryan Gosling, Eva Mendes, Mariska Hargitay, Tony Hawk, Patrick Bruel, Artus…","Aux JO, le spectacle est aussi parfois en tribune... ou dans les rues de Paris",https://img.20mn.fr/zXZIwZNkTh6lXNVWJdcQTCk/1444x920_307791-henri-szwarc-starface-2024-08-02-paris-france-2-aout-2024-paris-france-teddy-riner-gagne-sa-troisieme-medaille-d-or-en-judo-individuel-lors-des-jeux-olympiques-2024-photo-henri-szwarc-starface-august-2st-2024-france-s-teddy-riner-wins-his-3rd-gold-in-judo-of-the-olympic-games-2024-photo-henri-szwarc-starface-riner-teddy-sy-omar,2024-08-05T11:20:41Z,,"Comme sil navait pas été suffisamment récompensé, Teddy Riner a décroché la médaille du public VIP Frenchy ce week-end.
Les Français en force
Cest dailleurs Omar Sy qui a lancé la journée judo de v… [+1867 chars]",,fr,'Omar Sy'
https://www.liberation.fr/idees-et-debats/editorial/presidentielle-americaine-la-kamalamania-va-t-elle-durer-20240805_32OO6EEV2NBGDLDV33Y27JPJFQ/,https://www.liberation.fr/idees-et-debats/editorial/presidentielle-americaine-la-kamalamania-va-t-elle-durer-20240805_32OO6EEV2NBGDLDV33Y27JPJFQ/,0,www.liberation.fr,Présidentielle américaine : la Kamalamania va-t-elle durer ?,"Kamala Harris a insufflé un vent de fraîcheur dans la campagne pour la Maison Blanche, redonnant de l’espoir aux électeurs démocrates face au spectre d’un retour de Donald Trump. Le choix de son vice-président est son premier vrai test.",https://www.liberation.fr/resizer/rum1HObNdHyBr-BvTfpM2oqUI0g=/1200x630/filters:format(jpg):quality(70):focal(1755x1455:1765x1465)/cloudfront-eu-central-1.images.arcpublishing.com/liberation/KP26WX6T4VCT7IB7UQARWXLR3Q.jpg,2024-08-05T18:34:17Z,,"Cest le miracle que les électeurs démocrates désespéraient de voir saccomplir. Kamala Harris emballe les foules, du moins pour linstant. Et soudain tout paraît possible, y compris battre un Trump à q… [+1799 chars]",,fr,'Donald Trump'
https://www.bfmtv.com/politique/gouvernement/xavier-bertrand-premier-ministre-il-se-dit-pret-a-relever-le-defi-de-matignon_AN-202408060339.html,https://www.bfmtv.com/politique/gouvernement/xavier-bertrand-premier-ministre-il-se-dit-pret-a-relever-le-defi-de-matignon_AN-202408060339.html,0,www.bfmtv.com,"Xavier Bertrand, Premier ministre? Il se dit ""prêt à relever le défi"" de Matignon","Alors qu'Emmanuel Macron n'a toujours pas annoncé de nom pour succéder à Gabriel Attal au poste de Premier ministre après les dernières élections législatives, Xavier Bertrand passe à l'offensive en s'exprimant pour la première fois sur un avenir à Matignon.",https://images.bfmtv.com/e04qAJitvbigStQnEXhIDYkFnGc=/0x106:2048x1258/2048x0/images/Xavier-Bertrand-le-21-mai-2023-a-Villeneuve-d-Ascq-1793465.jpg,2024-08-06T12:32:16Z,,"Alors qu'Emmanuel Macron n'a toujours pas annoncé de nom pour succéder à Gabriel Attal au poste de Premier ministre après les dernières élections législatives, Xavier Bertrand semble enclin à prendre… [+2953 chars]",,fr,'Gérald Darmanin'
https://www.lalibre.be/international/europe/elections-france/2024/08/06/xavier-bertrand-de-plus-en-plus-candidat-au-poste-de-premier-ministre-4PMIABOWY5F2NJFU4FDL2BYFMY/,https://www.lalibre.be/international/europe/elections-france/2024/08/06/xavier-bertrand-de-plus-en-plus-candidat-au-poste-de-premier-ministre-4PMIABOWY5F2NJFU4FDL2BYFMY/,0,www.lalibre.be,Xavier Bertrand de plus en plus candidat au poste de Premier ministre,"Presque silencieux depuis les élections législatives, Xavier Bertrand laisse parler son entourage pour porter sa candidature à Matignon et mettre en avant son profil de ""droite sociale"" cultivé depuis plus de vingt ans, selon lui au barycentre d'une nouvelle …",https://www.lalibre.be/resizer/v2/N4XZPGX3TJBCND2XZ5OU3SBUMU.jpg?auth=e5d41ce81d5d0cfa0c9873737e8d73448aaf89aee8999610fc56e01e30a7b40d&width=1200&height=630&quality=85&focal=384%2C256&watermark=https%3A%2F%2Fcloudfront-eu-central-1.images.arcpublishing.com%2Fipmgroup%2F3R4IDPARFVEO3L2LC5OCCXQ5RM.png%3A100%3A0%2C557,2024-08-06T16:32:29Z,,"Si depuis cette sortie, l'ancien ministre de Jacques Chirac et de Nicolas Sarkozy fuit les micros, son entourage parle à sa place.
""Il est prêt à relever le défi, il est préparé"", a assuré un de ses… [+3628 chars]",,fr,'Gérald Darmanin'
https://www.20minutes.fr/politique/4104815-20240807-futur-premier-ministre-xavier-bertrand-cultive-fragile-statut-presque-favori-matignon,https://www.20minutes.fr/politique/4104815-20240807-futur-premier-ministre-xavier-bertrand-cultive-fragile-statut-presque-favori-matignon,0,www.20minutes.fr,Futur Premier ministre : Xavier Bertrand cultive son fragile statut de presque favori pour Matignon,"Le nom du président des Hauts-de-France revient avec insistance pour le poste de Premier ministre. Mais, au regard du poids des LR à l’Assemblée, sa nomination est très loin d’être acquise",https://img.20mn.fr/OIDsD7hXQkOpcQZN2oveXCk/1444x920_hauts-de-france-regional-council-president-xavier-bertrand-arrives-to-attend-an-emergency-executive-board-meeting-called-by-french-right-wing-party-les-republicains-lr-vice-president-at-the-party-s-headquarters-in-paris-on-june-12-2024-01jacqueswitt-wit-3163-credit-jacques-witt-sipa-2406121604,2024-08-07T02:48:57Z,,"Le bras de fer autour du fauteuil de Premier ministre se poursuit. Alors quEmmanuel Macron a choisi de repousser à laprès-JO sa décision pour nommer la tête du gouvernement, un nom circule avec insis… [+3940 chars]",,fr,'Gérald Darmanin'
https://www.20minutes.fr/politique/4104818-20240807-direct-futur-premier-ministre-castets-juge-xavier-bertrand-matignon-aberration,https://www.20minutes.fr/politique/4104818-20240807-direct-futur-premier-ministre-castets-juge-xavier-bertrand-matignon-aberration,0,www.20minutes.fr,EN DIRECT Futur Premier ministre : Castets juge que Xavier Bertrand à Matignon serait une « aberration »…,Suivez avec nous les informations politiques de ce mercredi 7 août 2024,https://img.20mn.fr/MeaUdKKwSGG8-1g_4ZsZWik/1444x920_french-economist-and-politician-lucie-castets-poses-during-her-first-outing-as-french-leftist-coalition-nouveau-front-populaire-new-popular-front-nfp-candidate-for-prime-minister-in-lille-northern-france-on-july-27-2024-photo-by-francois-lo-presti-afp,2024-08-07T04:55:56Z,,Lucie Castets refuse par contre dimaginer un seul instant Xavier Bertrand dans le fauteuil de Premier ministre. La candidate du Nouveau Front populaire pour Matignon estime que la nomination du prési… [+1859 chars],,fr,'Gérald Darmanin'
https://www.nouvelobs.com/justice/20240808.OBS92149/le-ministere-de-l-interieur-n-a-pas-fait-correctement-le-tri-un-nombre-tres-eleve-d-assignations-a-residence-pendant-les-jeux-olympiques.html,https://www.nouvelobs.com/justice/20240808.OBS92149/le-ministere-de-l-interieur-n-a-pas-fait-correctement-le-tri-un-nombre-tres-eleve-d-assignations-a-residence-pendant-les-jeux-olympiques.html,0,www.nouvelobs.com,« Le ministère de l’Intérieur n’a pas fait correctement le tri » : un nombre très élevé d’assignations à résidence pendant les Jeux olympiques,"A l’occasion des Jeux olympiques, la sécurité a été renforcée partout en France. Depuis quelques semaines, les juges administratifs voient défiler de plus en plus d’affaires concernant les Mesures individuelles de contrôle administratif et de surveillance, di…",https://focus.nouvelobs.com/2024/08/08/0/0/5599/3733/1200/800/0/0/15da4c6_1723124028618-050-only-0501175.jpg,2024-08-08T13:43:34Z,,"Au total, 15,3 millions de visiteurs étaient attendus dans la capitale à loccasion des Jeux olympiques et paralympiques. J-F ROLLINGER / ONLY FRANCE VIA AFP
Lire plus tard
Commenter
Google Actuali… [+9311 chars]",,fr,'Gérald Darmanin'
https://www.marianne.net/politique/xavier-bertrand-a-matignon-un-desir-qui-monte-dans-le-pays-pardon-qui-monte-dans-les-medias,https://www.marianne.net/politique/xavier-bertrand-a-matignon-un-desir-qui-monte-dans-le-pays-pardon-qui-monte-dans-les-medias,0,www.marianne.net,"""Xavier Bertrand à Matignon"" : un désir qui monte dans le pays... Pardon, qui monte dans les médias","Depuis quelques jours, le nom du président LR du Conseil régional des Hauts-de-France, Xavier Bertrand, héraut autoproclamé d'une « droite sociale », revient sur tous les plateaux pour évoquer le nom du futur Premier ministre. Un poisson-pilote sorti du chape…",https://media.marianne.net/assets/as5E7ohUOK7Q2Y9l2.jpg?w=1540&h=924&r=fill,2024-08-09T02:00:00Z,,"Cest la petite musique médiatique qui monte. Dans le creux politique du milieu de lété, accentué cette année par la « trêve olympique » qu'Emmanuel Macron a mis à l'ordre du jour le 22 juillet dernie… [+843 chars]",,fr,'Gérald Darmanin'
https://www.bfmtv.com/politique/gouvernement/avec-la-fin-des-jeux-olympiques-la-fin-d-un-moment-suspendu-aux-retombees-de-courte-duree-pour-macron_AN-202408090030.html,https://www.bfmtv.com/politique/gouvernement/avec-la-fin-des-jeux-olympiques-la-fin-d-un-moment-suspendu-aux-retombees-de-courte-duree-pour-macron_AN-202408090030.html,0,www.bfmtv.com,"Avec la fin des Jeux olympiques, la fin d'un ""moment suspendu"" aux retombées ""de courte durée"" pour Macron","Emmanuel Macron et ses ministres se réjouissent du succès des Jeux olympiques de Paris 2024. Grâce aux résultats des athlètes et à l'organisation qui s'est déroulée sans accroc majeur, la quinzaine qui s'est écoulée a rimé avec joie, concorde et fierté pour d…",https://images.bfmtv.com/S5fVDQ40_qaRv7t147IEFsff914=/0x124:2048x1276/2048x0/images/Emmanuel-Macron-felicite-Teddy-Riner-apres-le-troisieme-titre-olympique-de-sa-carriere-aux-JO-2024-1914325.jpg,2024-08-09T04:51:00Z,,"Emmanuel Macron et ses ministres se réjouissent du succès des Jeux olympiques de Paris 2024. Grâce aux résultats des athlètes et à l'organisation qui s'est déroulée sans accroc majeur, la quinzaine q… [+9750 chars]",,fr,'Emmanuel Macron'
https://www.francetvinfo.fr/replay-radio/l-edito-politique/la-proportionnelle-sur-la-feuille-de-route-de-la-ou-du-futur-premier-ministre_6649404.html,https://www.francetvinfo.fr/replay-radio/l-edito-politique/la-proportionnelle-sur-la-feuille-de-route-de-la-ou-du-futur-premier-ministre_6649404.html,0,www.francetvinfo.fr,La proportionnelle sur la feuille de route de la ou du futur Premier ministre ?,"Emmanuel Macron l’avait promise en 2017 mais jamais instaurée. De nombreuses voix réclament à nouveau la proportionnelle, comme une solution au morcellement de l’opinion et donc de l’Assemblée.",https://www.francetvinfo.fr/pictures/DUPQs1PDz_liQM3D4I0THdisTxE/0x0:6766x3804/1500x843/2024/08/09/000-364f23j-66b5b41abc950012958704.jpg,2024-08-09T06:20:02Z,,"Cest un peu le monde à lenvers. À lorigine, le scrutin majoritaire vous avez 50% au 2e tour, vous êtes élu - a été imaginé dans la Ve République pour dégager des majorités claires. Un seul grand part… [+2555 chars]",,fr,'président de la République'
https://www.francetvinfo.fr/politique/emmanuel-macron/gouvernement-la-recherche-du-futur-premier-ministre-se-poursuit_6715977.html,https://www.francetvinfo.fr/politique/emmanuel-macron/gouvernement-la-recherche-du-futur-premier-ministre-se-poursuit_6715977.html,0,www.francetvinfo.fr,Gouvernement : la recherche du futur Premier ministre se poursuit,"Même en vacances, Emmanuel Macron s'affaire à choisir son prochain chef du gouvernement. Les noms de Xavier Bertrand, Michel Barnier, Jean-Louis Borloo, Lucie Castets et Bernard Cazeneuve sont parmi les favoris.",https://www.francetvinfo.fr/pictures/fEqIMMiZB2P5BNgiCEKUtbgXUyQ/0x18:904x528/1500x843/2024/08/09/ministre-66b5d55209eba746010517.jpg,2024-08-09T08:38:03Z,,"Le couple présidentiel est en vacances au Fort de Brégançon. Quelques jours de repos durant lesquels le chef de l'État consulte et sonde son entourage dans sa quête d'un futur Premier ministre, car l… [+1231 chars]",,fr,'Gérald Darmanin'
https://www.courrierinternational.com/article/politique-en-tunisie-kais-saied-change-de-premier-ministre-pour-quoi-faire_221061,https://www.courrierinternational.com/article/politique-en-tunisie-kais-saied-change-de-premier-ministre-pour-quoi-faire_221061,0,www.courrierinternational.com,"En Tunisie, Kaïs Saïed change de Premier ministre : “Pour quoi faire ? ”","Le président tunisien, Kaïs Saïed, s’est débarrassé, mercredi 7 août, de son quatrième chef du gouvernement depuis son accession au pouvoir en 2019. Kamel Madouri remplace Ahmed Hachani, dont le bilan est durement jugé par la presse tunisienne.",https://focus.courrierinternational.com/2024/08/09/1/0/5000/3333/1200/630/60/0/2e892ab_1723195882064-000-34jm4ly.jpg,2024-08-09T10:34:09Z,,"Un an et six jours. Cest la durée du mandat dAhmed Hachani en tant que Premier ministre tunisien avant son limogeage sans justifications officielles par le président, Kaïs Saïed, mercredi 7 août. Une… [+1971 chars]",,fr,'président de la République'
