index,url,valid,domain,title,description,image,published,archive,content,quote,language,keyword
https://www.presse-citron.net/10-films-cultes-de-steven-spielberg-a-voir-durgence/,https://www.presse-citron.net/10-films-cultes-de-steven-spielberg-a-voir-durgence/,0,www.presse-citron.net,10 films cultes de Steven Spielberg à voir d’urgence,Découvrez les 10 meilleurs longs-métrages réalisés par Steven Spielberg dans cette sélection aux petits oignons.,https://www.presse-citron.net/app/uploads/2024/04/jurassic-park.jpg,2024-05-01T10:01:06Z,,"Le cinéaste Steven Spielberg est incontestablement une légende du septième art. Depuis une soixantaine dannées, il régale les cinéphiles de ses blockbusters qui innovent et divertissent, tout en ayan… [+6430 chars]",,fr,'Tom Hanks'
https://www.presse-citron.net/pourquoi-emmanuel-macron-utilise-t-il-des-iphone-et-smartphones-android-malgre-le-risque-despionnage/,https://www.presse-citron.net/pourquoi-emmanuel-macron-utilise-t-il-des-iphone-et-smartphones-android-malgre-le-risque-despionnage/,0,www.presse-citron.net,Pourquoi Emmanuel Macron utilise-t-il des iPhone et smartphones Android malgré le risque d’espionnage ?,"C'est un fait pour le moins paradoxal : le chef de l'État comme les ministres du gouvernements sont des cibles pour les services d'espionnage du monde entier. Et pourtant, ils continuent d'utiliser tous des iPhone et smartphones Android, tout ce qu'il y a de …",https://www.presse-citron.net/app/uploads/2023/06/emmanuel-macron-vivatech.jpg,2024-05-01T15:02:22Z,,"On pourrait penser qu’au sommet de l’État, utiliser des appareils de communication grand public comme les iPhone ou les smartphones Android serait strictement interdit. Pourtant c’est bien le cas – e… [+3138 chars]",,fr,'Emmanuel Macron'
https://www.lexpress.fr/sciences-sante/anthroposophie-autisme-les-etranges-contributions-au-rapport-sur-les-enfants-et-les-ecrans-FDBVYWZBDBCMRBC5SE53MH7JCE/,https://www.lexpress.fr/sciences-sante/anthroposophie-autisme-les-etranges-contributions-au-rapport-sur-les-enfants-et-les-ecrans-FDBVYWZBDBCMRBC5SE53MH7JCE/,0,www.lexpress.fr,"Anthroposophie, autisme… Les étranges contributions au rapport sur les enfants et les écrans","Un mouvement ésotérique, une médecin alarmiste, mais pas certains experts qui font l’unanimité ? Les contributions aux travaux remis à Emmanuel Macron sur les écrans font polémique. La commission reconnaît des erreurs.",https://www.lexpress.fr/resizer/U0HU0tDVAlaJyAc5uNL_5IS5-Io=/1200x630/cloudfront-eu-central-1.images.arcpublishing.com/lexpress/WZQA3WWU5ZCG3HF2CFLRQNECFY.jpg,2024-05-02T17:36:10Z,http://archive.md/20240503051237/https://www.lexpress.fr/sciences-sante/anthroposophie-autisme-les-etranges-contributions-au-rapport-sur-les-enfants-et-les-ecrans-FDBVYWZBDBCMRBC5SE53MH7JCE/,"La mention figure en annexe. Page 137. Elle est très succincte : quatre mots seulement : ""Ecoles Waldorf : contribution écrite"". Mais suffisante, pour comprendre que les ""écoles Waldorf"" ont apporté … [+8556 chars]",,fr,'Rudolf Steiner'
https://www.lemonde.fr/international/article/2024/05/03/l-allemagne-attribue-a-la-russie-une-cyberattaque-contre-le-spd-en-janvier-2023_6231310_3210.html,https://www.lemonde.fr/international/article/2024/05/03/l-allemagne-attribue-a-la-russie-une-cyberattaque-contre-le-spd-en-janvier-2023_6231310_3210.html,0,www.lemonde.fr,L’Allemagne attribue à la Russie une cyberattaque contre le SPD en janvier 2023,"Annalena Baerbock a annoncé, vendredi, que l’enquête fédérale sur cette attaque concluait à l’implication du groupe APT28, soupçonné d’être lié aux services de renseignements militaires russes.",https://img.lemde.fr/2024/05/03/0/0/5499/3666/1440/960/60/0/1222bd8_5364983-01-06.jpg,2024-05-03T06:03:40Z,https://web.archive.org/web/20240503060915/https://www.lemonde.fr/international/article/2024/05/03/l-allemagne-attribue-a-la-russie-une-cyberattaque-contre-le-spd-en-janvier-2023_6231310_3210.html,"La ministre des affaires étrangères allemande, Annalena Baerbock, en visite en Australie, le 3 mai 2024. DANIEL WALDING / AFP
Berlin a accusé, vendredi 3 mai, des hackeurs russes soutenus par Moscou… [+2031 chars]",,fr,'Daniel Penny'
https://www.20minutes.fr/arts-stars/people/4089365-20240504-angelina-jolie-brad-pitt-ca-chauffe-toujours-entre-ex-sujet-vente-domaine-miraval,https://www.20minutes.fr/arts-stars/people/4089365-20240504-angelina-jolie-brad-pitt-ca-chauffe-toujours-entre-ex-sujet-vente-domaine-miraval,0,www.20minutes.fr,Angelina Jolie et Brad Pitt : Ça chauffe toujours entre les ex au sujet de la vente du domaine de Miraval,On dirait bien que l'ex couple star d'Hollywood n'a pas fini de se faire des misères,https://img.20mn.fr/W1yY38ZhTUuHd5XtHEFFSyk/1444x920_opening-night-of-the-outsiders-on-broadway-featuring-angelina-jolie-where-new-york-new-york-united-states-when-12-apr-2024-credit-janet-mayer-insta-rimages-com,2024-05-04T13:02:39Z,,"Cest la guerre. Hors de question pour Angelina Jolie de dévoiler au tribunal toutes les clauses de confidentialité quelle a pu signer par le passé avec ses ex. Une exigence plutôt absurde, dailleurs,… [+1562 chars]",,fr,'Brad Pitt'
https://www.huffingtonpost.fr/culture/video/megalopolis-de-francis-ford-coppola-adam-driver-pret-a-se-jeter-dans-le-vide-dans-le-premier-extrait-du-film_233542.html,https://www.huffingtonpost.fr/culture/video/megalopolis-de-francis-ford-coppola-adam-driver-pret-a-se-jeter-dans-le-vide-dans-le-premier-extrait-du-film_233542.html,0,www.huffingtonpost.fr,« Megalopolis » de Francis Ford Coppola : Adam Driver prêt à se jeter dans le vide dans le premier extrait du film,"Le géant du cinéma Francis Ford Coppola a partagé ce samedi 4 mai un extrait exclusif de son prochain film « Megalopolis », très attendu au Festival de Cannes.",https://huffpost-focus.sirius.press/2024/05/04/0/0/1920/1080/1820/1023/75/0/701958f_1714835534407-appel-4.jpg,2024-05-04T15:40:26Z,,"La lecture de ce contenu est susceptible dentraîner un dépôt de cookies de la part de lopérateur tiers qui lhéberge. Compte-tenu des choix que vous avez exprimés en matière de dépôt de cookies, nous … [+2648 chars]",,fr,'Francis Ford Coppola'
https://www.lesinrocks.com/musique/taylor-swift-peut-elle-vraiment-sauver-lamerique-616639-04-05-2024/,https://www.lesinrocks.com/musique/taylor-swift-peut-elle-vraiment-sauver-lamerique-616639-04-05-2024/,0,www.lesinrocks.com,Taylor Swift peut-elle vraiment sauver l’Amérique ?,"À six mois de l’élection présidentielle américaine, Taylor Swift se retrouve au cœur d’une arène démocratique malade, elle qui fut longtemps rétive à tout engagement politique. Courtisée par le camp Biden, honnie par les trumpistes, la chanteuse pourrait-elle…",https://www.lesinrocks.com/wp-content/thumbnails/uploads/2024/04/WEB_ILLUS_TAYLOR_INROCKS_2LIGHT-t-1374x873.jpg,2024-05-04T17:00:00Z,https://web.archive.org/web/20240504225626/https://www.lesinrocks.com/musique/taylor-swift-peut-elle-vraiment-sauver-lamerique-616639-04-05-2024/,"À six mois de lélection présidentielle américaine, Taylor Swift se retrouve au cur dune arène démocratique malade, elle qui fut longtemps rétive à tout engagement politique. Courtisée par le camp Bid… [+23943 chars]",,fr,'Taylor Swift'
https://www.latribune.fr/culture-lifestyle/taylor-swift-une-idole-a-paris-996867.html,https://www.latribune.fr/culture-lifestyle/taylor-swift-une-idole-a-paris-996867.html,0,www.latribune.fr,"Taylor Swift, une idole à Paris","Dans le cadre de sa tournée mondiale, la pop star investit Paris pour quatre concerts. Retour sur un phénomène culturel, sociétal et politique.",https://static.latribune.fr/full_width/2366863/taylor-swift.jpg,2024-05-05T03:34:00Z,https://web.archive.org/web/20240505172242/https://www.latribune.fr/culture-lifestyle/taylor-swift-une-idole-a-paris-996867.html,"Attention, un séisme d'une intensité encore inconnue pourrait secouer la région parisienne jeudi prochain. Ce jour-là, Taylor Swift prendra ses quartiers à La Défense Arena dans le cadre de sa tourné… [+10459 chars]",,fr,'Joe Alwyn'
https://www.lemonde.fr/international/live/2024/05/05/en-direct-guerre-en-ukraine-xi-jinping-attendu-a-paris-pour-sa-premiere-tournee-en-europe-depuis-2019_6231636_3210.html,https://www.lemonde.fr/international/live/2024/05/05/en-direct-guerre-en-ukraine-xi-jinping-attendu-a-paris-pour-sa-premiere-tournee-en-europe-depuis-2019_6231636_3210.html,0,www.lemonde.fr,"En direct, guerre en Ukraine : Xi Jinping attendu à Paris pour sa première tournée en Europe depuis 2019","Le président chinois, qui continue d’afficher son soutien à la Russie, doit être accueilli dimanche après-midi à Orly par Gabriel Attal, avant de rencontrer, lundi, Emmanuel Macron.",https://img.lemde.fr/2024/05/04/57/0/5745/2872/1440/720/60/0/14a4f0c_2024-05-04t084804z-1598691223-rc2hj7aadrfj-rtrmadp-3-ukraine-crisis-donetsk.JPG,2024-05-05T03:55:11Z,,"Deux ans après le début de la guerre à grande échelle, la dynamique du soutien occidental à Kiev est en perte de vitesse : les aides nouvellement engagées sont en baisse sur la période daoût 2023 à j… [+2370 chars]",,fr,'Emmanuel Macron'
https://iletaitunepub.fr/2024/05/06/322996/news/cinema/megalopolis-le-tout-premier-apercu-du-prochain-film-de-francis-ford-coppola/,https://iletaitunepub.fr/2024/05/06/322996/news/cinema/megalopolis-le-tout-premier-apercu-du-prochain-film-de-francis-ford-coppola/,0,iletaitunepub.fr,Megalopolis : le tout premier aperçu du prochain film de Francis Ford Coppola,"Né en 1939 à Détroit, Francis Ford Coppola est un pilier du cinéma. On le connaît pour sa carrière de scénariste et de producteur. Mais aussi et surtout ses talents de réalisateur. En effet, on lui doit des films de légende. Comme la trilogie Le Parrain (avec…",https://iletaitunepub.fr/wp/wp-content/uploads/2024/05/adam-driver-incarne-caesar-dans-megalopolis.jpg,2024-05-06T06:47:46Z,,"Né en 1939 à Détroit, Francis Ford Coppola est un pilier du cinéma. On le connaît pour sa carrière de scénariste et de producteur. Mais aussi et surtout ses talents de réalisateur. En effet, on lui d… [+1892 chars]",,fr,'Francis Ford Coppola'
https://www.lesinrocks.com/cinema/trailer-adam-driver-defie-les-lois-du-temps-dans-megalopolis-617435-06-05-2024/,https://www.lesinrocks.com/cinema/trailer-adam-driver-defie-les-lois-du-temps-dans-megalopolis-617435-06-05-2024/,0,www.lesinrocks.com,[Trailer] Adam Driver défie les lois du temps dans “Megalopolis”,Francis Ford Coppola lève le voile sur les premières images de son nouveau film “Megalopolis” avec lequel il pourrait remporter une troisième Palme d’or au prochain Festival de Cannes.,https://www.lesinrocks.com/wp-content/thumbnails/uploads/2024/05/Megalopolis-e1714990716114-t-1200x653.jpg,2024-05-06T10:24:00Z,,"Francis Ford Coppola lève le voile sur les premières images de son nouveau film Megalopolis avec lequel il pourrait remporter une troisième Palme dor au prochain Festival de Cannes. 
À quelques jour… [+1164 chars]",,fr,'Francis Ford Coppola'
https://www.lalibre.be/economie/entreprises-startup/2024/05/06/la-scene-la-plus-classe-du-cinema-la-realite-business-derriere-le-lavage-de-dents-de-jacquouille-la-fripouille-FKAQCSXODVEMJKC74TL7OISJVA/,https://www.lalibre.be/economie/entreprises-startup/2024/05/06/la-scene-la-plus-classe-du-cinema-la-realite-business-derriere-le-lavage-de-dents-de-jacquouille-la-fripouille-FKAQCSXODVEMJKC74TL7OISJVA/,0,www.lalibre.be,"La scène la plus ""classe"" du cinéma: la réalité business derrière le lavage de dents de Jacquouille la Fripouille","Les “Visiteurs”, film culte de Jean-Marie Poiret, a été l’un des premiers films français à avoir massivement recours aux placements produits pour se financer. Et il est loin d’être le seul. ...",https://www.lalibre.be/resizer/v2/HL754ETZ4JGUHNYJXU56CLMGBI.jpg?auth=46f4a3759e96f98eaeff7af40e0dc13ae661a2e2b6a13e948438c008f2d4e71f&width=1200&height=630&quality=85&focal=1033%2C663&watermark=https%3A%2F%2Fcloudfront-eu-central-1.images.arcpublishing.com%2Fipmgroup%2FN2W5JL3V7JEUTOYYZCW5FAG7M4.png%3A100%3A0%2C557,2024-05-06T13:51:06Z,,"Ya point dpourrissement qui résiste, avec la pâte à dent ! Cest du diamant !, lance Jacquouille la Fripouille à ses voisins de table, dans le restaurant chic d'un château, avant dentamer un gargarism… [+4991 chars]",,fr,'Brad Pitt'
https://www.lemonde.fr/international/article/2024/05/06/xi-jinping-a-paris-le-president-chinois-appelle-a-l-instauration-d-une-treve-mondiale-pendant-les-jeux-olympiques_6231887_3211.html,https://www.lemonde.fr/international/article/2024/05/06/xi-jinping-a-paris-le-president-chinois-appelle-a-l-instauration-d-une-treve-mondiale-pendant-les-jeux-olympiques_6231887_3211.html,0,www.lemonde.fr,Xi Jinping à Paris : le président chinois appelle à l’instauration d’une trêve mondiale pendant les Jeux olympiques,"Paris veut s’assurer que la Chine ne bascule pas dans un soutien clair à l’effort de guerre contre Kiev ; voire « l’encourager à utiliser les leviers » dont elle dispose sur Moscou pour « contribuer à une résolution de ce conflit », selon l’Elysée.",https://img.lemde.fr/2024/05/06/1/0/5650/3766/1440/960/60/0/a500a66_1714998007356-lgeai-xi-jinping-macron-26.jpg,2024-05-06T17:34:52Z,,"Le président de la République, Emmanuel Macron, raccompagne le président de la Republique populaire de Chine, Xi Jinping, avec la présidente de la Commission européenne, Ursula von der Leyen, au pala… [+6778 chars]",,fr,'Emmanuel Macron'
https://www.01net.com/actualites/et-voici-les-premieres-rumeurs-sur-les-iphone-17-une-version-slim-plus-de-ram-une-dynamic-island-plus-petite.html,https://www.01net.com/actualites/et-voici-les-premieres-rumeurs-sur-les-iphone-17-une-version-slim-plus-de-ram-une-dynamic-island-plus-petite.html,0,www.01net.com,"Et voici les premières rumeurs sur les iPhone 17 : une version « Slim », plus de RAM, une Dynamic Island plus petite","La gamme d'iPhone 16 ne sera pas lancée avant cet automne, mais d'ores et déjà le cru 2025 des smartphones d'Apple commence à pointer à l'horizon ! Une série d'indiscrétions provenant d'un analyste réputé nous donne une première idée de ce qu'Apple pourrait b…",https://www.01net.com/app/uploads/2023/10/Iphone-15_06.jpg,2024-05-07T05:02:19Z,,"La gamme d’iPhone 16 ne sera pas lancée avant cet automne, mais d’ores et déjà le cru 2025 des smartphones d’Apple commence à pointer à l’horizon ! Une série d’indiscrétions provenant d’un analyste r… [+1887 chars]",,fr,'Jeff Ross'
https://www.konbini.com/popculture/wemby-rookie-de-lannee-hades-ii-et-des-capybaras-trop-mims-lactu-pop-du-7-mai-2024/,https://www.konbini.com/popculture/wemby-rookie-de-lannee-hades-ii-et-des-capybaras-trop-mims-lactu-pop-du-7-mai-2024/,0,www.konbini.com,"Wemby rookie de l’année, Hades II et des capybaras trop mims : l’actu pop du 7 mai 2024","Chaque jour, on vous résume sur notre fil Instagram l’actu pop du jour, et si vous avez cliqué sur le linkinbio, vous êtes super. #1. Steven Spielberg et A24 sont dans un bateau C’est encore...",https://cdn-www.konbini.com/files/2023/12/wemby-feat.jpg,2024-05-07T14:02:38Z,,"Chaque jour, on vous résume sur notre fil Instagram lactu pop du jour, et si vous avez cliqué sur le linkinbio, vous êtes super.
#1. Steven Spielberg et A24 sont dans un bateau
Cest encore à létat … [+3045 chars]",,fr,'Sabrina Carpenter'
https://www.lesinrocks.com/cinema/tiago-rodrigues-le-parrain-cest-un-film-monde-616635-07-05-2024/,https://www.lesinrocks.com/cinema/tiago-rodrigues-le-parrain-cest-un-film-monde-616635-07-05-2024/,0,www.lesinrocks.com,"Tiago Rodrigues : “‘Le Parrain’, c’est un film-monde”",[Les films de leur vie] Le directeur du Festival d’Avignon nous évoque le monument de Francis Ford Coppola et sa fascination pour la figure de Michael Corleone.,https://www.lesinrocks.com/wp-content/thumbnails/uploads/2024/04/Godfather_Still_KS_CR-326_13ff85e60fb30155b3b3ed1aac384072315e0871-t-960x700.jpg,2024-05-07T17:00:00Z,,"[Les films de leur vie] Le directeur du Festival dAvignon nous évoque le monument de Francis Ford Coppola et sa fascination pour la figure de Michael Corleone.
Le film vers lequel je retourne le plu… [+2096 chars]",,fr,'Francis Ford Coppola'
https://www.lemonde.fr/politique/article/2024/05/08/au-senat-gerard-larcher-avance-son-projet-transpartisan-pour-reformer-les-institutions_6232115_823448.html,https://www.lemonde.fr/politique/article/2024/05/08/au-senat-gerard-larcher-avance-son-projet-transpartisan-pour-reformer-les-institutions_6232115_823448.html,0,www.lemonde.fr,"Au Sénat, Gérard Larcher avance son projet transpartisan pour réformer les institutions","Cumul des mandats, référendum d’initiative partagée (seuil abaissé de 10 % à 5 % du corps électoral), recours aux ordonnances, fin de la présence des anciens présidents au Conseil constitutionnel, le président de la Chambre haute a présenté vingt propositions…",https://img.lemde.fr/2020/07/02/720/2176/813/542/1440/960/60/0/1ce44a9_GDN-FRA_FRANCE-POLITICS-_0702_1B.JPG,2024-05-07T23:03:31Z,,"Limmobilisme ou léchappée en solitaire ? Le président du Sénat, Gérard Larcher, opte pour la seconde voie, après avoir présenté lui-même à la presse, mardi 7 mai, une vingtaine de propositions pour r… [+2434 chars]",,fr,'nan nan'
https://www.lepoint.fr/pop-culture/entretien-avec-un-vampire-que-vaut-la-serie-de-paramount-30-ans-apres-la-version-avec-brad-pitt-et-tom-cruise-10-05-2024-2559831_2920.php,https://www.lepoint.fr/pop-culture/entretien-avec-un-vampire-que-vaut-la-serie-de-paramount-30-ans-apres-la-version-avec-brad-pitt-et-tom-cruise-10-05-2024-2559831_2920.php,0,www.lepoint.fr,« Entretien avec un vampire » : la série supporte-t-elle la comparaison avec le film joué par Tom Cruise et Brad Pitt ?,La nouvelle adaptation du roman d'Anne Rice n'a rien a envier au film de 1994. La serie explore avec pertinence et modernite la condition maudite du vampire.,https://static.lpnt.fr/images/2024/05/10/26560181lpw-26560693-mega-une-jpg_10295086.jpg,2024-05-10T05:15:00Z,,"On le croit définitivement enterré, mais il revient toujours d'entre les morts. Le vampire, ses dents pointues, son goût du sang et sa subversivité trouvent perpétuellement un moyen d'envahir le gran… [+7396 chars]",,fr,'Brad Pitt'
https://www.ledauphine.com/societe/2024/05/10/entretien-avec-un-vampire-revient-en-serie-sur-paramount,https://www.ledauphine.com/societe/2024/05/10/entretien-avec-un-vampire-revient-en-serie-sur-paramount,0,www.ledauphine.com,Streaming. «Entretien avec un vampire» revient en série sur Paramount+,"Trente années après le film avec Tom Cruise et Brad Pitt, Entretien avec un vampire revient, cette fois-ci en série, dont la première saison arrive ce vendredi sur Paramount+.",https://cdn-s-www.ledauphine.com/images/7C6EDE3C-B8C9-4206-8DE8-53F44DF809ED/FB1200/photo-1715268379.jpg,2024-05-10T06:45:00Z,,"En 1994, le cinéaste Neil Jordan réalisait Entretien avec un vampire, adaptation dun roman dAnne Rice sorti en 1978. Ce film exploita la veine romantique du vampirisme. Brad Pitt, Tom Cruise et Kirst… [+2013 chars]",,fr,'Brad Pitt'
https://atlantico.fr/article/rdv/lolita-sechan-seche-le-mariage-de-papa-renaud-brad-pitt-envisage-le-re-sien-louis-sarkozy-jet-settise-a-dc-mariah-carrey-divaise-en-floride-slimane-depapapoulise-a-l-eurovision-jennifer-lopez-privatise-le-louvre-penelope-cruz-quiquast,https://atlantico.fr/article/rdv/lolita-sechan-seche-le-mariage-de-papa-renaud-brad-pitt-envisage-le-re-sien-louis-sarkozy-jet-settise-a-dc-mariah-carrey-divaise-en-floride-slimane-depapapoulise-a-l-eurovision-jennifer-lopez-privatise-le-louvre-penelope-cruz-quiquast,0,atlantico.fr,"Lolita Séchan sèche le mariage de papa Renaud, Brad Pitt envisage le re-sien; Louis Sarkozy jet-settise à DC, Mariah Carey divaise en Floride; Slimane dépapapoulise à l’Eurovision, Jennifer Lopez privatise le Louvre; Pénélope Cruz quiquastarise",Mais aussi : Justin Bieber va devenir papa; Britney Spears accuse sa mère de l’avoir piégée; Kim Kardashian se fait huer en direct à la télé et le Prince Harry a encore trouvé porte close au Royaume-Uni.,https://atlantico-media.s3.eu-west-3.amazonaws.com/Capture_d_ecran_2024_05_10_a_20_18_11_cd89742ffb.png,2024-05-11T06:33:52Z,,Justin Bieber va être papa. Depuis le temps quil en rêvait ! Le chanteur et sa femme Hailey ont posté des photos deux en pleine cérémonie de renouvellement de leurs vux à Hawaï : et annoncé du même c… [+10025 chars],,fr,'Brad Pitt'
https://www.lemonde.fr/m-le-mag/article/2024/05/12/megalopolis-le-nouveau-pari-fou-de-francis-ford-coppola_6232682_4500055.html,https://www.lemonde.fr/m-le-mag/article/2024/05/12/megalopolis-le-nouveau-pari-fou-de-francis-ford-coppola_6232682_4500055.html,0,www.lemonde.fr,"« Megalopolis », le nouveau pari fou de Francis Ford Coppola","Quarante-cinq ans après sa dernière Palme d’or pour « Apocalypse Now », le réalisateur américain est de retour au Festival de Cannes où son nouveau film est en sélection officielle. Avec ce projet mûri de longue date, le cinéaste de 85 ans joue gros : il l’a …",https://img.lemde.fr/2024/05/10/0/1/4168/2779/1440/960/60/0/867332c_1715350958245-sipa-ap22860313-000006.jpg,2024-05-12T00:00:09Z,,"Francis Ford Coppola sur le tournage de « Megalopolis », dans les studios dAtlanta (Etats-Unis), en novembre 2022. MEGA / GC IMAGES / GETTY
Ce 28 mars au matin, un ballet inhabituel de berlines noir… [+2472 chars]",,fr,'Francis Ford Coppola'
https://www.francetvinfo.fr/culture/cinema/le-realisateur-et-producteur-americain-roger-corman-maitre-de-la-serie-b-est-mort-a-98-ans_6539492.html,https://www.francetvinfo.fr/culture/cinema/le-realisateur-et-producteur-americain-roger-corman-maitre-de-la-serie-b-est-mort-a-98-ans_6539492.html,0,www.francetvinfo.fr,"Le réalisateur et producteur américain Roger Corman, maître de la série B, est mort à 98 ans","On attribue au réalisateur la découverte de certains grands noms du cinéma tels que Martin Scorsese, Robert De Niro et Francis Ford Coppola.",https://www.francetvinfo.fr/pictures/ycwr7nuPKxMiaQjVNlzib1iYU3E/1500x843/2024/05/12/000-34re627-66406f357d541352957389.jpg,2024-05-12T07:39:17Z,,"Le réalisateur et producteur américain Roger Corman, connu pour ses films à petit budget produits à un rythme effréné, est mort à l'âge de 98 ans, selon les médias américains, samedi. Sa famille a dé… [+928 chars]",,fr,'Robert de Niro'
https://www.lesinrocks.com/cinema/roger-corman-pape-de-la-serie-b-a-tire-sa-reverence-617824-13-05-2024/,https://www.lesinrocks.com/cinema/roger-corman-pape-de-la-serie-b-a-tire-sa-reverence-617824-13-05-2024/,0,www.lesinrocks.com,"Roger Corman, pape de la série B, a tiré sa révérence","Le cinéaste américain à qui l’on attribue la découverte de certains grands noms du cinéma tels que Martin Scorsese, Robert De Niro et Francis Ford Coppola est décédé à l’âge de 98 ans.",https://www.lesinrocks.com/wp-content/thumbnails/uploads/1998/04/000_34RE8U4-e1715593037421-t-1024x558.jpg,2024-05-13T10:46:56Z,,"Le cinéaste américain à qui lon attribue la découverte de certains grands noms du cinéma tels que Martin Scorsese, Robert De Niro et Francis Ford Coppola est décédé à lâge de 98 ans. 
Figure majeure… [+2405 chars]",,fr,'Francis Ford Coppola'
https://www.fredzone.org/chris-hemsworth-critiques-scorsese-coppola-marvel-et-evoque-malediction-super-heros,https://www.fredzone.org/chris-hemsworth-critiques-scorsese-coppola-marvel-et-evoque-malediction-super-heros,0,www.fredzone.org,Chris Hemsworth réplique aux critiques de Scorsese et Coppola sur Marvel et évoque une “malédiction des super-héros”…,"L’acteur Chris Hemsworth a récemment exprimé sa déception face aux critiques virulentes formulées par des réalisateurs qu’il admire, comme Martin Scorsese et Francis Ford Coppola, à l’encontre des films Marvel.   Dans une interview accordée au Times de Londre…",https://www.fredzone.org/wp-content/uploads/2022/02/Chris-Hemsworth-marvel.jpg,2024-05-13T21:39:23Z,,"Dans une interview accordée au Times de Londres, la star des films Thor et Avengers n’a pas mâché ses mots.
“Ces critiques ont été blessantes”
“Les critiques de ces réalisateurs ont été ressenties … [+2507 chars]",,fr,'Martin Scorsese'
https://www.begeek.fr/francis-ford-coppola-realise-son-star-wars-avec-megalopolis-397278,https://www.begeek.fr/francis-ford-coppola-realise-son-star-wars-avec-megalopolis-397278,0,www.begeek.fr,Francis Ford Coppola réalise son “Star Wars” avec Megalopolis,Le film Megalopolis du réalisateur américain Francis Ford Coppola sera présenté en compétition au Festival de Cannes 2024.,https://www.begeek.fr/wp-content/uploads/2024/05/Megalopolis-American-Zoetrope.jpeg,2024-05-14T06:00:35Z,,"Le film Megalopolis du réalisateur américain Francis Ford Coppola sera présenté en compétition au Festival de Cannes 2024.
Tl;dr
<ul><li>Megalopolis est le premier film de Francis Ford Coppola depu… [+2705 chars]",,fr,'Francis Ford Coppola'
