index,url,valid,domain,title,description,image,published,archive,content,quote,language,keyword
https://www.bfmtv.com/international/asie/russie/russie-ouverture-d-une-enquete-pour-financement-du-terrorisme-impliquant-l-ukraine-et-les-occidentaux_AD-202404090659.html,https://www.bfmtv.com/international/asie/russie/russie-ouverture-d-une-enquete-pour-financement-du-terrorisme-impliquant-l-ukraine-et-les-occidentaux_AD-202404090659.html,0,www.bfmtv.com,"Russie: ouverture d'une enquête pour ""financement du terrorisme"" impliquant l'Ukraine et les Occidentaux","Comité d'enquête russe a annoncé mardi l'ouverture d'une enquête pour ""financement du terrorisme"" pour le compte de l'Ukraine impliquant les Etats-Unis et leurs alliés. Il cite notamment le nom d'une société ukrainienne ayant employé le fils du président amér…",https://images.bfmtv.com/WUn_7_8joG59DOX-1_Nhg2w_W3U=/5x57:1045x642/1040x0/images/1364424.jpg,2024-04-09T14:56:49Z,,"Comité d'enquête russe a annoncé mardi l'ouverture d'une enquête pour ""financement du terrorisme"" pour le compte de l'Ukraine impliquant les Etats-Unis et leurs alliés. Il cite notamment le nom d'une… [+2722 chars]",,fr,'Alexander Smirnov'
https://www.liberation.fr/idees-et-debats/tribunes/giorgia-meloni-assigne-lhistorien-luciano-canfora-en-justice-pour-diffamation-une-aberration-20240409_Z5SG4XVWAVEI5F6DLKQOYRDGPE/,https://www.liberation.fr/idees-et-debats/tribunes/giorgia-meloni-assigne-lhistorien-luciano-canfora-en-justice-pour-diffamation-une-aberration-20240409_Z5SG4XVWAVEI5F6DLKQOYRDGPE/,0,www.liberation.fr,"Giorgia Meloni assigne l’historien Luciano Canfora en justice pour diffamation, une aberration","Pour avoir qualifié la Première ministre italienne de «néonazie dans l’âme», le chercheur comparaît devant la justice italienne le 16 avril, alerte un collectif d’une centaine d’intellectuels et de journalistes. La plaignante n’est autre que Meloni elle-même,…",https://www.liberation.fr/resizer/VNSMzL7gZmkLcbaMf7VTxgHDteo=/1200x630/filters:format(jpg):quality(70):focal(2618x1502:2628x1512)/cloudfront-eu-central-1.images.arcpublishing.com/liberation/VCBZG5L535G6FHPRDX7N2FWPJM.jpg,2024-04-09T15:38:19Z,,"A lheure où les libertés académiques sont menacées partout dans le monde, nous, historiens, philologues, philosophes, éditeurs, journalistes, souhaiterions alerter lopinion publique sur une affaire e… [+7641 chars]",,fr,'Sergio Mattarella'
https://www.lalibre.be/international/europe/guerre-ukraine-russie/2024/04/09/russie-enquete-pour-financement-du-terrorisme-impliquant-lukraine-et-les-occidentaux-PY3MYCRDTJHWVOX3JPCOHLNYOM/,https://www.lalibre.be/international/europe/guerre-ukraine-russie/2024/04/09/russie-enquete-pour-financement-du-terrorisme-impliquant-lukraine-et-les-occidentaux-PY3MYCRDTJHWVOX3JPCOHLNYOM/,0,www.lalibre.be,"Russie : enquête pour ""financement du terrorisme"" impliquant l'Ukraine et les Occidentaux","Le Comité d'enquête russe a annoncé mardi l'ouverture d'une enquête pour ""financement du terrorisme"" pour le compte de l'Ukraine impliquant les États-Unis et leurs alliés, citant notamment le nom d'une société ukrainienne ayant employé le fils du président am…",https://www.lalibre.be/resizer/v2/EOZ6SUAHIFFMHDQI25MLA4WO5I.jpg?auth=d68dd16e8e045c49206926e8b1410c06ab12444a3f2609074ac1bb6d2fe1aeda&width=1200&height=630&quality=85&focal=384%2C256&watermark=https%3A%2F%2Fcloudfront-eu-central-1.images.arcpublishing.com%2Fipmgroup%2F3R4IDPARFVEO3L2LC5OCCXQ5RM.png%3A100%3A0%2C557,2024-04-09T18:49:47Z,,"Les enquêteurs affirment, sans présenter les éléments du dossier, que Burisma a servi d'intermédiaire pour des fonds utilisés ""ces dernières années pour mener des actes terroristes en Russie et à l'é… [+1956 chars]",,fr,'nan nan'
https://www.globenewswire.com/news-release/2024/04/10/2860443/0/fr/La-saison-%C3%A0-1-million-de-dollars-de-Canada-s-Got-Talent-sign%C3%A9e-Rogers-les-meilleures-prestations-de-l-%C3%A9pisode-de-ce-soir-sur-Citytv.html,https://www.globenewswire.com/news-release/2024/04/10/2860443/0/fr/La-saison-%C3%A0-1-million-de-dollars-de-Canada-s-Got-Talent-sign%C3%A9e-Rogers-les-meilleures-prestations-de-l-%C3%A9pisode-de-ce-soir-sur-Citytv.html,0,www.globenewswire.com,La saison à 1 million de dollars de Canada’s Got Talent signée Rogers : les meilleures prestations de l’épisode de ce soir sur Citytv,"– Rogers remettra 1 million de dollars à la ou les personnes derrière le numéro gagnant, soit le plus gros prix en argent de l’histoire de la télévision canadienne –",https://ml.globenewswire.com/Resource/Download/75df463a-930e-43e3-92cc-bdb2d7058d8e,2024-04-10T01:00:00Z,,"Rogers remettra 1 million de dollars à la ou les personnes derrière le numéro gagnant, soit le plus gros prix en argent de lhistoire de la télévision canadienne 
 Regardez lépisode de ce soir de Can… [+5998 chars]",,fr,'Sam H'
https://www.lalibre.be/international/amerique/elections-us/2024/04/10/le-pari-risque-de-trump-MLYSCRGY7JEM3KS4MPOM5AL2JI/,https://www.lalibre.be/international/amerique/elections-us/2024/04/10/le-pari-risque-de-trump-MLYSCRGY7JEM3KS4MPOM5AL2JI/,0,www.lalibre.be,Le pari risqué de Trump,"En faisant primer la stratégie politique sur les positions défendues par les opposants à l'avortement, Donald Trump suscite la colère d'une partie des conservateurs américains, sans avoir pour autant la garantie que son calcul sera payant. ...",https://www.lalibre.be/resizer/v2/ZUQ6B45X6NAOVA3473EUUY6YRQ.jpg?auth=836dff7f0af6fcb274bbf71d5abfdbaf606e77f63cc3496322beea24e7bb0655&width=1200&height=630&quality=85&focal=1872%2C1248&watermark=https%3A%2F%2Fcloudfront-eu-central-1.images.arcpublishing.com%2Fipmgroup%2F3R4IDPARFVEO3L2LC5OCCXQ5RM.png%3A100%3A0%2C557,2024-04-10T06:36:28Z,,"Ce ""recul"" constitue ""une gifle"" pour les millions d'opposants à l'avortement qui ont voté pour lui en 2016 et en 2020, a fustigé son ancien vice-président Mike Pence, un fervent chrétien qui lui ava… [+3768 chars]",,fr,'Donald Trump'
https://www.presse-citron.net/elon-musk-fait-une-prediction-stupefiante-sur-lia-un-nouveau-pari-perdant/,https://www.presse-citron.net/elon-musk-fait-une-prediction-stupefiante-sur-lia-un-nouveau-pari-perdant/,0,www.presse-citron.net,Elon Musk fait une prédiction stupéfiante sur l’IA : un nouveau pari perdant ?,Le dirigeant s’attend à l’arrivée d’une technologie majeure d’ici l’année prochaine.,https://www.presse-citron.net/app/uploads/2024/02/elon-musk.jpg,2024-04-10T06:55:42Z,,Cest le Graal de lIA. Les géants du secteur rêvent dune intelligence générale artificielle (AGI) qui serait capable de dépasser lêtre humain dans de nombreuses tâches et de réfléchir par elle-même. C… [+2448 chars],,fr,'Elon Musk'
https://www.lexpress.fr/politique/macron-tout-le-monde-dit-quil-ne-maime-pas-bruno-le-maire-ce-sentiment-dinjustice-qui-le-ronge-6JLIADV66RBWXJM4TCMYHYQIRA/,https://www.lexpress.fr/politique/macron-tout-le-monde-dit-quil-ne-maime-pas-bruno-le-maire-ce-sentiment-dinjustice-qui-le-ronge-6JLIADV66RBWXJM4TCMYHYQIRA/,0,www.lexpress.fr,"""Macron, tout le monde dit qu’il ne m’aime pas"" : Bruno Le Maire, ce sentiment d’injustice qui le ronge","En privé, Emmanuel Macron mais aussi Gabriel Attal ne retiennent plus leurs coups contre le ministre de l’Economie, la maîtrise des finances publiques pour prétexte.",https://www.lexpress.fr/resizer/comK84eD21rU2gdp0uZr_f0AI6s=/1200x630/filters:focal(995x659:1005x669)/cloudfront-eu-central-1.images.arcpublishing.com/lexpress/PO5UF7R4LRBEJNQKFOSIJ7PD5Y.jpg,2024-04-10T17:12:07Z,http://archive.md/20240411055642/http://www.lexpress.fr/politique/macron-tout-le-monde-dit-quil-ne-maime-pas-bruno-le-maire-ce-sentiment-dinjustice-qui-le-ronge-6JLIADV66RBWXJM4TCMYHYQIRA/,"Parfois, Bruno Le Maire agace Gabriel Attal. Très exceptionnellement, le Premier ministre exprime son exaspération contre ""son"" impétueux ministre de lEconomie, et a aussi le bon goût de choisir son … [+9534 chars]",,fr,'Gabriel Attal'
https://www.lemonde.fr/international/article/2024/04/10/joe-biden-annonce-une-relation-de-defense-renforcee-avec-le-japon_6227102_3210.html,https://www.lemonde.fr/international/article/2024/04/10/joe-biden-annonce-une-relation-de-defense-renforcee-avec-le-japon_6227102_3210.html,0,www.lemonde.fr,Joe Biden annonce une relation de défense renforcée avec le Japon,"Le président américain a reçu en grande pompe à la Maison Blanche le premier ministre japonais, parlant d’un partenariat aussi « florissant » que des cerisiers au printemps. Le dirigeant japonais a lui appelé à la « paix et la stabilité » sur fond de tensions…",https://img.lemde.fr/2024/04/10/0/0/4659/3106/1440/960/60/0/d8d46c0_d3311bfa7c3047778f28fdddb5b1c5d6-0-0dd65b21c9a74b81b4322d2cfb62c5fa.jpg,2024-04-10T20:38:09Z,,"Le président Joe Biden et le premier ministre japonais, Fumio Kishida, se serrent la main après avoir tenu une conférence de presse conjointe dans la roseraie de la Maison Blanche, mercredi 10 avril … [+4614 chars]",,fr,'Joe Biden'
https://www.ledauphine.com/culture-loisirs/2024/04/11/audiard-honore-lellouche-riedinger-et-fargeat-cinq-cineastes-francais-en-lice-pour-la-palme-d-or,https://www.ledauphine.com/culture-loisirs/2024/04/11/audiard-honore-lellouche-riedinger-et-fargeat-cinq-cineastes-francais-en-lice-pour-la-palme-d-or,0,www.ledauphine.com,"Cannes 2024. Audiard, Honoré, Lellouche, Riedinger et Fargeat : cinq cinéastes français en lice pour la Palme d’or","Au 77e Festival de Cannes (14-25 mai), avec Camille Cottin en maîtresse de cérémonie, le jury présidé par l’actrice, scénariste et réalisatrice américaine Greta Gerwig décernera la Palme d’or à l’un des 19 films de la compétition. Cinq cinéastes français figu…",https://cdn-s-www.ledauphine.com/images/44115DCC-FBF1-40D7-85BA-8335985F89D5/FB1200/photo-1712832816.jpg,2024-04-11T11:02:00Z,,"Le Festival de Cannes, avec son délégué général, Thierry Frémaux, et sa présidente Iris Knobloch, ont annoncé jeudi une sélection prestigieuse, après une édition 2023 exceptionnelle avec plus 220 000… [+4385 chars]",,fr,'Greta Gerwig'
https://www.francetvinfo.fr/culture/cinema/festival-de-cannes/festival-de-cannes-2024-francis-ford-coppola-demi-moore-george-lucas-greta-gerwig-les-americains-s-annoncent-nombreux-sur-la-croisette_6480539.html,https://www.francetvinfo.fr/culture/cinema/festival-de-cannes/festival-de-cannes-2024-francis-ford-coppola-demi-moore-george-lucas-greta-gerwig-les-americains-s-annoncent-nombreux-sur-la-croisette_6480539.html,0,www.francetvinfo.fr,"Festival de Cannes 2024 : Francis Ford Coppola, Demi Moore, George Lucas, Greta Gerwig, les Américains s'annoncent nombreux sur la Croisette","La longue grève qui a paralysé Hollywood l'an dernier a eu un impact sur les sorties de films, dont beaucoup ont été reportés à 2025. Pourtant, les Américains, dont on attend une poignée de légendes sur la Croisette, feront encore l'événement au prochain Fest…",https://www.francetvinfo.fr/pictures/NYrigol1l_OSbE01HHsFnL1UpDs/1500x843/2024/04/11/gettyimages-1388109869-1-6617f9a48d083192401002.jpg,2024-04-11T14:58:45Z,,"Le cinéma américain n'est jamais absent de la fête du cinéma mondial qu'est le Festival de Cannes. La grève des acteurs historique de 2023 à Hollywood, qui a paralysé les tournages durant de longs mo… [+5782 chars]",,fr,'Emma Stone'
https://www.huffingtonpost.fr/culture/article/comme-mademoiselle-holmes-sur-tf1-ces-autres-adaptations-des-aventures-de-sherlock-holmes_232391.html,https://www.huffingtonpost.fr/culture/article/comme-mademoiselle-holmes-sur-tf1-ces-autres-adaptations-des-aventures-de-sherlock-holmes_232391.html,0,www.huffingtonpost.fr,"Comme « Mademoiselle Holmes » sur TF1, ces autres adaptations des aventures de Sherlock Holmes","À partir du 11 avril, TF1 diffuse la série « Mademoiselle Holmes », tirée des aventures de Sherlock Holmes. Mais avant elle, le héros d’Arthur Conan Doyle a fait l’objet de nombreuses adaptations.",https://huffpost-focus.sirius.press/2024/04/11/0/0/1365/768/1820/1023/75/0/61d60ad_1712823964482-galerie-de-3-images.png,2024-04-11T16:30:10Z,,"CULTURE - Sherlock Holmes nest pas près de prendre sa retraite. Séries, films, animés Sherlock Holmes a eu son lot dadaptations. Créé par lécrivain Sir Arthur Conan Doyle en 1887, le célèbre détectiv… [+7313 chars]",,fr,'nan nan'
https://www.telerama.fr/cinema/festival-de-cannes-2024-les-acteurs-et-les-actrices-les-plus-attendues-sur-la-croisette-7020034.php,https://www.telerama.fr/cinema/festival-de-cannes-2024-les-acteurs-et-les-actrices-les-plus-attendues-sur-la-croisette-7020034.php,0,www.telerama.fr,Festival de Cannes 2024 : les acteurs et les actrices les plus attendues sur la Croisette,"Emma Stone, Adam Driver, Selena Gomez, Nicolas Cage… Mais aussi Léa Seydoux, Adèle Exarchopoulos, Vincent Lacoste ou Jean-Pascal Zadi : du beau monde devrait fouler le tapis rouge du 14 au 25 mai prochain.",https://focus.telerama.fr/2024/04/12/0/0/1500/1000/1200/800/60/0/380c82e_1712920039989-starscannes.jpg/webp,2024-04-12T10:26:54Z,,"Alain Chabat, Cate Blanchett et Zoe Saldana devraient se rendre à Cannes en mai prochain. Photo Jérôme Bonnet pour Télérama, Amanda Edwards/Getty Images, Todd Owyoung/NBC via Getty Images
Publié le … [+2488 chars]",,fr,'Emma Stone'
https://www.konbini.com/popculture/dua-lipa-future-metro-boomin-lafleyne-nia-archives-kpri-sonny-rave-nos-sorties-musicales-preferees-de-la-semaine/,https://www.konbini.com/popculture/dua-lipa-future-metro-boomin-lafleyne-nia-archives-kpri-sonny-rave-nos-sorties-musicales-preferees-de-la-semaine/,0,www.konbini.com,"Dua Lipa, Future &#038; Metro Boomin, Lafleyne, Nia Archives, Kpri, Sonny Rave : nos sorties musicales préférées de la semaine","Chaque semaine, la rédaction de Konbini partage avec vous ses nouveaux coups de cœur musicaux. Alors, on écoute quoi, ce 12 avril 2024 ? Le coup de cœur de Tim, le partageur qui écrit cet article Future...",https://cdn-www.konbini.com/files/2024/04/Dua-Lipa-Illusion.jpg,2024-04-12T14:48:09Z,,"Chaque semaine, la rédaction de Konbini partage avec vous ses nouveaux coups de cur musicaux. Alors, on écoute quoi, ce 12 avril 2024 ?
Le coup de cur de Tim, le partageur qui écrit cet article
Fut… [+6567 chars]",,fr,'Dua Lipa'
https://www.lemonde.fr/economie/article/2024/04/13/face-a-la-chine-l-allemagne-continue-a-preferer-le-rapprochement-a-l-affrontement_6227557_3234.html,https://www.lemonde.fr/economie/article/2024/04/13/face-a-la-chine-l-allemagne-continue-a-preferer-le-rapprochement-a-l-affrontement_6227557_3234.html,0,www.lemonde.fr,"Face à la Chine, l’Allemagne continue à préférer le rapprochement à l’affrontement","Le chancelier allemand, Olaf Scholz, est attendu à Pékin à partir de dimanche pour une visite qui devrait célébrer les liens économiques entre les deux pays. Loin des promesses de changement stratégique affiché par Berlin ces derniers mois.",https://img.lemde.fr/2024/04/13/60/0/8412/5608/1440/960/60/0/a0d60c9_1712978475296-441478.jpg,2024-04-13T03:37:53Z,,"Le président chinois Xi Jinping accueille le chancelier allemand Olaf Scholz au Grand Hall de Pékin, le 4 novembre 2022. KAY NIETFELD / AFP
Cétait il y a neuf mois. Le 13 juillet 2023, le gouverneme… [+2441 chars]",,fr,'Olaf Scholz'
https://www.liberation.fr/international/iran-israel-inquietude-appel-a-la-retenue-risque-descalade-les-reactions-apres-lattaque-sans-precedent-20240414_7MTRX6H7JZCAJNKJUPQQVMQ7KE/,https://www.liberation.fr/international/iran-israel-inquietude-appel-a-la-retenue-risque-descalade-les-reactions-apres-lattaque-sans-precedent-20240414_7MTRX6H7JZCAJNKJUPQQVMQ7KE/,0,www.liberation.fr,"Iran-Israël : «Inquiétude», «appel à la retenue», risque «d’escalade»… Les réactions après l’attaque sans précédent","Craignant un embrasement du Proche-Orient, la communauté internationale condamne les centaines de drones et de missiles lancés par Téhéran sur le territoire israélien samedi 13 avril dans la soirée.",https://www.liberation.fr/resizer/T4_jNOAB30--hK4NuAKRiGbjmSY=/1200x630/filters:format(jpg):quality(70)/cloudfront-eu-central-1.images.arcpublishing.com/liberation/6KNON4YGM5EW3P3H6FUGANZQLY.JPG,2024-04-14T05:34:13Z,,"Lattaque inédite menée par lIran contre Israël samedi 13 avril dans la soirée, avec des centaines de drones et de missiles lancés depuis le territoire iranien, suscite de vives condamnations dans le … [+6791 chars]",,fr,'nan nan'
https://www.liberation.fr/sports/jeux-olympiques/paris-2024-macron-confirme-la-grande-ceremonie-douverture-sur-la-seine-mais-evoque-des-scenarios-de-repli-20240415_XKFKWTEDC5H7LFB3D7FAKO5WG4/,https://www.liberation.fr/sports/jeux-olympiques/paris-2024-macron-confirme-la-grande-ceremonie-douverture-sur-la-seine-mais-evoque-des-scenarios-de-repli-20240415_XKFKWTEDC5H7LFB3D7FAKO5WG4/,0,www.liberation.fr,"Paris 2024 : Macron confirme la «grande cérémonie d’ouverture» sur la Seine, mais évoque des «scénarios de repli»","A près de 100 jours de l’ouverture des Jeux olympiques à Paris cet été, le président de la République est interviewé sur BFMTV et RMC ce lundi 15 avril au matin, avant de visiter le chantier du Grand Palais.",https://www.liberation.fr/resizer/QolSwyYtcdbEElasWDFOvNkU11k=/1200x630/filters:format(jpg):quality(70)/cloudfront-eu-central-1.images.arcpublishing.com/liberation/5ROGLMNH2BC7HFMI5RAZCKB7DE.jpg,2024-04-15T06:50:42Z,,"Lentrée dans la dernière ligne droite. A près de 100 jours du début des Jeux olympiques à Paris, Emmanuel Macron a confirmé la «grande cérémonie douverture» sur la Seine, ce lundi 15 avril au matin s… [+2647 chars]",,fr,'Emmanuel Macron'
https://www.liberation.fr/international/moyen-orient/iran-israel-la-france-a-procede-a-des-interceptions-de-missiles-et-de-drones-a-la-demande-de-la-jordanie-annonce-emmanuel-macron-20240415_KWAQ4G7FWFAJRNRLWHQMWAUPTY/,https://www.liberation.fr/international/moyen-orient/iran-israel-la-france-a-procede-a-des-interceptions-de-missiles-et-de-drones-a-la-demande-de-la-jordanie-annonce-emmanuel-macron-20240415_KWAQ4G7FWFAJRNRLWHQMWAUPTY/,0,www.liberation.fr,"Iran-Israël : la France a procédé à des «interceptions» de missiles et de drones à la demande de la Jordanie, annonce Emmanuel Macron","A l’occasion d’une interview chez RMC et BFMTV à 100 jours du début des Jeux olympiques, le président de la République a réagi à l’attaque iranienne sur Israël ce week-end.",https://www.liberation.fr/resizer/WrB45xnWfJtN4P8QiksPWmuZ1KE=/1200x630/filters:format(jpg):quality(70):focal(758x1539:768x1549)/cloudfront-eu-central-1.images.arcpublishing.com/liberation/3OUB27P7X5HGTJ2W4L7EKWQE6I.jpg,2024-04-15T07:15:15Z,,"Un gros point diplomatie. Emmanuel Macron était linvité ce lundi 15 avril de RMC et de BFMTV notamment pour évoquer lorganisation des Jeux olympiques à Paris, qui démarreront dans 100 jours. Le prési… [+1424 chars]",,fr,'président de la République'
https://www.lemonde.fr/international/live/2024/04/15/en-direct-guerre-en-ukraine-le-president-de-la-chambre-des-representants-compte-plaider-cette-semaine-en-faveur-d-une-aide-a-israel-et-a-l-ukraine_6227754_3210.html,https://www.lemonde.fr/international/live/2024/04/15/en-direct-guerre-en-ukraine-le-president-de-la-chambre-des-representants-compte-plaider-cette-semaine-en-faveur-d-une-aide-a-israel-et-a-l-ukraine_6227754_3210.html,0,www.lemonde.fr,"En direct, guerre en Ukraine : le président de la Chambre des représentants compte plaider « cette semaine » en faveur d’une aide à Israël et à l’Ukraine","Mike Johnson se heurte aux pressions d’un caucus républicain divisé sur la question de l’aide à l’Ukraine, et le Congrès bloque depuis deux mois une enveloppe supplémentaire de 95 milliards de dollars visant notamment à procurer une aide humanitaire aux civil…",https://img.lemde.fr/2024/04/15/486/0/5830/2915/1440/720/60/0/66fd799_1713184881575-296260.jpg,2024-04-15T12:44:24Z,,"Deux ans après le début de la guerre à grande échelle, la dynamique du soutien occidental à Kiev est en perte de vitesse : les aides nouvellement engagées sont en baisse sur la période daoût 2023 à j… [+2370 chars]",,fr,'Mike Johnson'
https://www.liberation.fr/international/europe/proces-de-donald-trump-appels-a-la-retenue-au-proche-orient-record-de-chaleur-en-france-lactu-de-ce-lundi-15-avril-20240415_4EQQVFGYYBGJRM3XX2CCEA76QM/,https://www.liberation.fr/international/europe/proces-de-donald-trump-appels-a-la-retenue-au-proche-orient-record-de-chaleur-en-france-lactu-de-ce-lundi-15-avril-20240415_4EQQVFGYYBGJRM3XX2CCEA76QM/,0,www.liberation.fr,"Procès de Donald Trump, appels à la retenue au Proche-Orient, record de chaleur en France… L’actu de ce lundi 15 avril",La rédaction de «Libération» récapitule les principales actualités de la journée du lundi 15 avril.,https://www.liberation.fr/resizer/xf1XhIzaZe4nNIR5wfRxhn6jiTY=/1200x630/filters:format(jpg):quality(70):focal(2785x503:2795x513)/cloudfront-eu-central-1.images.arcpublishing.com/liberation/HQGU6HTZY5HJLEUISGWYNZD73Q.jpg,2024-04-15T18:47:57Z,,"Chaque soir, la rédaction de Libé sélectionne les actualités du jour quil ne fallait pas rater en France et dans le reste du monde.
Jugé à New York à partir de ce lundi pour de possibles malversatio… [+4436 chars]",,fr,'Emmanuel Macron'
https://www.20minutes.fr/monde/etats-unis/4086636-20240416-etats-unis-biden-devoile-feuille-impots-revenus-hausse,https://www.20minutes.fr/monde/etats-unis/4086636-20240416-etats-unis-biden-devoile-feuille-impots-revenus-hausse,0,www.20minutes.fr,Etats-Unis : Biden dévoile sa feuille d’impôts avec des revenus en hausse,Cette tradition américaine avait été temporairement interrompue lors du mandat présidentielle de Donald Trump,https://img.20mn.fr/R4o9UZ00QSCTKUDzE_BW9Sk/1444x920_mandatory-credit-photo-by-mike-theiler-upi-shutterstock-14223730d-president-joe-biden-celebrating-his-81st-birthday-today-removes-his-trdemark-aviator-sunglasses-as-he-arrives-for-the-ceremony-to-pardon-the-thanksgiving-turkey-liberty-at-the-white-house-monday-november-20-2023-washington-dc-the-annual-holiday-tradition-spares-the-turkeys-from-a-family-s-carving-table-president-biden-marks-81st-birthday-at-white-hpuse-washington-district-of-columbia-united-states-20-nov-2023-shutterstock-editorial-president-biden-marks-81st-bir-14223730d-2311201908,2024-04-16T01:45:33Z,,"En pleine campagne présidentielle aux Etats-Unis, Joe Biden joue la carte de la transparence. Le président américain a rendu publique lundi sa déclaration dimpôts, une tradition américaine qui avait … [+1812 chars]",,fr,'Jill Biden'
https://www.lalibre.be/international/amerique/elections-us/2024/04/16/biden-publie-sa-declaration-dimpots-des-revenus-en-hausse-ZIINAZBKOBD4PFFQLYWHHNIASQ/,https://www.lalibre.be/international/amerique/elections-us/2024/04/16/biden-publie-sa-declaration-dimpots-des-revenus-en-hausse-ZIINAZBKOBD4PFFQLYWHHNIASQ/,0,www.lalibre.be,Biden publie sa déclaration d'impôts : des revenus en hausse,"Le président américain Joe Biden a rendu publique lundi sa déclaration d'impôts, une tradition américaine de transparence au sommet de l'Etat, qui avait été temporairement interrompue sous son prédécesseur à la Maison Blanche, le magnat milliardaire Donald Tr…",https://www.lalibre.be/resizer/v2/T7DEFM33KJDXZEA7UCLOZBCJLA.jpg?auth=1bd26c9411e3a96949daa33aa07692d959f430464b45e8857274d8f8439ee532&width=1200&height=630&quality=85&focal=1007%2C671&watermark=https%3A%2F%2Fcloudfront-eu-central-1.images.arcpublishing.com%2Fipmgroup%2F3R4IDPARFVEO3L2LC5OCCXQ5RM.png%3A100%3A0%2C557,2024-04-16T05:47:49Z,,"Selon leur déclaration, les époux Biden ont perçu 619.976 dollars en 2023, dont la majeure partie provient du salaire de 400.000 dollars du président et de la rémunération de 85.985 dollars de sa fem… [+1270 chars]",,fr,'Jill Biden'
https://www.dhnet.be/actu/monde/2024/04/16/biden-publie-sa-declaration-dimpots-des-revenus-en-hausse-UM7V7J44WBDO5N4BAZI2TQMNA4/,https://www.dhnet.be/actu/monde/2024/04/16/biden-publie-sa-declaration-dimpots-des-revenus-en-hausse-UM7V7J44WBDO5N4BAZI2TQMNA4/,0,www.dhnet.be,Biden publie sa déclaration d'impôts : des revenus en hausse,"Le président américain Joe Biden a rendu publique lundi sa déclaration d'impôts, une tradition américaine de transparence au sommet de l'Etat, qui avait été temporairement interrompue sous son prédécesseur à la Maison Blanche, le magnat milliardaire Donald Tr…",https://www.dhnet.be/resizer/v2/T7DEFM33KJDXZEA7UCLOZBCJLA.jpg?auth=1bd26c9411e3a96949daa33aa07692d959f430464b45e8857274d8f8439ee532&width=1200&height=630&quality=85&focal=1007%2C671&watermark=https%3A%2F%2Fcloudfront-eu-central-1.images.arcpublishing.com%2Fipmgroup%2FDZNGDE46VVGXRGHD3TEI5RB3GM.png%3A100%3A0%2C559,2024-04-16T05:58:03Z,,"Selon leur déclaration, les époux Biden ont perçu 619.976 dollars en 2023, dont la majeure partie provient du salaire de 400.000 dollars du président et de la rémunération de 85.985 dollars de sa fem… [+1270 chars]",,fr,'Joe Biden'
