index,url,valid,domain,title,description,image,published,archive,content,quote,language,keyword
https://www.challenges.fr/monde/defile-de-la-famille-trump-attendu-au-proces-civil-qui-menace-son-empire-immobilier_872566,https://www.challenges.fr/monde/defile-de-la-famille-trump-attendu-au-proces-civil-qui-menace-son-empire-immobilier_872566,0,www.challenges.fr,Défilé de la famille Trump attendu au procès civil qui menace son empire immobilier,"Donald Trump a toujours associé ses enfants à ses affaires et à sa carrière politique: trois d'entre eux et le milliardaire républicain lui-même sont attendus à partir de mercredi à la barre des témoins à New York, au procès civil pour fraudes financières qui…",https://www.challenges.fr/assets/afp/2023/11/01/907f87e7fd45044dbf373893afaf520257ada314.jpg,2023-11-01T03:00:28Z,https://web.archive.org/web/20231103050500/https://www.challenges.fr/monde/defile-de-la-famille-trump-attendu-au-proces-civil-qui-menace-son-empire-immobilier_872566,Donald Trump a toujours associé ses enfants à ses affaires et à sa carrière politique: trois d'entre eux et le milliardaire républicain lui-même sont attendus à partir de mercredi à la barre des témo… [+3697 chars],,fr,'Eric Trump'
https://www.challenges.fr/finance-et-marche/les-titans-de-la-finance-ont-ils-tire-les-lecons-de-la-crise-de-2008_871957,https://www.challenges.fr/finance-et-marche/les-titans-de-la-finance-ont-ils-tire-les-lecons-de-la-crise-de-2008_871957,0,www.challenges.fr,Les titans de la finance ont-ils tiré les leçons de la crise de 2008?,"Banques, fonds d'investissement, fonds souverains, fonds activistes... Challenges vous propose de découvrir comment les ""titans de la finance"" gouvernent le monde quinze ans après le krach de 2008.",https://www.challenges.fr/assets/img/2023/10/30/cover-r4x3w1200-653a54fda01e5-sipa-sipausa30323794-000002.jpg,2023-11-01T06:00:00Z,,"Lire aussiFaillite de Lehman Brothers : que pèse la morale face à lefficacité économique?
Le capitalisme mondialisé est au bord du gouffre, à cause de la spéculation de banquiers sous le regard bien… [+9600 chars]",,fr,'nan nan'
https://www.lepoint.fr/politique/immigration-lr-et-rn-a-front-renverse-01-11-2023-2541560_20.php,https://www.lepoint.fr/politique/immigration-lr-et-rn-a-front-renverse-01-11-2023-2541560_20.php,0,www.lepoint.fr,Immigration : LR et RN à front renversé,"ANALYSE. En miroir de la fermete affichee par les pontes des Republicains, Marine Le Pen entend envoyer une image de parti responsable et constructif. Un piege pour le gouvernement.",https://static.lpnt.fr/images/2023/11/01/25463615lpw-25463943-mega-une-jpg_9873566.jpg,2023-11-01T08:00:00Z,,"Alors que la loi immigration, présentée il y a un an et sans cesse reportée depuis, revient le 6 novembre au Sénat, nul, ou presque, ne connaissait, jusqu'à dimanche, la position du Rassemblement nat… [+6396 chars]",,fr,'Bruno Retailleau'
https://www.huffingtonpost.fr/divertissement/article/halloween-2023-heidi-klum-renversante-paris-hilton-version-toxic-les-meilleurs-deguisements-de-stars_225175.html,https://www.huffingtonpost.fr/divertissement/article/halloween-2023-heidi-klum-renversante-paris-hilton-version-toxic-les-meilleurs-deguisements-de-stars_225175.html,0,www.huffingtonpost.fr,"Halloween 2023 : Heidi Klum renversante, Paris Hilton version « Toxic »… Les meilleurs déguisements de stars",Déguisement de paon version Heidi Klum ou costume ultra-réaliste de caméléon pour Janelle Monáe. La guerre des déguisements à encore fait rage cette année entre les stars américaines pour Halloween.,https://huffpost-focus.sirius.press/2023/11/01/214/0/3000/1687/1820/1023/75/0/abcc9f4_1698828851471-063-1768099857.jpg,2023-11-01T09:46:49Z,,"HALLOWEEN - La reine des déguisements a encore frappé pour Halloween 2023. Comme chaque année, lors de cette fête très populaire de lautre côté de lAtlantique, les stars et people se sont déguisés co… [+10244 chars]",,fr,'Paris Hilton'
https://www.7sur7.be/monde/defile-de-la-famille-trump-attendu-au-proces-civil-qui-menace-son-empire-immobilier~a2507be2/,https://www.7sur7.be/monde/defile-de-la-famille-trump-attendu-au-proces-civil-qui-menace-son-empire-immobilier~a2507be2/,0,www.7sur7.be,Défilé de la famille Trump attendu au procès civil qui menace son empire immobilier,"Donald Trump a toujours associé ses enfants à ses affaires et à sa carrière politique: trois d’entre eux et le milliardaire républicain lui-même sont attendus à partir de mercredi à la barre des témoins à New York, au procès civil pour fraudes financières qui…",https://images0.persgroep.net/rcs/ha-6VzDT44_eJWoiZaPD3z-yZp0/diocontent/237098465/_focus/0.52/0.26/_fill/1200/630/?appId=21791a8992982cd8da851550a453bd7f&quality=0.7,2023-11-01T11:30:32Z,https://web.archive.org/web/20231102031644/https://www.7sur7.be/monde/defile-de-la-famille-trump-attendu-au-proces-civil-qui-menace-son-empire-immobilier~a2507be2/,"Si tout se passe comme prévu, le défilé du clan familial démarre mercredi par Donald Trump Jr, 45 ans, et se poursuit jeudi avec Eric Trump, 39 ans.
Tous deux vice-présidents exécutifs de la Trump O… [+3683 chars]",,fr,'Donald Trump'
https://iletaitunepub.fr/2023/11/01/291934/actualites-people/paris-hilton-souhaite-un-bel-anniversaire-a-sa-cousine-et-devoile-des-photos-denfance/,https://iletaitunepub.fr/2023/11/01/291934/actualites-people/paris-hilton-souhaite-un-bel-anniversaire-a-sa-cousine-et-devoile-des-photos-denfance/,0,iletaitunepub.fr,Paris Hilton souhaite un bel anniversaire à sa cousine et dévoile des photos d’enfance,"Si vous aviez la télévision il y a une vingtaine d’années, vous vous souvenez forcément de Paris Hilton. La jolie blonde faisait les 400 coups avec son amie Nicole Richie dans la téléréalité The simple life. Actrice, mannequin, mais aussi DJ, on connaît surto…",https://iletaitunepub.fr/wp/wp-content/uploads/2023/11/paris-hilton.jpg,2023-11-01T13:19:53Z,,"Afficher Masquer le sommaire
Si vous aviez la télévision il y a une vingtaine d’années, vous vous souvenez forcément de Paris Hilton. La jolie blonde faisait les 400 coups avec son amie Nicole Richi… [+2623 chars]",,fr,'Paris Hilton'
https://theconversation.com/conflit-israelo-palestinien-quel-impact-possible-sur-la-presidentielle-aux-etats-unis-216659,https://theconversation.com/conflit-israelo-palestinien-quel-impact-possible-sur-la-presidentielle-aux-etats-unis-216659,0,theconversation.com,Conflit israélo-palestinien : quel impact possible sur la présidentielle aux États-Unis ?,"En se plaçant du côté d’Israël, Joe Biden s’expose à de vives critiques venant du flanc gauche de son parti, et à la perte d’un certain nombre de voix à la présidentielle qui aura lieu dans un an.",https://images.theconversation.com/files/556678/original/file-20231030-19-y14ksp.jpg?ixlib=rb-1.1.0&rect=70%2C774%2C7751%2C3870&q=45&auto=format&w=1356&h=668&fit=crop,2023-11-01T17:18:41Z,,"Le 5 novembre 2024, les Américains se rendront aux urnes pour désigner leur prochain président. Côté démocrate, Joe Biden va probablement se représenter pour un second mandat ; en face, dans le camp … [+10700 chars]",,fr,'Joe Biden'
https://www.ledauphine.com/faits-divers-justice/2023/11/01/defile-de-la-famille-trump-au-proces-civil-qui-menace-son-empire-immobilier,https://www.ledauphine.com/faits-divers-justice/2023/11/01/defile-de-la-famille-trump-au-proces-civil-qui-menace-son-empire-immobilier,0,www.ledauphine.com,États-Unis. Défilé de la famille Trump au procès civil qui menace son empire immobilier,"Le fils aîné de l'ancien président américain Donald Trump Jr. a été auditionné ce mercredi au tribunal de Manhattan dans un procès civil pour fraudes financières. Ce sera ensuite au tour d'Eric Trump, puis Donald Trump lui-même et Ivanka Trump de venir témoig…",https://cdn-s-www.ledauphine.com/images/1149C1DB-0C42-4E6D-A109-633FCA23FDD8/FB1200/photo-1698873271.jpg,2023-11-01T21:16:00Z,https://web.archive.org/web/20231102022737/https://www.ledauphine.com/faits-divers-justice/2023/11/01/defile-de-la-famille-trump-au-proces-civil-qui-menace-son-empire-immobilier,"Donald Trump Jr, 45 ans, a confirmé, au tout début de son témoignage mercredi, son rôle au sommet de la Trump Organization qui regroupe une myriade de sociétés gérant des gratte-ciel de logements et … [+2436 chars]",,fr,'Donald Trump'
https://www.lalibre.be/international/amerique/2023/11/02/donald-trump-jr-se-defend-au-proces-civil-qui-menace-lempire-familial-PVD53DZCR5D7BC4RHIXQ5MOA3U/,https://www.lalibre.be/international/amerique/2023/11/02/donald-trump-jr-se-defend-au-proces-civil-qui-menace-lempire-familial-PVD53DZCR5D7BC4RHIXQ5MOA3U/,0,www.lalibre.be,Donald Trump Jr se défend au procès civil qui menace l'empire familial,"Donald Trump Jr, premier des enfants du milliardaire républicain à témoigner à son procès civil à New York pour de vastes fraudes financières, a assuré mercredi au tribunal qu'il ne s'était pas occupé des documents financiers au centre de l'accusation.","https://www.lalibre.be/resizer/O7domEzMwc_TBJo4OMI_trZM5GU=/1200x630/filters:format(jpeg):focal(2655.5x1778.5:2665.5x1768.5):watermark(cloudfront-eu-central-1.images.arcpublishing.com/ipmgroup/OIO44DUUUNC2DB5T3FIJECBT5U.png,0,-0,0,100)/cloudfront-eu-central-1.images.arcpublishing.com/ipmgroup/CSD6V7IJOJFN7NFHUFFU3HVA2I.jpg",2023-11-02T06:24:24Z,https://web.archive.org/web/20231103021647/https://www.lalibre.be/international/amerique/2023/11/02/donald-trump-jr-se-defend-au-proces-civil-qui-menace-lempire-familial-PVD53DZCR5D7BC4RHIXQ5MOA3U/,"Vice-président exécutif de la Trump Organization, Donald Trump Jr, 45 ans, est accusé, comme son père et son frère cadet Eric, par la procureure générale de l'Etat de New York, Letitia James, d'avoir… [+1317 chars]",,fr,'Donald Trump'
https://www.lavenir.net/actu/monde/2023/11/02/le-fils-aine-trump-se-defend-au-proces-civil-qui-menace-lempire-familial-PEOX4DVFIVGVNF2X35JTNMDWU4/,https://www.lavenir.net/actu/monde/2023/11/02/le-fils-aine-trump-se-defend-au-proces-civil-qui-menace-lempire-familial-PEOX4DVFIVGVNF2X35JTNMDWU4/,0,www.lavenir.net,Le fils aîné Trump se défend au procès civil qui menace l'empire familial,"Donald Trump Jr, premier des enfants du milliardaire républicain à témoigner à son procès civil à New York pour de vastes fraudes financières, a assuré mercredi au tribunal qu'il ne s'était pas occupé des documents financiers au centre de l'accusation.","https://www.lavenir.net/resizer/mr7Er-_uk6eSfCNB0TEORTky3vU=/1200x630/filters:format(jpeg):focal(2257.5x1513.5:2267.5x1503.5):watermark(cloudfront-eu-central-1.images.arcpublishing.com/ipmgroup/UFVD77VYQZHRHBUO5OR7E7I6TY.png,0,-0,0,100)/cloudfront-eu-central-1.images.arcpublishing.com/ipmgroup/SNOYWA2GKFA7JMJLJC4OCUFPAI.jpg",2023-11-02T06:27:05Z,https://web.archive.org/web/20231103015808/https://www.lavenir.net/actu/monde/2023/11/02/le-fils-aine-trump-se-defend-au-proces-civil-qui-menace-lempire-familial-PEOX4DVFIVGVNF2X35JTNMDWU4/,"Vice-président exécutif de la Trump Organization, Donald Trump Jr, 45 ans, est accusé, comme son père et son frère cadet Eric, par la procureure générale de l'Etat de New York, Letitia James, d'avoir… [+2129 chars]",,fr,'Eric Trump'
https://www.dhnet.be/actu/monde/2023/11/02/le-fils-aine-trump-se-defend-au-proces-civil-qui-menace-lempire-familial-RLFTQURZO5G2LJC37QCXOBUGUA/,https://www.dhnet.be/actu/monde/2023/11/02/le-fils-aine-trump-se-defend-au-proces-civil-qui-menace-lempire-familial-RLFTQURZO5G2LJC37QCXOBUGUA/,0,www.dhnet.be,Le fils aîné Trump se défend au procès civil qui menace l'empire familial,"Donald Trump Jr, premier des enfants du milliardaire républicain à témoigner à son procès civil à New York pour de vastes fraudes financières, a assuré mercredi au tribunal qu'il ne s'était pas occupé des documents financiers au centre de l'accusation.","https://www.dhnet.be/resizer/CRMyyYG_GHJ2c6llVmMUn6xOoj0=/1200x630/filters:format(jpeg):focal(251x175.5:261x165.5):watermark(cloudfront-eu-central-1.images.arcpublishing.com/ipmgroup/KSYODHLMNBBMDA7B5YPJPTFVNY.png,0,-0,0,100)/cloudfront-eu-central-1.images.arcpublishing.com/ipmgroup/4TFIHQ3VPRCSRDXLEFYC4QHOD4.jpg",2023-11-02T06:28:20Z,https://web.archive.org/web/20231102205454/https://www.dhnet.be/actu/monde/2023/11/02/le-fils-aine-trump-se-defend-au-proces-civil-qui-menace-lempire-familial-RLFTQURZO5G2LJC37QCXOBUGUA/,"Vice-président exécutif de la Trump Organization, Donald Trump Jr, 45 ans, est accusé, comme son père et son frère cadet Eric, par la procureure générale de l'Etat de New York, Letitia James, d'avoir… [+1144 chars]",,fr,'Eric Trump'
https://www.lemonde.fr/international/article/2023/11/02/en-argentine-javier-milei-et-sa-colistiere-remettent-en-cause-l-existence-d-un-terrorisme-d-etat-durant-la-dictature_6197854_3210.html,https://www.lemonde.fr/international/article/2023/11/02/en-argentine-javier-milei-et-sa-colistiere-remettent-en-cause-l-existence-d-un-terrorisme-d-etat-durant-la-dictature_6197854_3210.html,0,www.lemonde.fr,"En Argentine, Javier Milei et sa colistière remettent en cause l’existence d’un terrorisme d’Etat durant la dictature","Les propos, qualifiés de négationnisme par les familles de victimes, du candidat d’extrême droite au second tour de la présidentielle du 19 novembre, et de Victoria Villarruel, pressentie pour être sa vice-présidente, inquiètent.",https://img.lemde.fr/2023/11/01/0/0/5500/3666/1440/960/60/0/b3cfaf0_1698856674164-100483.jpg,2023-11-02T10:27:38Z,https://web.archive.org/web/20231102122710/https://www.lemonde.fr/international/article/2023/11/02/en-argentine-javier-milei-et-sa-colistiere-remettent-en-cause-l-existence-d-un-terrorisme-d-etat-durant-la-dictature_6197854_3210.html,"Le candidat à la présidentielle en Argentine Javier Milei et sa colistière Victoria Villarruel, à Buenos Aires, le 18 octobre 2023. MATIAS BAGLIETTO / REUTERS
Le visage est fermé, le ton dur : « Pen… [+2947 chars]",,fr,'Javier Milei'
https://www.challenges.fr/economie/sous-le-feu-des-questions-les-fils-trump-tentent-de-faire-bloc-au-tribunal_872847,https://www.challenges.fr/economie/sous-le-feu-des-questions-les-fils-trump-tentent-de-faire-bloc-au-tribunal_872847,0,www.challenges.fr,"Sous le feu des questions, les fils Trump tentent de faire bloc au tribunal","Donald Trump Jr, puis Eric Trump, les deux fils de Donald Trump poursuivis avec lui au procès civil pour de vastes fraudes financières qui menace l'empire familial, ont tenté de faire bloc jeudi au tribunal face au feu roulant des questions de l'accusation.
L…",https://www.challenges.fr/assets/afp/2023/11/02/901aaf7859347e710029cce22032b94bba0084ce.jpg,2023-11-02T16:09:45Z,,"Donald Trump Jr, puis Eric Trump, les deux fils de Donald Trump poursuivis avec lui au procès civil pour de vastes fraudes financières qui menace l'empire familial, ont tenté de faire bloc jeudi au t… [+4485 chars]",,fr,'Eric Trump'
https://www.slate.fr/story/255716/guerre-israel-hamas-presidentielle-americaine-2024-etats-unis-joe-biden-donald-trump-palestine,https://www.slate.fr/story/255716/guerre-israel-hamas-presidentielle-americaine-2024-etats-unis-joe-biden-donald-trump-palestine,0,www.slate.fr,La guerre Israël-Hamas plombe le Parti démocrate à un an de la présidentielle américaine,"En se plaçant du côté d'Israël, Joe Biden s'expose à la perte d'un certain nombre de voix à l'élection qui se tiendra en novembre 2024. Lire la suite",https://www.slate.fr/sites/default/files/styles/1200x680/public/33yk37q-highres.jpg,2023-11-02T18:00:00Z,,"Temps de lecture: 7 min
Le 5 novembre 2024, les Américains devraient se rendre aux urnes pour désigner leur prochain président. Côté démocrate, l'actuel dirigeant Joe Biden va probablement se représ… [+11019 chars]",,fr,'George Bush'
https://www.7sur7.be/monde/les-fils-de-donald-trump-sous-pression-au-tribunal-je-faisais-confiance-aux-comptables~a6291bf8/,https://www.7sur7.be/monde/les-fils-de-donald-trump-sous-pression-au-tribunal-je-faisais-confiance-aux-comptables~a6291bf8/,0,www.7sur7.be,Les fils de Donald Trump sous pression au tribunal: “Je faisais confiance aux comptables”,"Donald Trump Jr, puis Eric Trump, les deux fils de Donald Trump poursuivis avec lui au procès civil pour de vastes fraudes financières qui menace l’empire familial, ont tenté de faire bloc jeudi au tribunal face au feu roulant des questions de l’accusation.",https://images0.persgroep.net/rcs/-xv0rOnbQ80JoLJsoxIRnB9Gmxk/diocontent/237200123/_focus/0.44/0.44/_fill/1200/630/?appId=21791a8992982cd8da851550a453bd7f&quality=0.7,2023-11-02T20:24:56Z,https://web.archive.org/web/20231103014752/https://www.7sur7.be/monde/les-fils-de-donald-trump-sous-pression-au-tribunal-je-faisais-confiance-aux-comptables~a6291bf8/,"Lun après lautre, laîné Donald Jr, 45 ans, puis le cadet Eric, 39 ans, entendus à la barre jeudi, ont adopté la même ligne de défense: ils ne soccupaient pas des déclarations financières au centre du… [+4079 chars]",,fr,'nan nan'
https://www.lalibre.be/international/amerique/2023/11/02/sous-le-feu-des-questions-les-fils-trump-tentent-de-faire-bloc-au-tribunal-P3RMKP6QHBAQNKY6NTAET35GEQ/,https://www.lalibre.be/international/amerique/2023/11/02/sous-le-feu-des-questions-les-fils-trump-tentent-de-faire-bloc-au-tribunal-P3RMKP6QHBAQNKY6NTAET35GEQ/,0,www.lalibre.be,"Sous le feu des questions, les fils Trump tentent de faire bloc au tribunal","Donald Trump Jr, puis Eric Trump, les deux fils de Donald Trump accusés comme leur père de vastes fraudes financières au procès civil qui menace l'empire familial, ont tenté de faire bloc jeudi au tribunal de New York, malgré un feu roulant de questions de l'…","https://www.lalibre.be/resizer/V8KZE0GXdOJ4_j86ad3OfjAnE_A=/1200x630/filters:format(jpeg):focal(1695x1138.5:1705x1128.5):watermark(cloudfront-eu-central-1.images.arcpublishing.com/ipmgroup/OIO44DUUUNC2DB5T3FIJECBT5U.png,0,-0,0,100)/cloudfront-eu-central-1.images.arcpublishing.com/ipmgroup/2LJ42UFSNBAX3CBJXH2QJCISNI.jpg",2023-11-02T22:52:56Z,https://web.archive.org/web/20231103031241/https://www.lalibre.be/international/amerique/2023/11/02/sous-le-feu-des-questions-les-fils-trump-tentent-de-faire-bloc-au-tribunal-P3RMKP6QHBAQNKY6NTAET35GEQ/,"C'est à partir de ces états financiers annuels de Donald Trump, sortes de photographies de sa fortune listant ses propriétés -- comme la Trump Tower à Manhattan -- que le parquet général de l'Etat de… [+3779 chars]",,fr,'Eric Trump'
https://www.lemonde.fr/international/article/2023/11/03/cryptomonnaies-le-patron-de-ftx-sam-bankman-fried-reconnu-coupable-de-fraude_6197923_3210.html,https://www.lemonde.fr/international/article/2023/11/03/cryptomonnaies-le-patron-de-ftx-sam-bankman-fried-reconnu-coupable-de-fraude_6197923_3210.html,0,www.lemonde.fr,"Cryptomonnaies : le patron de FTX, Sam Bankman-Fried, reconnu coupable de fraude","A la sortie du procès, le procureur fédéral a déclaré que l’affaire était un avertissement « à tous les fraudeurs qui pensent qu’ils sont intouchables ou que leurs crimes sont trop complexes pour que nous puissions les comprendre ». Le fondateur de la plate-f…",https://img.lemde.fr/2023/11/03/0/0/3015/2010/1440/960/60/0/8e5303e_5767859-01-06.jpg,2023-11-03T02:30:03Z,https://web.archive.org/web/20231103030658/https://www.lemonde.fr/international/article/2023/11/03/cryptomonnaies-le-patron-de-ftx-sam-bankman-fried-reconnu-coupable-de-fraude_6197923_3210.html,"Le fondateur de FTX, Sam Bankman-Fried, à son arrivée au tribunal fédéral de New York, le 30 mars 2023. ED JONES / AFP
Le verdict fut rendu en moins de cinq heures : coupable. Sam Bankman-Fried, le … [+2765 chars]",,fr,'Caroline Ellison'
https://www.fark.com/comments/13043882/John-Fetterman-intends-to-make-Bob-Menendez-shiat-a-gold-brick,https://www.fark.com/comments/13043882/John-Fetterman-intends-to-make-Bob-Menendez-shiat-a-gold-brick,0,www.fark.com,John Fetterman intends to make Bob Menendez shiat a (gold) brick [Hero],<table> <tr><td> </td><td> [link] [8 comments] </td></tr></table>,https://usrimg-full.fark.net/j/jo/fark_joHP9R_GSCjwgDZJ0VZPRgmSB-4.jpg?AWSAccessKeyId=UKDINQXVGV49TCSSKJLK&Expires=1699243200&Signature=iXvh1aQ3vGYQvX56zX5%2Bv5NotMg%3D,2023-11-03T03:45:47Z,,"Wanebo:It won't. They will not pass legislation that may harm themselves someday.
But I do have a new respect for Fetterman for proposing this. To me it's only right that if you are formally charged… [+179 chars]",,fr,'Bob Menendez'
https://www.courrierinternational.com/article/pendant-que-vous-dormiez-sam-bankman-fried-trump-thomas-mattingly-les-informations-de-la-nuit,https://www.courrierinternational.com/article/pendant-que-vous-dormiez-sam-bankman-fried-trump-thomas-mattingly-les-informations-de-la-nuit,0,www.courrierinternational.com,"Sam Bankman-Fried, Trump, Thomas Mattingly : les informations de la nuit","Le fondateur de FTX, Sam Bankman-Fried, reconnu coupable de fraude. Accusé de fraude, d’association de malfaiteurs et de blanchiment d’argent, Sam Bankman-Fried a été reconnu coupable, jeudi 2 novembre, par un jury new-yorkais des sept chefs d’accusation rete…",https://focus.courrierinternational.com/2023/11/03/0/0/3571/2409/1200/630/60/0/425f6be_afp-33zu26w.jpg,2023-11-03T05:03:04Z,https://web.archive.org/web/20231104043526/https://www.courrierinternational.com/article/pendant-que-vous-dormiez-sam-bankman-fried-trump-thomas-mattingly-les-informations-de-la-nuit,"Le fondateur de FTX, Sam Bankman-Fried, reconnu coupable de fraude. Accusé de fraude, dassociation de malfaiteurs et de blanchiment dargent, Sam Bankman-Fried a été reconnu coupable, jeudi 2 novembre… [+1462 chars]",,fr,'Eric Trump'
https://www.slate.fr/story/255647/britney-spears-memoires-la-femme-en-moi-sante-mentale-psychiatre-inquietudes,https://www.slate.fr/story/255647/britney-spears-memoires-la-femme-en-moi-sante-mentale-psychiatre-inquietudes,0,www.slate.fr,Mon avis de psychiatre sur la publication des mémoires de Britney Spears,"Il est impossible de savoir comment la pop-star vit la diffusion de son livre, mais son post Instagram du 20 octobre laisse penser que c'est très, très dur pour elle. Lire la suite",https://www.slate.fr/sites/default/files/styles/1200x680/public/britney_spears-_piece_of_me_-_jan_2014-3_12416187554.jpg,2023-11-03T05:40:00Z,https://web.archive.org/web/20231104020145/https://www.slate.fr/story/255647/britney-spears-memoires-la-femme-en-moi-sante-mentale-psychiatre-inquietudes,"Temps de lecture: 6 min
Dans les jours qui ont précédé la sortie des mémoires de Britney Spears, La Femme en moi, je faisais défiler mes fils d'actualité sur les réseaux sociaux. J'ai été alors frap… [+8707 chars]",,fr,'Britney Spears'
https://www.dhnet.be/actu/monde/2023/11/03/proces-de-donald-trump-sous-le-feu-des-questions-ses-fils-tentent-de-faire-bloc-au-tribunal-UCLLPGQL3RDBHLI7IPK5B7XOMY/,https://www.dhnet.be/actu/monde/2023/11/03/proces-de-donald-trump-sous-le-feu-des-questions-ses-fils-tentent-de-faire-bloc-au-tribunal-UCLLPGQL3RDBHLI7IPK5B7XOMY/,0,www.dhnet.be,"Procès de Donald Trump: sous le feu des questions, ses fils tentent de faire bloc au tribunal","Donald Trump Jr, puis Eric Trump, les deux fils de Donald Trump accusés comme leur père de vastes fraudes financières au procès civil qui menace l'empire familial, ont tenté de faire bloc jeudi au tribunal de New York, malgré un feu roulant de questions de l'…","https://www.dhnet.be/resizer/4XCR7Woyifp2edUuYK_iyGTYiII=/1200x630/filters:format(jpeg):focal(4123x2757:4133x2747):watermark(cloudfront-eu-central-1.images.arcpublishing.com/ipmgroup/KSYODHLMNBBMDA7B5YPJPTFVNY.png,0,-0,0,100)/cloudfront-eu-central-1.images.arcpublishing.com/ipmgroup/MZHNCTUIYRANVECS5XJJZVHUWI.jpg",2023-11-03T06:10:17Z,https://web.archive.org/web/20231103075602/https://www.dhnet.be/actu/monde/2023/11/03/proces-de-donald-trump-sous-le-feu-des-questions-ses-fils-tentent-de-faire-bloc-au-tribunal-UCLLPGQL3RDBHLI7IPK5B7XOMY/,"C'est à partir de ces états financiers annuels de Donald Trump, sortes de photographies de sa fortune listant ses propriétés -- comme la Trump Tower à Manhattan -- que le parquet général de l'Etat de… [+952 chars]",,fr,'Donald Trump'
https://www.01net.com/actualites/resultats-dapple-le-mac-plonge-les-services-senvolent.html,https://www.01net.com/actualites/resultats-dapple-le-mac-plonge-les-services-senvolent.html,0,www.01net.com,"Le Mac plonge, les services s’envolent : une année dans le rouge pour Apple","Sur le plan financier, 2023 a été une année compliquée pour Apple, qui a révélé hier les résultats de son quatrième trimestre fiscal recouvrant les mois de juillet, août et septembre. Chiffre d'affaires et bénéfices en recul, toutes les catégories de produits…",https://www.01net.com/app/uploads/2023/10/Iphone-15_11.jpg,2023-11-03T06:30:22Z,,"Sur le plan financier, 2023 a été une année compliquée pour Apple, qui a révélé hier les résultats de son quatrième trimestre fiscal recouvrant les mois de juillet, août et septembre. Chiffre d’affai… [+3590 chars]",,fr,'nan nan'
