index,url,valid,domain,title,description,image,published,archive,content,quote,language,keyword
https://www.lexpress.fr/monde/amerique/cest-ridicule-la-reponse-de-donald-trump-au-nouveau-parti-delon-musk-YW5PTV4WI5AUBPDOBH7T7YXG7Y/,https://www.lexpress.fr/monde/amerique/cest-ridicule-la-reponse-de-donald-trump-au-nouveau-parti-delon-musk-YW5PTV4WI5AUBPDOBH7T7YXG7Y/,0,www.lexpress.fr,"""C’est ridicule"" : la réponse de Donald Trump au nouveau parti d’Elon Musk","Après qu’Elon Musk a annoncé la création de sa formation politique, le président américain a estimé que son ancien allié était en train de ""dérailler complètement"".",https://www.lexpress.fr/resizer/v2/UZUNTRJ35JDKBGGNDOJYZSWTGA.jpg?auth=8b51e3d2e5ee3fb194fc701f1bd250d3baef7a8603a0b2273397c52672c0d5c2&width=1200&height=630&quality=85&focal=2009%2C573,2025-07-07T05:18:21Z,,"Donald Trump et son ancien allié Elon Musk ont repris leur duel de plus belle ce week-end, le président américain raillant le projet de création dun troisième parti politique aux Etats-Unis annoncé p… [+3947 chars]",,fr,'Elon Musk'
https://www.dhnet.be/actu/monde/2025/07/07/face-a-trump-les-brics-sinquietent-des-droits-de-douane-unilateraux-GK3GAJS2AFBLXAZ7IWP66325RE/,https://www.dhnet.be/actu/monde/2025/07/07/face-a-trump-les-brics-sinquietent-des-droits-de-douane-unilateraux-GK3GAJS2AFBLXAZ7IWP66325RE/,0,www.dhnet.be,"Face à Trump, les Brics s'inquiètent des droits de douane ""unilatéraux""","Les Brics ont exprimé dimanche à Rio de Janeiro leurs ""sérieuses préoccupations"" face à la guerre commerciale menée par Donald Trump. ...",https://www.dhnet.be/resizer/v2/ZW4TL5OMORCR7F2QQF4QB7DFDY.jpg?auth=6ded6cfcbd454aadb95deb7dada2f77d3cf56b7f1a5b7335e56c8fc2d4791819&width=1200&height=630&quality=85&focal=1420%2C946&watermark=https%3A%2F%2Fcloudfront-eu-central-1.images.arcpublishing.com%2Fipmgroup%2FDZNGDE46VVGXRGHD3TEI5RB3GM.png%3A100%3A0%2C559,2025-07-07T05:29:04Z,,"En l'absence de Poutine et Xi Jinping, que faut-il attendre du sommet des BRICS + ? ""L'Inde va peser de tout son poids dans les négociations""De telles mesures ""affectent les perspectives de développe… [+4561 chars]",,fr,'Elon Musk'
https://www.generation-nt.com/actualites/elon-musk-america-party-creation-riposte-loi-budte-trump-2059888,https://www.generation-nt.com/actualites/elon-musk-america-party-creation-riposte-loi-budte-trump-2059888,0,www.generation-nt.com,"Face à la loi budgétaire de Trump, Elon Musk secoue la politique américaine avec l’America Party","Elon Musk crée la surprise avec l’America Party, un nouveau parti politique qui promet de rebattre les cartes à l’approche de la présidentielle américaine. Quels sont ses objectifs et peut-il vraiment changer la donne ?",https://img.generation-nt.com/elon-musk-jeux-vid-eacute-o_04B002A301702457.webp,2025-07-07T06:10:02Z,,"L’annonce a fait l’effet d’une bombe sur la scène politique américaine : Elon Musk, figure incontournable de la tech, vient de lancer l’America Party. À quelques mois d’une élection présidentielle dé… [+4699 chars]",,fr,'Elon Musk'
https://www.presse-citron.net/cest-une-grosse-epave-donald-trump-assassine-methodiquement-elon-musk-dans-ce-message-ravageur/,https://www.presse-citron.net/cest-une-grosse-epave-donald-trump-assassine-methodiquement-elon-musk-dans-ce-message-ravageur/,0,www.presse-citron.net,« C’est une grosse épave » : Donald Trump assassine méthodiquement Elon Musk dans ce message ravageur,Le président mutiplie les critiques envers son ancien allié qui le lui rend bien.,https://www.presse-citron.net/app/uploads/2025/07/donald-trump-elon-musk-1600x900.jpg,2025-07-07T06:35:05Z,,"La tension monte encore dun cran entre Donald Trump et Elon Musk. Alors que ce dernier vient de créer un nouveau parti politique “The America Party”, comme nous vous en parlions ce week-end, le prési… [+3773 chars]",,fr,'Donald Trump'
https://www.numerama.com/politique/2028345-elon-musk-lance-un-parti-politique-une-initiative-vouee-a-lechec.html,https://www.numerama.com/politique/2028345-elon-musk-lance-un-parti-politique-une-initiative-vouee-a-lechec.html,0,www.numerama.com,Elon Musk lance un parti politique : une initiative vouée à l’échec,"Face aux Parti républicain et au Parti démocrate, qu'il juge corrompus, Elon Musk a annoncé le 5 juillet la création du Parti de l'Amérique. Une nouvelle entité politique qui vise à provoquer du bouleversement à Washington. Elle doit déjà faire face à un prem…","https://c0.lestechnophiles.com/www.numerama.com/wp-content/uploads/2024/10/musk.jpg?resize=1600,900&key=bb460acc&watermark",2025-07-07T07:31:00Z,,"Face aux Parti républicain et au Parti démocrate, qu’il juge corrompus, Elon Musk a annoncé le 5 juillet la création du Parti de l’Amérique. Une nouvelle entité politique qui vise à provoquer du boul… [+7114 chars]",,fr,'Elon Musk'
https://www.begeek.fr/elon-musk-tente-une-incursion-politique-avec-the-america-party-417980,https://www.begeek.fr/elon-musk-tente-une-incursion-politique-avec-the-america-party-417980,0,www.begeek.fr,Elon Musk tente une incursion politique avec « The America Party »,"Un nouveau parti politique annoncé par Elon Musk attire des soutiens, mais son existence reste incertaine.",https://www.begeek.fr/app/uploads/2025/07/Elon-Musk.jpeg,2025-07-07T08:00:33Z,,"Un nouveau parti politique annoncé par Elon Musk attire des soutiens, mais son existence reste incertaine.
Tl;dr
<ul><li>Elon Musk a annoncé vouloir créer un nouveau parti politique, « The America … [+3088 chars]",,fr,'Elon Musk'
https://rmcsport.bfmtv.com/football/transferts/mercato-l-arabie-saoudite-revient-a-la-charge-pour-messi-libre-dans-six-mois_AV-202507070289.html,https://rmcsport.bfmtv.com/football/transferts/mercato-l-arabie-saoudite-revient-a-la-charge-pour-messi-libre-dans-six-mois_AV-202507070289.html,0,rmcsport.bfmtv.com,"Mercato: l’Arabie saoudite revient à la charge pour Messi, libre dans six mois","En fin de contrat le 31 décembre avec l’Inter Miami, Lionel Messi est de nouveau courtisé par le championnat saoudien. Selon L’Équipe, Al-Ahli a entamé des discussions avec l’Argentin.",https://images.bfmtv.com/449JAdHW1TZ50a9ntErHR84cPAA=/6x63:1510x909/images/Lionel-Messi-avec-l-Inter-Miami-pendant-la-Coupe-du-monde-des-clubs-le-24-juin-2025-2102152.jpg,2025-07-07T08:46:53Z,,"En fin de contrat le 31 décembre avec lInter Miami, Lionel Messi est de nouveau courtisé par le championnat saoudien. Selon LÉquipe, Al-Ahli a entamé des discussions avec lArgentin.
LArabie saoudite… [+2011 chars]",,fr,'David Beckham'
https://www.konbini.com/internet/une-carte-pokemon-a-ete-dedicacee-par-le-pape-leon-xiv/,https://www.konbini.com/internet/une-carte-pokemon-a-ete-dedicacee-par-le-pape-leon-xiv/,0,www.konbini.com,Une carte Pokémon a été dédicacée par&#8230; le Pape Léon XIV,"Une carte Pokémon bénie par le Vatican ? C’est l’histoire improbable qui enflamme les réseaux depuis ce week-end. Au départ, une personne a usurpé la paternité de cette carte publiant quelques photos au passage. Mais...",https://cdn-www.konbini.com/files/2025/07/PokemonPopeFeat.png?width=1200&height=675,2025-07-07T14:58:58Z,,"Une carte Pokémon bénie par le Vatican ? Cest lhistoire improbable qui enflamme les réseaux depuis ce week-end. Au départ, une personne a usurpé la paternité de cette carte publiant quelques photos a… [+1202 chars]",,fr,'Leo XIV'
https://www.20minutes.fr/arts-stars/people/4162416-20250707-justin-bieber-deborde-amour-hailey-bieber-gojira-rejoue-tube-jo-dernier-concert-ozzy-osbourne,https://www.20minutes.fr/arts-stars/people/4162416-20250707-justin-bieber-deborde-amour-hailey-bieber-gojira-rejoue-tube-jo-dernier-concert-ozzy-osbourne,0,www.20minutes.fr,Justin Bieber déborde d’amour pour Hailey Bieber… Gojira rejoue son tube des JO au dernier concert d’Ozzy Osbourne…,Toute l’actualité people est dans « 20 Minutes »,https://img.20mn.fr/TbR81KywS-KsttNM1f-Aeyk/1444x920_justin-bieber-spotted-leaving-lunch-in-new-york-city-featuring-justin-bieber-where-new-york-new-york-united-states-when-23-jun-2024-credit-insta-rimages,2025-07-07T15:42:58Z,,"7 juillet 2025
Sabrina Carpenter invite Duran Duran sur scène au BST Festival de Londres
La chanteuse dEspresso a fait une surprise à son public londonien lors de son passage ce week-end au festiva… [+1262 chars]",,fr,'Justin Bieber'
https://www.dhnet.be/sports/football/europe/championnatsetrangers/2025/07/08/messi-et-arabie-vont-ils-rimer-en-2026-voici-pourquoi-ca-pourrait-finalement-matcher-ou-pas-HF7S3MCNDFC6DAA5BPY6KSJV6E/,https://www.dhnet.be/sports/football/europe/championnatsetrangers/2025/07/08/messi-et-arabie-vont-ils-rimer-en-2026-voici-pourquoi-ca-pourrait-finalement-matcher-ou-pas-HF7S3MCNDFC6DAA5BPY6KSJV6E/,0,www.dhnet.be,Messi et Arabie vont-ils rimer en 2026 ? Voici pourquoi ça pourrait finalement matcher… ou pas,Lionel Messi pourrait rejoindre le club de Matteo Dams à l’issue de son contrat avec l’Inter Miami. ...,https://www.dhnet.be/resizer/v2/GG3MO742WVBXBGWAAOFB4EAAXY.jpg?auth=3ddf318ab61f98e54529298275f4a31356891444117a0b8104f3bc6f0df5c544&width=1200&height=630&quality=85&focal=3443%2C2295&watermark=https%3A%2F%2Fcloudfront-eu-central-1.images.arcpublishing.com%2Fipmgroup%2F3WZLNJVGMFAQRHOXFC5ZVE3GU4.png%3A100%3A0%2C559,2025-07-08T08:54:13Z,,"Pourquoi il pourrait accepter
Même s'il a montré ce week-end qu'il était toujours motivé pour faire briller l'Inter Miami, Lionel Messi est sorti très déçu de la Coupe du monde des clubs où il a con… [+3564 chars]",,fr,'David Beckham'
… [+2257 chars],,fr,'Elon Musk',,,,,,,,,
