index,url,valid,domain,title,description,image,published,archive,content,quote,language,keyword
https://www.lemonde.fr/international/article/2025/07/02/guerre-a-gaza-la-rapporteuse-speciale-des-nations-unies-pour-les-territoires-palestiniens-accuse-des-entreprises-etrangeres-de-complicite-dans-l-ecrasement-de-l-enclave_6617420_3210.html,https://www.lemonde.fr/international/article/2025/07/02/guerre-a-gaza-la-rapporteuse-speciale-des-nations-unies-pour-les-territoires-palestiniens-accuse-des-entreprises-etrangeres-de-complicite-dans-l-ecrasement-de-l-enclave_6617420_3210.html,0,www.lemonde.fr,Guerre à Gaza : la rapporteuse spéciale des Nations unies pour les territoires palestiniens accuse des entreprises étrangères de « complicité » dans l’écrasement de l’enclave,"Le rapport publié par la juriste italienne Francesca Albanese épingle une quarantaine de sociétés pour participation à une « économie opérant sur un mode génocidaire ». Parmi elles, des fabricants d’armes comme l’américain Lockheed Martin, des géants de la te…",https://img.lemde.fr/2025/07/01/0/4/4200/2800/1440/960/60/0/cdbce08_ftp-import-images-1-hvjpkfwvwbz3-5303430-01-06.jpg,2025-07-02T15:10:02Z,,"Depuis une position à la frontière israélienne avec la bande de Gaza, le 1 juillet 2025. JACK GUEZ / AFP
Rapporteuse spéciale des Nations unies pour les territoires palestiniens occupés, Francesca A… [+1191 chars]",,fr,'Francesca Albanese'
https://www.cathobel.be/2025/07/leon-xiv-recoit-au-vatican-giorgia-meloni/,https://www.cathobel.be/2025/07/leon-xiv-recoit-au-vatican-giorgia-meloni/,0,www.cathobel.be,Léon XIV reçoit au Vatican Giorgia Meloni,"La présidente du Conseil des ministres italien a été reçue par le Pape ce mercredi matin au Vatican. Après cette première rencontre officielle, la cheffe du gouvernement s’est entretenue à la Secrétairerie d'État avec le cardinal Parolin et Mgr Gallagher. Les…",https://cathobel.cdnartwhere.eu/wp-content/uploads/2025/07/cq5dam.thumbnail.cropped.750.422-36.jpeg,2025-07-02T15:13:25Z,,"La présidente du Conseil des ministres italien a été reçue par le Pape ce mercredi matin au Vatican. Après cette première rencontre officielle, la cheffe du gouvernement sest entretenue à la Secrétai… [+2444 chars]",,fr,'Giorgia Meloni'
https://www.numerama.com/cyberguerre/2025639-bluff-ou-futur-scandale-lentourage-de-trump-victime-dun-chantage-de-hackers-pro-iraniens.html,https://www.numerama.com/cyberguerre/2025639-bluff-ou-futur-scandale-lentourage-de-trump-victime-dun-chantage-de-hackers-pro-iraniens.html,0,www.numerama.com,Bluff ou futur scandale ? L’entourage de Trump victime d’un chantage de hackers pro-iraniens,"Un groupe de hackers pro-iranien a revendiqué, le 30 juin 2025, le vol de près de 100 gigaoctets d’emails appartenant à des membres de l’entourage de Donald Trump. Cette annonce intervient dans un contexte de tensions accrues entre Washington et Téhéran, aprè…","https://c0.lestechnophiles.com/www.numerama.com/wp-content/uploads/2025/07/hacked-1.jpg?resize=1600,900&key=97033a5a&watermark",2025-07-02T15:36:08Z,,"Un groupe de hackers pro-iranien a revendiqué, le 30 juin 2025, le vol de près de 100 gigaoctets d’emails appartenant à des membres de l’entourage de Donald Trump. Cette annonce intervient dans un co… [+3882 chars]",,fr,'Stormy Daniels'
https://www.lepoint.fr/monde/comment-trump-a-capitalise-sur-son-retour-a-la-maison-blanche-02-07-2025-2593552_24.php,https://www.lepoint.fr/monde/comment-trump-a-capitalise-sur-son-retour-a-la-maison-blanche-02-07-2025-2593552_24.php,0,www.lepoint.fr,Comment Trump a capitalisé sur son retour à la Maison blanche,"Contrairement à ce qu'il a toujours laissé entendre, les finances personnelles du président américain étaient « gravement menacées » avant son élection, révèle le New York Times.",https://static.lpnt.fr/images/2025/07/02/27651683lpw-27651684-mega-une-jpg_11220402.jpg,2025-07-02T20:32:00Z,,"Alors que Donald Trump avait affirmé en 2023 devant un tribunal bénéficier de 300 à 400 millions de dollars en liquidités, ses finances personnelles étaient en fait en difficulté avant sa réélection,… [+2669 chars]",,fr,'nan nan'
https://www.huffingtonpost.fr/politique/article/a-l-assemblee-nationale-les-republicains-votent-plus-avec-le-rn-qu-avec-le-socle-commun_252154.html,https://www.huffingtonpost.fr/politique/article/a-l-assemblee-nationale-les-republicains-votent-plus-avec-le-rn-qu-avec-le-socle-commun_252154.html,0,www.huffingtonpost.fr,"À l’Assemblée nationale, Les Républicains votent plus avec le RN qu’avec le « socle commun »",Un décompte effectué par « Politico » est sans appel : les troupes de Laurent Wauquiez sont plus souvent alignées avec Marine Le Pen qu’avec François Bayrou.,https://focus.huffingtonpost.fr/2025/07/03/428/0/8192/4608/1820/1023/75/0/5ba09c4_upload-1-ktxye9io6szv-000-64bf7u4.jpg,2025-07-03T07:07:13Z,,"POLITIQUE - Plaisir doffrir. En théorie, Les Républicains (qui comptent plusieurs ministres au gouvernement) font pleinement partie du « socle commun » soutenant François Bayrou. En pratique, les dép… [+2460 chars]",,fr,'Laurent Wauquiez'
https://www.frandroid.com/marques/tesla/2718861_nous-sommes-au-plus-bas-les-ventes-de-tesla-degringolent-mais-elon-musk-ne-voit-pas-le-probleme,https://www.frandroid.com/marques/tesla/2718861_nous-sommes-au-plus-bas-les-ventes-de-tesla-degringolent-mais-elon-musk-ne-voit-pas-le-probleme,0,www.frandroid.com,« Nous sommes au plus bas » : les ventes de Tesla dégringolent mais Elon Musk ne voit pas le problème,Tesla affiche des ventes en forte baisse au cours du 2ème trimestre 2025. Le constructeur pourrait subir un recul de ses immatriculations annuelles pour la seconde fois consécutive.,"https://c0.lestechnophiles.com/images.frandroid.com/wp-content/uploads/2025/04/gn6lihfxyaatc8j.jpeg?resize=1600,900&key=3a90dfcd&watermark",2025-07-03T08:27:08Z,,"Tesla affiche des ventes en forte baisse au cours du 2ème trimestre 2025. Le constructeur pourrait subir un recul de ses immatriculations annuelles pour la seconde fois consécutive.
Source : Tesla
… [+4233 chars]",,fr,'Elon Musk'
https://www.frandroid.com/marques/byd/2719077_la-domination-de-tesla-seffondre-byd-simpose-comme-le-nouveau-geant-de-la-voiture-electrique,https://www.frandroid.com/marques/byd/2719077_la-domination-de-tesla-seffondre-byd-simpose-comme-le-nouveau-geant-de-la-voiture-electrique,0,www.frandroid.com,La domination de Tesla s’effondre : BYD s’impose comme le nouveau géant de la voiture électrique,"BYD frappe fort avec des chiffres impressionnants, qui vont clairement rendre jaloux Tesla et Elon Musk. C'est un tournant historique que nous sommes en train de vivre, où le géant chinois dépasse la firme américaine.","https://c0.lestechnophiles.com/images.frandroid.com/wp-content/uploads/2025/07/0f2a2466.jpg?resize=1600,900&key=d7e17ca2&watermark",2025-07-03T09:04:22Z,,"BYD frappe fort avec des chiffres impressionnants, qui vont clairement rendre jaloux Tesla et Elon Musk. C’est un tournant historique que nous sommes en train de vivre, où le géant chinois dépasse la… [+3737 chars]",,fr,'Elon Musk'
https://www.fredzone.org/des-hackers-menacent-de-divulguer-des-emails-voles-a-lentourage-de-trump-roger-stone-et-stormy-daniels/,https://www.fredzone.org/des-hackers-menacent-de-divulguer-des-emails-voles-a-lentourage-de-trump-roger-stone-et-stormy-daniels/,0,www.fredzone.org,"Des hackers menacent de divulguer des emails volés à l’entourage de Trump, Roger Stone et Stormy Daniels…","Une nouvelle offensive cybercriminelle secoue la sphère politique américaine. Un groupe baptisé « Robert », soupçonné d’être lié à l’appareil militaire iranien, affirme détenir une vaste collection d’emails internes provenant de proches collaborateurs de Dona…",https://www.fredzone.org/wp-content/uploads/2025/07/IMG_9575.jpeg,2025-07-03T10:45:35Z,,"Une campagne de déstabilisation sur fond de tensions géopolitiques
Le contexte dans lequel surgit cette menace na rien danodin. Les hackers reprennent leurs activités alors que les États-Unis, sous … [+2860 chars]",,fr,'Stormy Daniels'
https://www.lexpress.fr/idees-et-debats/zorhan-mamdani-nouveau-chouchou-de-la-gauche-apres-leuphorie-les-new-yorkais-vont-vite-dechanter-3HCY34UIRREWTHVX2P6LWB6BSY/,https://www.lexpress.fr/idees-et-debats/zorhan-mamdani-nouveau-chouchou-de-la-gauche-apres-leuphorie-les-new-yorkais-vont-vite-dechanter-3HCY34UIRREWTHVX2P6LWB6BSY/,0,www.lexpress.fr,"Zohran Mamdani, nouveau chouchou de la gauche américaine ? ""Les New-Yorkais vont vite déchanter…""","L’essayiste Peter W. Wood estime que le programme du vainqueur de la primaire démocrate à New York ""est une absurdité économique"". Et prévient : ""Zohran Mamdani est l’incarnation de la nouvelle élite radicale"".",https://www.lexpress.fr/resizer/v2/FJ4HUW2VNVFJBPSM2X4OKNTJEA.jpg?auth=64cd4c61cdc303fe546f7b40101bd5578d8764ce01e753b0b5a66e829d5b4a91&width=1200&height=630&quality=85&focal=3284%2C1516,2025-07-03T16:30:00Z,,"Un socialiste pur et dur va-t-il prendre les rênes de la capitale mondiale du capitalisme ? Contre toute attente, Zohran Mamdani, 33 ans, a remporté le 25 juin la primaire démocrate pour la mairie de… [+19066 chars]",,fr,'Zohran Mamdani'
https://www.cathobel.be/2025/07/video-du-pape-leon-xiv-propose-une-priere-inedite-a-lesprit-saint/,https://www.cathobel.be/2025/07/video-du-pape-leon-xiv-propose-une-priere-inedite-a-lesprit-saint/,0,www.cathobel.be,Vidéo du Pape : Léon XIV propose une prière inédite à l’Esprit Saint,"L’intention de prière du Pape Léon XIV pour le mois de juillet 2025 souligne l’importance de développer la capacité de prendre des décisions sages, guidées par l’Esprit Saint, dans un monde de plus en plus complexe.",https://cathobel.cdnartwhere.eu/wp-content/uploads/2025/07/Design-sans-titre-2025-07-04T114041.273.png,2025-07-04T10:14:40Z,,"Lintention de prière du Pape Léon XIV pour le mois de juillet 2025 souligne limportance de développer la capacité de prendre des décisions sages, guidées par lEsprit Saint, dans un monde de plus en p… [+2397 chars]",,fr,'Léon XIV'
https://www.mediapart.fr/journal/economie-et-social/050725/les-milliardaires-sont-ils-utiles-zohran-mamdani-relance-le-debat,https://www.mediapart.fr/journal/economie-et-social/050725/les-milliardaires-sont-ils-utiles-zohran-mamdani-relance-le-debat,0,www.mediapart.fr,Les milliardaires sont-ils utiles? Zohran Mamdani relance le débat,"Le candidat démocrate à la mairie de New York a déclaré qu’« il ne devrait pas y avoir de milliardaires ». Des propos qui ont relancé le discours sur le ruissellement dans la presse économique, alors même qu’il est désormais intenable.",https://static.mediapart.fr/etmagine/og/journal/files/2025/07/03/250703-img-les-milliardaires-sont-ils-utiles-zohran-mamdani-relance-le-debat.jpg,2025-07-05T08:31:27Z,,"Les cookies et technologies similaires que nous utilisons sur Mediapart sont de différentes natures et nous permettent de poursuivre différentes finalités. 
Certains sont nécessaires au fonctionneme… [+3291 chars]",,fr,'Zohran Mamdani'
https://www.liberation.fr/societe/le-pape-leon-xiv-nomme-un-eveque-francais-en-charge-de-la-lutte-contre-la-pedocriminalite-dans-leglise-catholique-20250705_Y4L4BKW5UFGPLLQNK4HKEZV6II/,https://www.liberation.fr/societe/le-pape-leon-xiv-nomme-un-eveque-francais-en-charge-de-la-lutte-contre-la-pedocriminalite-dans-leglise-catholique-20250705_Y4L4BKW5UFGPLLQNK4HKEZV6II/,0,www.liberation.fr,Le pape Léon XIV nomme un évêque français en charge de la lutte contre la pédocriminalité dans l’Eglise catholique,"Archevêque de Chambéry, en Savoie, Thibault Verny prend la tête de la Commission pour la protection des mineurs au Vatican.",https://www.liberation.fr/resizer/v2/EPHMR6GMIFFPFBS4RD7DFYVLCA.jpg?smart=true&auth=67f107eea969d8b84eff6dcab1f201d89686a9859e4ba115cd04ecc3c7f50c6a&quality=70&width=1200&height=630,2025-07-05T10:15:00Z,,"Choisi par Léon XIV, un évêque français, Thibault Verny, prend en charge la lutte contre la pédocriminalité et les violences sexuelles dans lEglise catholique. Le Vatican a annoncé officiellement, ce… [+610 chars]",,fr,'Léon XIV'
https://www.ledauphine.com/societe/2025/07/05/l-archeveque-de-chambery-nomme-president-de-la-commission-pontificale-pour-la-protection-des-mineurs-par-le-pape-leon-xiv,https://www.ledauphine.com/societe/2025/07/05/l-archeveque-de-chambery-nomme-president-de-la-commission-pontificale-pour-la-protection-des-mineurs-par-le-pape-leon-xiv,0,www.ledauphine.com,Savoie - Vatican. L’archevêque de Chambéry nommé président de la commission pontificale pour la protection des mineurs par le pape Léon XIV,"Le pape Léon XIV vient de nommer un nouveau président de la commission pontificale pour la protection des mineurs. Et c’est Thibault Verny, archevêque de Chambéry, qui occupe ce poste depuis ce samedi 5 juillet.",https://cdn-s-www.ledauphine.com/images/9B04D2E3-569E-4D7B-8F79-957BAC022006/FB1200/photo-1751721687.jpg,2025-07-05T13:23:00Z,,"Mgr  Thibault Verny, qui est depuis le 11 mai 2023 a rchevêque de Chambéry , évêque de Maurienne et de Tarentaise, a été nommé ce samedi 5 juillet président de la Commission pontificale pour la prote… [+1333 chars]",,fr,'Léon XIV'
https://www.huffingtonpost.fr/international/article/thibault-verny-l-eveque-francais-que-le-pape-leon-xiv-a-nomme-pour-lutter-contre-la-pedocriminalite_252259.html,https://www.huffingtonpost.fr/international/article/thibault-verny-l-eveque-francais-que-le-pape-leon-xiv-a-nomme-pour-lutter-contre-la-pedocriminalite_252259.html,0,www.huffingtonpost.fr,"Thibault Verny, l’évêque français que le pape Léon XIV a nommé pour lutter contre la pédocriminalité",La Commission pontificale pour la protection des mineurs a été fondée en 2014 sur demande du pape François.,https://focus.huffingtonpost.fr/2025/07/05/0/0/750/421/1820/1023/75/0/c6233b0_upload-1-lpjpggqppz9g-verny-pape.jpeg,2025-07-05T14:27:01Z,,ÉGLISE - Une lourde responsabilité. Le diocèse de Savoie a annoncé ce samedi 5 juillet sur son site internet la nomination de lévêque Thibault Verny par le pape Léon XIV à la tête de la Commission po… [+1477 chars],,fr,'Léon XIV'
https://www.lalibre.be/belgique/societe/2025/07/05/le-pape-part-en-vacances-dans-sa-residence-de-castel-gandolfo-ou-il-pourra-jouer-au-tennis-et-regarder-les-etoiles-74UFV46OABA7ZFCYTMG7XCVCYU/,https://www.lalibre.be/belgique/societe/2025/07/05/le-pape-part-en-vacances-dans-sa-residence-de-castel-gandolfo-ou-il-pourra-jouer-au-tennis-et-regarder-les-etoiles-74UFV46OABA7ZFCYTMG7XCVCYU/,0,www.lalibre.be,Le Pape part en vacances dans sa résidence de Castel Gandolfo où il pourra jouer au tennis et regarder les étoiles,"François n’y avait jamais mis les pieds, Léon y profitera sans doute de la piscine et des jardins majestueux du domaine. ...",https://www.lalibre.be/resizer/v2/3G7WXSHR7BH6HJ7MUMW4NWSOAY.jpg?auth=6ade311e8a7e1da41964a4ad9a3a6905461c0c32787e5e9e21c997462d5c79f9&width=1200&height=630&quality=85&focal=4251%2C2834&watermark=https%3A%2F%2Fcloudfront-eu-central-1.images.arcpublishing.com%2Fipmgroup%2F3R4IDPARFVEO3L2LC5OCCXQ5RM.png%3A100%3A0%2C557,2025-07-05T15:59:31Z,,"Ces sept défis qui attendent Léon XIVLéon, en la matière, s'annonce plus bucolique. Le jeune pape au pontificat jusqu'ici très discret prendra ses quartiers à Castel Gandolfo dès ce 6 juillet, et pou… [+1806 chars]",,fr,'Pape François'
https://www.20minutes.fr/monde/4162155-20250705-etats-unis-elon-musk-annonce-creer-parti-politique,https://www.20minutes.fr/monde/4162155-20250705-etats-unis-elon-musk-annonce-creer-parti-politique,0,www.20minutes.fr,Etats-Unis : Elon Musk annonce créer son parti politique,L’homme le plus riche du monde compte s’imposer sur le terrain politique face à Donald Trump,https://img.20mn.fr/9YSL55AbSP6aPQ8LWMoPQCk/1444x920_in-this-photo-illustration-social-media-posts-by-u-s-president-donald-trump-and-elon-musk-are-displayed-on-smartphones-u-s-president-donald-trump-has-threatened-to-revoke-government-contracts-from-tesla-and-space-x-ceo-elon-musk-as-a-public-feud-escalates-over-musk-s-criticism-of-the-trump-administration-s-policies-on-june-6-2025-yassine-mahjoub-sipa-mahjoubyassine-sipa-6383-credit-yassine-mahjoub-sipa-2506061528,2025-07-05T20:38:13Z,,"La bromance entre Elon Musk et Donald Trump est bien et bien terminé, on ne peut désormais plus en douter. Le patron de Tesla a annoncé samedi la création de sa formation politique, le « parti de lAm… [+2410 chars]",,fr,'Elon Musk'
https://www.lemonde.fr/international/article/2025/07/06/avec-leon-xiv-le-retour-vers-un-style-de-papaute-plus-traditionnel_6619190_3210.html,https://www.lemonde.fr/international/article/2025/07/06/avec-leon-xiv-le-retour-vers-un-style-de-papaute-plus-traditionnel_6619190_3210.html,0,www.lemonde.fr,"Avec Léon XIV, le retour vers un style de papauté plus traditionnel","Deux mois après son élection, Léon XIV prendra, dimanche, ses quartiers d’été à la résidence de Castel Gandolfo, délaissée par son prédécesseur. Cette décision témoigne de sa volonté d’apaiser une curie romaine que François avait braquée par des décisions per…",https://img.lemde.fr/2025/07/04/0/0/3499/2333/1440/960/60/0/6f626b7_upload-1-egn4c0w4hb1r-000-46429km.jpg,2025-07-06T04:00:28Z,,"Le pape Léon XIV sur le balcon de la loggia centrale de la basilique Saint-Pierre, à Rome, le 8 mai 2025. TIZIANA FABI/AFP
Des jardins somptueux, un superbe palais du XIIIe siècle et une vue imprena… [+1269 chars]",,fr,'Léon XIV'
https://www.liberation.fr/international/amerique/elon-musk-lance-sa-formation-politique-le-parti-de-lamerique-20250706_FNLBXIKT3VG3PHYRVLKYPGBS7Y/,https://www.liberation.fr/international/amerique/elon-musk-lance-sa-formation-politique-le-parti-de-lamerique-20250706_FNLBXIKT3VG3PHYRVLKYPGBS7Y/,0,www.liberation.fr,"Elon Musk lance sa formation politique, le «parti de l’Amérique»","Le milliardaire, ancien allié de Donald Trump, a annoncé samedi 5 juillet au soir la création d’un parti pour concurrencer républicains et démocrates en représailles à la promulgation de la «grande et belle loi» budgétaire du président américain.",https://www.liberation.fr/resizer/v2/DVVD2QMXUNAKPD5QLRCI574ORE.jpg?smart=true&auth=a9240f270e73ca2d84d1909ab3e840804d8fe05f698846049147cfa93d13cc24&quality=70&width=1200&height=630,2025-07-06T06:45:40Z,,"Elon Musk a mis sa menace à exécution. Le multimilliardaire a lancé samedi 5 juillet au soir la création de sa propre formation politique, présentée comme une alternative aux deux partis américains d… [+2880 chars]",,fr,'Elon Musk'
https://www.presse-citron.net/elon-musk-president-le-milliardaire-lance-son-parti-politique-pour-vous-rendre-votre-liberte/,https://www.presse-citron.net/elon-musk-president-le-milliardaire-lance-son-parti-politique-pour-vous-rendre-votre-liberte/,0,www.presse-citron.net,“Elon Musk Président !” : le milliardaire lance son parti politique « pour vous rendre votre liberté »,"Le samedi 5 juillet au soir, Elon Musk annonçait sur son réseau social X, le lancement officiel de sa propre formation politiqué baptisée ""parti de l'Amérique"". Il promet de ""vous rendre votre liberté"". Tout un programme.",https://www.presse-citron.net/app/uploads/2025/07/Elon-musk-parti-politique-1600x900.jpg,2025-07-06T10:39:54Z,,"Samedi 5 juillet au soir, le paysage politique américain a connu un bouleversement pour le moins inattendu : Elon Musk a officiellement lancé sa propre formation politique, baptisée le « parti de lAm… [+3754 chars]",,fr,'Elon Musk'
https://www.bfmtv.com/international/amerique-nord/etats-unis/donald-trump/elon-musk-annonce-creer-son-parti-donald-trump-denonce-une-idee-ridicule_AN-202507060383.html,https://www.bfmtv.com/international/amerique-nord/etats-unis/donald-trump/elon-musk-annonce-creer-son-parti-donald-trump-denonce-une-idee-ridicule_AN-202507060383.html,0,www.bfmtv.com,"Elon Musk lance son parti: Donald Trump dénonce une idée ""ridicule""","Donald Trump a qualifié de ""ridicule"" ce dimanche 6 juillet l'annonce de la création par Elon Musk d'une nouvelle formation politique.",https://images.bfmtv.com/9jNRXGXbmUynDQGWawTCcsyRwR0=/0x0:1920x1080/1920x0/images/Donald-Trump-le-6-juillet-2025-2107983.jpg,2025-07-06T21:40:53Z,,"Donald Trump a qualifié de ""ridicule"" ce dimanche 6 juillet l'annonce de la création par Elon Musk d'une nouvelle formation politique.
Donald Trump n'aura pas tardé à réagir. Depuis le New Jersey ce… [+593 chars]",,fr,'Elon Musk'
https://www.dhnet.be/actu/monde/2025/07/06/je-pense-que-cest-ridicule-de-lancer-un-troisieme-parti-donald-trump-attaque-encore-elon-musk-MLSHOLMSIVGHZIG6ADKEDRERMY/,https://www.dhnet.be/actu/monde/2025/07/06/je-pense-que-cest-ridicule-de-lancer-un-troisieme-parti-donald-trump-attaque-encore-elon-musk-MLSHOLMSIVGHZIG6ADKEDRERMY/,0,www.dhnet.be,"""Je pense que c'est ridicule de lancer un troisième parti"" : Donald Trump attaque encore Elon Musk","Le président américain Donald Trump a qualifié dimanche de ""ridicule"" la décision de créer un parti politique annoncée la veille par le milliardaire Elon Musk, son ancien allié. ...",https://www.dhnet.be/resizer/v2/UB7DTRK5SJFWJODH45GAIHTQFI.jpg?auth=4dae9a28645fffc21d3d33c2f16c2a26ac6fb9224283ef83e349ab75e8136d24&width=1200&height=630&quality=85&focal=2479%2C1652&watermark=https%3A%2F%2Fcloudfront-eu-central-1.images.arcpublishing.com%2Fipmgroup%2FDZNGDE46VVGXRGHD3TEI5RB3GM.png%3A100%3A0%2C559,2025-07-06T21:57:14Z,,"""Je pense que c'est ridicule de lancer un troisième parti. Nous connaissons un formidable succès avec le parti républicain"", a déclaré M. Trump à des journalistes avant d'embarquer dans son avion pou… [+98 chars]",,fr,'Elon Musk'
https://www.20minutes.fr/monde/etats-unis/4162222-20250707-etats-unis-trump-prend-choix-ridicule-musk-creer-parti,https://www.20minutes.fr/monde/etats-unis/4162222-20250707-etats-unis-trump-prend-choix-ridicule-musk-creer-parti,0,www.20minutes.fr,Etats-Unis : Trump s’en prend au choix « ridicule » de Musk de créer un parti,"Désormais à couteaux tirés avec le patron de Tesla, Donald Trump martèle que « les troisièmes partis n’ont jamais fonctionné »",https://img.20mn.fr/pVV-GBeTR_SLsZFFi8N3Vyk/1444x920_billionaire-elon-musk-former-close-ally-of-american-president-donald-trump-with-whom-he-recently-fell-out-announced-on-saturday-july-5-the-creation-of-his-political-group-which-he-named-the-america-party-when-it-comes-to-ruining-our-country-through-waste-and-corruption-we-live-in-a-one-party-system-not-a-democracy-the-tesla-and-space-x-boss-wrote-on-his-social-network-x-today-the-party-of-america-is-created-to-give-you-back-your-freedom-he-added-with-the-wind-rising-against-the-american-president-s-budget-bill-which-he-accuses-of-increasing-the-public-debt-elon-musk-had-promised-in-recent-days-to-launch-his-own-political-party-if-the-text-was-adopted-originally-from-south-africa-the-billionaire-will-not-be-able-to-run-in-a-future-presidential-election-as-candidates-must-be-born-americans-he-launched-a-poll-on-this-idea-on-x-friday-the-day-of-the-national-holiday-in-the-united-states-and-the-promulgation-with-great-fanfare-of-donald-trump-s-one-big-beautiful-bill-by-a-ratio-of-two-to-one-you-want-a-new-political-party-and-you-will-have-it-launched-the-entrepreneur-on-saturday-while-65-of-some-1-2-million-voters-answered-yes-to-the-question-of-whether-they-wanted-the-party-of-america-to-see-the-light-of-day-on-july-6-2025-yassine-mahjoub-sipa-mahjoubyassine-mahjoub03268-credit-yassine-mahjoub-sipa-2507061756,2025-07-07T00:30:09Z,,Donald Trump ne voit pas dun bon il le dernier choix de son ancien allié avec lequel il est désormais à couteaux tirés. Le président américain a ainsi qualifié dimanche de « ridicule » la décision de… [+2630 chars],,fr,'Donald Trump'
https://www.lemonde.fr/international/article/2025/07/07/elon-musk-cree-son-propre-parti-dans-une-tentative-de-seduire-les-americains-lasses-par-la-partition-de-la-vie-politique-en-deux-camps-irreconciliables_6619511_3210.html,https://www.lemonde.fr/international/article/2025/07/07/elon-musk-cree-son-propre-parti-dans-une-tentative-de-seduire-les-americains-lasses-par-la-partition-de-la-vie-politique-en-deux-camps-irreconciliables_6619511_3210.html,0,www.lemonde.fr,"Elon Musk crée son propre parti, dans une tentative de séduire les Américains lassés par la partition de la vie politique en deux camps irréconciliables","Avec le Parti de l’Amérique, le patron de SpaceX et Tesla entérine sa rupture avec Donald Trump après le vote de la loi budgétaire. Le président américain a jugé « ridicule » l’initiative de son ancien allié.",https://img.lemde.fr/2025/05/20/0/0/3277/2185/1440/960/60/0/15c77e3_ftp-import-images-1-bs3do7rwq3ol-8cfd76c738f7447aa60ab8abfb95a49e-0-3911bf5d38f74ce0a2ea5df4cf021f05.jpg,2025-07-07T03:34:08Z,,"Elon Musk, à lhôtel de ville de Green Bay (Wisconsin), le 30 mars 2025. JEFFREY PHELPS/AP
Donald Trump a réagi avec une relative modération, dimanche 6 juillet, à lannonce faite la veille par son an… [+1495 chars]",,fr,'Elon Musk'
