index,url,valid,domain,title,description,image,published,archive,content,quote,language,keyword
https://www.zdnet.fr/blogs/l-esprit-libre/technofascisme-un-documentaire-sur-lalliance-big-tech-et-extreme-droite-476750.htm,https://www.zdnet.fr/blogs/l-esprit-libre/technofascisme-un-documentaire-sur-lalliance-big-tech-et-extreme-droite-476750.htm,0,www.zdnet.fr,"""Technofascisme ?"", un documentaire sur l’alliance Big Tech et extrême droite","Franceinfo inaugure ce vendredi son nouveau canal 16 sur la TNT avec ce film instructif sur les milliardaires de la tech, comme Elon Musk et surtout Peter Thiel, et les trumpistes.",https://www.zdnet.fr/wp-content/uploads/zdnet/2025/06/technofascisme-docu.jpg,2025-06-06T09:06:09Z,https://web.archive.org/web/20250606175444/https://www.zdnet.fr/blogs/l-esprit-libre/technofascisme-un-documentaire-sur-lalliance-big-tech-et-extreme-droite-476750.htm,"Lactualité galope si vite que ce 6 juin, la rupture spectaculaire entre Elon Musk et Donald Trump fait les gros titres. Mais les idées politiques des deux hommes restent alignées en bien des points, … [+5016 chars]",,fr,'Curtis Yarvin'
https://www.ledauphine.com/culture-loisirs/2025/06/07/il-y-a-40-ans-avoriaz-revelait-a-la-france-le-premier-terminator-de-james-cameron,https://www.ledauphine.com/culture-loisirs/2025/06/07/il-y-a-40-ans-avoriaz-revelait-a-la-france-le-premier-terminator-de-james-cameron,0,www.ledauphine.com,"Cinéma. ""De la merde"": il y a 40 ans, le ""Terminator"" de James Cameron enflammait Avoriaz... mais pas Michel Blanc","De 1973 à 1993, le festival haut-savoyard a mis en lumière certains des plus grands réalisateurs de tous les temps : Steven Spielberg, George Miller, David Cronenberg et... James Cameron !",https://cdn-s-www.ledauphine.com/images/F963841B-192E-4A0D-8CCB-655FF04903CC/FB1200/photo-1748959456.jpg,2025-06-07T04:10:00Z,,"Cétait il y a à peine quarante ans. Le 24 avril 1985, les cinéphiles français découvraient pour la toute première fois un film à petit budget aujourdhui entré dans la légende : Terminator. Et par la … [+3291 chars]",,fr,'George Miller'
https://www.lexpress.fr/monde/royaume-uni-la-strategie-risquee-de-keir-starmer-pour-contrer-la-montee-de-lextreme-droite-KL2W65A6RZCBLD2DHW3VO4TRLI/,https://www.lexpress.fr/monde/royaume-uni-la-strategie-risquee-de-keir-starmer-pour-contrer-la-montee-de-lextreme-droite-KL2W65A6RZCBLD2DHW3VO4TRLI/,0,www.lexpress.fr,Royaume-Uni : la stratégie risquée de Keir Starmer pour contrer la montée de l’extrême droite,"Devancé par Reform UK dans les sondages, le Premier ministre britannique durcit le ton sur l’immigration. Et donne l’impression de naviguer à vue.",https://www.lexpress.fr/resizer/v2/G7U2RXUUSZCPJKGLR33S7F3HKU.jpg?auth=73850faefdf74b221686811e95ce55b9e271c21e309705e372be4fd69658efab&width=1200&height=630&quality=85&focal=426%2C185,2025-06-07T06:45:00Z,,"De lautre côté de la Manche, son nom est sur toutes les lèvres. Le Premier ministre travailliste Keir Starmer considère même Nigel Farage, leader du parti nationaliste et anti-immigration Reform UK, … [+7733 chars]",,fr,'David Cameron'
https://www.20minutes.fr/arts-stars/people/4157150-20250607-etrange-proposition-tony-blair-festival-sxsw-londres-devrait-avoir-infirmiers-medecins-ia,https://www.20minutes.fr/arts-stars/people/4157150-20250607-etrange-proposition-tony-blair-festival-sxsw-londres-devrait-avoir-infirmiers-medecins-ia,0,www.20minutes.fr,L’étrange proposition de Tony Blair au festival SXSW de Londres : « On devrait avoir des infirmiers et des médecins IA »,La présence de l’ex-Premier ministre britannique à l’événement a fait grincer des dents,https://img.20mn.fr/MyN6OFyQQLmbH2IhRaGiUCk/1444x920_439633-avalon-starface-2025-01-22-davos-suisse,2025-06-07T08:02:36Z,,"Tony Blair a créé la surprise au festival SXSW London en proposant une vision futuriste du système de santé britannique ! Lancien Premier ministre britannique, dont la présence navait pas été annoncé… [+1168 chars]",,fr,'Premier ministre'
https://www.lexpress.fr/politique/rn/giorgia-meloni-lempecheuse-de-tourner-en-rond-du-camp-des-patriotes-europeens-KPKLK57RIFG7XBCV44KZQARNH4/,https://www.lexpress.fr/politique/rn/giorgia-meloni-lempecheuse-de-tourner-en-rond-du-camp-des-patriotes-europeens-KPKLK57RIFG7XBCV44KZQARNH4/,0,www.lexpress.fr,"Giorgia Meloni, l’empêcheuse de tourner en rond du camp des ""patriotes"" européens","Lundi, le RN reçoit ses alliés européens dans le Loiret pour fêter l’anniversaire de leurs victoires aux européennes. Brilleront Orbán, Wilders, Salvini… Mais la dirigeante italienne ne sera pas là.",https://www.lexpress.fr/resizer/v2/Y4PNAA324ZAH5KH7SWNDHXTLRU.jpg?auth=cf7ef683be9d3f588e23a37459f5414fb7b7dfe08349dd0552cc0a23f77f6ac5&width=1200&height=630&quality=85&focal=4252%2C2408,2025-06-08T14:00:00Z,,"Des noces de coton dans le Loiret. A Mormant-sur-Vernisson, petit village de moins de 150 âmes, cest un drôle danniversaire quon célèbre ce lundi 9 juin. Celui de la large victoire de lextrême droite… [+6390 chars]",,fr,'Giorgia Meloni'
https://www.franceinfo.fr/replay-radio/l-edito-politique/edito-a-mormant-sur-vernisson-marine-le-pen-et-jordan-bardella-veulent-montrer-que-le-rn-n-est-ni-isole-ni-divise_7273026.html,https://www.franceinfo.fr/replay-radio/l-edito-politique/edito-a-mormant-sur-vernisson-marine-le-pen-et-jordan-bardella-veulent-montrer-que-le-rn-n-est-ni-isole-ni-divise_7273026.html,0,www.franceinfo.fr,"Édito. À Mormant-sur-Vernisson, Marine Le Pen et Jordan Bardella veulent montrer que le RN n'est ni isolé, ni divisé","Le Rassemblement national réunit ses alliés européens à Mormant-sur-Vernisson, dans le Loiret, pour célébrer sa victoire de 2024 aux Européennes et afficher sa force politique.",https://www.franceinfo.fr/pictures/TDN6mdf6te9hh1aUSD-xfoXoF9c/0x0:4500x2530/1500x843/2025/06/09/marineetjordan-6846724de3342218909315.jpg,2025-06-09T05:59:38Z,,"Lextrême droite européenne se réunit lundi 9 juin au cur du Loiret à Mormant-sur-Vernisson, un  village de 133 âmes à lannée, que le RN veut transformer, le temps dune journée, en capitale de lextrêm… [+2748 chars]",,fr,'Marine Le Pen'
https://www.lalibre.be/international/europe/2025/06/09/comment-donald-trump-pousse-lextreme-droite-europeenne-dans-le-dos-pour-affaiblir-lunion-DSTRFB3CINHRLG4QFUWHD2Y2KU/,https://www.lalibre.be/international/europe/2025/06/09/comment-donald-trump-pousse-lextreme-droite-europeenne-dans-le-dos-pour-affaiblir-lunion-DSTRFB3CINHRLG4QFUWHD2Y2KU/,0,www.lalibre.be,Comment Donald Trump pousse l’extrême droite européenne dans le dos pour affaiblir l'Union,"Les partis européens nationalistes et d’extrême droite ont enregistré des succès électoraux notables, ces dernières années. Ils sont désormais ouvertement appuyés par la nouvelle administration américaine. ...",https://www.lalibre.be/resizer/v2/QLYTZ7PIKBELPGRYRZTWC2TS5Y.jpg?auth=38c52a4d48a4df82f7dad7e633d5c87562d984b0be0c102fa8b24e280e9c8867&width=1200&height=630&quality=85&focal=3691%2C2462&watermark=https%3A%2F%2Fcloudfront-eu-central-1.images.arcpublishing.com%2Fipmgroup%2F3R4IDPARFVEO3L2LC5OCCXQ5RM.png%3A100%3A0%2C557,2025-06-09T06:03:05Z,,"Le nationaliste Karol Nawrocki s'impose de justesse à l'élection présidentielle polonaise""La montée de l'extrême droite dans l'UE est un phénomène continu depuis trente ans"", contextualise le Jérôme … [+5909 chars]",,fr,'Geert Wilders'
https://www.lavenir.net/actu/monde/2025/06/09/pousser-lextreme-droite-europeenne-dans-le-dos-pour-affaiblir-lunion-la-strategie-de-donald-trump-P27QX7ACKZEFTHU6BTXCGIKEBQ/,https://www.lavenir.net/actu/monde/2025/06/09/pousser-lextreme-droite-europeenne-dans-le-dos-pour-affaiblir-lunion-la-strategie-de-donald-trump-P27QX7ACKZEFTHU6BTXCGIKEBQ/,0,www.lavenir.net,Pousser l’extrême droite européenne dans le dos pour affaiblir l'Union: la stratégie de Donald Trump,"Les partis européens nationalistes et d’extrême droite ont enregistré des succès électoraux notables, ces dernières années. Ils sont désormais ouvertement appuyés par la nouvelle administration américaine. ...",https://www.lavenir.net/resizer/v2/QLYTZ7PIKBELPGRYRZTWC2TS5Y.jpg?auth=38c52a4d48a4df82f7dad7e633d5c87562d984b0be0c102fa8b24e280e9c8867&width=1200&height=630&quality=85&focal=3691%2C2462&watermark=https%3A%2F%2Fcloudfront-eu-central-1.images.arcpublishing.com%2Fipmgroup%2FUVYY255VT5BDBHOGCTGBCGI364.png%3A100%3A0%2C558,2025-06-09T07:24:51Z,,"""La montée de l'extrême droite dans l'UE est un phénomène continu depuis trente ans"", contextualise le Jérôme Jamin, professeur en sciences politiques à l'Université de Liège, qui travaille sur le po… [+5459 chars]",,fr,'Donald Trump'
https://www.franceinfo.fr/politique/front-national/viktor-orban-invite-une-contre-manifestation-organisee-ce-que-l-on-sait-du-rassemblement-de-l-extreme-droite-europeenne-autour-de-marine-le-pen-et-jordan-bardella-dans-le-loiret_7301385.html,https://www.franceinfo.fr/politique/front-national/viktor-orban-invite-une-contre-manifestation-organisee-ce-que-l-on-sait-du-rassemblement-de-l-extreme-droite-europeenne-autour-de-marine-le-pen-et-jordan-bardella-dans-le-loiret_7301385.html,0,www.franceinfo.fr,"Viktor Orban invité, une contre-manifestation organisée... Ce que l'on sait du rassemblement de l'extrême droite européenne autour de Marine Le Pen et Jordan Bardella dans le Loiret","Environ 5 000 personnes sont attendues, lundi, à Mormant-sur-Vernisson, petite commune de 130 habitants, pour ""La fête de la victoire"". Cet événement entend célébrer l'arrivée en tête du Rassemblement national, il y a un an, lors des élections européennes du …",https://www.franceinfo.fr/pictures/wiNSvYJ9uw6txY64-jVzICSY2Bw/0x12:1024x588/1500x843/2025/06/09/080-hl-rgautier-2793645-6846aef6eb1fd005865121.jpg,2025-06-09T11:13:44Z,,"Un ""coup de tonnerre électoral"". C'est ce que le Rassemblement national (RN) entend saluer, lundi 9 juin, à Mormant-sur-Vernisson (Loiret), un an après être arrivé nettement en tête aux élections eur… [+4717 chars]",,fr,'Geert Wilders'
https://www.lemonde.fr/politique/article/2025/06/09/l-extreme-droite-europeenne-s-en-prend-a-l-ue-lors-d-un-rassemblement-dans-le-loiret_6611742_823448.html,https://www.lemonde.fr/politique/article/2025/06/09/l-extreme-droite-europeenne-s-en-prend-a-l-ue-lors-d-un-rassemblement-dans-le-loiret_6611742_823448.html,0,www.lemonde.fr,"L’extrême droite européenne s’en prend à l’UE, lors d’un rassemblement dans le Loiret","De nombreux dirigeants européens d’extrême droite, dont Viktor Orban et Marine Le Pen, sont réunis à Mormant-sur-Vernisson, à l’invitation du RN. Plusieurs responsables de gauche, associations et syndicats ont manifesté à quelques kilomètres de là, plus tôt, …",https://img.lemde.fr/2025/06/09/0/0/1500/1000/1440/960/60/0/ff88421_sirius-fs-upload-1-oq1e1tn2yhwa-1749474721122-gj3a1537.jpg,2025-06-09T13:34:56Z,,"Le premier ministre hongrois Viktor Orban à Mormant-sur-Vernisson, le 9 juin 2025. CYRIL BITTON/DIVERGENCE POUR « LE MONDE »
Le premier ministre hongrois Viktor Orban a comparé la politique migratoi… [+4843 chars]",,fr,'Marine Le Pen'
https://www.nouvelobs.com/politique/20250609.OBS104763/dans-le-loiret-le-rn-reunit-ses-allies-europeens-et-espere-se-relancer.html,https://www.nouvelobs.com/politique/20250609.OBS104763/dans-le-loiret-le-rn-reunit-ses-allies-europeens-et-espere-se-relancer.html,0,www.nouvelobs.com,"Dans le Loiret, le RN réunit ses alliés européens et espère se relancer","Les partis d’extrême droite du groupe « Patriotes pour l’Europe » étaient conviés à se rassembler, ce lundi 9 juin, à l’invitation du Rassemblement national. Le parti ne parvient pas à faire taire les rumeurs sur des tensions entre Marine Le Pen et Jordan Bar…",https://focus.nouvelobs.com/2025/06/09/0/0/4711/3141/1200/800/0/0/e47f294_sirius-fs-upload-1-tmnaudhgp87e-1749483007736-080-hl-fmoreau-2794010.jpg,2025-06-09T14:48:01Z,,"Par 
Lucas Burel
Publié le
9 juin 2025 à 16h38, mis à jour le
9 juin 2025 à 17h38 
Marine Le Pen et Jordan Bardella sur la scène de la « Fête de la victoire », avec leurs alliés européens, à Mor… [+6543 chars]",,fr,'Geert Wilders'
https://www.20minutes.fr/arts-stars/people/4157762-20250610-artus-garde-souvenir-mitige-dals-concert-katy-perry-sydney-perturbe,https://www.20minutes.fr/arts-stars/people/4157762-20250610-artus-garde-souvenir-mitige-dals-concert-katy-perry-sydney-perturbe,0,www.20minutes.fr,Artus garde un souvenir mitigé de « DALS »… Le concert de Katy Perry à Sydney perturbé…,Toute l’actualité people est dans « 20 Minutes »,https://img.20mn.fr/ZVOVvY1XQq2hOTT7MmKIKCk/1444x920_440352-ivanka-voisin-starface-2025-02-10-victor-artus-solaro-artus,2025-06-10T14:09:44Z,,"10 juin 2025
Tom Felton nest pas sensible aux controverses autour de J.K. Rowling
Lacteur, qui sera à nouveau Drago Malefoy dans la reprise à Broadway des aventures dHarry Potter, sen tient au plai… [+1726 chars]",,fr,'Katy Perry'
https://www.huffingtonpost.fr/culture/article/katy-perry-ne-s-est-pas-arretee-de-chanter-malgre-ce-fan-qui-a-perturbe-son-concert_251171.html,https://www.huffingtonpost.fr/culture/article/katy-perry-ne-s-est-pas-arretee-de-chanter-malgre-ce-fan-qui-a-perturbe-son-concert_251171.html,0,www.huffingtonpost.fr,Katy Perry ne s’est pas arrêtée de chanter malgré ce fan qui a perturbé son concert,"Katy Perry se produisait lundi à Sydney, en Australie, pour sa tournée « Lifetimes », lorsqu’un fan a fait irruption sur scène.",https://focus.huffingtonpost.fr/2025/04/30/729/782/4090/2301/1820/1023/75/0/a40af56_sirius-fs-upload-1-ado9jbef50ub-1746027097766-063-2211709730.jpg,2025-06-10T15:50:05Z,,"CONCERT - « The Show must go on », comme le disait Queen. Alors quelle performait sur la scène de la Qudos Bank Arena, à Sydney, la chanteuse Katy Perry a été rejointe sur scène par un fan. Mais cett… [+1758 chars]",,fr,'Katy Perry'
https://www.huffingtonpost.fr/france/article/surveillante-poignardee-a-nogent-ce-que-disent-les-experimentations-des-portiques-au-college-et-lycee_251192.html,https://www.huffingtonpost.fr/france/article/surveillante-poignardee-a-nogent-ce-que-disent-les-experimentations-des-portiques-au-college-et-lycee_251192.html,0,www.huffingtonpost.fr,Surveillante poignardée à Nogent : ce que disent les expérimentations des portiques au collège et lycée,François Bayrou veut expérimenter des portiques de détection d’armes. Pourtant les tests réalisés jusqu’à présent ne sont pas très concluants.,https://focus.huffingtonpost.fr/2025/06/11/0/0/1024/576/1820/1023/75/0/96b502a_sirius-fs-upload-1-humfur3xa0hi-1749633904447-000-382t37d-1.jpg,2025-06-11T11:15:14Z,,"EN BREFAprès la mort dune surveillante poignardée par un élève, François Bayrou souhaite tester des portiques de détection darmes dans les écoles.Les expérimentations précédentes montrent des résulta… [+4922 chars]",,fr,'Laurent Wauquiez'
https://www.20minutes.fr/politique/4157738-20250611-flottille-vers-gaza-comment-insoumis-mettent-pression-executif-apres-arrestation-rima-hassan,https://www.20minutes.fr/politique/4157738-20250611-flottille-vers-gaza-comment-insoumis-mettent-pression-executif-apres-arrestation-rima-hassan,0,www.20minutes.fr,Flottille vers Gaza : Comment les insoumis mettent la pression sur l’exécutif après l’arrestation de Rima Hassan,Jean-Luc Mélenchon et les insoumis multiplient les rassemblements pour demander la « libération » de Rima Hassan et des autres militants arrêtés par Israël avant leur arrivée à Gaza. Une manière de critiquer aussi l’exécutif français,https://img.20mn.fr/S8lYUTJKSSaBnFlX4qyCtCk/1444x920_thousands-gathered-in-paris-including-jean-luc-melenchon-and-members-of-parliament-from-la-france-insoumise-lfi-to-denounce-the-arrest-by-israel-of-mep-rima-hassan-swedish-activist-greta-thunberg-and-others-france-june-9-2025-sevgi-sipa-6653-credit-sevgi-sipa-2506100901,2025-06-11T15:54:05Z,,"Alors quau-dessus de lui flotte un drapeau de la Palestine, Jean-Luc Mélenchon lève le poing et tonne devant les milliers de personnes réunies lundi place de la République, à Paris : « Rima Hassan re… [+5385 chars]",,fr,'Jean-Luc Mélenchon'
https://france3-regions.franceinfo.fr/auvergne-rhone-alpes/rhone/lyon/securite-dans-les-colleges-le-bilan-mitige-des-portiques-installes-par-la-region-auvergne-rhone-alpes-3169254.html,https://france3-regions.franceinfo.fr/auvergne-rhone-alpes/rhone/lyon/securite-dans-les-colleges-le-bilan-mitige-des-portiques-installes-par-la-region-auvergne-rhone-alpes-3169254.html,0,france3-regions.franceinfo.fr,Sécurité dans les collèges : le bilan mitigé des portiques installés par la Région Auvergne-Rhône-Alpes,"Au lendemain de l’agression mortelle d’une surveillante dans un collège du Nord, François Bayrou dit vouloir expérimenter les portiques de sécurité à l’entrée des établissements scolaires. Déployé en Auvergne-Rhône-Alpes depuis plusieurs années, l’efficacité …",https://france3-regions.franceinfo.fr/image/5yQQ42zyhSqHGJPrMjl_GJZUots/930x620/regions/2025/06/11/allec0012-00-00-00-16-684999ef15d1c268205740.jpg,2025-06-11T16:20:07Z,,"Au lendemain de lagression mortelle dune surveillante dans un collège du Nord, François Bayrou dit vouloir expérimenter les portiques de sécurité à lentrée des établissements scolaires. Déployé en Au… [+6221 chars]",,fr,'Laurent Wauquiez'
https://www.bfmtv.com/politique/gouvernement/surveillante-tuee-a-nogent-cout-efficacite-l-installation-de-portiques-contre-les-couteaux-est-elle-possible_AN-202506110715.html,https://www.bfmtv.com/politique/gouvernement/surveillante-tuee-a-nogent-cout-efficacite-l-installation-de-portiques-contre-les-couteaux-est-elle-possible_AN-202506110715.html,0,www.bfmtv.com,"Surveillante tuée à Nogent: coût, efficacité... l'installation de portiques contre les couteaux à l'école est-elle possible?","Après le décès d'une assistante d'éducation ce lundi dans la Haute-Marne, François Bayrou appelle à l'installation de portiques pour détecter les métaux dans certains établissements scolaires. La mesure semble cependant difficile à mettre en place, à commence…",https://images.bfmtv.com/wfDO1rW9r1z-_1T604N-EJJGC0g=/0x106:2048x1258/2048x0/images/Un-controle-aux-portiques-de-securite-de-l-aeroport-Charles-de-Gaulle-en-2021-2095646.jpg,2025-06-11T17:10:48Z,,"Après le décès d'une assistante d'éducation ce lundi dans la Haute-Marne, François Bayrou appelle à l'installation de portiques pour détecter les métaux dans certains établissements scolaires. La mes… [+5445 chars]",,fr,'Laurent Wauquiez'
https://www.bfmtv.com/politique/gouvernement/on-a-les-memes-electeurs-gerald-darmanin-affirme-que-bruno-retailleau-est-macroniste_AN-202506110761.html,https://www.bfmtv.com/politique/gouvernement/on-a-les-memes-electeurs-gerald-darmanin-affirme-que-bruno-retailleau-est-macroniste_AN-202506110761.html,0,www.bfmtv.com,"""On a les mêmes électeurs"": Gérald Darmanin affirme que Bruno Retailleau est ""macroniste""","Bruno Retailleau est à la fois ministre de l'Intérieur et président des Républicains. Pour cette double casquette, il est régulièrement attaqué, à la fois par son propre camp et par les proches d'Emmanuel Macron.",https://images.bfmtv.com/z3iIkCMI98Sh4eow_Gx7rSMr9UE=/0x106:2048x1258/2048x0/images/Gerald-Darmanin-et-Bruno-Retailleau-a-l-Assemblee-nationale-a-Paris-le-1er-avril-2025-2067802.jpg,2025-06-11T18:18:21Z,,"Bruno Retailleau est à la fois ministre de l'Intérieur et président des Républicains. Pour cette double casquette, il est régulièrement attaqué, à la fois par son propre camp et par les proches d'Emm… [+1550 chars]",,fr,'Bruno Retailleau'
https://www.huffingtonpost.fr/international/video/israel-a-mene-des-frappes-en-iran-contre-des-installations-nucleaires-et-des-sites-militaires_251297.html,https://www.huffingtonpost.fr/international/video/israel-a-mene-des-frappes-en-iran-contre-des-installations-nucleaires-et-des-sites-militaires_251297.html,0,www.huffingtonpost.fr,Israël a mené des frappes en Iran contre des installations nucléaires et des sites militaires,Le chef de la diplomatie américaine Marco Rubio a averti l’Iran de ne pas répliquer en  « ciblant les intérêts américains ».,https://focus.huffingtonpost.fr/2025/06/13/0/48/992/558/1820/1023/75/0/e5576f7_upload-1-tlt0dlyau8wd-capture-da-a-cran-2025-06-13-032149.png,2025-06-13T01:30:11Z,,"MOYEN-ORIENT - « Première phase » de lattaque. Israël a frappé des installations « au cur » du programme nucléaire iranien et dautres sites militaires à travers lIran, dans la nuit de jeudi 12 juin à… [+2169 chars]",,fr,'Marco Rubio'
https://www.20minutes.fr/politique/4158470-20250613-flottille-gaza-rima-hassan-victor-hugo-compliment-melenchon-fait-marrer-toile,https://www.20minutes.fr/politique/4158470-20250613-flottille-gaza-rima-hassan-victor-hugo-compliment-melenchon-fait-marrer-toile,0,www.20minutes.fr,"Flottille pour Gaza : « Rima Hassan, c’est Victor Hugo »… Le compliment de Mélenchon fait marrer sur la Toile","Jean-Luc Mélenchon a comparé Rima Hassan à Victor Hugo après son retour d’Israël, provoquant moqueries et critiques au sein de la classe politique et sur les réseaux sociaux",https://img.20mn.fr/R-hzA9blRoWjb_eFIupKDCk/1444x920_portrait-of-mep-rima-hassan-with-a-keffiyeh-on-her-head-la-france-insoumise-lfi-party-and-jean-luc-melenchon-rally-on-the-place-de-la-republique-to-celebrate-the-liberation-and-return-to-france-of-part-of-the-crew-of-the-madleen-ship-freedom-flotilla-intercepted-by-the-israeli-army-on-its-way-to-gaza-to-bring-humanitarian-aid-to-the-palestinian-population-against-the-blockade-in-palestine-in-paris-france-on-june-12-2025-portrait-de-l-eurodeputee-rima-hassan-avec-un-keffieh-sur-la-tete-parti-la-france-insoumise-lfi-et-jean-luc-melenchon-rassemblement-sur-la-place-de-la-republique-pour-feter-la-liberation-et-le-retour-en-france-d-une-partie-de-l-equipage-du-bateau-madleen-flottille-de-la-liberte-intercepte-par-l-armee-israelienne-sur-sa-route-vers-gaza-pour-apporter-de-l-aide-humanitaire-a-la-population-palestinienne-contre-le-blocus-en-palestine-a-paris-france-le-12-juin-2025-photo-by-augustin-pasquini-hans-lucas-via-afp,2025-06-13T20:01:36Z,,"Lanalogie de Jean-Luc Mélenchon entre Rima Hassan et Victor Hugo a enflammé les réseaux sociaux, entre sarcasmes, indignations et critiques acérées de la classe politique. Accueillie en héroïne place… [+1795 chars]",,fr,'Jean-Luc Mélenchon'
