index,url,valid,domain,title,description,image,published,archive,content,quote,language,keyword
https://www.lemonde.fr/politique/article/2023/07/01/mort-de-nahel-m-face-aux-emeutes-la-riposte-graduee-d-emmanuel-macron_6180126_823448.html,https://www.lemonde.fr/politique/article/2023/07/01/mort-de-nahel-m-face-aux-emeutes-la-riposte-graduee-d-emmanuel-macron_6180126_823448.html,0,www.lemonde.fr,"Mort de Nahel M. : face aux émeutes, la riposte graduée d’Emmanuel Macron","Après la mort du jeune homme, mardi 27 juin, à Nanterre, le chef de l’Etat s’est efforcé de stopper le cycle des violences urbaines à grand renfort de moyens de maintien de l’ordre et de communication politique. Mais sans aller jusqu’à décréter l’état d’urgen…",https://img.lemde.fr/2023/06/30/0/0/4800/3200/1440/960/60/0/01a75b3_1688134368950-333405.jpg,2023-07-01T09:52:22Z,https://web.archive.org/web/20230701104213/https://www.lemonde.fr/politique/article/2023/07/01/mort-de-nahel-m-face-aux-emeutes-la-riposte-graduee-d-emmanuel-macron_6180126_823448.html,"Emmanuel Macron, lors de la cellule interministérielle de crise, au ministère de lintérieur, à Paris, le 30 juin 2023. YVES HERMAN/AFP
Le feu couve toujours, mais, après quatre nuits démeutes, la vi… [+3342 chars]",,fr,'Eric Ciotti'
https://www.lepoint.fr/monde/a-la-une-de-l-actu-ce-dimanche-2-juillet-01-07-2023-2527019_24.php,https://www.lepoint.fr/monde/a-la-une-de-l-actu-ce-dimanche-2-juillet-01-07-2023-2527019_24.php,0,www.lepoint.fr,À la une de l’actu ce dimanche 2 juillet,"Pedro Sanchez recoit Charles Michel apres avoir pris la tete de l'UE, debut de la fete du cinema, Grand prix en Autriche... Toute l'actualite de ce dimanche.",https://static.lpnt.fr/images/2023/07/01/24693535lpw-24693553-article-jpg_9627081_540x282.jpg,2023-07-01T21:21:00Z,,"Espagne. Pedro Sánchez, le Premier ministre espagnol, reçoit, ce dimanche 2 juillet, Charles Michel, le président du Conseil européen. La veille, l'Espagne prenait la tête de l'Union européenne et ce… [+1927 chars]",,fr,'Pedro Sánchez'
https://www.lemonde.fr/international/article/2023/07/02/guerre-en-ukraine-nouvelles-frictions-entre-la-france-et-l-allemagne-sur-l-otan_6180238_3210.html,https://www.lemonde.fr/international/article/2023/07/02/guerre-en-ukraine-nouvelles-frictions-entre-la-france-et-l-allemagne-sur-l-otan_6180238_3210.html,0,www.lemonde.fr,Guerre en Ukraine : nouvelles frictions entre la France et l’Allemagne sur l’OTAN,"L’annulation de la visite d’Emmanuel Macron en Allemagne, pour cause d’émeutes en France, intervient alors que les relations entre les deux pays sont au point mort, en particulier en matière de défense et de sécurité.",https://img.lemde.fr/2023/07/01/1/0/8192/5461/1440/960/60/0/f88b894_1688199528356-332639.jpg,2023-07-02T13:39:21Z,http://archive.md/20230702142646/https://www.lemonde.fr/international/article/2023/07/02/guerre-en-ukraine-nouvelles-frictions-entre-la-france-et-l-allemagne-sur-l-otan_6180238_3210.html,"Le président français, Emmanuel Macron, avec le chancelier allemand, Olaf Scholz, le 30 juin 2023 à Bruxelles. JOHN THYS / AFP
En raison des émeutes qui embrasent la France, le président français a … [+2713 chars]",,fr,'George Bush'
https://www.challenges.fr/politique/borne-reunit-les-groupes-politiques-pour-echanger-sur-des-propositions_860681,https://www.challenges.fr/politique/borne-reunit-les-groupes-politiques-pour-echanger-sur-des-propositions_860681,0,www.challenges.fr,"Borne réunit les groupes politiques pour échanger sur des ""propositions""","Elisabeth Borne a reçu lundi à Matignon les représentants de l'ensemble des groupes politiques au Parlement pour échanger sur des ""propositions"", après six nuits de violences en France qui ont suivi la mort du jeune Nahel, tué par un policier.
La Première min…",https://www.challenges.fr/assets/img/2023/07/03/cover-r4x3w1200-64a2f66370bbe-459e8aa9eff8f82c9e131ed577b2c8a8dae59d4a-jpg.jpg,2023-07-03T10:38:55Z,https://web.archive.org/web/20230705092917/https://www.challenges.fr/politique/borne-reunit-les-groupes-politiques-pour-echanger-sur-des-propositions_860681,"Elisabeth Borne a reçu lundi à Matignon les représentants de l'ensemble des groupes politiques au Parlement pour échanger sur des ""propositions"", après six nuits de violences en France qui ont suivi … [+3164 chars]",,fr,'Elisabeth Borne'
https://www.huffingtonpost.fr/people/article/mort-de-leandro-de-niro-rodriguez-petit-fils-de-robert-de-niro-vu-dans-a-star-is-born_220088.html,https://www.huffingtonpost.fr/people/article/mort-de-leandro-de-niro-rodriguez-petit-fils-de-robert-de-niro-vu-dans-a-star-is-born_220088.html,0,www.huffingtonpost.fr,"Mort de Leandro De Niro Rodriguez, petit-fils de Robert De Niro vu dans « A Star Is Born »","Le petit-fils de Robert de Niro n’avait que 19 ans. C’est sa mère Dreana De Niro, actrice, qui a annoncé la nouvelle sur son compte Instagram.",https://huffpost-focus.sirius.press/2023/07/03/44/0/6720/3780/1820/1023/75/0/151471f_1688377275194-robert-de-niro.jpg,2023-07-03T10:47:43Z,,"DÉCÈS - « Au paradis éternel mon garçon chéri. » Lactrice Drena De Niro, fille aînée des sept enfants de Robert De Niro, a annoncé ce dimanche 2 juillet la mort de son fils, Leandro.
Le petit-fils d… [+2315 chars]",,fr,'Robert de Niro'
https://www.dhnet.be/lifestyle/people/2023/07/03/robert-de-niro-endeuille-son-petit-fils-de-19-ans-est-decede-67EZUSBP55CYFN2ULED2YFVP2Y/,https://www.dhnet.be/lifestyle/people/2023/07/03/robert-de-niro-endeuille-son-petit-fils-de-19-ans-est-decede-67EZUSBP55CYFN2ULED2YFVP2Y/,0,www.dhnet.be,Robert De Niro endeuillé : son petit fils de 19 ans est décédé,"Leandro De Niro Rodriguez, le petit-fils de l'acteur américain Robert De Niro (âgé de 79 ans), est décédé à l'âge de 19 ans.","https://www.dhnet.be/resizer/dbQcPxq88Cocda88ZRsYZPSsZvo=/1200x630/filters:format(jpeg):focal(2982x1969.5:2992x1959.5):watermark(cloudfront-eu-central-1.images.arcpublishing.com/ipmgroup/KSYODHLMNBBMDA7B5YPJPTFVNY.png,0,-0,0,100)/cloudfront-eu-central-1.images.arcpublishing.com/ipmgroup/YSESX3QHZJCNXHY2UEXMSWNRNA.jpg",2023-07-03T12:40:02Z,,"""Mon bel ange, mon doux ange. Je t'ai aimé d'un amour indescriptible depuis le moment où j'ai senti ta présence dans mon ventre. Tu étais ma joie, mon cur et tout ce qui était pur et réel dans ma vie… [+773 chars]",,fr,'Robert de Niro'
https://www.lalibre.be/lifestyle/people/2023/07/03/robert-de-niro-endeuille-son-petit-fils-de-19-ans-est-decede-WOGFIZMLL5HEHIO2232VEWIF6Y/,https://www.lalibre.be/lifestyle/people/2023/07/03/robert-de-niro-endeuille-son-petit-fils-de-19-ans-est-decede-WOGFIZMLL5HEHIO2232VEWIF6Y/,0,www.lalibre.be,Robert De Niro endeuillé : son petit fils de 19 ans est décédé,"Leandro De Niro Rodriguez, le petit-fils de l'acteur américain Robert De Niro (âgé de 79 ans), est décédé à l'âge de 19 ans.","https://www.lalibre.be/resizer/RscnP1lFGv9Kix1oilD49CSuIqc=/1200x630/filters:format(jpeg):focal(2982x1969.5:2992x1959.5):watermark(cloudfront-eu-central-1.images.arcpublishing.com/ipmgroup/OIO44DUUUNC2DB5T3FIJECBT5U.png,0,-0,0,100)/cloudfront-eu-central-1.images.arcpublishing.com/ipmgroup/YSESX3QHZJCNXHY2UEXMSWNRNA.jpg",2023-07-03T12:47:33Z,,"""Mon bel ange, mon doux ange. Je t'ai aimé d'un amour indescriptible depuis le moment où j'ai senti ta présence dans mon ventre. Tu étais ma joie, mon cur et tout ce qui était pur et réel dans ma vie… [+773 chars]",,fr,'Robert De Niro'
https://www.challenges.fr/politique/emeutes-elisabeth-borne-reunit-les-groupes-politiques-parlementaires_860664,https://www.challenges.fr/politique/emeutes-elisabeth-borne-reunit-les-groupes-politiques-parlementaires_860664,0,www.challenges.fr,Émeutes : Elisabeth Borne réunit les groupes politiques,"La Première ministre devait recevoir à Matignon les présidents des groupes politiques à l'Assemblée et au Sénat à 17 heures, suite aux violences urbaines qui ont suivi la mort du jeune Nahel. Emmanuel Macron devait de son côté s'entretenir avec la présidente …",https://www.challenges.fr/assets/img/2023/07/03/cover-r4x3w1200-64a2d2210f073-000-33lr7yw.jpg,2023-07-03T13:50:26Z,https://web.archive.org/web/20230703155504/https://www.challenges.fr/politique/emeutes-elisabeth-borne-reunit-les-groupes-politiques-parlementaires_860664,"Elisabeth Borne recevra ce lundi 3 juillet à 17h00 à Matignon les représentants de l'ensemble des groupes politiques au Parlement, après six nuits de violences en France qui ont suivi la mort du jeun… [+2609 chars]",,fr,'Bruno Retailleau'
https://www.challenges.fr/politique/emeutes-elisabeth-borne-reunit-les-groupes-politiques-parlementaires-a-17h00_860664,https://www.challenges.fr/politique/emeutes-elisabeth-borne-reunit-les-groupes-politiques-parlementaires-a-17h00_860664,0,www.challenges.fr,Émeutes : Elisabeth Borne réunit les groupes politiques à 17h00,"La Première ministre recevra à 17 heures à Matignon les présidents des groupes politiques à l'Assemblée et au Sénat, suite aux violences urbaines qui ont suivi la mort du jeune Nahel. Emmanuel Macron devait de son côté s'entretenir avec la présidente de l'Ass…",https://www.challenges.fr/assets/img/2023/07/03/cover-r4x3w1200-64a2d2210f073-000-33lr7yw.jpg,2023-07-03T13:50:26Z,https://web.archive.org/web/20230703205449/https://www.challenges.fr/politique/emeutes-elisabeth-borne-reunit-les-groupes-politiques-parlementaires-a-17h00_860664,"Elisabeth Borne recevra ce lundi 3 juillet à 17h00 à Matignon les représentants de l'ensemble des groupes politiques au Parlement, après six nuits de violences en France qui ont suivi la mort du jeun… [+2609 chars]",,fr,'Elisabeth Borne'
https://www.lemonde.fr/politique/article/2023/07/04/emeutes-urbaines-les-maires-au-premier-rang-des-fractures-francaises_6180403_823448.html,https://www.lemonde.fr/politique/article/2023/07/04/emeutes-urbaines-les-maires-au-premier-rang-des-fractures-francaises_6180403_823448.html,0,www.lemonde.fr,Emeutes urbaines : les maires au premier rang des fractures françaises,"Emmanuel Macron a prévu de recevoir, mardi à l’Elysée, les 220 maires qui ont subi des violences sur leur commune. Des élus qui expriment leur désarroi et leur inquiétude face aux défis multiples qu’ils doivent affronter.",https://img.lemde.fr/2023/07/03/0/0/8020/5347/1440/960/60/0/f53a535_1688414333125-344620.jpg,2023-07-04T03:45:16Z,,"Au centre, Vincent Jeanbrun, le maire (Les Républicains) de LHaÿ-les-Roses (Val-de-Marne), lors dune manifestation aux côtés dAurore Bergé, Eric Ciotti, Gérard Larcher et Valérie Pecresse, dans sa co… [+2749 chars]",,fr,'Eric Ciotti'
https://www.huffingtonpost.fr/politique/article/bruno-retailleau-accuse-de-racisme-apres-avoir-pointe-une-regression-vers-les-origines-ethniques-en-banlieues_220209.html,https://www.huffingtonpost.fr/politique/article/bruno-retailleau-accuse-de-racisme-apres-avoir-pointe-une-regression-vers-les-origines-ethniques-en-banlieues_220209.html,0,www.huffingtonpost.fr,Bruno Retailleau accusé de racisme après avoir pointé une « régression vers les origines ethniques » en banlieues,Le sénateur LR était invité sur franceinfo pour commenter les émeutes faisant suite à la mort de Nahel.,https://huffpost-focus.sirius.press/2023/07/05/0/58/1776/999/1820/1023/75/0/02bc82b_1688547063352-screenshot-2023-07-05-10-15-41.png,2023-07-05T09:07:34Z,https://web.archive.org/web/20230705093108/https://www.huffingtonpost.fr/politique/article/bruno-retailleau-accuse-de-racisme-apres-avoir-pointe-une-regression-vers-les-origines-ethniques-en-banlieues_220209.html,"POLITIQUE - Dictionnaire Larousse. Entrée « racisme ». Définition : «  Idéologie fondée sur la croyance quil existe une hiérarchie entre les groupes humains, autrefois appelés races ; comportement in… [+5151 chars]",,fr,'Bruno Retailleau'
https://www.huffingtonpost.fr/politique/video/gerald-darmanin-repond-kevin-et-matheo-a-une-senatrice-liant-les-emeutes-a-l-immigration_220247.html,https://www.huffingtonpost.fr/politique/video/gerald-darmanin-repond-kevin-et-matheo-a-une-senatrice-liant-les-emeutes-a-l-immigration_220247.html,0,www.huffingtonpost.fr,Gérald Darmanin répond « Kevin et Mathéo » à une sénatrice liant les émeutes à l’immigration,"Pour le ministre de l’Intérieur, « l’explication identitaire » utilisée par la droite et l’extrême droite au sujet des émeutes en réaction à la mort de Nahel est « très erronée ».",https://huffpost-focus.sirius.press/2023/07/05/0/0/1920/1080/1820/1023/75/0/7e925ec_1688574747968-darmanin-audition-00-06-25-14-still003.jpg,2023-07-05T16:50:41Z,https://web.archive.org/web/20230705172220/https://www.huffingtonpost.fr/politique/video/gerald-darmanin-repond-kevin-et-matheo-a-une-senatrice-liant-les-emeutes-a-l-immigration_220247.html,POLITIQUE - Cest manifestement la question qui préoccupe les sénateurs LR après les émeutes qui ont éclaté en réaction à la mort de Nahel à Nanterre. Après Bruno Retailleau qui a évoqué ce mercredi 5… [+2553 chars],,fr,'Gérald Darmanin'
https://www.lemonde.fr/politique/article/2023/07/06/entre-emmanuel-macron-et-les-banlieues-le-rendez-vous-manque_6180759_823448.html,https://www.lemonde.fr/politique/article/2023/07/06/entre-emmanuel-macron-et-les-banlieues-le-rendez-vous-manque_6180759_823448.html,0,www.lemonde.fr,"Entre Emmanuel Macron et les banlieues, le rendez-vous manqué","En 2017, le volontarisme du chef de l’Etat avait fait naître des espoirs dans les quartiers populaires. Malgré la relance de la rénovation urbaine, le rejet du plan Borloo comme son discours sur le séparatisme l’ont peu à peu coupé des habitants.",https://img.lemde.fr/2023/07/05/0/6/6750/4500/1440/960/60/0/cc0ab31_1688567054938-monge-myop-macron-marseille-6.jpg,2023-07-06T08:04:51Z,https://web.archive.org/web/20230706090335/https://www.lemonde.fr/politique/article/2023/07/06/entre-emmanuel-macron-et-les-banlieues-le-rendez-vous-manque_6180759_823448.html,"Emmanuel Macron, sur le chantier de la prison des Baumettes 3, à Marseille, le 26 juin 2023. OLIVIER MONGE/MYOP POUR « LE MONDE »
Il ny a « pas de solution miracle ». Surtout pas « avec plus dargent… [+2684 chars]",,fr,'Bruno Le Maire'
https://www.lemonde.fr/economie/article/2023/07/06/voiture-electrique-en-france-la-reponse-du-patron-de-stellantis-a-bruno-le-maire_6180773_3234.html,https://www.lemonde.fr/economie/article/2023/07/06/voiture-electrique-en-france-la-reponse-du-patron-de-stellantis-a-bruno-le-maire_6180773_3234.html,0,www.lemonde.fr,Voiture électrique en France : la réponse du patron de Stellantis à Bruno Le Maire,"Au ministre de l’économie qui lui demande de faire preuve de « patriotisme économique » en rapatriant en France la production de petites voitures électriques, le directeur général de Stellantis (Peugeot-Citroën-Fiat-Chrysler), Carlos Tavares, répond qu’on ne …",https://img.lemde.fr/2023/07/05/0/0/5776/3850/1440/960/60/0/dc6aaad_1688576049772-000-32ma4uu.jpg,2023-07-06T09:05:55Z,https://web.archive.org/web/20230706110628/https://www.lemonde.fr/economie/article/2023/07/06/voiture-electrique-en-france-la-reponse-du-patron-de-stellantis-a-bruno-le-maire_6180773_3234.html,"Carlos Tavares, directeur général de Stellantis, lors dune conférence de presse à Hordain (Nord), le 27 octobre 2022. SAMEER AL-DOUMY / AFP
Par médias interposés, Bruno Le Maire et Carlos Tavares se… [+2577 chars]",,fr,'Bruno Le Maire'
https://www.lexpress.fr/politique/pap-ndiaye-debranche-par-lelysee-segolene-royal-et-la-mechante-elisabeth-borne-HDA7B6GGZRA6HDIN7KH7JUEJ44/,https://www.lexpress.fr/politique/pap-ndiaye-debranche-par-lelysee-segolene-royal-et-la-mechante-elisabeth-borne-HDA7B6GGZRA6HDIN7KH7JUEJ44/,0,www.lexpress.fr,"Pap Ndiaye débranché par l'Elysée, Ségolène Royal et ""la méchante"" Elisabeth Borne","Pap Ndiaye débranché par l'Elysée, Ségolène Royal et ""la méchante"" Elisabeth Borne",https://www.lexpress.fr/resizer/vnb_23Py7HCweMSrHjs0zqLQVjI=/1200x630/filters:focal(1918x821:1928x831)/cloudfront-eu-central-1.images.arcpublishing.com/lexpress/K62RPTJ5KNDGZDP2F5E7YEC5DE.jpg,2023-07-06T14:48:43Z,https://web.archive.org/web/20230706155106/https://www.lexpress.fr/politique/pap-ndiaye-debranche-par-lelysee-segolene-royal-et-la-mechante-elisabeth-borne-HDA7B6GGZRA6HDIN7KH7JUEJ44/,"Que serait la politique sans ses coups déclat, ses coups bas, ses coups tordus, ses coups fourrés ? Parce que, comme dirait Edouard Philippe, ""il faut faire les choses sérieusement sans se prendre au… [+3699 chars]",,fr,'Bruno Le Maire'
https://www.marianne.net/economie/economie-francaise/pas-de-relocalisation-en-france-de-la-208-electrique-de-qui-se-moque-le-patron-de-peugeot,https://www.marianne.net/economie/economie-francaise/pas-de-relocalisation-en-france-de-la-208-electrique-de-qui-se-moque-le-patron-de-peugeot,0,www.marianne.net,Pas de relocalisation en France de la 208 électrique : de qui se moque le patron de Peugeot ?,"Après un bras de fer entre Bruno Le Maire et le patron de Stellantis Carlos Tavares autour de la nouvelle e-208, la production de la variante électrique du best-seller de Peugeot ne sera pas relocalisée en France. Ces dernières années, la marque automobile a …","https://resize.marianne.net/r/1540,924/img/var/LQ13595645C/673584/000_1101OA.jpg",2023-07-06T17:00:00Z,https://web.archive.org/web/20230706171143/https://www.marianne.net/economie/economie-francaise/pas-de-relocalisation-en-france-de-la-208-electrique-de-qui-se-moque-le-patron-de-peugeot,La nouvelle Peugeot e-208 a été officiellement dévoilée ce jeudi 6 juillet. Pas de gros changements pour cette variante 100 % électrique de la citadine commercialisée en France depuis 2019. Un style … [+5965 chars],,fr,'Bruno Le Maire'
https://www.lemonde.fr/politique/article/2023/07/06/emeutes-urbaines-la-droite-s-aventure-sur-le-terrain-identitaire-au-risque-de-la-derive_6180880_823448.html,https://www.lemonde.fr/politique/article/2023/07/06/emeutes-urbaines-la-droite-s-aventure-sur-le-terrain-identitaire-au-risque-de-la-derive_6180880_823448.html,0,www.lemonde.fr,"Emeutes urbaines : la droite s’aventure sur le terrain identitaire, au risque de la dérive","Après une surenchère de positions sécuritaires, des élus du parti Les Républicains font le lien entre l’immigration et les violences commises. Le chef de file des sénateurs, Bruno Retailleau a notamment évoqué une « régression vers les origines ethniques ».",https://img.lemde.fr/2023/07/06/3/0/5900/3933/1440/960/60/0/6642708_1688660686467-jmug230606051.jpg,2023-07-06T20:39:31Z,,"A la suite des émeutes qui ont ébranlé le pays, Les Républicains (LR) avancent leur « plan pour restaurer lordre public en France ». Et confirment que la droite en a fini avec ses complexes, sils exi… [+2672 chars]",,fr,'Bruno Retailleau'
https://www.francetvinfo.fr/replay-radio/le-brief-eco/voiture-electrique-passe-d-armes-entre-bruno-le-maire-et-carlos-tavares-pour-la-fabrication-de-la-208-electrique_5904929.html,https://www.francetvinfo.fr/replay-radio/le-brief-eco/voiture-electrique-passe-d-armes-entre-bruno-le-maire-et-carlos-tavares-pour-la-fabrication-de-la-208-electrique_5904929.html,0,www.francetvinfo.fr,Voiture électrique : passe d’armes entre Bruno Le Maire et Carlos Tavares pour la fabrication de la 208 électrique,Un débat oppose le gouvernement et le constructeur automobile Stellantis sur la fabrication de la future Peugeot 208 électrique. Le sujet est la localisation des chaînes de productions en France. Et la tension monte d’un cran,https://www.francetvinfo.fr/pictures/N6nFankzHo0GRYoiiBE6MUF1VWY/1500x843/2023/07/07/64a7a867440e3_gettyimages-1457702217-1.jpg,2023-07-07T06:47:29Z,http://archive.md/20230707131649/https://www.francetvinfo.fr/replay-radio/le-brief-eco/voiture-electrique-passe-d-armes-entre-bruno-le-maire-et-carlos-tavares-pour-la-fabrication-de-la-208-electrique_5904929.html,"C'est rare : on vient dassister à un duel à fleurets mouchetés entre deux principaux acteurs de l'industrie française. Face à face : le politique Bruno Le Maire, ministre de l'Économie, et lindustrie… [+2381 chars]",,fr,'Bruno Le Maire'
https://www.latribune.fr/economie/france/les-francais-se-preparent-deja-a-un-match-edouard-philippe-contre-marine-le-pen-en-2027-968638.html,https://www.latribune.fr/economie/france/les-francais-se-preparent-deja-a-un-match-edouard-philippe-contre-marine-le-pen-en-2027-968638.html,0,www.latribune.fr,Les Français se préparent déjà à un match Edouard Philippe contre Marine Le Pen en 2027,"Selon notre sondage Elabe pour La Tribune et CCI France, Edouard Philippe devance Marine Le Pen et Emmanuel Macron parmi les personnalités les mieux à même de recréer l'espoir en France. Mais les Français restent majoritairement sceptiques à l'égard de la cla…",https://static.latribune.fr/full_width/2196471/edouard-philippe.jpg,2023-07-07T12:30:00Z,,"Par deux fois, en 2027 et en 2022, le duel final de la présidentielle s'est joué entre Emmanuel Macron et Marine Le Pen. À en croire notre baromètre Elabe pour La Tribune et CCI France, publié à l'oc… [+4878 chars]",,fr,'Emmanuel Macron'
https://www.bfmtv.com/economie/economie-social/emeutes-bruno-le-maire-appelle-les-assureurs-a-avoir-un-comportement-exceptionnel_AD-202307070725.html,https://www.bfmtv.com/economie/economie-social/emeutes-bruno-le-maire-appelle-les-assureurs-a-avoir-un-comportement-exceptionnel_AD-202307070725.html,0,www.bfmtv.com,"Emeutes: Bruno Le Maire appelle les assureurs à avoir ""un comportement exceptionnel""","Le ministre de l'Economie a enjoint une nouvelle fois les assureurs d'indemniser ""rapidement"" et ""à la hauteur du préjudice subi"" les commerçants touchés par les récentes émeutes.",https://images.bfmtv.com/xPAynC_q7coTC-x_KYwg0_r2Yog=/0x39:768x471/768x0/images/Le-ministre-de-l-Economie-et-des-Finances-Bruno-Le-Maire-lors-d-une-conference-de-presse-a-Paris-le-19-juin-2023-1659683.jpg,2023-07-07T17:43:18Z,,"Le ministre de l'Economie a enjoint une nouvelle fois les assureurs d'indemniser ""rapidement"" et ""à la hauteur du préjudice subi"" les commerçants touchés par les récentes émeutes.
Le ministre de l'E… [+2583 chars]",,fr,'Bruno Le Maire'
https://www.20minutes.fr/economie/4044770-20230707-emeutes-bruno-maire-demande-assureurs-avoir-comportement-exceptionnel,https://www.20minutes.fr/economie/4044770-20230707-emeutes-bruno-maire-demande-assureurs-avoir-comportement-exceptionnel,0,www.20minutes.fr,Émeutes : Bruno Le Maire demande aux assureurs d’avoir « un comportement exceptionnel »,"Le ministre de l'Économie était en déplacement à Marseille ce vendredi, au chevet des commerçants touchés par les violences urbaines",https://img.20mn.fr/6ZEB4JfESeyUslOD4WRILCk/1200x768_french-minister-for-the-economy-and-finances-bruno-le-maire-r-speaks-with-a-member-of-the-public-in-the-street-during-a-visit-to-meet-with-business-owners-whose-shops-were-damaged-and-looted-during-riots-that-took-place-after-17-year-old-teenage-boy-nahel-m-was-shot-dead-by-a-police-officer-in-marseille-southeastern-france-on-july-7-2023-the-june-27-fatal-shooting-in-the-parisian-suburb-of-nanterre-sparked-successive-nights-of-rioting-in-which-cars-and-public-buildings-were-burnt-businesses-looted-and-youths-clashed-with-police-photo-by-christophe-simon-afp,2023-07-07T18:15:58Z,https://web.archive.org/web/20230708172033/https://www.20minutes.fr/economie/4044770-20230707-emeutes-bruno-maire-demande-assureurs-avoir-comportement-exceptionnel,"Au chevet des commerçants marseillais ce vendredi, le ministre de l’Economie Bruno Le Maire a appelé les assureurs à « se comporter de manière exceptionnelle », les enjoignant une nouvelle fois d’ind… [+2460 chars]",,fr,'Bruno Le Maire'
https://www.huffingtonpost.fr/politique/article/le-projet-de-loi-immigration-sera-debattu-a-l-automne-reaffirme-elisabeth-borne_220396.html,https://www.huffingtonpost.fr/politique/article/le-projet-de-loi-immigration-sera-debattu-a-l-automne-reaffirme-elisabeth-borne_220396.html,0,www.huffingtonpost.fr,"Le projet de loi immigration sera débattu à l’automne, réaffirme Élisabeth Borne","Les concertations ont été suspendues lors des émeutes après la mort de Nahel, mais le texte sera bien débattu au Parlement à la fin de l’année.",https://huffpost-focus.sirius.press/2023/07/08/99/0/4724/2657/1820/1023/75/0/b2ffb2e_1688843552713-000-33lv429.jpg,2023-07-08T19:15:02Z,https://web.archive.org/web/20230709022453/https://www.huffingtonpost.fr/politique/article/le-projet-de-loi-immigration-sera-debattu-a-l-automne-reaffirme-elisabeth-borne_220396.html,"POLITIQUE - Cette fois, cest sûr. Ou presque ? Élisabeth Borne a réaffirmé ce samedi 8 juillet dans Le Parisien lobjectif de « débattre dun texte à lautomne » sur limmigration, malgré la suspension d… [+2771 chars]",,fr,'Élisabeth Borne'
