index,url,valid,domain,title,description,image,published,archive,content,quote,language,keyword
https://www.francetvinfo.fr/culture/musique/pop/en-argentine-la-chanteuse-taylor-swift-rattrappee-par-la-politique-dans-un-contexte-electoral-pesant_6175353.html,https://www.francetvinfo.fr/culture/musique/pop/en-argentine-la-chanteuse-taylor-swift-rattrappee-par-la-politique-dans-un-contexte-electoral-pesant_6175353.html,0,www.francetvinfo.fr,"En Argentine, la chanteuse Taylor Swift rattrapée par la politique dans un contexte électoral pesant","Le premier des trois concerts de Taylor Swift à Buenos Aires, jeudi soir, a été l'occasion pour ses admiratrices argentines d'éloigner pour quelques heures ""le nuage qui pèse"" sur le pays, à dix jours d'un scrutin présidentiel très incertain.",https://www.francetvinfo.fr/pictures/2srKzhpFBPlfxnOqHi8P38cnJL0/1500x843/2023/11/10/taylorswiftgetty-1785029554-654df680e4de7909950508.jpg,2023-11-10T10:11:14Z,,"Certaines fans, venues de toute l'Amérique latine, campaient sur place depuis cinq mois, tours de garde organisés avec tableau Excel et repas livrés sur place pour avoir le privilège d'être au pied d… [+3850 chars]",,fr,'Javier Milei'
https://www.konbini.com/popculture/euuuuuuh-a24-annonce-un-film-biopic-sur-elon-musk-realise-par-darren-aronofsky-le-real-de-black-swan/,https://www.konbini.com/popculture/euuuuuuh-a24-annonce-un-film-biopic-sur-elon-musk-realise-par-darren-aronofsky-le-real-de-black-swan/,0,www.konbini.com,"Euuuuuuh : A24 annonce un film biopic sur Elon Musk réalisé par Darren Aronofsky, le réal de Black Swan","Celle-là, on ne l’avait pas vue venir. Après Paris Hilton, c’est Elon Musk qui va avoir droit à l’adaptation cinématographique de sa vie par la firme indépendante A24. Mieux encore : le biopic sera réalisé par...",https://cdn-www.konbini.com/files/2022/08/feat-elon-musk-1.jpg,2023-11-10T14:10:45Z,,"Celle-là, on ne lavait pas vue venir. Après Paris Hilton, cest Elon Musk qui va avoir droit à ladaptation cinématographique de sa vie par la firme indépendante A24. Mieux encore : le biopic sera réal… [+1430 chars]",,fr,'Paris Hilton'
https://www.voltairenet.org/article219981.html,https://www.voltairenet.org/article219981.html,0,www.voltairenet.org,Tony Blair pourrait devenir le coordinateur humanitaire à Gaza,"Selon Ynet, le cabinet de Benjamin Netanyahu est en contact avec l’ancien Premier ministre britannique, Tony Blair. Il espère que celui-ci acceptera de devenir coordinateur humanitaire pour Gaza. 
Tony Blair n’a pas encore donné sa réponse. Les discussions po…",https://www.voltairenet.org/IMG/logo/400_-_1-215.jpg?1699856335,2023-11-13T07:23:51Z,,"Selon Ynet, le cabinet de Benjamin Netanyahu est en contact avec l’ancien Premier ministre britannique, Tony Blair. Il espère que celui-ci acceptera de devenir coordinateur humanitaire pour Gaza.
To… [+749 chars]",,fr,'Premier ministre'
