index,url,valid,domain,title,description,image,published,archive,content,quote,language,keyword
https://www.begeek.fr/le-record-de-martin-scorsese-et-robert-de-niro-que-leonardo-dicaprio-ne-battra-probablement-jamais-395230,https://www.begeek.fr/le-record-de-martin-scorsese-et-robert-de-niro-que-leonardo-dicaprio-ne-battra-probablement-jamais-395230,0,www.begeek.fr,Le record de Martin Scorsese et Robert De Niro que Leonardo DiCaprio ne battra probablement jamais,"Les acteurs américains Leonardo DiCaprio et Robert De Niro sont les deux collaborateurs les plus importants du réalisateur Martin Scorsese. Cependant, il sera difficile pour la star de Killers of the Flower Moon de battre un record détenu par son partenaire.",https://www.begeek.fr/wp-content/uploads/2024/04/Martin-Scorsese-Robert-De-Niro-Leonardo-DiCaprio-cinema-.jpeg,2024-04-01T06:00:06Z,,"Les acteurs américains Leonardo DiCaprio et Robert De Niro sont les deux collaborateurs les plus importants du réalisateur Martin Scorsese. Cependant, il sera difficile pour la star de Killers of the… [+2741 chars]",,fr,'Robert de Niro'
https://dailygeekshow.com/sims-film/,https://dailygeekshow.com/sims-film/,0,dailygeekshow.com,Un film sur Les Sims est en développement avec la star de Barbie à la production,"Après le succès planétaire de Barbie, Margot Robbie et sa maison de production vont s’attaquer à l'adaptation Les Sims. 
The post Un film sur Les Sims est en développement avec la star de Barbie à la production appeared first on Daily Geek Show.",https://dailygeekshow.com/wp-content/uploads/2024/03/Une-sims-film-electronic-arts.jpg,2024-04-01T11:00:00Z,,"Après le succès planétaire de Barbie, Margot Robbie et sa maison de production vont sattaquer à un autre mastodonte, du côté des jeux vidéo cette fois-ci. 
Barbie vient sans doute de lancer une nouv… [+1009 chars]",,fr,'Margot Robbie'
https://www.france24.com/fr/info-en-continu/20240401-la-religion-cheval-de-bataille-davantage-enfourch%C3%A9-par-trump,https://www.france24.com/fr/info-en-continu/20240401-la-religion-cheval-de-bataille-davantage-enfourch%C3%A9-par-trump,0,www.france24.com,"La religion, cheval de bataille davantage enfourché par Trump","Par la voix de sa porte-parole Karoline Leavitt, le tribun républicain a exigé des ""excuses"" de Joe Biden, l'exécutif ayant reconnu le 31 mars comme ""jour de visibilité des personnes transgenres"". 

Or, cette année, le 31 mars a coïncidé avec le dimanche de P…",https://s.france24.com/media/display/35f7f550-f047-11ee-b7f2-005056bf30b7/w:1280/p:16x9/7e495fd1ca0105b9cd475194c1fdf6f6999abdc9.jpg,2024-04-01T16:45:14Z,,"Washington (AFP) Des deux principaux candidats à la Maison Blanche, seul un va à la messe le dimanche: Joe Biden, qui est catholique. Et pourtant c'est Donald Trump qui vend des bibles, se compare à … [+3479 chars]",,fr,'Joe Biden'
https://www.slate.fr/story/266309/ayahuasca-nouvelle-lubie-riches-amazonie-breuvage-hallucinogene-capitalisme-occident,https://www.slate.fr/story/266309/ayahuasca-nouvelle-lubie-riches-amazonie-breuvage-hallucinogene-capitalisme-occident,0,www.slate.fr,"L'ayahuasca, breuvage hallucinogène devenu l'opium des riches","Venu d'Amazonie, ce puissant psychotrope intéresse de nouveaux publics à la recherche de prestations confortables. Une manne financière qui concourt au développement de ce qui est devenu une véritable filière économique.",https://www.slate.fr/uploads/store/story_266309/original_266309.jpg,2024-04-02T04:45:01Z,,"«J'ai vu les serpents qui viennent vous attraper et vous conduisent à Mama Aya []. J'ai adoré», confiait la chanteuse Miley Cyrus dans une interview accordée au magazine Rolling Stone en 2021. Will S… [+8186 chars]",,fr,'Miley Cyrus'
https://www.begeek.fr/cillian-murphy-stupefait-par-sa-consommation-de-cigarettes-a-lecran-395274,https://www.begeek.fr/cillian-murphy-stupefait-par-sa-consommation-de-cigarettes-a-lecran-395274,0,www.begeek.fr,Cillian Murphy stupéfait par sa consommation de cigarettes à l’écran,"Le comédien britannique Cillian Murphy, connu pour ses rôles de grands fumeurs dans Peaky Blinders et Oppenheimer, suscite des interrogations quant à ses habitudes personnelles.",https://www.begeek.fr/wp-content/uploads/2024/04/Cillian-Murphy-consommation-cigarettes.jpeg,2024-04-02T08:00:22Z,,"Le comédien britannique Cillian Murphy, connu pour ses rôles de grands fumeurs dans Peaky Blinders et Oppenheimer, suscite des interrogations quant à ses habitudes personnelles.
Tl;dr
<ul><li>Cilli… [+2336 chars]",,fr,'Cillian Murphy'
https://www.camer.be/84937/30:27/cameroun-un-constat-simple-a-prendre-en-consideration-dans-tous-les-systemes-de-gouvernance-cameroon.html,https://www.camer.be/84937/30:27/cameroun-un-constat-simple-a-prendre-en-consideration-dans-tous-les-systemes-de-gouvernance-cameroon.html,0,www.camer.be,Cameroun :: Un Constat Simple A Prendre En Consideration Dans Tous Les Systemes De Gouvernance :: Cameroon,"Le pouvoir sans la conscience du devoir de servir honnêtement et
équitablement, construit inéluctablement la perte de son autorité
et ultimement sa destruction...",https://www.camer.be/storage/photos/shares/Cameroun/Shanda_Tonme08022024.jpg,2024-04-02T08:25:04Z,https://web.archive.org/web/20240402115332/https://www.camer.be/84937/30:27/cameroun-un-constat-simple-a-prendre-en-consideration-dans-tous-les-systemes-de-gouvernance-cameroon.html,"Le pouvoir sans la conscience du devoir de servir honnêtement et équitablement, construit inéluctablement la perte de son autorité et ultimement sa destruction certaine.
Ceux qui détiennent un pouvo… [+3871 chars]",,fr,'nan Si'
https://www.liberation.fr/societe/sante/a-saclay-lirm-le-plus-puissant-du-monde-commence-a-livrer-les-secrets-du-cerveau-20240402_MU74TH2NMJAJVKG4JCH6MI7Q3I/,https://www.liberation.fr/societe/sante/a-saclay-lirm-le-plus-puissant-du-monde-commence-a-livrer-les-secrets-du-cerveau-20240402_MU74TH2NMJAJVKG4JCH6MI7Q3I/,0,www.liberation.fr,"A Saclay, l’IRM le plus puissant du monde commence à livrer les secrets du cerveau","Salué comme une «avancée majeure et un espoir immense» par Emmanuel Macron, ce dispositif développé au CEA va permettre de mieux comprendre le fonctionnement du cerveau et de certaines maladies neurodégénératives ou psychiatriques.",https://www.liberation.fr/resizer/1iPHTt8mDX3GdOSSEFd1ReDMst4=/1200x630/filters:format(jpg):quality(70)/cloudfront-eu-central-1.images.arcpublishing.com/liberation/KYIC5E6NUZCIXDNVCP7FK23NCE.jpg,2024-04-02T15:07:58Z,,"LIRM le plus puissant du monde a livré, près de Paris, ses premières images du cerveau humain et est désormais prêt à mieux comprendre son fonctionnement et certaines maladies neurodégénératives ou p… [+4272 chars]",,fr,'Emmanuel Macron'
https://www.madmoizelle.com/dieu-est-une-femme-rencontre-avec-jack-antonoff-chanteur-de-bleachers-et-producteur-de-taylor-swift-lana-del-rey-1739419,https://www.madmoizelle.com/dieu-est-une-femme-rencontre-avec-jack-antonoff-chanteur-de-bleachers-et-producteur-de-taylor-swift-lana-del-rey-1739419,0,www.madmoizelle.com,"« Dieu est une femme » : rencontre avec Jack Antonoff, chanteur de Bleachers, et producteur de Taylor Swift, Lana Del Rey…","L’ordinaire serait-il le vrai paradis ? C’est l’une des réflexions de Jack Antonoff dans le nouvel album de son groupe Bleachers. Aujourd’hui en France, le grand public connaît plutôt cet auteur-compositeur-interprète né en 1984 pour le tube de sa précédente …",https://www.madmoizelle.com/wp-content/uploads/2024/03/jack-antonoff-margaret-qualley-dans-le-clip-de-tiny-moves-issu-du-quatrieme-album-du-groupe-bleachers.jpg,2024-04-02T16:00:00Z,,Le groupe Bleachers de Jack Antonoff a sorti son quatrième album le 8 mars et fera résoner l’Olympia de ses mélodies pop rock lumineuses et thérapeutiques le 2 septembre. L’occasion d’interviewer cet… [+17595 chars],,fr,'Lana Del Rey'
https://www.huffingtonpost.fr/politique/article/assemblee-gabriel-attal-va-confirmer-sa-strategie-de-l-omnipresence-avec-les-qag-nouvelle-formule_232053.html,https://www.huffingtonpost.fr/politique/article/assemblee-gabriel-attal-va-confirmer-sa-strategie-de-l-omnipresence-avec-les-qag-nouvelle-formule_232053.html,0,www.huffingtonpost.fr,Assemblée : Gabriel Attal va confirmer sa stratégie de l’omniprésence avec les « QAG » nouvelle formule,"Le Premier ministre va se prêter à un exercice inédit à l’Assemblée : un face-à-face de 45 minutes avec les députés. Ceci, toutes les semaines jusqu’à fin mai.",https://huffpost-focus.sirius.press/2024/04/02/53/0/1024/576/1820/1023/75/0/b1b2408_1712071349374-000-34hp8wa.jpg,2024-04-03T04:00:14Z,,"POLITIQUE - Seul en scène. Gabriel Attal va se présenter sans ses ministres, ce mercredi 3 avril, pour répondre aux traditionnelles « questions au gouvernement » à lAssemblée nationale. Le locataire … [+4774 chars]",,fr,'Premier ministre'
https://www.lexpress.fr/politique/deficit-public-comment-attal-tente-de-composer-avec-une-majorite-divisee-MD2BWUXMPRHV7B5CCSVKQFDVP4/,https://www.lexpress.fr/politique/deficit-public-comment-attal-tente-de-composer-avec-une-majorite-divisee-MD2BWUXMPRHV7B5CCSVKQFDVP4/,0,www.lexpress.fr,Déficit public : comment Attal tente de composer avec une majorité divisée,"Gabriel Attal promet des propositions ""d’ici juin"" pour taxer les ""rentes"", dans l’espoir de calmer une partie de sa majorité, mais reste inflexible sur la hausse des impôts.",https://www.lexpress.fr/resizer/_ZBR2XMuUvbtvhvGoti7PN8fiIY=/1200x630/cloudfront-eu-central-1.images.arcpublishing.com/lexpress/CN4DQ3QDLZGJZN7FPVSEZFZ2D4.jpg,2024-04-03T05:48:00Z,,Un peu deau sur un début dincendie. Gabriel Attal nest pas venu les mains vides ce mardi 2 avril à la réunion hebdomadaire des députés Renaissance. Le Premier ministre a annoncé devant les siens le l… [+3565 chars],,fr,'François Bayrou'
https://www.francetvinfo.fr/replay-radio/le-brief-politique/mayotte-la-suppression-du-droit-du-sol-ne-fait-pas-l-unanimite-au-sein-de-la-majorite-presidentielle_6434572.html,https://www.francetvinfo.fr/replay-radio/le-brief-politique/mayotte-la-suppression-du-droit-du-sol-ne-fait-pas-l-unanimite-au-sein-de-la-majorite-presidentielle_6434572.html,0,www.francetvinfo.fr,Mayotte : la suppression du droit du sol ne fait pas l'unanimité au sein de la majorité présidentielle,"La ministre des Outre-mer, Marie Guévenoux, retourne à Mayotte mercredi et jeudi, pour la troisième fois en moins de deux mois. Au menu des discussions sur place : la suppression du droit du sol. Cette proposition ne fait pas l'unanimité dans la majorité.",https://www.francetvinfo.fr/pictures/rnfaQ9zjM0PP4iFyaHxz9pktASo/1500x843/2024/04/03/maxnewsspecial830102-660cf7604fe43305139625.jpg,2024-04-03T07:24:24Z,,"À Mayotte, face à l'afflux de migrants, la révision de la Constitution pour supprimer le droit du sol est globalement attendue par la population, et même réclamée par les élus. La ministre des Outre-… [+2097 chars]",,fr,'François Bayrou'
https://www.bfmtv.com/politique/front-national/affaire-des-assistants-d-eurodeputes-aliot-denonce-un-acharnement-judiciaire-avant-le-proces-des-cadres-du-rn_AV-202404030303.html,https://www.bfmtv.com/politique/front-national/affaire-des-assistants-d-eurodeputes-aliot-denonce-un-acharnement-judiciaire-avant-le-proces-des-cadres-du-rn_AV-202404030303.html,0,www.bfmtv.com,"Affaire des assistants d'eurodéputés: Aliot dénonce ""un acharnement judiciaire"" avant le procès des cadres du RN","À quelques mois du procès qui l'attend aux côtés de Marine Le Pen et 25 autres personnes, le maire RN de Perpignan revient sur les soupçons qui pèsent sur son parti concernant la mise en place d'un système d'assistants d'eurodéputés travaillant en réalité pou…",https://images.bfmtv.com/8DDNyN1FcID0BBorjmYzpMG_Z4A=/0x0:1920x1080/1920x0/images/Le-maire-RN-de-Perpignan-Louis-Aliot-le-3-avril-2024-1837070.jpg,2024-04-03T07:47:54Z,,"À quelques mois du procès qui l'attend aux côtés de Marine Le Pen et 25 autres personnes, le maire RN de Perpignan revient sur les soupçons qui pèsent sur son parti concernant la mise en place d'un s… [+3078 chars]",,fr,'Marine Le Pen'
https://www.konbini.com/opinions/apres-le-drama-autour-de-dua-lipa-qui-refuse-des-selfies-il-est-bon-de-rappeler-que-les-stars-ne-nous-appartiennent-pas/,https://www.konbini.com/opinions/apres-le-drama-autour-de-dua-lipa-qui-refuse-des-selfies-il-est-bon-de-rappeler-que-les-stars-ne-nous-appartiennent-pas/,0,www.konbini.com,"Après le “drama” autour de Dua Lipa qui “refuse des selfies”, il est bon de rappeler que les stars ne nous appartiennent pas","Les images, plus ou moins violentes, ont fait le tour des feeds TikTok et X/Twitter. Dua Lipa était récemment à Paris, non pas pour un clip ou un concert, mais pour des événements pour la...",https://cdn-www.konbini.com/files/2024/02/dualipa_trainingseason.png,2024-04-03T13:06:45Z,,"Les images, plus ou moins violentes, ont fait le tour des feeds TikTok et X/Twitter. Dua Lipa était récemment à Paris, non pas pour un clip ou un concert, mais pour des événements pour la marque Yves… [+3679 chars]",,fr,'Dua Lipa'
https://www.lepoint.fr/economie/taxation-des-rentes-gabriel-attal-joue-les-equilibristes-03-04-2024-2556777_28.php,https://www.lepoint.fr/economie/taxation-des-rentes-gabriel-attal-joue-les-equilibristes-03-04-2024-2556777_28.php,0,www.lepoint.fr,Taxation des « rentes » : à quoi pense Gabriel Attal ?,"Le Premier ministre entend rassurer l'aile gauche de la majorite defavorable a la reforme de l'assurance-chomage, sans augmenter les impots.",https://static.lpnt.fr/images/2024/04/03/26340030lpw-26340590-mega-une-jpg_10223140.jpg,2024-04-03T16:38:00Z,https://web.archive.org/web/20240403180742/https://www.lepoint.fr/economie/taxation-des-rentes-gabriel-attal-joue-les-equilibristes-03-04-2024-2556777_28.php,"Une mission spéciale pour taxer les « rentes ». Face à l'ampleur du déficit public, le gouvernement a annoncé mardi le lancement d'une « mission » confiée à Jean-René Cazeneuve, rapporteur du budget.… [+3314 chars]",,fr,'Gabriel Attal'
https://www.20minutes.fr/arts-stars/people/4084721-20240403-cillian-murphy-joue-egeries-meghan-markle-lit-enfants-malades,https://www.20minutes.fr/arts-stars/people/4084721-20240403-cillian-murphy-joue-egeries-meghan-markle-lit-enfants-malades,0,www.20minutes.fr,Cillian Murphy joue les égéries… Meghan Markle lit pour les enfants malades…,Toute l’actualité people est dans « 20 Minutes »,https://img.20mn.fr/U67oI-MAR0qswAG8Ir6eZCk/1444x920_celebrities-spotted-at-the-jimmy-kimmel-live-featuring-cillian-murphy-where-los-angeles-california-united-states-when-22-feb-2024-credit-bauer-griffin-insta-rimages,2024-04-03T16:59:37Z,,"3 avril 2024
Isabelle Huppert sattendait à « plus » de huées à la fin de sa prestation au théâtre
Isabelle Huppert na pas fait lunanimité auprès de la critique et du public avec son interprétation … [+1448 chars]",,fr,'Cillian Murphy'
https://www.francetvinfo.fr/replay-radio/l-edito-politique/edito-edouard-philippe-vise-par-une-enquete-du-parquet-national-financier-premiere-difficulte-dans-la-course-a-la-presidentielle_6436708.html,https://www.francetvinfo.fr/replay-radio/l-edito-politique/edito-edouard-philippe-vise-par-une-enquete-du-parquet-national-financier-premiere-difficulte-dans-la-course-a-la-presidentielle_6436708.html,0,www.francetvinfo.fr,ÉDITO. Édouard Philippe visé par une enquête du Parquet national financier : première difficulté dans la course à la présidentielle ?,Le parquet national financier (PNF) a ouvert une enquête préliminaire visant notamment Édouard Philippe après le dépôt d'une plainte de l'ancienne directrice générale adjointe de la communauté urbaine du Havre.,https://www.francetvinfo.fr/pictures/7-yuVJKPBk_pEAuH80VPSpmEYQk/1500x843/2024/04/04/edouardphilippe2-660e30e4d4470057737447.jpg,2024-04-04T04:54:54Z,,Une perquisition a eu lieu mercredi 3 avril dans les locaux de la mairie et de la communauté urbaine du Havre présidées par Édouard Philippe. Une initiative qui intervient dans le cadre dune enquête … [+2864 chars],,fr,'François Bayrou'
https://www.nouvelobs.com/opinions/20240404.OBS86663/le-haut-commissariat-au-plan-est-il-assujetti-aux-ambitions-personnelles-de-francois-bayrou.html,https://www.nouvelobs.com/opinions/20240404.OBS86663/le-haut-commissariat-au-plan-est-il-assujetti-aux-ambitions-personnelles-de-francois-bayrou.html,0,www.nouvelobs.com,Le haut-commissariat au Plan est-il assujetti aux ambitions personnelles de François Bayrou ?,"La déception que soulève le bilan du haut-commissariat est d’autant plus aiguë que l’enjeu de planification a rarement été aussi névralgique qu’en cette époque des ruptures, des chaos et de l’invisibilité permanents, défend Denis Lafay.",https://focus.nouvelobs.com/2024/04/04/0/0/5962/3974/1200/800/0/0/ea8ca11_1712217091919-080-hl-xbouzas-2079556.jpg,2024-04-04T10:30:09Z,,"La déception que soulève le bilan du haut-commissariat est dautant plus aiguë que lenjeu de planification a rarement été aussi névralgique quen cette époque des ruptures, des chaos et de linvisibilit… [+9346 chars]",,fr,'François Bayrou'
https://www.marianne.net/politique/questions-attendues-et-com-a-gogo-a-lassemblee-le-flop-du-attal-show,https://www.marianne.net/politique/questions-attendues-et-com-a-gogo-a-lassemblee-le-flop-du-attal-show,0,www.marianne.net,"Questions attendues et com’ à gogo : à l’Assemblée le flop du ""Attal show""","Pour la première fois, Gabriel Attal a répondu seul ce 3 avril pendant 45 minutes aux interpellations des députés. Loin de revivifier les traditionnelles « questions au gouvernement », le format n’a pas bouleversé les grosses ficelles de ces séances.","https://resize.marianne.net/r/1540,924/img/var/ceihpziBWJ/asxMZcQ0zgCsyc8eO/asxMZcQ0zgCsyc8eO.jpg",2024-04-04T13:52:05Z,,"C'est un vieil exercice, né sous Valéry Giscard d'Estaing, désormais en perte de vitesse. Longtemps au centre de lattention politique, les « questions au gouvernement » organisées à l'Assemblée et au… [+6433 chars]",,fr,'Élisabeth Borne'
https://www.liberation.fr/environnement/climat/le-haut-conseil-pour-le-climat-rappelle-gabriel-attal-a-lordre-sur-un-risque-de-recul-de-lambition-de-la-politique-climatique-20240404_U4NPHFT7JFEPVN4IAWTCGPVBDE/,https://www.liberation.fr/environnement/climat/le-haut-conseil-pour-le-climat-rappelle-gabriel-attal-a-lordre-sur-un-risque-de-recul-de-lambition-de-la-politique-climatique-20240404_U4NPHFT7JFEPVN4IAWTCGPVBDE/,0,www.liberation.fr,Le Haut Conseil pour le climat rappelle Gabriel Attal à l’ordre sur un «risque de recul de l’ambition de la politique climatique»,"Fait rare, l’organisme indépendant publie ce jeudi une lettre très critique adressée au Premier ministre pour «attirer son attention sur le niveau d’urgence actuel». Et il «invite le gouvernement à réaffirmer la politique climatique de la France avec une traj…",https://www.liberation.fr/resizer/VXaAuwHGVAEejaUiuFoFY1I6dls=/1200x630/filters:format(jpg):quality(70):focal(2915x1975:2925x1985)/cloudfront-eu-central-1.images.arcpublishing.com/liberation/3UWU7JCR2VE7TPPUOBLYKGBKOQ.jpg,2024-04-04T13:52:45Z,,"Dhabitude, le Haut Conseil pour le climat (HCC) attend la publication de ses rapports annuels ou thématiques pour pointer le hiatus existant entre laggravation de la crise climatique et linsuffisance… [+3068 chars]",,fr,'Emmanuel Macron'
https://www.fark.com/comments/13209732/Mike-Johnson-is-revolting,https://www.fark.com/comments/13209732/Mike-Johnson-is-revolting,0,www.fark.com,Mike Johnson is revolting [Obvious],<table> <tr><td> </td><td> [link] [11 comments] </td></tr></table>,https://usrimg-full.fark.net/A/Aw/fark_AwskXP_kvOVoPwTvbjyyqqbtmqE.jpg?AWSAccessKeyId=JO3ELGV4BGLFW7Y3EZXN&Expires=1712548800&Signature=qk83AAgfALsJZFWmxIDlEQC3ZWY%3D,2024-04-04T14:03:50Z,,"Here's the thing...These Republican psychos are aligned on like 80-90% of everything. That last 10-20% is either Trump-related or completely bonkers stuff.
The MAGA ones are all about ""100% PURE!"" w… [+259 chars]",,fr,'Mike Johnson'
https://www.liberation.fr/sports/jeux-olympiques/jai-glisse-chef-la-chute-memorable-du-plongeur-alexis-jandard-devant-macron-et-oudea-castera-20240404_ZMQ2DB7SIRFT3P4V67ATQP32JA/,https://www.liberation.fr/sports/jeux-olympiques/jai-glisse-chef-la-chute-memorable-du-plongeur-alexis-jandard-devant-macron-et-oudea-castera-20240404_ZMQ2DB7SIRFT3P4V67ATQP32JA/,0,www.liberation.fr,«J’ai glissé chef» : la chute mémorable du plongeur Alexis Jandard devant Macron et Oudéa-Castéra,"Lors d’une démonstration pour l’inauguration du nouveau bassin olympique en Seine-saint-Denis, le vice-champion du monde français s’est offert une chute mémorable, sous les yeux du président de la République.",https://www.liberation.fr/resizer/GKlwInrkMDsuA5gv_64K868TSjo=/1200x630/filters:format(jpg):quality(70)/cloudfront-eu-central-1.images.arcpublishing.com/liberation/GDFJJ4U3RJELJPMIJHUSGDDTVA.jpg,2024-04-04T15:18:57Z,,"Médaille dor de la plus belle chute. Ce jeudi 4 avril, à loccasion de linauguration du Centre aquatique olympique qui doit accueillir les épreuves de water-polo et de natation synchronisée aux procha… [+1588 chars]",,fr,'président de la République'
https://www.lemonde.fr/international/article/2024/04/04/guerre-israel-hamas-joe-biden-previent-benyamin-netanyahou-que-la-politique-americaine-a-l-egard-de-gaza-sera-determinee-par-les-mesures-concretes-d-israel-pour-proteger-les-civils-palestiniens_6226010_3210.html,https://www.lemonde.fr/international/article/2024/04/04/guerre-israel-hamas-joe-biden-previent-benyamin-netanyahou-que-la-politique-americaine-a-l-egard-de-gaza-sera-determinee-par-les-mesures-concretes-d-israel-pour-proteger-les-civils-palestiniens_6226010_3210.html,0,www.lemonde.fr,Guerre Israël-Hamas : Joe Biden prévient Benyamin Nétanyahou que la politique américaine à l’égard de Gaza sera déterminée par les « mesures concrètes » d’Israël pour protéger les civils palestiniens,"L’appel téléphonique, jeudi, entre les deux dirigeants s’inscrit dans un contexte de « mécontentement croissant » de Washington face à son allié, selon un porte-parole de la Maison Blanche.",https://img.lemde.fr/2024/04/03/1/0/2752/1834/1440/960/60/0/92fde5b_2024-04-03t190250z-1731419878-rc25z6an0z7f-rtrmadp-3-usa-biden.JPG,2024-04-04T18:57:43Z,http://archive.md/20240405072545/https://www.lemonde.fr/international/article/2024/04/04/guerre-israel-hamas-joe-biden-previent-benyamin-netanyahou-que-la-politique-americaine-a-l-egard-de-gaza-sera-determinee-par-les-mesures-concretes-d-israel-pour-proteger-les-civils-palestiniens_6226010_3210.html,"Joe Biden à Washington le 3 avril. EVELYN HOCKSTEIN / REUTERS
Au cours dun entretien téléphonique avec Benyamin Nétanyahou le premier depuis le 18 mars , le président américain a laissé entendre, po… [+2698 chars]",,fr,'Jill Biden'
https://atlantico.fr/article/decryptage/dans-les-coulisses-de-la-redoutable-machine-trump-andre-kaspi,https://atlantico.fr/article/decryptage/dans-les-coulisses-de-la-redoutable-machine-trump-andre-kaspi,0,atlantico.fr,Dans les coulisses de la redoutable machine Trump,"Le premier mandat de Donald Trump était brouillon, un second pourrait l’être beaucoup moins tant il s’appuie désormais sur une équipe structurée.",https://atlantico-media.s3.eu-west-3.amazonaws.com/AFP_20240404_2133986117_v4_High_Res_Donald_Trump_Holds_Presidential_Campaign_Rally_In_G_487db28eaf.jpg,2024-04-05T06:52:42Z,,"Atlantico : Donald Trump apparaît en passe d'être réélu. Pour autant, la situation politique diffère de 2016, du fait notamment de différents rapports de force interne au parti des Républicains et ai… [+7833 chars]",,fr,'Jared Kushner'
https://www.lemonde.fr/idees/article/2024/04/05/intelligence-artificielle-sam-altman-va-t-il-reussir-a-maintenir-le-cap-de-la-double-mission-d-openai_6226140_3232.html,https://www.lemonde.fr/idees/article/2024/04/05/intelligence-artificielle-sam-altman-va-t-il-reussir-a-maintenir-le-cap-de-la-double-mission-d-openai_6226140_3232.html,0,www.lemonde.fr,Intelligence artificielle : « Sam Altman va-t-il réussir à maintenir le cap de la double mission d’OpenAI ? »,"Les chercheuses en gestion Julie Battilana et Anne-Claire Pache décrivent, dans une tribune au « Monde », la cohabitation difficile entre mission d’intérêt général et objectif commercial de l’éditeur de ChatGPT.",https://img.lemde.fr/2023/09/15/2/0/5000/3333/1440/960/60/0/a561cd1_1694781892655-pns-6528943.jpg,2024-04-05T12:00:06Z,,"Sam Altman, exclu dOpenAI en novembre 2023, a fait un retour remarqué au conseil dadministration de la société, vendredi 8 mars. Un nouvel épisode des luttes de pouvoir au sein de la high-tech améric… [+2917 chars]",,fr,'Sam Altman'
