index,url,valid,domain,title,description,image,published,archive,content,quote,language,keyword
https://www.bfmtv.com/international/amerique-nord/etats-unis/elections-americaines/election-americaine-l-ancien-president-jimmy-carter-100-ans-a-vote-pour-kamala-harris_AD-202410170273.html,https://www.bfmtv.com/international/amerique-nord/etats-unis/elections-americaines/election-americaine-l-ancien-president-jimmy-carter-100-ans-a-vote-pour-kamala-harris_AD-202410170273.html,0,www.bfmtv.com,"Élection américaine: l'ancien président Jimmy Carter, 100 ans, a voté pour Kamala Harris","Jimmy Carter, âgé de 100 ans depuis le 1er octobre dernier, a apporté son soutien à la candidate démocrate dans la course à la Maison Blanche.",https://images.bfmtv.com/ae2og2bMIskLNe7s4FVo9JuV6GQ=/3x222:2035x1365/2032x0/images/Jimmy-Carter-ancien-president-des-Etats-Unis-1958162.jpg,2024-10-17T07:06:32Z,,"Jimmy Carter, âgé de 100 ans depuis le 1er octobre dernier, a apporté son soutien à la candidate démocrate dans la course à la Maison Blanche.
Il avait exprimé son vu de vivre assez longtemps pour a… [+1192 chars]",,fr,'Jimmy Carter'
https://www.bfmtv.com/politique/front-national/un-vent-nouveau-qui-souffle-le-pen-juge-que-des-pays-europeens-entendent-ce-que-dit-le-rn-sur-l-immigration_AD-202410170424.html,https://www.bfmtv.com/politique/front-national/un-vent-nouveau-qui-souffle-le-pen-juge-que-des-pays-europeens-entendent-ce-que-dit-le-rn-sur-l-immigration_AD-202410170424.html,0,www.bfmtv.com,"""Un vent nouveau qui souffle"": Le Pen juge que des pays européens ""entendent ce que dit"" le RN sur l'immigration","La cheffe de file de l'extrême droite française Marine Le Pen a dit jeudi à Bruxelles douter de la volonté de l'UE de muscler sa politique migratoire, tout en saluant les évolutions sur ce sujet de certains États et dirigeants du bloc.",https://images.bfmtv.com/eRFfPSOgXWQUPfyk7UO_Nb2d4R8=/0x106:2048x1258/2048x0/images/Marine-Le-Pen-a-Bruxelles-le-17-octobre-2024-1958313.jpg,2024-10-17T09:44:51Z,,"La cheffe de file de l'extrême droite française Marine Le Pen a dit jeudi à Bruxelles douter de la volonté de l'UE de muscler sa politique migratoire, tout en saluant les évolutions sur ce sujet de c… [+2585 chars]",,fr,'Matteo Salvini'
https://rmcsport.bfmtv.com/football/le-classement-des-footballeurs-les-mieux-payes-en-2024-avec-mbappe-en-cinquieme-position_AV-202410170450.html,https://rmcsport.bfmtv.com/football/le-classement-des-footballeurs-les-mieux-payes-en-2024-avec-mbappe-en-cinquieme-position_AV-202410170450.html,0,rmcsport.bfmtv.com,"Le classement des footballeurs les mieux payés en 2024, avec Mbappé dans le top 5","Le magazine Forbes a publié ce jeudi son Top 10 des footballeurs les mieux payés de l’année 2024. Après son départ au Real Madrid, Kylian Mbappé n’est pas le Français le mieux rémunéré alors que Cristiano Ronaldo trône toujours au sommet mondial depuis son ex…",https://images.bfmtv.com/iDat_eyKuqEIl2sxBr8zMtIKgS0=/0x11:2048x1163/images/Cristiano-Ronaldo-lors-d-un-match-du-Portugal-en-Ligue-des-nations-le-15-octobre-2024-1958304.jpg,2024-10-17T10:11:24Z,,"Le magazine Forbes a publié ce jeudi son Top 10 des footballeurs les mieux payés de lannée 2024. Après son départ au Real Madrid, Kylian Mbappé nest pas le Français le mieux rémunéré alors que Cristi… [+2777 chars]",,fr,'Cristiano Ronaldo'
https://www.lemonde.fr/international/live/2024/10/17/en-direct-presidentielle-americaine-les-dernieres-informations-sur-donald-trump-et-kamala-harris-et-les-reponses-a-toutes-vos-questions_6351439_3210.html,https://www.lemonde.fr/international/live/2024/10/17/en-direct-presidentielle-americaine-les-dernieres-informations-sur-donald-trump-et-kamala-harris-et-les-reponses-a-toutes-vos-questions_6351439_3210.html,0,www.lemonde.fr,"En direct, présidentielle américaine : les dernières informations sur Donald Trump et Kamala Harris et les réponses à toutes vos questions","Dans une interview tendue sur Fox News, la candidate démocrate a pris ses distances avec l’administration Biden. Le républicain a participé à une séance de questions-réponses pour s’adresser à l’électorat latino, reprenant sa rhétorique anti-immigrés.",https://img.lemde.fr/2024/09/13/250/0/3000/1500/1440/720/60/0/52131fa_1726220318255-us-2024-trump-harris-afp.jpg,2024-10-17T11:00:26Z,,"« LE MONDE » DAPRèS AFP
Kamala Harris se concentre sur le « Blue Wall » démocrate La candidate continue, jeudi, de sillonner les trois Etats dits du « Blue Wall », indispensables à sa victoire le 5 … [+2168 chars]",,fr,'Tim Cook'
https://www.dhnet.be/actu/monde/2024/10/17/cest-la-premiere-etape-vers-une-guerre-mondiale-zelensky-affirme-que-10000-nord-coreens-se-preparent-a-combattre-aux-cotes-de-la-russie-4AJRW3O3GJCEXPHHSPN2THFDN4/,https://www.dhnet.be/actu/monde/2024/10/17/cest-la-premiere-etape-vers-une-guerre-mondiale-zelensky-affirme-que-10000-nord-coreens-se-preparent-a-combattre-aux-cotes-de-la-russie-4AJRW3O3GJCEXPHHSPN2THFDN4/,0,www.dhnet.be,"""C'est la première étape vers une guerre mondiale"" : Zelensky affirme que 10.000 Nord-coréens se préparent à combattre aux côtés de la Russie",Le président ukrainien Volodymyr Zelensky a affirmé jeudi à Bruxelles que 10.000 soldats nord-coréens se préparaient à combattre l'armée ukrainienne aux côtés des forces russes. ...,https://www.dhnet.be/resizer/v2/6QKSVI5PMBEDZH6XS2WYQWW3UA.jpg?auth=1a95bc6553f62bde662170d3d127f67fd64566af33d34ef66ae48b6da47d0ca2&width=1200&height=630&quality=85&focal=2996%2C1998&watermark=https%3A%2F%2Fcloudfront-eu-central-1.images.arcpublishing.com%2Fipmgroup%2FDZNGDE46VVGXRGHD3TEI5RB3GM.png%3A100%3A0%2C559,2024-10-17T15:47:11Z,,"Selon le chef de l'Etat ukrainien, Vladimir Poutine ""tente d'impliquer"" d'autres parties ""dans cette guerre"" en raison des ""lourdes pertes"" subies par l'armée russe et parce qu'il a ""peur d'une mobil… [+2413 chars]",,fr,'Kim Jong-un'
https://www.ledauphine.com/defense-guerre-conflit/2024/10/17/selon-zelensky-10-000-nord-coreens-vont-combattre-aux-cotes-de-la-russie,https://www.ledauphine.com/defense-guerre-conflit/2024/10/17/selon-zelensky-10-000-nord-coreens-vont-combattre-aux-cotes-de-la-russie,0,www.ledauphine.com,"Guerre en Ukraine. Selon Zelensky, 10 000 Nord-coréens vont combattre aux côtés de la Russie","Poutine « tente d'impliquer » d'autres parties « dans cette guerre », a affirmé le président ukrainien ce jeudi lors d'un sommet européen à Bruxelles.",https://cdn-s-www.ledauphine.com/images/01275F30-3B4A-4017-94BB-E26C76DC2A7F/FB1200/photo-1729180748.jpg,2024-10-17T15:59:00Z,,"Le président ukrainien Volodymyr Zelensky a affirmé ce jeudi à Bruxelles que 10 000 soldats nord-coréens se préparaient à combattre l'armée ukrainienne aux côtés des forces russes.
« Première étape … [+2703 chars]",,fr,'Poutine'
https://www.lexpress.fr/monde/loccident-a-de-quoi-sinquieter-le-rapprochement-chine-russie-vu-par-un-ex-conseiller-a-la-maison-OM4DIIYIFZFXVC33AGUQGU2GZ4/,https://www.lexpress.fr/monde/loccident-a-de-quoi-sinquieter-le-rapprochement-chine-russie-vu-par-un-ex-conseiller-a-la-maison-OM4DIIYIFZFXVC33AGUQGU2GZ4/,0,www.lexpress.fr,"""L’Occident a de quoi s’inquiéter"" : le rapprochement Chine-Russie vu par un ex-conseiller à la Maison-Blanche","Pour Ryan Hass, le rapprochement entre Pékin et Moscou, et celui entre Kim Jong-un et Poutine sont des motifs de préoccupation.",https://www.lexpress.fr/resizer/v2/AXTKNKOG7BGFXHOOCIIHII6LAM.jpg?auth=a1c13c6a2f60ae3ee2ca9b25dd5a4a9dceb8c4388229240b7bbd01500fff0664&width=1200&height=630&quality=85&focal=3504%2C1791,2024-10-17T18:00:00Z,http://archive.md/20241017191138/https://www.lexpress.fr/monde/loccident-a-de-quoi-sinquieter-le-rapprochement-chine-russie-vu-par-un-ex-conseiller-a-la-maison-OM4DIIYIFZFXVC33AGUQGU2GZ4/,"Ancien conseiller du président Barack Obama sur la Chine et Taïwan, de 2013 à 2017, Ryan Hass est lun des meilleurs experts américains des questions géopolitiques asiatiques. Alors que les Etats-Unis… [+16843 chars]",,fr,'Kim Jong-un'
https://www.macg.co/ailleurs/2024/10/x-la-commission-europeenne-pourrait-infliger-une-amende-portant-sur-toutes-les-proprietes-de-musk-146621,https://www.macg.co/ailleurs/2024/10/x-la-commission-europeenne-pourrait-infliger-une-amende-portant-sur-toutes-les-proprietes-de-musk-146621,0,www.macg.co,"X, la commission européenne pourrait infliger une amende portant sur toutes les propriétés de Musk","Alors que Donald Trump a récemment fait part d’un appel durant lequel Tim Cook se serait plaint des instances européennes, un autre acteur de la technologie pourrait bientôt venir pleurer sur l’épaule du candidat républicain.

Il va falloir se cacher mieux qu…",https://cdn.mgig.fr/2024/10/mga-b584f6f7-w375-w1500-w750_accroche.jpg,2024-10-17T19:00:00Z,,"Alors que Donald Trump a récemment fait part dun appel durant lequel Tim Cook se serait plaint des instances européennes, un autre acteur de la technologie pourrait bientôt venir pleurer sur lépaule … [+2624 chars]",,fr,'Donald Trump'
https://www.lepoint.fr/monde/l-italie-de-giorgia-meloni-fait-de-la-gpa-un-crime-universel-18-10-2024-2573026_24.php,https://www.lepoint.fr/monde/l-italie-de-giorgia-meloni-fait-de-la-gpa-un-crime-universel-18-10-2024-2573026_24.php,0,www.lepoint.fr,L’Italie de Giorgia Meloni fait de la GPA un « crime universel »,Jusqu'a deux ans de prison et un million d'euros d'amende : c'est ce que risquent les Italiens se rendant a l'etranger pour une gestation pour autrui. Une pratique interdite depuis vingt ans dans le pays.,https://static.lpnt.fr/images/2024/10/18/26932372lpw-26932483-mega-une-jpg_10589382.jpg,2024-10-18T04:10:00Z,,"En campagne électorale, la candidate Giorgia Meloni avait juré de combattre sans relâche la gestation pour autrui. Deux ans après, la présidente du Conseil peut enfin exulter : en Italie, la GPA est … [+5305 chars]",,fr,'Matteo Salvini'
https://www.lemonde.fr/idees/article/2024/10/18/le-jardin-et-la-jungle-edwy-plenel-s-attaque-a-l-hypocrisie-de-la-diplomatie-europeenne_6354875_3232.html,https://www.lemonde.fr/idees/article/2024/10/18/le-jardin-et-la-jungle-edwy-plenel-s-attaque-a-l-hypocrisie-de-la-diplomatie-europeenne_6354875_3232.html,0,www.lemonde.fr,« Le Jardin et la jungle » : Edwy Plenel s’attaque à l’hypocrisie de la diplomatie européenne,"Le journaliste tire un bilan du mandat du haut représentant de l’UE, Josep Borrell, incarnation, selon lui, d’une Europe encore empreinte de son passé colonial et adepte du double discours concernant les conflits au Proche-Orient ou en Ukraine.",https://img.lemde.fr/2024/10/17/264/0/800/533/1440/960/60/0/f2fbfee_1729162689408-9782348083242.jpg,2024-10-18T06:00:08Z,http://archive.md/20241022102227/https://www.lemonde.fr/idees/article/2024/10/18/le-jardin-et-la-jungle-edwy-plenel-s-attaque-a-l-hypocrisie-de-la-diplomatie-europeenne_6354875_3232.html,"Livre. Il ne fallait pas, Josep Borrell, monsieur le (bientôt ex-)haut représentant de lUnion européenne (UE) pour les affaires étrangères et la politique de sécurité, lui offrir ce bâton si vous ne … [+2633 chars]",,fr,'nan nan'
https://www.generation-nt.com/actualites/donald-trump-tim-cook-apple-europe-amendes-2051709,https://www.generation-nt.com/actualites/donald-trump-tim-cook-apple-europe-amendes-2051709,0,www.generation-nt.com,Donald Trump dit que Tim Cook l'a appelé pour se plaindre de l'UE,"Selon le candidat Donald Trump à la présidentielle américaine, le patron d'Apple l'a appelé pour pester contre les amendes infligées par l'Union européenne.",https://img.generation-nt.com/donald-trump-podcast-pbd-youtube_04B002A301701132.webp,2024-10-18T08:40:01Z,,"Ancien président des États-Unis et candidat républicain à la présidentielle américaine 2024, Donald Trump a été longuement interrogé sur le podcast PBD Podcast de l'entrepreneur Patrick Bet-David. Il… [+2406 chars]",,fr,'Donald Trump'
https://fr.sputniknews.africa/20241018/principales-declarations-de-vladimir-poutine-sur-la-croissance-economique-des-brics-1068746731.html,https://fr.sputniknews.africa/20241018/principales-declarations-de-vladimir-poutine-sur-la-croissance-economique-des-brics-1068746731.html,0,fr.sputniknews.africa,Principales déclarations de Vladimir Poutine sur la croissance économique des BRICS,"Vladimir Poutine a pris part ce 18 octobre à la session plénière du forum d’affaires des BRICS. Dans son intervention, le dirigeant russe a évoqué la croissance économique du bloc.",https://cdn1.img.sputniknews.africa/images/sharing/article/fra/1068746731.jpg?10687463421729243948,2024-10-18T09:32:27Z,,"https://fr.sputniknews.africa/20241018/principales-declarations-de-vladimir-poutine-sur-la-croissance-economique-des-brics-1068746731.html
Principales déclarations de Vladimir Poutine sur la croissa… [+2098 chars]",,fr,'Poutine'
https://www.marianne.net/culture/je-n-y-retournerai-que-si-poutine-meurt-deux-artistes-russes-refugiees-en-bretagne-retrouvent-la-vie-et-l-art,https://www.marianne.net/culture/je-n-y-retournerai-que-si-poutine-meurt-deux-artistes-russes-refugiees-en-bretagne-retrouvent-la-vie-et-l-art,0,www.marianne.net,"""Je n'y retournerai que si Poutine meurt"" : deux artistes russes réfugiées en Bretagne retrouvent la vie… et l'art","Dans le nord de l'Ille-et-Vilaine, sur la côte d'Émeraude, la petite cité de Saint-Briac-sur-Mer héberge depuis 2018 la Maison des artistes en exil, un atypique lieu de résidence créé à l'initiative de Daniel Noël, retraité de l'Éducation nationale. Une expér…",https://media.marianne.net/assets/asTD0fFsmg5wq9EKF.jpg?w=1540&h=924&r=fill,2024-10-18T11:30:00Z,,"Dans le nord de l'Ille-et-Vilaine, sur la côte d'Émeraude, la petite cité de Saint-Briac-sur-Mer héberge depuis 2018 la Maison des artistes en exil, un atypique lieu de résidence créé à l'initiative … [+990 chars]",,fr,'Poutine'
https://www.cinemablend.com/superheroes/marvel-cinematic-universe/chris-hemsworth-real-what-happened-day-filming-avengers-team-up-scene,https://www.cinemablend.com/superheroes/marvel-cinematic-universe/chris-hemsworth-real-what-happened-day-filming-avengers-team-up-scene,0,www.cinemablend.com,‘It Felt Anything But Iconic’: Chris Hemsworth Gets Real About What Happened The Day He Filming The Avengers’ Team-Up Scene,Avengers assemble!,https://cdn.mos.cms.futurecdn.net/kvaikqkzmb59rK5Zvci6MH-1200-80.jpg,2024-10-18T12:03:03Z,,"Whether you are a Marvel fan or not, you have to admit the superhero franchise has a huge impact on pop culture, especially since its expansion to more television in this new phase of the MCU. One of… [+3913 chars]",,fr,'Chris Hemsworth'
https://www.lemonde.fr/international/article/2024/10/18/immigration-un-tribunal-italien-invalide-la-retention-des-premiers-migrants-transferes-en-albanie_6355279_3210.html,https://www.lemonde.fr/international/article/2024/10/18/immigration-un-tribunal-italien-invalide-la-retention-des-premiers-migrants-transferes-en-albanie_6355279_3210.html,0,www.lemonde.fr,Immigration : un tribunal italien invalide la rétention des premiers migrants transférés en Albanie,"Fin 2023, le gouvernement de Giorgia Meloni avait signé avec Tirana un accord prévoyant la création de deux centres en Albanie, d’où les migrants secourus en Méditerranée pourront effectuer une demande d’asile.",https://img.lemde.fr/2024/10/11/0/0/5504/3669/1440/960/60/0/d023909_2024-10-11t130604z-1649596793-rc29iaavq9ft-rtrmadp-3-migration-italy-albania.JPG,2024-10-18T14:45:40Z,,"Des policiers italiens à lintérieur du camp albanais du port de Shëngjin, où lItalie transférera des demandeurs dasile, en Albanie, le 11 octobre 2024. FLORION GOGA / REUTERS
Un tribunal italien a i… [+2378 chars]",,fr,'Giorgia Meloni'
https://www.liberation.fr/societe/immigration/accord-migratoire-entre-litalie-et-lalbanie-le-transfert-des-premiers-demandeurs-dasile-invalide-par-la-justice-20241018_XG6S3BO5WVF6RHNEJ27PGCD53A/,https://www.liberation.fr/societe/immigration/accord-migratoire-entre-litalie-et-lalbanie-le-transfert-des-premiers-demandeurs-dasile-invalide-par-la-justice-20241018_XG6S3BO5WVF6RHNEJ27PGCD53A/,0,www.liberation.fr,Accord migratoire entre l’Italie et l’Albanie : le transfert des premiers demandeurs d’asile invalidé par la justice,"Un tribunal de Rome a estimé ce vendredi 18 octobre que la rétention de douze hommes envoyés par l’Italie en Albanie ne remplit pas les conditions prévues par leur accord, concernant la «sûreté» de leur pays d’origine. Ils vont être rapatriés en Italie, après…",https://www.liberation.fr/resizer/9fk2QivBzAO2ctudkEnDyQ5ZxlI=/1200x630/filters:format(jpg):quality(70)/cloudfront-eu-central-1.images.arcpublishing.com/liberation/NOHC5YK32JDQ3OY3LQE347EKEU.jpg,2024-10-18T16:09:54Z,,"Le gouvernement italien enfreint son propre accord. Les juges de la section immigration du tribunal de Rome ont invalidé, ce vendredi 18 octobre, la rétention dans des centres albanais de douze deman… [+3467 chars]",,fr,'nan nan'
https://www.lemonde.fr/international/live/2024/10/19/en-direct-presidentielle-americaine-kamala-harris-et-donald-trump-a-la-recherche-du-soutien-des-electeurs-musulmans-en-plein-conflit-au-proche-orient_6351439_3210.html,https://www.lemonde.fr/international/live/2024/10/19/en-direct-presidentielle-americaine-kamala-harris-et-donald-trump-a-la-recherche-du-soutien-des-electeurs-musulmans-en-plein-conflit-au-proche-orient_6351439_3210.html,0,www.lemonde.fr,"En direct, présidentielle américaine : Kamala Harris et Donald Trump à la recherche du soutien des électeurs musulmans en plein conflit au Proche-Orient","La candidate démocrate tient trois meetings, vendredi, dans le Michigan qui abrite une des plus grandes communautés arabo-musulmanes des Etats-Unis. Des électeurs très critiques du soutien inconditionnel de l’administration démocrate à Israël. Donald Trump a,…",https://img.lemde.fr/2024/10/18/609/1327/2806/1403/1440/720/60/0/e46ba15_45de89777ccd4dffb30d58fbe7350547-1-c8028728567c4f39a1cc19793125fb6e.jpg,2024-10-18T22:51:36Z,,"Donald Trump a profité, jeudi soir, du réputé dîner annuel de la Fondation Alfred E. Smith, à New York, pour attaquer Kamala Harris, la décrivant comme quelquun qui « peut à peine parler et enchaîner… [+2100 chars]",,fr,'Donald Trump'
https://www.liberation.fr/international/amerique/presidentielle-americaine-2024-une-campagne-au-rythme-de-la-musique-pour-kamala-harris-et-donald-trump-20241019_4KTLKCRVWNDV3A3B4AQCIBGRTE/,https://www.liberation.fr/international/amerique/presidentielle-americaine-2024-une-campagne-au-rythme-de-la-musique-pour-kamala-harris-et-donald-trump-20241019_4KTLKCRVWNDV3A3B4AQCIBGRTE/,0,www.liberation.fr,Présidentielle américaine 2024 : une campagne au rythme de la musique pour Kamala Harris et Donald Trump,"Un rap à la gloire de la vice-présidente démocrate, une salsa cubaine en l’honneur de l’ancien président républicain, des miaulements de chats à la sauce électro : militantes ou parodiques, les chansons s’invitent dans la course à la Maison-Blanche.",https://www.liberation.fr/resizer/U95cgr0IJEgMsoS0K-n3DmM0jws=/1200x630/filters:format(jpg):quality(70)/cloudfront-eu-central-1.images.arcpublishing.com/liberation/CHAFESZYMVDKZPQ4PRP5TUQVN4.jpg,2024-10-19T15:00:00Z,,"Inscrivez-vous ici pour recevoir gratuitement toutes les semaines notre newsletter Libé America.
Le 20 septembre, Donald Trump plastronnait : «Une chanson sur moi est numéro 1 dans les hit-parades, … [+5005 chars]",,fr,'Donald Trump'
https://www.konbini.com/lifestyle/pour-son-retour-au-mma-francis-ngannou-simpose-par-k-o-en-trois-minutes/,https://www.konbini.com/lifestyle/pour-son-retour-au-mma-francis-ngannou-simpose-par-k-o-en-trois-minutes/,0,www.konbini.com,"Pour son retour au MMA, Francis Ngannou s&#8217;impose par K.O en trois minutes","Quasiment trois ans après son dernier combat de MMA, la star des lourds Francis Ngannou n'a eu besoin que de 3 min 32 secondes pour anéantir le Brésilien Renan Ferreira samedi à Ryad, où il...",https://cdn-www.konbini.com/files/2024/10/Francis-Ngannou.jpg,2024-10-20T09:12:27Z,,"Quasiment trois ans après son dernier combat de MMA, la star des lourds Francis Ngannou n’a eu besoin que de 3 min 32 secondes pour anéantir le Brésilien Renan Ferreira samedi à Ryad, où il effectuai… [+3562 chars]",,fr,'nan nan'
https://www.ledauphine.com/environnement/2024/10/20/l-ouragan-oscar-s-apprete-frapper-une-ile-toujours-sans-electricite,https://www.ledauphine.com/environnement/2024/10/20/l-ouragan-oscar-s-apprete-frapper-une-ile-toujours-sans-electricite,0,www.ledauphine.com,Cuba. L'ouragan Oscar s'apprête frapper une île toujours sans électricité,"Sans électricité depuis deux jours, l'île de Cuba se prépare maintenant à être frappée par l'ouragan Oscar, avec des vents pouvant atteindre 130 km/h.",https://cdn-s-www.ledauphine.com/images/B6E810DE-4ADE-4E71-8EE9-BFF14D64A296/FB1200/photo-1729438428.jpg,2024-10-20T15:33:00Z,,"Après une deuxième nuit de panne d'électricité presque totale, Cuba se prépare ce dimanche à l'arrivée imminente de l'ouragan Oscar, qui doit toucher dans la journée l'est de l'île. Oscar traverse le… [+2089 chars]",,fr,'nan nan'
https://www.liberation.fr/idees-et-debats/editorial/aux-etats-unis-les-jeunes-americaines-ont-les-cartes-de-la-presidentielle-en-main-20241020_KATXDEQJNZBG5C7LCCA3GKZ67U/,https://www.liberation.fr/idees-et-debats/editorial/aux-etats-unis-les-jeunes-americaines-ont-les-cartes-de-la-presidentielle-en-main-20241020_KATXDEQJNZBG5C7LCCA3GKZ67U/,0,www.liberation.fr,"Aux Etats-Unis, les jeunes Américaines ont les cartes de la présidentielle en main","Les femmes de la génération Z, qui défendent le droit à l’avortement et la lutte contre le réchauffement climatique, se positionnent massivement pour Kamala Harris face à un Trump ringard. Reste à savoir si elles se mobiliseront.",https://www.liberation.fr/resizer/KdDVm2Na9-ZM-SYJgL4ZgrF5Qyg=/1200x630/filters:format(jpg):quality(70):focal(3000x1902:3010x1912)/cloudfront-eu-central-1.images.arcpublishing.com/liberation/XDEURDMVEZEL7I4OZ7G6Q4FK4U.jpg,2024-10-20T17:36:58Z,,"Et si lavenir de la planète reposait entre les mains des jeunes Américaines ? On exagère un peu, bien sûr, mais pas tant que ça. Dans le contexte actuel de volatilité et de dangerosité de la situatio… [+1898 chars]",,fr,'Kamala Harris'
https://www.presse-citron.net/apple-vision-pro-apple-intelligence-tim-cook-revient-sur-laccueil-mitige-des-nouveautes-apple/,https://www.presse-citron.net/apple-vision-pro-apple-intelligence-tim-cook-revient-sur-laccueil-mitige-des-nouveautes-apple/,0,www.presse-citron.net,"Apple Vision Pro, Apple Intelligence : Tim Cook revient sur l’accueil mitigé des nouveautés Apple",Le dirigeant évoque le lancement de ces deux produits.,https://www.presse-citron.net/app/uploads/2024/02/tim-cook-apple.jpg,2024-10-21T08:25:35Z,,"Lorsquil se réveille le matin, Tim Cook prend son téléphone pour lire ses e-mails et vérifier les résultats de vente dApple à travers le monde. Les chiffres plutôt mitigés concernant le Vision Pro no… [+2807 chars]",,fr,'Tim Cook'
https://www.huffingtonpost.fr/international/article/russie-la-veuve-d-alexei-navalny-ioulia-navalnaia-veut-se-presenter-a-la-presidentielle_241143.html,https://www.huffingtonpost.fr/international/article/russie-la-veuve-d-alexei-navalny-ioulia-navalnaia-veut-se-presenter-a-la-presidentielle_241143.html,0,www.huffingtonpost.fr,"Russie : La veuve d’Alexeï Navalny, Ioulia Navalnaïa, veut se présenter à la présidentielle","L’opposante à Vladimir Poutine veut poursuivre son objectif de se présenter à l’élection présidentielle russe, et souhaite voir le maître du Kremlin derrière les barreaux.",https://huffpost-focus.sirius.press/2024/10/21/372/0/8256/4644/1820/1023/75/0/d1cbd11_1729502523993-gettyimages-2147917866.jpg,2024-10-21T10:09:54Z,,"INTERNATIONAL - Trois jours après lannonce de la mort de son mari, en février dernier, Ioulia Navalnaïa avait affirmé sans hésiter : « Je poursuivrai luvre dAlexeï Navalny. » Huit mois plus tard, la … [+3593 chars]",,fr,'Vladimir Poutine'
https://fr.sputniknews.africa/20241021/president-emirati-les-relations-moscou---abou-dabi-revetent-un-caractere-historique-et-strategique-1068792435.html,https://fr.sputniknews.africa/20241021/president-emirati-les-relations-moscou---abou-dabi-revetent-un-caractere-historique-et-strategique-1068792435.html,0,fr.sputniknews.africa,Président émirati: les relations Moscou - Abou Dabi revêtent un caractère historique et stratégique,Mohammed ben Zayed Al Nahyane dit apprécier hautement ses relations avec Vladimir Poutine au niveau tant personnel que professionnel.,https://cdn1.img.sputniknews.africa/images/sharing/article/fra/1068792435.jpg?10687922481729508530,2024-10-21T11:02:09Z,,"https://fr.sputniknews.africa/20241021/president-emirati-les-relations-moscou---abou-dabi-revetent-un-caractere-historique-et-strategique-1068792435.html
Président émirati: les relations Moscou - Ab… [+2083 chars]",,fr,'Vladimir Poutine'
