index,url,valid,domain,title,description,image,published,archive,content,quote,language,keyword
https://siecledigital.fr/2024/04/05/loffre-chatgpt-enterprise-connait-une-croissance-fulgurante-malgre-la-concurrence/,https://siecledigital.fr/2024/04/05/loffre-chatgpt-enterprise-connait-une-croissance-fulgurante-malgre-la-concurrence/,0,siecledigital.fr,L’offre ChatGPT Enterprise connaît une croissance fulgurante malgré la concurrence,"Plus de 600 000 personnes se sont inscrites pour utiliser ChatGPT Enterprise, contre environ 150 000 en janvier. Une croissance impressionnante pour OpenAI, alors même que de plus en plus d’entreprises déploient leur propre abonnement. Monétiser ChatGPT D’Ant…",https://siecledigital.fr/wp-content/uploads/2023/03/chatgpt-ecran.jpg,2024-04-05T12:47:03Z,,"Plus de 600 000 personnes se sont inscrites pour utiliser ChatGPT Enterprise, contre environ 150 000 en janvier. Une croissance impressionnante pour OpenAI, alors même que de plus en plus dentreprise… [+2361 chars]",,fr,'nan nan'
https://www.dhnet.be/medias/musique/2024/04/05/le-producteur-de-taylor-swift-en-pince-pour-angele-AOCKZKKSCBDPXCL22WYAUGUK3E/,https://www.dhnet.be/medias/musique/2024/04/05/le-producteur-de-taylor-swift-en-pince-pour-angele-AOCKZKKSCBDPXCL22WYAUGUK3E/,0,www.dhnet.be,Le producteur de Taylor Swift en pince pour... Angèle!,Jack Antonoff s’est exprimé devant la caméra de Konbini à l’occasion de la promotion de l’album de son groupe Bleachers. ...,"https://www.dhnet.be/resizer/gnpNp5I_oRfNQHg2dAbVTaqqXBU=/1200x630/filters:format(jpeg):focal(2475x1365:2485x1355):watermark(cloudfront-eu-central-1.images.arcpublishing.com/ipmgroup/KSYODHLMNBBMDA7B5YPJPTFVNY.png,0,-0,0,100)/cloudfront-eu-central-1.images.arcpublishing.com/ipmgroup/LCR4TZOKW5C23HOXDNYEQK5EZI.jpg",2024-04-05T14:34:37Z,,"Dans lunivers de la musique pop, Jack Antonoff, cest quelquun. Dix Grammy Awards et 16 nominations depuis 2013 à lui seul ! Producteur, et donc homme de lombre, son nom est associé à ceux de Lorde (M… [+224 chars]",,fr,'Lana Del Rey'
https://www.lalibre.be/lifestyle/people/2024/04/05/angele-a-tape-dans-loeil-dun-celebre-producteur-P5CUJVS2BZAU7AIYJFVXYTAH4E/,https://www.lalibre.be/lifestyle/people/2024/04/05/angele-a-tape-dans-loeil-dun-celebre-producteur-P5CUJVS2BZAU7AIYJFVXYTAH4E/,0,www.lalibre.be,Angèle a tapé dans l’œil d'un célèbre producteur,Jack Antonoff s’est exprimé devant la caméra de Konbini à l’occasion de la promotion de l’album de son groupe Bleachers. ...,"https://www.lalibre.be/resizer/80m-lfgps6F7PA7N8e4kJdCr2Pk=/1200x630/filters:format(jpeg):focal(2475x1365:2485x1355):watermark(cloudfront-eu-central-1.images.arcpublishing.com/ipmgroup/OIO44DUUUNC2DB5T3FIJECBT5U.png,0,-0,0,100)/cloudfront-eu-central-1.images.arcpublishing.com/ipmgroup/LCR4TZOKW5C23HOXDNYEQK5EZI.jpg",2024-04-05T15:17:36Z,,"Dans lunivers de la musique pop, Jack Antonoff, cest quelquun. Dix Grammy Awards et 16 nominations depuis 2013 à lui seul ! Producteur, et donc homme de lombre, son nom est associé à ceux de Lorde (M… [+224 chars]",,fr,'Jack Antonoff'
https://www.lepoint.fr/politique/quand-la-deputee-elisabeth-borne-tacle-macron-et-attal-06-04-2024-2556939_20.php,https://www.lepoint.fr/politique/quand-la-deputee-elisabeth-borne-tacle-macron-et-attal-06-04-2024-2556939_20.php,0,www.lepoint.fr,Les piques de la députée Élisabeth Borne,LA CHRONIQUE DE MICHEL RICHARD. L'ex-Premiere ministre a fait sa rentree parlementaire avec des propos urticants qui n'epargnent ni Gabriel Attal ni Emmanuel Macron.,https://static.lpnt.fr/images/2024/04/06/26345183lpw-26345278-mega-une-jpg_10226870.jpg,2024-04-06T05:30:00Z,http://archive.md/20240406084047/http://www.lepoint.fr/politique/quand-la-deputee-elisabeth-borne-tacle-macron-et-attal-06-04-2024-2556939_20.php,"C'est assez rare un(e) Premier(e) ministre qui, à la sortie de l'enfer matignonnesque, rejoint modestement les bancs de l'Assemblée nationale comme député(e). C'est le parcours choisi par Élisabeth B… [+1020 chars]",,fr,'Élisabeth Borne'
https://atlantico.fr/article/decryptage/qui-seraient-vraiment-les-electeurs-d-un-edouard-philippe-candidat-en-2027-popularite-sondages-horizons-vote-citoyens-centre-majorite-presidentielle-macron-bayrou-election-presidentielle-elysee-matignon-christophe-boutin,https://atlantico.fr/article/decryptage/qui-seraient-vraiment-les-electeurs-d-un-edouard-philippe-candidat-en-2027-popularite-sondages-horizons-vote-citoyens-centre-majorite-presidentielle-macron-bayrou-election-presidentielle-elysee-matignon-christophe-boutin,0,atlantico.fr,Qui seraient vraiment les électeurs d’un Edouard Philippe candidat en 2027 ?,La cote de popularité d'Edouard Philippe enregistre une nouvelle baisse selon le baromètre Elabe pour Les Echos. Sur quelle sociologie électorale l’ancien Premier ministre peut-il s’appuyer pour conquérir le pouvoir en 2027 ?,https://atlantico-media.s3.eu-west-3.amazonaws.com/AFP_20240405_34_NP_9_YF_v1_High_Res_France_Eu_Politics_Parties_5034ac28b1.jpg,2024-04-06T09:10:13Z,,"Atlantico : Longtemps, Edouard Philippe a pu se vanter dune popularité résistante à toutes les épreuves. Des années après son départ de Matignon, lancien Premier ministre caracolait en tête des sonda… [+8569 chars]",,fr,'Edouard Philippe'
https://www.20minutes.fr/arts-stars/people/4084905-20240406-colin-farrell-tres-fier-reussite-irlandais-hollywood-arts-general,https://www.20minutes.fr/arts-stars/people/4084905-20240406-colin-farrell-tres-fier-reussite-irlandais-hollywood-arts-general,0,www.20minutes.fr,Colin Farrell est très fier de la réussite des Irlandais à Hollywood et dans les arts en général,"Pour l’acteur, il y a clairement une exception irlandaise",https://img.20mn.fr/gRucK0qQRPqBWiG6iwRQ4yk/1444x920_prime-video-s-thirteen-lives-los-angeles-premiere-featuring-colin-farrell-where-los-angeles-california-united-states-when-28-jul-2022-credit-bauer-griffin-insta-rimages-com-cover-images,2024-04-06T13:02:36Z,,"Colin Farrell na pas fini de sétonner de lincroyable réussite de ses compatriotes irlandais à Hollywood et dans tous les domaines de la culture en général. Rien quà lécran, lîle verte a donné naissan… [+1055 chars]",,fr,'Colin Farrell'
https://www.20minutes.fr/sport/football/4085214-20240406-arabie-saoudite-besoin-aide-karim-benzema-toujours-panne-efficacite-al-ittihad,https://www.20minutes.fr/sport/football/4085214-20240406-arabie-saoudite-besoin-aide-karim-benzema-toujours-panne-efficacite-al-ittihad,0,www.20minutes.fr,Arabie saoudite : « J’ai besoin d’aide »… Karim Benzema toujours en panne d’efficacité avec Al-Ittihad,L'ancien attaquant du Real Madrid a estimé qu'il ne pouvait pas faire « gagner » seul son nouveau club saoudien,https://img.20mn.fr/-J9dOQsYT-2XSQZBhEq-YCk/1444x920_files-ittihad-s-french-forward-09-karim-benzema-runs-with-the-ball-during-the-saudi-pro-league-football-match-between-al-ittihad-and-al-nassr-at-king-abdullah-sports-city-stadium-in-jeddah-on-december-26-2023-karim-benzema-feels-under-pressure-at-his-saudi-club-al-ittihad-and-wants-to-leave-temporarily-a-source-close-to-the-club-told-afp-on-tuesday-photo-by-afp,2024-04-06T13:38:03Z,,"15 décembre 2023. Depuis près de quatre mois, Karim Benzema na plus trouvé le chemin des filets avec Al-Ittihad. Et la mauvaise série na pas pris fin vendredi soir, lors de la rencontre face à Al-Taa… [+1522 chars]",,fr,'Al Nassr'
https://www.sofoot.com/breves/benzema-je-ne-peux-pas-gagner-un-match-tout-seul,https://www.sofoot.com/breves/benzema-je-ne-peux-pas-gagner-un-match-tout-seul,0,www.sofoot.com,Benzema : « Je ne peux pas gagner un match tout seul »,Un ambassadeur qui se demande : quel est le projet ? La pige saoudienne de Karim Benzema à Djeddah…,https://sofoot.s3.eu-central-1.amazonaws.com/wp-content/uploads/2024/04/06160939/ICONSPORT_191329_0002-1400x933.jpg,2024-04-06T14:15:32Z,,"Un ambassadeur qui se demande : quel est le projet ?
La pige saoudienne de Karim Benzema à Djeddah est tout sauf une promenade de santé, contrairement à celle de son grand ami Cristiano Ronaldo. Ce … [+1015 chars]",,fr,'Karim Benzema'
https://www.lalibre.be/international/amerique/2024/04/06/dans-la-guerre-du-cash-joe-biden-conserve-lavantage-sur-donald-trump-IQCM5TFZV5CJZD3MXZHW6TPRQI/,https://www.lalibre.be/international/amerique/2024/04/06/dans-la-guerre-du-cash-joe-biden-conserve-lavantage-sur-donald-trump-IQCM5TFZV5CJZD3MXZHW6TPRQI/,0,www.lalibre.be,"Dans la guerre du cash, Joe Biden conserve l’avantage sur Donald Trump","L’argent est plus que jamais le nerf de la guerre présidentielle aux États-Unis, où le coût d’une campagne se chiffre en milliards de dollars. Et, sur ce terrain, le Président sortant distance son adversaire républicain, accablé notamment par ses frais de jus…","https://www.lalibre.be/resizer/_6xQwgGnE29Pr6rJaI25LzBUMbY=/1200x630/filters:format(jpeg):focal(1679.5x1128.5:1689.5x1118.5):watermark(cloudfront-eu-central-1.images.arcpublishing.com/ipmgroup/OIO44DUUUNC2DB5T3FIJECBT5U.png,0,-0,0,100)/cloudfront-eu-central-1.images.arcpublishing.com/ipmgroup/7ZPJRAPOMVDYRG4FJI63724YGM.jpg",2024-04-06T16:58:56Z,,"Telles sont les règles du jeu de la grande soirée de levée de fonds qui aura lieu en Floride, ce samedi, au bénéfice de la campagne du Républicain. Le raout est coorganisé par le milliardaire John Pa… [+5696 chars]",,fr,'Lara Trump'
https://www.latribune.fr/culture-lifestyle/tendance-le-nouveau-western-994729.html,https://www.latribune.fr/culture-lifestyle/tendance-le-nouveau-western-994729.html,0,www.latribune.fr,Tendance : le nouveau western,"Cet été, pas moyen d’échapper au style country. Derrière cette mode défendue par Beyoncé ou Lana Del Rey se cachent des enjeux culturels et politiques.",https://static.latribune.fr/full_width/2350716/country-mode.jpg,2024-04-07T03:13:00Z,,"Le nouvel album de Beyoncé, Act II : Cowboy Carter, est sorti ce 29 mars. Dernier avatar d'une tendance lancée durant le mois de la mode de septembre 2023 et qui ne fait que prendre de l'ampleur : la… [+3077 chars]",,fr,'Lana Del Rey'
https://www.lepoint.fr/politique/gabriel-attal-la-droite-et-le-baril-de-poudre-07-04-2024-2557019_20.php,https://www.lepoint.fr/politique/gabriel-attal-la-droite-et-le-baril-de-poudre-07-04-2024-2557019_20.php,0,www.lepoint.fr,"Gabriel Attal, la droite et le baril de poudre",LA CHRONIQUE POLITIQUE. La decision est actee : LR compte deposer sa premiere motion de censure du quinquennat. Reste a savoir quand et avec quelles consequences.,https://static.lpnt.fr/images/2024/04/07/26342902lpw-26342940-mega-une-jpg_10228105.jpg,2024-04-07T10:00:00Z,http://archive.md/20240407121341/http://www.lepoint.fr/politique/gabriel-attal-la-droite-et-le-baril-de-poudre-07-04-2024-2557019_20.php,"Gabriel Attal fêtera-t-il Noël à Matignon ? Bien malin qui peut répondre à cette question. Nommé le 9 janvier, le plus jeune Premier ministre de la Ve République sait pertinemment que son bail peut p… [+5833 chars]",,fr,'Gabriel Attal'
https://www.iphon.fr/post/la-bonne-affaire-du-pdg-dapple-ne-passe-pas-inapercue,https://www.iphon.fr/post/la-bonne-affaire-du-pdg-dapple-ne-passe-pas-inapercue,0,www.iphon.fr,La bonne affaire du PDG d’Apple ne passe pas inaperçue,"Tim Cook est riche, très riche, même. Voici de nouveaux chiffres qui le démontrent, de nouveau.",https://www.iphon.fr/app/uploads/2024/04/tim-cook-apple.jpg,2024-04-07T12:38:29Z,https://web.archive.org/web/20240408095852/https://www.iphon.fr/post/la-bonne-affaire-du-pdg-dapple-ne-passe-pas-inapercue,"Tim Cook vient de vendre près de deux cent mille actions AAPL, pour une valeur de plus de trente millions de dollars. Ces options lui sont probablement dues grâce à des résultats financiers en forme.… [+3862 chars]",,fr,'Tim Cook'
https://www.huffingtonpost.fr/economie/video/l-assurance-chomage-dans-le-viseur-de-gabriel-attal-qui-ne-veut-pas-attendre-les-effets-des-reformes-precedentes_232196.html,https://www.huffingtonpost.fr/economie/video/l-assurance-chomage-dans-le-viseur-de-gabriel-attal-qui-ne-veut-pas-attendre-les-effets-des-reformes-precedentes_232196.html,0,www.huffingtonpost.fr,L’assurance chômage dans le viseur de Gabriel Attal qui ne veut pas attendre les effets des réformes précédentes,"Après l’annonce du déficit, l’exécutif a rapidement annoncé une prochaine réforme de l’assurance chômage. Une cible de choix depuis cinq ans de la part de la majorité.",https://storage.googleapis.com/huffpost-assets/huffpost-phalcon/prd/medias/default-entry.jpg,2024-04-08T04:00:16Z,,"EMPLOI - Jamais deux sans trois. Le déficit français a atteint à 5,5 % du PIB en 2023, concrètement cela veut dire quil manque 16 milliards deuros dans les caisses. Pour renflouer les caisses, lexécu… [+5293 chars]",,fr,'Élisabeth Borne'
https://www.presse-citron.net/jony-ive-et-sam-altman-le-duo-de-choc-chercherait-des-investisseurs-pour-un-projet-fou/,https://www.presse-citron.net/jony-ive-et-sam-altman-le-duo-de-choc-chercherait-des-investisseurs-pour-un-projet-fou/,0,www.presse-citron.net,Jony Ive et Sam Altman : le duo de choc chercherait des investisseurs pour un projet fou,"Le projet d’appareil dédié à l’IA de Jony Ive et Sam Altman. Après avoir fondé une entreprise, le duo serait en discussion avec des investisseurs potentiels.",https://www.presse-citron.net/app/uploads/2023/08/intelligence-artificielle.jpg,2024-04-08T04:33:50Z,,"Depuis un moment, des rumeurs circulent au sujet d’une possible collaboration entre Jony Ive, l’ancien chef du design chez Apple et Sam Altman, le CEO d’OpenAI, qui a démocratisé l’intelligence artif… [+2241 chars]",,fr,'Sam Altman'
https://www.journaldugeek.com/2024/04/08/jony-ive-lancien-designer-dapple-cherche-un-milliard-de-dollars-pour-son-mysterieux-projet-ia/,https://www.journaldugeek.com/2024/04/08/jony-ive-lancien-designer-dapple-cherche-un-milliard-de-dollars-pour-son-mysterieux-projet-ia/,0,www.journaldugeek.com,"Jony Ive, l’ancien designer d’Apple, cherche un milliard de dollars pour son mystérieux projet IA","Jony Ive, connu pour son rôle déterminant dans le design iconique de nombreux appareils d'Apple, se tourne vers de grands noms du capital-risque spécialisé en intelligence artificielle pour financer son nouveau projet d'assistant personnel. Un projet nimbé de…",https://www.journaldugeek.com/app/uploads/2024/04/JonyIve.jpg,2024-04-08T07:00:21Z,,"Selon les indiscrétions rapportées par le site The Information, Jony Ive aurait approché Thrive Capital, un financeur historique d’OpenAI, ainsi que l’Emerson Collective de Laurene Powell-Jobs, dans … [+2249 chars]",,fr,'nan nan'
https://www.clubic.com/actualite-523548-gpt-4-openai-aurait-utilise-plus-d-un-millions-d-heures-de-video-sur-youtube-pour-entrainer-son-ia.html,https://www.clubic.com/actualite-523548-gpt-4-openai-aurait-utilise-plus-d-un-millions-d-heures-de-video-sur-youtube-pour-entrainer-son-ia.html,0,www.clubic.com,GPT-4 : OpenAI aurait utilisé plus d'un millions d'heures de vidéo sur YouTube pour entraîner son IA,"OpenAI cherche toujours de nouvelles données pour entraîner ses modèles de langage. Et il semble que la firme de Sam Altman se soit, dans cette idée, tournée vers YouTube, où elle se serait largement servie !",https://pic.clubic.com/v1/images/2170102/raw,2024-04-08T13:13:00Z,,Le New-York Times est depuis de nombreux mois en conflit ouvert avec OpenAI. Alors si le célèbre journal américain peut trouver des informations potentiellement gênantes sur la firme dirigée par Sam … [+651 chars],,fr,'Sam Altman'
https://www.liberation.fr/societe/sante/taxe-lapin-5-euros-pour-un-rendez-vous-medical-non-honore-les-4-points-que-souleve-le-projet-du-gouvernement-20240408_QTE45YXYSFEBDPCQVKLSLY6PV4/,https://www.liberation.fr/societe/sante/taxe-lapin-5-euros-pour-un-rendez-vous-medical-non-honore-les-4-points-que-souleve-le-projet-du-gouvernement-20240408_QTE45YXYSFEBDPCQVKLSLY6PV4/,0,www.liberation.fr,"«Taxe lapin», 5 euros pour un rendez-vous médical non honoré : les 4 points que soulève le projet du gouvernement","Gabriel Attal a précisé samedi 6 avril le principe de la mesure, qui consiste à sanctionner de 5 euros toute personne ne se rendant pas chez son médecin sans l’avoir prévenu au moins 24 heures avant. La somme sera versée au praticien, qui décidera de l’appliq…",https://www.liberation.fr/resizer/8roP67YM9bAWkwlpwzw3-gyCBiY=/1200x630/filters:format(jpg):quality(70)/cloudfront-eu-central-1.images.arcpublishing.com/liberation/WGL7DIBJEJAHDBYRLABLRKPIWA.jpg,2024-04-08T14:38:36Z,,Faire payer les patients qui planteraient leur médecin : la fameuse «taxe lapin» se précise. Lidée de sanctionner les rendez-vous médicaux non honorés avait été vaguement évoquée il y a un an par Emm… [+5544 chars],,fr,'Gabriel Attal'
https://www.sofoot.com/breves/benzema-retrouve-enfin-le-chemin-des-filets,https://www.sofoot.com/breves/benzema-retrouve-enfin-le-chemin-des-filets,0,www.sofoot.com,Benzema retrouve enfin le chemin des filets,"Un éclair dans la nuit. Muet depuis quatre mois, Karim Benzema a marqué ce lundi. En faisant trembler les filets dès…",https://sofoot.s3.eu-central-1.amazonaws.com/wp-content/uploads/2024/04/08232632/6701357-1400x933.jpg,2024-04-08T21:28:46Z,,"Un éclair dans la nuit.
Muet depuis quatre mois, Karim Benzema a marqué ce lundi. En faisant trembler les filets dès la première minute de jeu, bien aidé par la relance catastrophique dun défenseur … [+787 chars]",,fr,'Karim Benzema'
https://rmcsport.bfmtv.com/football/arabie-saoudite-benzema-enfin-buteur-apres-quatre-mois-de-disette_AV-202404080997.html,https://rmcsport.bfmtv.com/football/arabie-saoudite-benzema-enfin-buteur-apres-quatre-mois-de-disette_AV-202404080997.html,0,rmcsport.bfmtv.com,"Arabie saoudite: Benzema enfin buteur, après quatre mois de disette","Pas au mieux ces derniers mois en Arabie saoudite, Karim Benzema a marqué lundi son premier but depuis le mois de novembre lors de la victoire d'Al-Ittihad en demi-finale de Supercoupe contre Al-Wehda (2-1).",https://images.bfmtv.com/B2QKYcJ2octitoH2EG2PuttS1LY=/548x0:1684x639/images/Karim-Benzema-avec-Al-Ittihad-en-Arabie-saoudite-decembre-2023-1840538.jpg,2024-04-08T21:35:56Z,,"Pas au mieux ces derniers mois en Arabie saoudite, Karim Benzema a marqué lundi son premier but depuis le mois de novembre lors de la victoire d'Al-Ittihad en demi-finale de Supercoupe contre Al-Wehd… [+1719 chars]",,fr,'Al Nassr'
https://rmcsport.bfmtv.com/football/arabie-saoudite-l-enorme-craquage-de-cristiano-ronaldo-expulse-et-proche-de-s-en-prendre-a-l-arbitre_AV-202404081001.html,https://rmcsport.bfmtv.com/football/arabie-saoudite-l-enorme-craquage-de-cristiano-ronaldo-expulse-et-proche-de-s-en-prendre-a-l-arbitre_AV-202404081001.html,0,rmcsport.bfmtv.com,"Arabie saoudite: l'énorme craquage de Cristiano Ronaldo, expulsé et proche de s'en prendre à l'arbitre",Cristiano Ronaldo a reçu un carton rouge logique après un geste d'humeur dans les dernières minutes de la demi-finale de Supercoupe d'Arabie saoudite perdue par Al-Nassr contre Al-Hilal (1-2) ce lundi.,https://images.bfmtv.com/6qIJZ0cbjOOtEa3cEQcct6yJLHA=/2x0:1490x837/images/Cristiano-Ronaldo-menacant-l-arbitre-du-poing-le-8-avril-2024-1840546.jpg,2024-04-08T21:46:29Z,,Cristiano Ronaldo a reçu un carton rouge logique après un geste d'humeur dans les dernières minutes de la demi-finale de Supercoupe d'Arabie saoudite perdue par Al-Nassr contre Al-Hilal (1-2) ce lund… [+2219 chars],,fr,'Al Nassr'
https://www.ouest-france.fr/europe/ukraine/guerre-en-ukraine-frappes-a-bilopillia-importations-agricoles-ukrainiennes-le-point-sur-la-nuit-362a8cc1-7644-468a-9f03-3305d6e8f94f,https://www.ouest-france.fr/europe/ukraine/guerre-en-ukraine-frappes-a-bilopillia-importations-agricoles-ukrainiennes-le-point-sur-la-nuit-362a8cc1-7644-468a-9f03-3305d6e8f94f,0,www.ouest-france.fr,"Guerre en Ukraine. Frappes à Bilopillia, importations agricoles ukrainiennes… Le point sur la nuit","Ce lundi 8 avril, plusieurs administrations régionales ukrainiennes ont déploré des victimes dans des attaques russes.
De son côté, l’UE a reconduit l’exemption de droits de douane sur les importations agricoles venant d’Ukraine, en l’assortissant de restrict…",https://media.ouest-france.fr/v1/pictures/MjAyNDA0OTY0N2YzYTA4ZjY2N2I2MTZkMWFmNTVmMmFhNTcwNzc?width=1260&height=708&focuspoint=50%2C25&cropresize=1&client_id=bpeditorial&sign=2567fdfc1e0f950c12ff8197054148b5610c633734e8f43c27c0cb438b9b9f9c,2024-04-09T03:35:26Z,https://web.archive.org/web/20240409053815/https://www.ouest-france.fr/europe/ukraine/guerre-en-ukraine-frappes-a-bilopillia-importations-agricoles-ukrainiennes-le-point-sur-la-nuit-362a8cc1-7644-468a-9f03-3305d6e8f94f,"Le jour se lève en Europe et un 776e jour de conflit armé souvre en Ukraine après le début de linvasion russe le 24 février 2022.
Ce lundi, des frappes russes ont fait trois morts dans la région de … [+5928 chars]",,fr,'nan nan'
https://www.dhnet.be/actu/monde/2024/04/09/russie-enquete-pour-financement-du-terrorisme-impliquant-lukraine-et-les-occidentaux-MVD4XWAJCRCV7OXXKD3SB5MIYE/,https://www.dhnet.be/actu/monde/2024/04/09/russie-enquete-pour-financement-du-terrorisme-impliquant-lukraine-et-les-occidentaux-MVD4XWAJCRCV7OXXKD3SB5MIYE/,0,www.dhnet.be,"Russie : enquête pour ""financement du terrorisme"" impliquant l'Ukraine et les Occidentaux","Le Comité d'enquête russe a annoncé mardi l'ouverture d'une enquête pour ""financement du terrorisme"" pour le compte de l'Ukraine impliquant les États-Unis et leurs alliés, citant notamment le nom d'une société ukrainienne ayant employé le fils du président am…",https://www.dhnet.be/resizer/v2/EOZ6SUAHIFFMHDQI25MLA4WO5I.jpg?auth=d68dd16e8e045c49206926e8b1410c06ab12444a3f2609074ac1bb6d2fe1aeda&width=1200&height=630&quality=85&focal=384%2C256&watermark=https%3A%2F%2Fcloudfront-eu-central-1.images.arcpublishing.com%2Fipmgroup%2FDZNGDE46VVGXRGHD3TEI5RB3GM.png%3A100%3A0%2C559,2024-04-09T14:18:20Z,,"Les enquêteurs affirment, sans présenter les éléments du dossier, que Burisma a servi d'intermédiaire pour des fonds utilisés ""ces dernières années pour mener des actes terroristes en Russie et à l'é… [+1861 chars]",,fr,'Alexander Smirnov'
https://www.lavenir.net/actu/monde/2024/04/09/russie-enquete-pour-financement-du-terrorisme-impliquant-lukraine-et-les-occidentaux-CB3CEJG4UZHB7P4JI2PW5ESATY/,https://www.lavenir.net/actu/monde/2024/04/09/russie-enquete-pour-financement-du-terrorisme-impliquant-lukraine-et-les-occidentaux-CB3CEJG4UZHB7P4JI2PW5ESATY/,0,www.lavenir.net,"Russie : enquête pour ""financement du terrorisme"" impliquant l'Ukraine et les Occidentaux","Le Comité d'enquête russe a annoncé, ce mardi 9 avril 2024, l'ouverture d'une enquête pour ""financement du terrorisme"" pour le compte de l'Ukraine impliquant les États-Unis et leurs alliés, citant notamment le nom d'une société ukrainienne ayant employé le fi…",https://www.lavenir.net/resizer/v2/EOZ6SUAHIFFMHDQI25MLA4WO5I.jpg?auth=d68dd16e8e045c49206926e8b1410c06ab12444a3f2609074ac1bb6d2fe1aeda&width=1200&height=630&quality=85&focal=384%2C256&watermark=https%3A%2F%2Fcloudfront-eu-central-1.images.arcpublishing.com%2Fipmgroup%2FUVYY255VT5BDBHOGCTGBCGI364.png%3A100%3A0%2C558,2024-04-09T14:18:37Z,,"Les enquêteurs affirment, sans présenter les éléments du dossier, que Burisma a servi d'intermédiaire pour des fonds utilisés ""ces dernières années pour mener des actes terroristes en Russie et à l'é… [+1772 chars]",,fr,'Alexander Smirnov'
https://www.20minutes.fr/monde/russie/4085651-20240409-russie-enquete-penale-financement-terrorisme-impliquant-ukraine-pays-occidentaux,https://www.20minutes.fr/monde/russie/4085651-20240409-russie-enquete-penale-financement-terrorisme-impliquant-ukraine-pays-occidentaux,0,www.20minutes.fr,Russie : Enquête pénale pour « financement du terrorisme » impliquant l’Ukraine et des pays occidentaux,"Selon les enquêteurs russes, de l’argent ayant servi à financer des attaques aurait transité par la compagnie gazière Burisma, qui avait vu Hunter Biden siéger à son conseil d’administration",https://img.20mn.fr/ybjl8ZQsTKC2ewKv0sidkCk/1444x920_president-joe-biden-speaks-to-the-media-on-the-south-lawn-of-the-white-house-as-his-son-hunter-biden-looks-on-during-the-easter-egg-roll-celebration-on-april-1-2024-house-republicans-are-mounting-an-impeachment-inquiry-regarding-president-biden-x92-s-alleged-interference-into-his-son-x92-s-businesses-abroad-photo-by-aaron-schwartz-sipa-usa-52297014-as-2404012020,2024-04-09T14:26:56Z,,"Le Comité denquête russe a annoncé mardi louverture dune enquête pour « financement du terrorisme » pour le compte de lUkraine. Elle implique les Etats-Unis et leurs alliés, citant notamment le nom d… [+2451 chars]",,fr,'Hunter Biden'
