index,url,valid,domain,title,description,image,published,archive,content,quote,language,keyword
https://pointgphone.com/fin-smartphone-tim-cook-contre-geants-tech-77684/,https://pointgphone.com/fin-smartphone-tim-cook-contre-geants-tech-77684/,0,pointgphone.com,La fin du smartphone ? Tim Cook contre-attaque face aux géants de la tech,"Tim Cook, à la tête d’Apple, incarne une approche conservatrice face à l’avenir des smartphones. Alors que Mark Zuckerberg, Elon Musk, Sam Altman et Bill Gates annoncent une transformation radicale avec des technologies comme les implants cérébraux, les tatou…",https://pointgphone.com/wp-content/uploads/2025/06/Tim-Cook.jpg,2025-06-01T11:32:31Z,,"Tim Cook, à la tête dApple, incarne une approche conservatrice face à lavenir des smartphones. Alors que Mark Zuckerberg, Elon Musk, Sam Altman et Bill Gates annoncent une transformation radicale ave… [+2439 chars]",,fr,'Elon Musk'
https://www.nouvelobs.com/monde/20250601.OBS104503/trump-retire-brutalement-la-nomination-de-jared-isaacman-proche-d-elon-musk-a-la-tete-de-la-nasa.html,https://www.nouvelobs.com/monde/20250601.OBS104503/trump-retire-brutalement-la-nomination-de-jared-isaacman-proche-d-elon-musk-a-la-tete-de-la-nasa.html,0,www.nouvelobs.com,"Trump retire brutalement la nomination de Jared Isaacman, proche d’Elon Musk, à la tête de la Nasa","Selon la presse américaine, Trump a découvert que le milliardaire, magnat du paiement en ligne, aurait effectué par le passé des dons à des élus démocrates.",https://focus.nouvelobs.com/2025/06/01/0/0/4897/3265/1200/800/0/0/4dc2938_ftp-import-images-1-vcv7vp1vlhca-afp-48rm3nx.jpg,2025-06-01T11:32:31Z,,"Par 
Le Nouvel Obs avec AFP
Publié le
1 juin 2025 à 13h32
Jared Isaacman, commandant de la mission Inspiration4 et fondateur et PDG de Shift4 Payments, pose pour un portrait devant le premier éta… [+4578 chars]",,fr,'Elon Musk'
https://www.courrierinternational.com/article/etats-unis-les-espoirs-decus-du-neoreactionnaire-curtis-yarvin-l-inspirateur-du-doge-d-elon-musk_231190,https://www.courrierinternational.com/article/etats-unis-les-espoirs-decus-du-neoreactionnaire-curtis-yarvin-l-inspirateur-du-doge-d-elon-musk_231190,0,www.courrierinternational.com,"Les espoirs déçus du néoréactionnaire Curtis Yarvin, l’inspirateur du Doge d’Elon Musk","Chantre des “lumières obscures”, appelant de ses vœux le remplacement de la démocratie américaine par une dictature, Curtis Yarvin se montre très critique des résultats obtenus par le “département de l’efficacité gouvernementale” qu’a piloté Elon Musk jusqu’à…",https://focus.courrierinternational.com/2025/05/30/82/38/5994/3996/1200/630/60/0/8fbb846_sirius-fs-upload-1-rekml88rubdu-1748605232091-web-curtis-yarvin-ammer.jpg,2025-06-01T14:49:42Z,http://archive.md/20250601163251/https://www.courrierinternational.com/article/etats-unis-les-espoirs-decus-du-neoreactionnaire-curtis-yarvin-l-inspirateur-du-doge-d-elon-musk_231190,"Avant de devenir la mission dElon Musk, démolir la fonction publique fédérale était le rêve de Curtis Yarvin.
Ingénieur informaticien et blogueur de la Silicon Valley appelant de ses vux le remplace… [+4313 chars]",,fr,'Curtis Yarvin'
https://www.lemonde.fr/international/live/2025/06/01/en-direct-guerre-en-ukraine-volodymyr-zelensky-salue-des-resultats-brillants-apres-une-attaque-de-drones-ukrainienne-d-ampleur-a-longue-portee_6609764_3210.html,https://www.lemonde.fr/international/live/2025/06/01/en-direct-guerre-en-ukraine-volodymyr-zelensky-salue-des-resultats-brillants-apres-une-attaque-de-drones-ukrainienne-d-ampleur-a-longue-portee_6609764_3210.html,0,www.lemonde.fr,"En direct, guerre en Ukraine : Volodymyr Zelensky salue des résultats « brillants » après une attaque de drones ukrainienne d’ampleur à « longue portée »","« Au total, 117 drones ont été utilisés dans le cadre de cette opération », a précisé le président ukrainien. Kiev revendique des dégâts sur l’aviation russe à hauteur de 7 milliards de dollars.",https://img.lemde.fr/2025/06/01/200/0/2400/1200/1440/720/60/0/0210fd3_ftp-import-images-1-7pumexae4dts-5075306-01-06.jpg,2025-06-01T19:57:12Z,,"LUkraine a mené, dimanche, une opération « dampleur visant à détruire des bombardiers ennemis » loin du front en Russie, a annoncé une source au sein du service de sécurité ukrainien (SBU), disant qu… [+2014 chars]",,fr,'Volodymyr Zelensky'
https://www.lemonde.fr/international/live/2025/06/02/en-direct-guerre-en-ukraine-volodymyr-zelensky-met-en-garde-poutine-ne-doit-rien-obtenir-qui-puisse-justifier-son-agression_6609764_3210.html,https://www.lemonde.fr/international/live/2025/06/02/en-direct-guerre-en-ukraine-volodymyr-zelensky-met-en-garde-poutine-ne-doit-rien-obtenir-qui-puisse-justifier-son-agression_6609764_3210.html,0,www.lemonde.fr,"En direct, guerre en Ukraine : Volodymyr Zelensky met en garde : « Poutine ne doit rien obtenir qui puisse justifier son agression »","A l’issue de pourparlers russo-ukrainiens à Istanbul, sous médiation turque, le président ukrainien a également annoncé, à Vilnius, « la préparation » d’un nouvel échange de prisonniers avec la Russie.",https://img.lemde.fr/2025/06/02/624/0/7489/3744/1440/720/60/0/190d392_ftp-import-images-1-8zlxi7r32wcr-641e399cb9ba443dbbdd333b6142e376-0-b16269c228604caea9e9b50cf7da00c3.jpg,2025-06-02T13:44:08Z,,"« Notre délégation est maintenant à Istanbul et nous sommes prêts à prendre les mesures nécessaires pour la paix. Naturellement, un point de départ serait un cessez-le-feu et des actions humanitaires… [+1773 chars]",,fr,'Poutine'
https://www.lemonde.fr/politique/article/2025/06/03/bruno-retailleau-agite-sans-trop-y-croire-la-menace-d-un-depart-du-gouvernement-en-cas-de-mise-en-place-de-la-proportionnelle_6610268_823448.html,https://www.lemonde.fr/politique/article/2025/06/03/bruno-retailleau-agite-sans-trop-y-croire-la-menace-d-un-depart-du-gouvernement-en-cas-de-mise-en-place-de-la-proportionnelle_6610268_823448.html,0,www.lemonde.fr,"Bruno Retailleau agite, sans trop y croire, la menace d’un départ du gouvernement en cas de mise en place de la proportionnelle","A l’issue d’un entretien avec François Bayrou lundi, le président des Républicains (LR), sous la pression du chef de file des députés LR, Laurent Wauquiez, a assuré que « toutes les options [seraient] ouvertes » si le premier ministre maintenait son projet de…",https://img.lemde.fr/2025/06/02/1/0/8192/5461/1440/960/60/0/f079d12_ftp-import-images-1-imu6yzt52dgw-5082743-01-06.jpg,2025-06-02T22:53:38Z,,"Bruno Retailleau (au centre), Laurent Wauquiez et Mathieu Darnaud, à lHôtel de Matignon, à Paris, le 2 juin 2025. THIBAUD MORITZ/AFP
Réelle menace ou habile précaution tactique ? La phrase laisse li… [+1539 chars]",,fr,'Laurent Wauquiez'
https://www.lexpress.fr/monde/europe/pourquoi-lallemagne-va-poursuivre-ses-refoulements-a-la-frontiere-malgre-un-revers-judiciaire-J5UWVLJEOFHDDJCDLYDJMNRG6I/,https://www.lexpress.fr/monde/europe/pourquoi-lallemagne-va-poursuivre-ses-refoulements-a-la-frontiere-malgre-un-revers-judiciaire-J5UWVLJEOFHDDJCDLYDJMNRG6I/,0,www.lexpress.fr,Pourquoi l'Allemagne va poursuivre ses refoulements à la frontière malgré un revers judiciaire,"Mis en place depuis l’arrivée du nouveau chancelier Friedrich Merz, le retour des refoulements d’étrangers à la frontière allemande a été jugé illégal par un tribunal de Berlin. Mais l’exécutif compte poursuivre sa politique.",https://www.lexpress.fr/resizer/v2/N3XV5BZJ7VEY5EGTOB2C6DBT4A.jpg?auth=ca7be6f0d472048c3a8b08bbd24cf2b97a7f95cf66fbeb529e5f6060cc14aeaa&width=1200&height=630&quality=85&focal=962%2C499,2025-06-03T06:38:08Z,https://web.archive.org/web/20250603065428/https://www.lexpress.fr/monde/europe/pourquoi-lallemagne-va-poursuivre-ses-refoulements-a-la-frontiere-malgre-un-revers-judiciaire-J5UWVLJEOFHDDJCDLYDJMNRG6I/,"Une politique qui fait débat outre-Rhin. Elu dans la douleur le 6 mai dernier chancelier allemand par le Bundestag, Friedrich Merz avait promis durant sa campagne de diminuer le nombre dimmigrés accu… [+5140 chars]",,fr,'Alexander Dobrindt'
https://www.frenchweb.fr/penser-contre-son-epoque-la-philosophie-de-peter-thiel/454401,https://www.frenchweb.fr/penser-contre-son-epoque-la-philosophie-de-peter-thiel/454401,0,www.frenchweb.fr,"Penser contre son époque, la philosophie de Peter Thiel","À Miami, dans un bureau discret loin de la Silicon Valley, Peter Thiel ne construit plus seulement des startups mais bâtit une contre-société. Il finance des candidats radicaux, investit dans des technologies de défense algorithmique, et défend une vision trè…",https://www.frenchweb.fr/wp-content/uploads/2025/05/peter-thiel-mj.png,2025-06-03T07:31:19Z,https://web.archive.org/web/20250603073147/https://www.frenchweb.fr/penser-contre-son-epoque-la-philosophie-de-peter-thiel/454401,"À Miami, dans un bureau discret loin de la Silicon Valley, Peter Thiel ne construit plus seulement des startups mais bâtit une contre-société. Il finance des candidats radicaux, investit dans des tec… [+6721 chars]",,fr,'nan Si'
https://www.courrierinternational.com/article/economie-les-allemands-devraient-ils-travailler-plus_231503,https://www.courrierinternational.com/article/economie-les-allemands-devraient-ils-travailler-plus_231503,0,www.courrierinternational.com,Les Allemands devraient-ils travailler plus ?,Le chancelier chrétien-démocrate Friedrich Merz a récemment laissé entendre que ses compatriotes devraient travailler davantage afin de redresser le pays. Ce qui pousse la presse d’outre-Rhin à s’interroger : les Allemands sont-ils devenus paresseux ? Ou les …,https://focus.courrierinternational.com/2025/05/30/0/0/5500/3666/1200/630/60/0/b404919_ftp-import-images-1-2qdkh3zyf2vp-2025-05-30t152144z-795956380-rc26rea05a5k-rtrmadp-3-germany-tech-tax.JPG,2025-06-03T08:17:55Z,,"Friedrich Merz a touché un point sensible et on dirait que ça fait mal, annonce le journal centriste Der Spiegel. Peu de temps après son investiture, le chancelier chrétien-démocrate a laissé entendr… [+1000 chars]",,fr,'Friedrich Merz'
https://iphoneaddict.fr/post/news-407540-oepnai-souhaite-chatgpt-puisse-totalement-remplacer-siri,https://iphoneaddict.fr/post/news-407540-oepnai-souhaite-chatgpt-puisse-totalement-remplacer-siri,0,iphoneaddict.fr,OepnAI souhaite que ChatGPT puisse totalement remplacer Siri,"OpenAI ne veut pas seulement être le partenaire d’Apple pour certaines fonctions d’IA d’iOS et iPadOS. Si l’on en croit en effet des documents juridiques liés au procès antitrust en cours ciblant Google, les ambitions sont beaucoup plus vastes concernant la s…",https://static.iphoneaddict.fr/wp-content/uploads/2023/06/ChatGPT-Logo-Icone-Application-iPhone.jpg,2025-06-03T09:05:38Z,,OpenAI ne veut pas seulement être le partenaire d’Apple pour certaines fonctions d’IA d’iOS et iPadOS. Si l’on en croit en effet des documents juridiques liés au procès antitrust en cours ciblant Goo… [+1786 chars],,fr,'Sam Altman'
https://www.lalibre.be/international/europe/2025/06/03/friedrich-merz-nest-pas-pret-a-baisser-les-bras-sur-limmigration-lunion-chretienne-democrate-joue-avec-le-feu-Y6CZOWIOXFCA3BE7CCE4PQGB54/,https://www.lalibre.be/international/europe/2025/06/03/friedrich-merz-nest-pas-pret-a-baisser-les-bras-sur-limmigration-lunion-chretienne-democrate-joue-avec-le-feu-Y6CZOWIOXFCA3BE7CCE4PQGB54/,0,www.lalibre.be,"Friedrich Merz n’est pas prêt à baisser les bras sur l’immigration: ""L’Union chrétienne-démocrate joue avec le feu""","Malgré une décision de justice contraire, le chancelier annonce maintenir les refoulements de demandeurs d’asile aux frontières du pays. ...",https://www.lalibre.be/resizer/v2/VMYWBQGQ3BAXLCW4XWMKQUCKWY.jpg?auth=74e716699de9f9d82b21cf06d316df8408cbec544917c9bbb3adbdbec6343d54&width=1200&height=630&quality=85&focal=3000%2C2000&watermark=https%3A%2F%2Fcloudfront-eu-central-1.images.arcpublishing.com%2Fipmgroup%2F3R4IDPARFVEO3L2LC5OCCXQ5RM.png%3A100%3A0%2C557,2025-06-03T17:41:57Z,https://web.archive.org/web/20250604043731/https://www.lalibre.be/international/europe/2025/06/03/friedrich-merz-nest-pas-pret-a-baisser-les-bras-sur-limmigration-lunion-chretienne-democrate-joue-avec-le-feu-Y6CZOWIOXFCA3BE7CCE4PQGB54/,"Mis en place le 8 mai, au premier jour de l'entrée en fonction du ministre de l'Intérieur, Alexander Dobrindt, ces refoulements aux frontières, même de demandeurs d'asile hors mineurs, femmes enceint… [+3110 chars]",,fr,'Alexander Dobrindt'
https://www.lalibre.be/international/amerique/2025/06/04/le-temps-presse-trump-passe-a-50-la-surtaxe-sur-lacier-et-laluminium-G5MRO7DQFJBTRJHXSGQJQ63F7Y/,https://www.lalibre.be/international/amerique/2025/06/04/le-temps-presse-trump-passe-a-50-la-surtaxe-sur-lacier-et-laluminium-G5MRO7DQFJBTRJHXSGQJQ63F7Y/,0,www.lalibre.be,"""Le temps presse"": Trump passe à 50% la surtaxe sur l'acier et l'aluminium","Le président américain Donald Trump a doublé la mise mercredi sur les importations d'acier et d'aluminium, en portant les droits de douane sectoriels à 50%, alors que les négociations avec plusieurs partenaires commerciaux des Etats-Unis doivent se tenir dans…",https://www.lalibre.be/resizer/v2/RCEKNHUUE5CKDL6OM6BFZ5KFKY.jpg?auth=1a16568e42c46e4709cfdfe06aecb138c51998db133ea0c0bfcbcbf26905037d&width=1200&height=630&quality=85&focal=2080%2C2600&watermark=https%3A%2F%2Fcloudfront-eu-central-1.images.arcpublishing.com%2Fipmgroup%2F3R4IDPARFVEO3L2LC5OCCXQ5RM.png%3A100%3A0%2C557,2025-06-04T05:07:24Z,https://web.archive.org/web/20250605013106/https://www.lalibre.be/international/amerique/2025/06/04/le-temps-presse-trump-passe-a-50-la-surtaxe-sur-lacier-et-laluminium-G5MRO7DQFJBTRJHXSGQJQ63F7Y/,"L'acier et l'aluminium ont été le premier secteur concerné par les droits de douane voulus par Donald Trump, avec l'entrée en vigueur d'une surtaxe de 25% le 12 mars, dans la volonté affichée d'incit… [+3982 chars]",,fr,'Donald Trump'
https://www.dhnet.be/actu/economie/2025/06/04/absurde-illegal-et-injustifie-trump-passe-a-50-la-surtaxe-sur-lacier-et-laluminium-QRBZD2Z2LNCNXI3YTBMJLKZRIE/,https://www.dhnet.be/actu/economie/2025/06/04/absurde-illegal-et-injustifie-trump-passe-a-50-la-surtaxe-sur-lacier-et-laluminium-QRBZD2Z2LNCNXI3YTBMJLKZRIE/,0,www.dhnet.be,"""Absurde"", ""illégal et injustifié"": Trump passe à 50% la surtaxe sur l'acier et l'aluminium",Donald Trump a annoncé que les droits de douane sur l'acier et l'aluminium passaient à 50%. ...,https://www.dhnet.be/resizer/v2/X52ZOVYEL5BAJDYTZX3FHB3OFM.jpg?auth=338ee8a2360b56d7f377e0d21fe074b387197312f5186de3de74654afd4060e7&width=1200&height=630&quality=85&focal=1605%2C1070&watermark=https%3A%2F%2Fcloudfront-eu-central-1.images.arcpublishing.com%2Fipmgroup%2FDZNGDE46VVGXRGHD3TEI5RB3GM.png%3A100%3A0%2C559,2025-06-04T06:50:02Z,https://web.archive.org/web/20250604070332/https://www.dhnet.be/actu/economie/2025/06/04/absurde-illegal-et-injustifie-trump-passe-a-50-la-surtaxe-sur-lacier-et-laluminium-QRBZD2Z2LNCNXI3YTBMJLKZRIE/,"""Même si les droits de douane imposés jusqu'ici ont apporté un soutien essentiel aux prix sur le marché américain, ils n'ont pas permis à ces industries de développer et de maintenir un taux d'utilis… [+4030 chars]",,fr,'Donald Trump'
https://atlantico.fr/article/decryptage/la-ministre-de-la-justice-allemande-se-prononce-pour-une-interdiction-de-lafd-au-nom-de-la-defense-de-la-democratie,https://atlantico.fr/article/decryptage/la-ministre-de-la-justice-allemande-se-prononce-pour-une-interdiction-de-lafd-au-nom-de-la-defense-de-la-democratie,0,atlantico.fr,La ministre de la Justice allemande se prononce pour une interdiction de l’AfD au nom de la défense de… la démocratie,"Stefanie Hubig affirme que l'État doit agir si l'AfD menace la démocratie, mais elle n'apporte aucune preuve de la manière dont il le fait.",https://atlantico.codexcdn.net/assets/asJiJdbrpu5ZascHb.jpg?width=650&height=500&quality=75,2025-06-04T08:37:05Z,,"Javier Villamor est un journaliste et analyste espagnol. Basé à Bruxelles, il couvre les affaires de l'OTAN et de l'UE sur europeanconservative.com. Javier a plus de 17 ans d'expérience dans les doma… [+215 chars]",,fr,'Stefanie Hubig'
https://www.20minutes.fr/arts-stars/people/4156536-20250604-venise-mariage-venir-jeff-bezos-lauren-sanchez-vraiment-teuf-siecle,https://www.20minutes.fr/arts-stars/people/4156536-20250604-venise-mariage-venir-jeff-bezos-lauren-sanchez-vraiment-teuf-siecle,0,www.20minutes.fr,"Venise : Le mariage à venir de Jeff Bezos et Lauren Sanchez, vraiment la teuf du siècle ?","Dans notre chronique « Pendant ce temps chez les milliardaires » sur 20 Minutes TV, on s’intéresse au rendez-vous (glamour ?) du début d’été : le mariage du patron d’Amazon en Italie fin juin",https://img.20mn.fr/QK1PyNJLSlK7VT0yRUnXyCk/1444x920_lauren-sanchez-jeff-bezos-attend-the-11th-breakthrough-prize-ceremony-at-barker-hangar-on-april-05-2025-in-santa-monica-california-photo-cra-sh-image-space-sipa-usa-60625911-cf-2504070051,2025-06-04T09:02:36Z,,"Si vous avez prévu fin juin de faire une petite escapade à Venise, en Italie, vous serez aux premières loges - ou pas loin - pour assister au mariage de lannée : lunion entre Jeff Bezos, le patron dA… [+619 chars]",,fr,'Katy Perry'
https://www.lalibre.be/economie/conjoncture/2025/06/04/pour-eviter-la-justice-donald-trump-est-force-de-changer-de-strategie-sur-les-taxes-douanieres-MZ5BHUFDIRASBM6BHCBHBQ3Q4A/,https://www.lalibre.be/economie/conjoncture/2025/06/04/pour-eviter-la-justice-donald-trump-est-force-de-changer-de-strategie-sur-les-taxes-douanieres-MZ5BHUFDIRASBM6BHCBHBQ3Q4A/,0,www.lalibre.be,"Pour éviter la justice, Donald Trump est forcé de changer de stratégie sur les taxes douanières","Donald Trump a annoncé doubler les taxes douanières sur l’acier et l’aluminium (à 50 %). Une décision drastique, qui cache des réalités contrastées pour l’administration du président. ...",https://www.lalibre.be/resizer/v2/6IGQXY5SYRAKHH4AQBFOVFVT6A.jpg?auth=2b9d8b72c1a00ea1f92554e0f693e9e4870746bb814ae1cc2732ef1ee336bb33&width=1200&height=630&quality=85&focal=2645%2C1763&watermark=https%3A%2F%2Fcloudfront-eu-central-1.images.arcpublishing.com%2Fipmgroup%2FN2W5JL3V7JEUTOYYZCW5FAG7M4.png%3A100%3A0%2C557,2025-06-04T14:02:21Z,http://archive.md/20250604160910/https://www.lalibre.be/economie/conjoncture/2025/06/04/pour-eviter-la-justice-donald-trump-est-force-de-changer-de-strategie-sur-les-taxes-douanieres-MZ5BHUFDIRASBM6BHCBHBQ3Q4A/,"1. Donald Trump change de cap, malgré lui
Pour implanter ses tarifs douaniers, Donald Trump surfe sur une loi américaine. L'International Emergency Economic Powers Act (IEEPA) permet, ""en cas d'urge… [+7648 chars]",,fr,'Katherina Reiche'
https://www.phonandroid.com/cetait-inevitable-il-y-aura-bien-un-film-sur-chatgpt-et-son-patron-charismatique.html,https://www.phonandroid.com/cetait-inevitable-il-y-aura-bien-un-film-sur-chatgpt-et-son-patron-charismatique.html,0,www.phonandroid.com,C’était inévitable : il y aura bien un film sur ChatGPT et son patron charismatique (et on connaît déjà l’histoire),"ChatGPT, OpenAI et le patron de la firme Sam Altman seront au coeur d'un film qui arrive bientôt au cinéma. L'histoire elle-même se centrera sur une période particulièrement difficile fin 2023. Voici ce que l'on sait du projet. Amazon MGM...",https://wp-pa.phonandroid.com/uploads/2024/03/Sam-Altman-OpenAI.jpg,2025-06-04T16:47:18Z,,"ChatGPT, OpenAI et le patron de la firme Sam Altman seront au coeur d'un film qui arrive bientôt au cinéma. L'histoire elle-même se centrera sur une période particulièrement difficile fin 2023. Voici… [+1986 chars]",,fr,'Sam Altman'
https://www.20minutes.fr/monde/israel/4157173-20250605-israel-pourquoi-allemagne-favorable-reconnaissance-etat-palestinien,https://www.20minutes.fr/monde/israel/4157173-20250605-israel-pourquoi-allemagne-favorable-reconnaissance-etat-palestinien,0,www.20minutes.fr,Israël : Pourquoi l’Allemagne n’est pas favorable à la reconnaissance d’un Etat palestinien,"L’Allemagne s’oppose à la reconnaissance d’un État palestinien, le chef de la diplomatie allemande Johann Wadephul déclarant que « ce processus doit être mené dans le cadre de négociations entre Israël et les Palestiniens »",https://img.20mn.fr/qFPusbJvTZuHL_SH57QbICk/1444x920_05-june-2025-berlin-foreign-minister-johann-wadephul-r-cdu-and-his-israeli-counterpart-gideon-saar-say-goodbye-after-joint-talks-following-the-press-conference-photo-kay-nietfeld-dpa-urn-newsml-dpa-com-20090101-250605-99-75169-kay-nietfeld-dpa-sipa-2506051517,2025-06-05T16:06:13Z,,"La reconnaissance dun Etat palestinien serait « un mauvais signal », a déclaré jeudi le chef de la diplomatie allemande. Il prend ainsi le contrepied dun mouvement en ce sens de plusieurs pays europé… [+2285 chars]",,fr,'Johann Wadephul'
https://www.lemonde.fr/international/article/2025/06/06/pour-donald-trump-l-ukraine-et-la-russie-sont-deux-enfants-qui-se-battent-dans-un-parc_6610749_3210.html,https://www.lemonde.fr/international/article/2025/06/06/pour-donald-trump-l-ukraine-et-la-russie-sont-deux-enfants-qui-se-battent-dans-un-parc_6610749_3210.html,0,www.lemonde.fr,"Pour Donald Trump, l’Ukraine et la Russie sont deux enfants qui « se battent dans un parc »","Le président américain, qui a reçu le chancelier allemand, Friedrich Merz, jeudi, a laissé entendre qu’il faudrait « mieux laisser se battre pendant un temps » la Russie et l’Ukraine, placées sur le même pied.",https://img.lemde.fr/2025/06/05/0/0/7221/4814/1440/960/60/0/43ed983_sirius-fs-upload-1-b9ypzum3ci0y-1749140886022-485426.jpg,2025-06-06T02:45:05Z,,"Le chancelier allemand, Friedrich Merz, et le président américain, Donald Trump, lors dune réunion dans le bureau Ovale de la Maison Blanche à Washington, DC, le 5 juin 2025. BRENDAN SMIALOWSKI / AFP… [+1703 chars]",,fr,'Friedrich Merz'
https://www.franceinfo.fr/internet/elon-musk/videos-je-ne-crois-plus-que-la-liberte-et-la-democratie-soient-compatibles-comment-des-grands-patrons-de-la-tech-americaine-influencent-donald-trump_7277634.html,https://www.franceinfo.fr/internet/elon-musk/videos-je-ne-crois-plus-que-la-liberte-et-la-democratie-soient-compatibles-comment-des-grands-patrons-de-la-tech-americaine-influencent-donald-trump_7277634.html,0,www.franceinfo.fr,"VIDEOS. ""Je ne crois plus que la liberté et la démocratie soient compatibles"" : comment des grands patrons de la tech américaine influencent Donald Trump","Une enquête intitulée ""Technofascisme ? Les barons de la Silicon Valley à l'assaut de la démocratie"" est diffusée vendredi soir sur franceinfo, canal 16 de la TNT. Elle questionne l'influence de milliardaires prônant une idéologie libertarienne ou réactionnai…",https://www.franceinfo.fr/pictures/bChM7IFz2JxmTjdv0LrY9CLVpzk/0x0:888x501/1500x843/2025/06/03/silicon-683ee3ab4b024433376064.jpg,2025-06-06T03:36:23Z,https://web.archive.org/web/20250606035322/https://www.franceinfo.fr/internet/elon-musk/videos-je-ne-crois-plus-que-la-liberte-et-la-democratie-soient-compatibles-comment-des-grands-patrons-de-la-tech-americaine-influencent-donald-trump_7277634.html,"Une enquête intitulée ""Technofascisme ? Les barons de la Silicon Valley à l'assaut de la démocratie"" est diffusée vendredi soir sur franceinfo, canal 16 de la TNT. Elle questionne l'influence de mill… [+6871 chars]",,fr,'nan nan'
https://www.agoravox.fr/tribune-libre/article/de-quoi-merz-va-t-il-parler-avec-261383,https://www.agoravox.fr/tribune-libre/article/de-quoi-merz-va-t-il-parler-avec-261383,0,www.agoravox.fr,De quoi Merz va-t-il parler avec Trump dans le Bureau Ovale ?,"À Washington, le chancelier allemand, Friedrich Merz, sera le « porte-parole » de l'UE. Celui-ci, qui vient d'arriver à Washington pour rencontrer Donald Trump, est confronté à une grave crise dans les relations américano-allemandes. La visite officielle du c…",https://www.agoravox.fr/local/cache-vignettes/L476xH268/Merz_Washington-b1b24.jpg,2025-06-06T06:46:52Z,,"À Washington, le chancelier allemand, Friedrich Merz, sera le « porte-parole » de l’UE. Celui-ci, qui vient d’arriver à Washington pour rencontrer Donald Trump, est confronté à une grave crise dans l… [+5369 chars]",,fr,'Friedrich Merz'
https://atlantico.fr/article/decryptage/derriere-la-chute-de-la-coalition-gouvernementale-neerlandaise-le-redoutable-dilemme-des-populistes-europeens,https://atlantico.fr/article/decryptage/derriere-la-chute-de-la-coalition-gouvernementale-neerlandaise-le-redoutable-dilemme-des-populistes-europeens,0,atlantico.fr,"Derrière la chute de la coalition gouvernementale néerlandaise, le redoutable dilemme des populistes européens","Aux Pays-Bas, la coalition gouvernementale menace d’exploser face à l’intransigeance de Geert Wilders sur la question migratoire. La possible éviction de la ministre de l’Immigration illustre les dilemmes profonds auxquels sont confrontés les partis populiste…",https://atlantico.codexcdn.net/assets/as4G7ZFRHvYHhijq0.jpg?width=650&height=500&quality=75,2025-06-06T09:02:29Z,,"CHUTEAux Pays-Bas, la coalition gouvernementale menace dexploser face à lintransigeance de Geert Wilders sur la question migratoire. La possible éviction de la ministre de lImmigration illustre les d… [+450 chars]",,fr,'Geert Wilders'
