index,url,valid,domain,title,description,image,published,archive,content,quote,language,keyword
https://www.journaldugeek.com/2024/10/05/le-patron-de-netflix-soutient-kamala-harris-les-conservateurs-se-desabonnent/,https://www.journaldugeek.com/2024/10/05/le-patron-de-netflix-soutient-kamala-harris-les-conservateurs-se-desabonnent/,0,www.journaldugeek.com,"Le patron de Netflix soutient Kamala Harris, les conservateurs se désabonnent","Netflix a essuyé une hausse importante des annulations d'abonnements aux États-Unis au mois de juillet, après le soutien de son cofondateur Reed Hastings à la campagne de Kamala Harris. Une situation qui n'a pas duré bien longtemps, mais qui révèle les tensio…",https://www.journaldugeek.com/app/uploads/2024/10/netflix.jpg,2024-10-05T12:02:07Z,,"Netflix a subi une augmentation soudaine des annulations d’abonnements aux États-Unis à la suite de l’annonce publique du soutien de Reed Hastings, le cofondateur et président du conseil d’administra… [+3544 chars]",,fr,'Kamala Harris'
https://www.monde-diplomatique.fr/2024/10/FRANK/67651,https://www.monde-diplomatique.fr/2024/10/FRANK/67651,0,www.monde-diplomatique.fr,Kamala Harris ou l'illusion du changement,"Qui est Mme Kamala Harris et que propose-t-elle ? Candidate du Parti démocrate sans avoir fait campagne, la vice-présidente a revigoré son camp. Cependant, l’adulation qui l’entoure ne renvoie ni à son action passée ni à son programme, mais à l’espoir qu’elle…",https://www.monde-diplomatique.fr/IMG/arton67651.jpg,2024-10-05T13:43:58Z,http://archive.md/20241009132446/https://www.monde-diplomatique.fr/2024/10/FRANK/67651,"Robin Kid. — « We Too Have a Job to Do ! » (Nous aussi, nous avons un travail à faire !), de la série « Searching for America » (À la recherche de lAmérique), 2023-2024
© Robin Kid, galerie Templon… [+2019 chars]",,fr,'Kamala Harris'
https://www.ledauphine.com/politique/2024/10/05/les-manifestations-ecolos-criminalisees-les-militants-risqueront-la-prison,https://www.ledauphine.com/politique/2024/10/05/les-manifestations-ecolos-criminalisees-les-militants-risqueront-la-prison,0,www.ledauphine.com,"Italie. Les manifestations écolos criminalisées, les militants risqueront la prison","L’Italie de Giorgia Meloni s’attaque aux manifestants climatiques. Le texte, baptisé “anti-Gandhi” par ses opposants car il vise les militants pacifiques, doit être adopté dans les jours qui viennent.",https://cdn-s-www.ledauphine.com/images/4C5F1570-9680-49E6-BF76-577CBD7D557B/FB1200/photo-1728140942.jpg,2024-10-05T16:10:00Z,https://web.archive.org/web/20241005163931/https://www.ledauphine.com/politique/2024/10/05/les-manifestations-ecolos-criminalisees-les-militants-risqueront-la-prison,"Bloquer une route pour protester contre linaction climatique? Le gouvernement italien de Giorgia Meloni entend frapper fort contre les manifestants, même pacifiques, visant en particulier les militan… [+3186 chars]",,fr,'Giorgia Meloni'
https://www.lemonde.fr/politique/live/2024/10/05/l-actualite-politique-en-direct-est-ce-que-l-immigration-c-est-mauvais-la-reponse-est-non-affirme-emmanuel-macron_6342223_823448.html,https://www.lemonde.fr/politique/live/2024/10/05/l-actualite-politique-en-direct-est-ce-que-l-immigration-c-est-mauvais-la-reponse-est-non-affirme-emmanuel-macron_6342223_823448.html,0,www.lemonde.fr,"L’actualité politique, en direct : « Est-ce que l’immigration, c’est mauvais ? La réponse est non », affirme Emmanuel Macron","Le président de la République s’exprimait sur France Inter, comme en écho au ministre de l’intérieur, Bruno Retailleau, qui en a fait son cheval de bataille numéro un.",https://img.lemde.fr/2024/10/04/230/0/2761/1380/1440/720/60/0/79fab97_5874035-01-06.jpg,2024-10-05T16:22:28Z,,"Le leader de La France insoumise, Jean-Luc Mélenchon, a appelé, vendredi, à « mettre des drapeaux palestiniens partout où cest possible » à partir de mardi 8 octobre, en réaction à une circulaire du … [+2126 chars]",,fr,'président de la République'
https://www.francetvinfo.fr/monde/proche-orient/guerre/guerre-au-proche-orient-yael-braun-pivet-affirme-qu-elle-a-depose-une-trentaine-de-plaintes-pour-des-faits-antisemites-depuis-l-ete-2022_6820541.html,https://www.francetvinfo.fr/monde/proche-orient/guerre/guerre-au-proche-orient-yael-braun-pivet-affirme-qu-elle-a-depose-une-trentaine-de-plaintes-pour-des-faits-antisemites-depuis-l-ete-2022_6820541.html,0,www.francetvinfo.fr,"Guerre au Proche-Orient : Yaël Braun-Pivet affirme qu'elle a déposé ""une trentaine de plaintes pour des faits antisémites"" depuis l'été 2022","La présidente de l'Assemblée nationale rappelle, dans une interview avec Gérard Larcher au ""Parisien"", qu'elle a une protection policière depuis le 7-Octobre.",https://www.francetvinfo.fr/pictures/EH0b2tFfiV9nwGjpyJF63WUxE8c/0x899:8640x5756/1500x843/2024/10/05/080-hl-xbouzas-2530080-6701789b38578577657780.jpg,2024-10-05T17:36:46Z,https://web.archive.org/web/20241005182132/https://www.francetvinfo.fr/monde/proche-orient/guerre/guerre-au-proche-orient-yael-braun-pivet-affirme-qu-elle-a-depose-une-trentaine-de-plaintes-pour-des-faits-antisemites-depuis-l-ete-2022_6820541.html,"A la fin de son premier mandat de députée, elle affirmait à franceinfo qu'il fallait ""porter plainte systématiquement"" contre des propos et des actes antisémites. Deux ans et demi plus tard, devenue … [+1492 chars]",,fr,'Yaël Braun-Pivet'
https://www.marianne.net/monde/des-fillettes-pendues-a-une-branche-voulet-chanoine-la-colonne-de-sang-au-bout-du-cauchemar-colonial,https://www.marianne.net/monde/des-fillettes-pendues-a-une-branche-voulet-chanoine-la-colonne-de-sang-au-bout-du-cauchemar-colonial,0,www.marianne.net,"""Des fillettes pendues à une branche"" : Voulet-Chanoine, la colonne de sang au bout du cauchemar colonial","Comme le colonel Kurtz qui se taille une petite dictature à son image dans le « Apocalypse Now ! » (1979) de Francis Ford Coppola, ils ont marqué l'histoire par leur démesure et leur mégalomanie. Troisième épisode, avec les sinistres capitaines Voulet et Chan…",https://media.marianne.net/assets/asOJOBjbMGBhwHgFW.jpg?w=1540&h=924&r=fill,2024-10-06T09:00:00Z,https://web.archive.org/web/20241006113701/https://www.marianne.net/monde/des-fillettes-pendues-a-une-branche-voulet-chanoine-la-colonne-de-sang-au-bout-du-cauchemar-colonial,"Un câblogramme pour le gouverneur du Sénégal ! Il provient de Paris, du ministère des Colonies. Ce 17 avril 1899, le ministre Antoine Guillain écrit avoir eu vent d'« atrocités inutiles » sur le pass… [+1090 chars]",,fr,'Francis Ford Coppola'
https://www.marianne.net/monde/europe/s-ils-veulent-les-migrants-qu-ils-se-les-gardent-ecoterroristes-salvini-et-orban-vent-debout-contre-bruxelles,https://www.marianne.net/monde/europe/s-ils-veulent-les-migrants-qu-ils-se-les-gardent-ecoterroristes-salvini-et-orban-vent-debout-contre-bruxelles,0,www.marianne.net,"""S'ils veulent les migrants, qu'ils se les gardent"", ""écoterroristes"" : Salvini et Orban vent debout contre Bruxelles","L'Italien Matteo Salvini a ressorti sa rhétorique antieuropéenne aux côtés du Hongrois Viktor Orbán, ce dimanche 6 octobre, à l'occasion de la fête annuelle de son parti populiste d'extrême droite, Ligue. Migrants, règles agricoles et écologiques et attaques …",https://media.marianne.net/assets/asq5MwtetkSMDfgp3.jpg?w=1540&h=924&r=fill,2024-10-06T13:01:38Z,https://web.archive.org/web/20241006155231/https://www.marianne.net/monde/europe/s-ils-veulent-les-migrants-qu-ils-se-les-gardent-ecoterroristes-salvini-et-orban-vent-debout-contre-bruxelles,"Les deux leaders populistes étaient réunis pour la fête annuelle de la Ligue, le parti de Matteo Salvini.AFP or licensors
Par Marianne avec AFP
Publié le
06/10/2024 à 17:01
L'Italien Matteo Salvi… [+2882 chars]",,fr,'Viktor Orbán'
https://www.lexpress.fr/monde/trump-revient-sur-les-lieux-du-crime-ce-film-dhorreur-qui-linspire-le-pas-de-cote-de-melania-BBUJ37MENNDINO4NPIDFFYVBBM/,https://www.lexpress.fr/monde/trump-revient-sur-les-lieux-du-crime-ce-film-dhorreur-qui-linspire-le-pas-de-cote-de-melania-BBUJ37MENNDINO4NPIDFFYVBBM/,0,www.lexpress.fr,"Trump revient sur les lieux du crime, ce film d'horreur qui l'inspire, le pas de côté de Melania","Pas le temps de suivre la course à la Maison-Blanche ? L’Express vous résume ce qu’il faut savoir : le débat entre les colistiers, les nouveaux soutiens clés de Kamala Harris, et la nouvelle proposition sulfureuse de Trump pour la criminalité.",https://www.lexpress.fr/resizer/v2/I3HLCBZZPBDDFIQBO73VVGW24I.jpg?auth=8db3c313ab1e7859e9ece4f0bea4eba2936b041d3dfd93e58eb42d6bb1189d81&width=1200&height=630&quality=85&focal=711%2C352,2024-10-06T13:49:28Z,https://web.archive.org/web/20241006140431/https://www.lexpress.fr/monde/trump-revient-sur-les-lieux-du-crime-ce-film-dhorreur-qui-linspire-le-pas-de-cote-de-melania-BBUJ37MENNDINO4NPIDFFYVBBM/,"À moins dun mois de lélection présidentielle américaine du 5 novembre, lancien président républicain Donald Trump et sa rivale démocrate Kamala Harris tentent de convaincre les indécis. La semaine a … [+8287 chars]",,fr,'Bruce Springsteen'
https://www.francetvinfo.fr/monde/proche-orient/guerre/guerre-au-proche-orient-il-ne-faut-pas-desarmer-israel-previent-yael-braun-pivet-apres-les-propos-d-emmanuel-macron_6822011.html,https://www.francetvinfo.fr/monde/proche-orient/guerre/guerre-au-proche-orient-il-ne-faut-pas-desarmer-israel-previent-yael-braun-pivet-apres-les-propos-d-emmanuel-macron_6822011.html,0,www.francetvinfo.fr,"Guerre au Proche-Orient : ""Il ne faut pas désarmer Israël"", prévient Yaël Braun-Pivet après les propos d'Emmanuel Macron","La présidente de l'Assemblée nationale a déclaré qu'il n'y aurait ""pas de moment particulier"" au Palais-Bourbon en mémoire du 7-Octobre.",https://www.francetvinfo.fr/pictures/gArru8ICjdlX72ry5Ytbhiy_rxQ/0x899:8640x5756/1500x843/2024/10/06/080-hl-xbouzas-2531717-67029ebec212a826690732.jpg,2024-10-06T14:32:31Z,https://web.archive.org/web/20241006152005/https://www.francetvinfo.fr/monde/proche-orient/guerre/guerre-au-proche-orient-il-ne-faut-pas-desarmer-israel-previent-yael-braun-pivet-apres-les-propos-d-emmanuel-macron_6822011.html,"Sa position dénote par rapport à celle du chef de l'Etat. La présidente de l'Assemblée nationale, Yaël Braun-Pivet, a estimé dimanche 6 octobre qu'il ne fallait pas ""désarmer"" Israël, en réaction aux… [+1775 chars]",,fr,'Emmanuel Macron'
https://www.lalibre.be/international/europe/guerre-ukraine-russie/2024/10/06/guerre-en-ukraine-lopposant-russe-ildar-dadine-tue-sur-le-front-QDUEUNGHJRD4DL6ZZ7WLKWSHP4/,https://www.lalibre.be/international/europe/guerre-ukraine-russie/2024/10/06/guerre-en-ukraine-lopposant-russe-ildar-dadine-tue-sur-le-front-QDUEUNGHJRD4DL6ZZ7WLKWSHP4/,0,www.lalibre.be,Guerre en Ukraine : l'opposant russe Ildar Dadine tué sur le front,"L'opposant russe Ildar Dadine, qui avait été emprisonné en Russie pour des manifestations contre Vladimir Poutine, a été tué sur le front en Ukraine, où il combattait aux côtés des forces de Kiev, ont annoncé dimanche des proches et des médias russes. ...",https://www.lalibre.be/resizer/v2/MXAE4XHYQZEMLHV2OZCGEUOZ4Y.jpg?auth=9b70665546036deca915ddf0151126047a87a0ea3a1d6edabb24e6b602a7d96f&width=1200&height=630&quality=85&focal=2909%2C1935&watermark=https%3A%2F%2Fcloudfront-eu-central-1.images.arcpublishing.com%2Fipmgroup%2F3R4IDPARFVEO3L2LC5OCCXQ5RM.png%3A100%3A0%2C557,2024-10-06T15:36:31Z,,"Il a salué un ""combattant intrépide et déterminé"" qui était allé ""au front pour combattre le poutinisme"".
Selon M. Ponomarev, Ildar Dadine combattait aux côtés des forces armées ukrainiennes au sein… [+987 chars]",,fr,'Poutine'
https://www.dhnet.be/actu/monde/2024/10/06/guerre-en-ukraine-lopposant-russe-ildar-dadine-tue-sur-le-front-WNEREU64Y5CQLAEVMOIQSZPGRQ/,https://www.dhnet.be/actu/monde/2024/10/06/guerre-en-ukraine-lopposant-russe-ildar-dadine-tue-sur-le-front-WNEREU64Y5CQLAEVMOIQSZPGRQ/,0,www.dhnet.be,Guerre en Ukraine : l'opposant russe Ildar Dadine tué sur le front,"L'opposant russe Ildar Dadine, qui avait été emprisonné en Russie pour des manifestations contre Vladimir Poutine, a été tué sur le front en Ukraine, où il combattait aux côtés des forces de Kiev, ont annoncé dimanche des proches et des médias russes. ...",https://www.dhnet.be/resizer/v2/MXAE4XHYQZEMLHV2OZCGEUOZ4Y.jpg?auth=9b70665546036deca915ddf0151126047a87a0ea3a1d6edabb24e6b602a7d96f&width=1200&height=630&quality=85&focal=2909%2C1935&watermark=https%3A%2F%2Fcloudfront-eu-central-1.images.arcpublishing.com%2Fipmgroup%2FDZNGDE46VVGXRGHD3TEI5RB3GM.png%3A100%3A0%2C559,2024-10-06T15:40:32Z,,"Il a salué un ""combattant intrépide et déterminé"" qui était allé ""au front pour combattre le poutinisme"".
Selon M. Ponomarev, Ildar Dadine combattait aux côtés des forces armées ukrainiennes au sein… [+950 chars]",,fr,'Vladimir Poutine'
https://www.lexpress.fr/monde/europe/pour-que-lukraine-survive-lappel-de-deux-diplomates-americains-a-changer-de-strategie-face-a-poutine-TQCQXHWO4RE53NFCCKXQC6BSY4/,https://www.lexpress.fr/monde/europe/pour-que-lukraine-survive-lappel-de-deux-diplomates-americains-a-changer-de-strategie-face-a-poutine-TQCQXHWO4RE53NFCCKXQC6BSY4/,0,www.lexpress.fr,"""Pour que l’Ukraine survive…"" : l’appel de deux diplomates américains à changer de stratégie face à Poutine","Vétérans de la politique étrangère américaine, Richard Haass et Charles Kupchan appellent les Occidentaux à admettre ""l’inconfortable réalité"" sur l’Ukraine et à changer rapidement de stratégie.",https://www.lexpress.fr/resizer/v2/HHI3KSL5WFDFJGTRS62OIFNV44.jpg?auth=ffaea09ea1c683aea712c2ad432e7342578aeee5dd0e7f38d7fe2438edf794e2&width=1200&height=630&quality=85&focal=1060%2C508,2024-10-06T16:00:00Z,http://archive.md/20241006162955/https://www.lexpress.fr/monde/europe/pour-que-lukraine-survive-lappel-de-deux-diplomates-americains-a-changer-de-strategie-face-a-poutine-TQCQXHWO4RE53NFCCKXQC6BSY4/,On les a taxés de défaitistes et même didiots utiles de Moscou. Richard Haass et Charles Kupchan ont défrayé la chronique lannée dernière quand NBC News a révélé les négociations que ces deux diploma… [+13836 chars],,fr,'Poutine'
https://www.20minutes.fr/monde/ukraine/4113957-20241006-guerre-ukraine-opposant-russe-poutine-tue-front-russie-conquiert-village-956e-jour-guerre,https://www.20minutes.fr/monde/ukraine/4113957-20241006-guerre-ukraine-opposant-russe-poutine-tue-front-russie-conquiert-village-956e-jour-guerre,0,www.20minutes.fr,"Guerre en Ukraine : Un opposant russe à Poutine tué sur le front, la Russie conquiert un village au 956e jour de guerre","La Russie a lancé son « opération militaire » en Ukraine le 24 février 2022. Tous les soirs, 20 Minutes vous propose son récap du conflit russo-ukrainien.Une déclaration marquante, un chiffre-clé, les tendances de fond… Voici les informations essentielles",https://img.20mn.fr/fpYta4lzRiGtiB_xDNKsOCk/1444x920_a-local-resident-walks-next-to-destroyed-buildings-following-an-air-attack-in-kostyantynivka-eastern-donetsk-region-on-october-5-2024-amid-the-russian-invasion-of-ukraine-photo-by-roman-pilipey-afp,2024-10-06T17:17:25Z,,"Vous avez raté les derniers événements sur la guerre en Ukraine ? 20 Minutes fait le point pour vous tous les soirs. Entre les déclarations fortes, les avancées sur le front et le bilan des combats, … [+2594 chars]",,fr,'Poutine'
https://www.lalibre.be/international/amerique/elections-us/2024/10/06/donald-trump-rejoue-les-victimes-persecutees-sur-le-theatre-de-lattentat-CU327SU4YVGMDJ7BOU7PDOQBOY/,https://www.lalibre.be/international/amerique/elections-us/2024/10/06/donald-trump-rejoue-les-victimes-persecutees-sur-le-theatre-de-lattentat-CU327SU4YVGMDJ7BOU7PDOQBOY/,0,www.lalibre.be,Donald Trump rejoue les victimes persécutées sur le théâtre de l’attentat,"Le candidat républicain a tenu un meeting samedi à Butler, là où il faillit être assassiné le 13 juillet, en compagnie de son plus fervent allié : Elon Musk. ...",https://www.lalibre.be/resizer/v2/UNPXEUSLT5H73OSGNYBEBBA5UQ.jpg?auth=29507e237fc392f6633efb5eb5a19650b29fefc8422e77f551fdac4a77f868b4&width=1200&height=630&quality=85&focal=3168%2C2260&watermark=https%3A%2F%2Fcloudfront-eu-central-1.images.arcpublishing.com%2Fipmgroup%2F3R4IDPARFVEO3L2LC5OCCXQ5RM.png%3A100%3A0%2C557,2024-10-06T18:05:44Z,,"""Ces huit dernières années, ceux qui veulent nous arrêter m'ont calomnié, ont tenté de me destituer, m'ont poursuivi en justice, ont essayé de m'enlever des bulletins de vote et, qui sait, même peut-… [+4410 chars]",,fr,'Poutine'
https://www.francetvinfo.fr/monde/usa/presidentielle/presidentielle-americaine-au-c-ur-des-villes-industrielles_6822209.html,https://www.francetvinfo.fr/monde/usa/presidentielle/presidentielle-americaine-au-c-ur-des-villes-industrielles_6822209.html,0,www.francetvinfo.fr,"Présidentielle américaine 2024 : au cœur des villes industrielles, tiraillées entre Donald Trump et Kamala Harris","Direction, ce dimanche 6 octobre, l’Ohio et l’Indiana, deux Etats symboles d'une Amérique industrielle qui oscille en permanence entre l'espoir d’une renaissance et la fatigue des désillusions.",https://www.francetvinfo.fr/pictures/SW6pU99o2ccmn4VzznlzofN_pUU/0x9:830x476/1500x843/2024/10/06/usa-6702df06b4d20735616326.png,2024-10-06T19:18:10Z,https://web.archive.org/web/20241006195302/https://www.francetvinfo.fr/monde/usa/presidentielle/presidentielle-americaine-au-c-ur-des-villes-industrielles_6822209.html,"Prendre la route à la rencontre de lAmérique ouvrière, cest croiser dimmenses usines désaffectées, et traverser des villes abandonnées à leur sort. Comme Youngstown (Ohio, États-Unis), cité industrie… [+1227 chars]",,fr,'Donald Trump'
https://www.lemonde.fr/international/article/2024/10/07/en-italie-les-droites-radicales-a-la-fete-lors-du-rendez-vous-annuel-de-la-ligue-a-pontida_6345561_3210.html,https://www.lemonde.fr/international/article/2024/10/07/en-italie-les-droites-radicales-a-la-fete-lors-du-rendez-vous-annuel-de-la-ligue-a-pontida_6345561_3210.html,0,www.lemonde.fr,"En Italie, les droites radicales à la fête lors du rendez-vous annuel de la Ligue à Pontida","Sur l’invitation du chef du parti illibéral Matteo Salvini, le premier ministre hongrois Viktor Orban ou le Néerlandais Geert Wildeers ont martelé leurs antiennes sur « l’invasion de migrants » et « l’extrémisme islamiste » qui guetteraient l’Europe.",https://img.lemde.fr/2024/10/06/0/4/4491/2994/1440/960/60/0/68744e8_5887203-01-06.jpg,2024-10-07T03:00:06Z,https://web.archive.org/web/20241007033840/https://www.lemonde.fr/international/article/2024/10/07/en-italie-les-droites-radicales-a-la-fete-lors-du-rendez-vous-annuel-de-la-ligue-a-pontida_6345561_3210.html,"Lors du rendez-vous annuel de la Ligue à Pontida (Italie), le 6 octobre 2024. PIERO CRUCIATTI / AFP
Leur heure est arrivée, ils en sont convaincus. Le premier ministre hongrois, Viktor Orban, la pro… [+2821 chars]",,fr,'Matteo Salvini'
https://www.lavenir.net/sports/basket/2024/10/07/lebron-james-et-bronny-premier-duo-pere-fils-de-lhistoire-a-jouer-un-match-nba-video-HT6AJREHLZHDFDTHNE4A2TWEXE/,https://www.lavenir.net/sports/basket/2024/10/07/lebron-james-et-bronny-premier-duo-pere-fils-de-lhistoire-a-jouer-un-match-nba-video-HT6AJREHLZHDFDTHNE4A2TWEXE/,0,www.lavenir.net,"LeBron James et Bronny, premier duo père-fils de l'histoire à jouer un match NBA (vidéo)","LeBron James a, une nouvelle fois, marqué l'histoire de la NBA en jouant aux côtés de son fils Bronny pour les Los Angeles Lakers. Ce dernier, sélectionné par la franchise californienne au deuxième tour de la draft après avoir joué à l'Université de Californi…",https://www.lavenir.net/resizer/v2/3FPN5ZKF2ZCXTKMORM37CGKPII.jpg?auth=ee2ac6a894834315cc39d75f88db918687460bc3fa5e015c4fa2a24cdab12ee5&width=1200&height=630&quality=85&focal=3091%2C2062&watermark=https%3A%2F%2Fcloudfront-eu-central-1.images.arcpublishing.com%2Fipmgroup%2FUVYY255VT5BDBHOGCTGBCGI364.png%3A100%3A0%2C558,2024-10-07T06:36:33Z,,"Ce match a également marqué la première apparition de LeBron dans sa 22e saison en NBA, égalant ainsi un record, après avoir remporté une médaille d'or olympique avec les États-Unis à Paris. Bronny, … [+549 chars]",,fr,'Bronny James'
https://www.dhnet.be/sports/basket/2024/10/07/historique-lebron-james-et-bronny-premier-duo-pere-fils-de-lhistoire-a-jouer-un-match-nba-T7KDEBOMNVG6BHES6GX654CLHE/,https://www.dhnet.be/sports/basket/2024/10/07/historique-lebron-james-et-bronny-premier-duo-pere-fils-de-lhistoire-a-jouer-un-match-nba-T7KDEBOMNVG6BHES6GX654CLHE/,0,www.dhnet.be,"Historique : LeBron James et Bronny, premier duo père-fils de l'histoire à jouer un match NBA","LeBron James a, une nouvelle fois, marqué l'histoire de la NBA ! ...",https://www.dhnet.be/resizer/v2/56EAOO76SRH4DMBIS6VNBYXVDQ.jpg?auth=e9efb476448f326751748c6901ec34a7c956441c10217ea9e9fc51dfc0980a8b&width=1200&height=630&quality=85&focal=3263%2C2176&watermark=https%3A%2F%2Fcloudfront-eu-central-1.images.arcpublishing.com%2Fipmgroup%2F3WZLNJVGMFAQRHOXFC5ZVE3GU4.png%3A100%3A0%2C559,2024-10-07T06:38:05Z,,"Ils sont devenus le premier duo père-fils à jouer ensemble dans un match de NBA, qui plus est le jour du 20e anniversaire de Bronny. LeBron, âgé de 39 ans, est le meilleur marqueur de l'histoire de l… [+939 chars]",,fr,'Bronny James'
https://www.20minutes.fr/sport/basketball/nba/4114004-20241007-nba-surrealiste-lebron-james-joue-premiere-fois-match-fils-bronny,https://www.20minutes.fr/sport/basketball/nba/4114004-20241007-nba-surrealiste-lebron-james-joue-premiere-fois-match-fils-bronny,0,www.20minutes.fr,"NBA : « Surréaliste », LeBron James joue pour la première fois un match avec son fils Bronny","LeBron James et son fils Bronny, sont devenus le premier duo père-fils à disputer un match de NBA",https://img.20mn.fr/eI1T3cjvTkaMbA-nF9WOJik/1444x920_los-angeles-lakers-guard-bronny-james-9-right-steps-onto-the-court-with-los-angeles-lakers-forward-le-bron-james-23-during-the-first-half-of-a-preseason-nba-basketball-game-sunday-oct-6-2024-in-palm-desert-calif-ap-photo-william-liang-cawl102-24281102252372-2410070456,2024-10-07T07:08:01Z,,"LeBron James continue décrire lhistoire de la NBA. La légende du basket mondiale a joué aux côtés de son fils Bronny, pour la première fois dimanche lors du match de présaison entre les Los Angeles L… [+769 chars]",,fr,'LeBron James'
https://www.francetvinfo.fr/sports/basket/nba/nba-lebron-james-et-son-fils-bronny-ont-joue-pour-la-premiere-fois-ensemble-sous-le-maillot-des-lakers_6823334.html,https://www.francetvinfo.fr/sports/basket/nba/nba-lebron-james-et-son-fils-bronny-ont-joue-pour-la-premiere-fois-ensemble-sous-le-maillot-des-lakers_6823334.html,0,www.francetvinfo.fr,NBA : LeBron James et son fils Bronny ont joué pour la première fois ensemble sous le maillot des Lakers,"Bronny James a fêté ses 20 ans en disputant ses premières minutes avec son père, bientôt 40 ans, sous le maillot des Lakers, en match de présaison, dimanche.",https://www.francetvinfo.fr/pictures/uljO-z5mhWKg_mrXuRpj61qQbtw/0x18:1024x594/1500x843/2024/10/07/ap24281102252372-6703854862ded794424121.jpg,2024-10-07T08:06:42Z,,"Une association rêvée par LeBron James, devenue réalité. Pour la première fois, le meilleur marqueur de l'histoire de la NBA a joué avec son fils, Bronny, lors d'un match de présaison, dimanche 6 oct… [+2185 chars]",,fr,'LeBron James'
https://www.konbini.com/lifestyle/cest-historique-lebron-james-et-son-fils-bronny-james-ont-joue-leur-premier-match-de-nba-ensemble/,https://www.konbini.com/lifestyle/cest-historique-lebron-james-et-son-fils-bronny-james-ont-joue-leur-premier-match-de-nba-ensemble/,0,www.konbini.com,C’est historique : LeBron James et son fils Bronny James ont joué leur premier match de NBA ensemble,"LeBron James, meilleur marqueur de l’histoire de la NBA, et son fils Bronny sur un même parquet avec les Lakers, c’est fait ! Certes, il ne s’agit que d’un match de présaison, mais ""LeBron&fils"" ont joué...",https://cdn-www.konbini.com/files/2024/10/LeBron-James-Bronny-James-Lakers-1.jpg,2024-10-07T09:11:52Z,,"LeBron James, meilleur marqueur de lhistoire de la NBA, et son fils Bronny sur un même parquet avec les Lakers, cest fait ! Certes, il ne sagit que dun match de présaison, mais “LeBron&amp;fils” ont … [+3198 chars]",,fr,'LeBron James'
https://www.lemonde.fr/sport/article/2024/10/07/lebron-james-et-son-fils-bronny-disputent-un-premier-match-ensemble-avec-les-los-angeles-lakers_6345877_3242.html,https://www.lemonde.fr/sport/article/2024/10/07/lebron-james-et-son-fils-bronny-disputent-un-premier-match-ensemble-avec-les-los-angeles-lakers_6345877_3242.html,0,www.lemonde.fr,LeBron James et son fils Bronny disputent un premier match ensemble avec les Los Angeles Lakers,"Le meilleur marqueur de l’histoire de la NBA et son fils ont tous les deux participé, sous les mêmes couleurs, dimanche, à une rencontre de pré-saison.",https://img.lemde.fr/2024/10/07/1/0/6526/4350/1440/960/60/0/adde58e_5895713-01-06.jpg,2024-10-07T09:35:06Z,,"Bronny et LeBron James, à Palm Springs (Californie, Etats-Unis), le 6 octobre 2024. KATELYN MULCAHY / AFP
Cétait lun des objectifs symboliques de la fin de carrière de LeBron James et il a été attei… [+3490 chars]",,fr,'Bronny James'
