index,url,valid,domain,title,description,image,published,archive,content,quote,language,keyword
https://www.lexpress.fr/monde/amerique/presidentielle-americaine-biden-fait-de-sa-declaration-dimpots-un-argument-de-campagne-6FVD35CSPND6PK3XLNYBPBYRBI/,https://www.lexpress.fr/monde/amerique/presidentielle-americaine-biden-fait-de-sa-declaration-dimpots-un-argument-de-campagne-6FVD35CSPND6PK3XLNYBPBYRBI/,0,www.lexpress.fr,Présidentielle américaine : Biden fait de sa déclaration d’impôts un argument de campagne,"Le président américain Joe Biden a rendu publique lundi sa déclaration d’impôts, une tradition américaine de transparence au sommet de l’Etat, rompue par son futur adversaire lorsqu’il était à la Maison-Blanche.",https://www.lexpress.fr/resizer/euF9sfXjvhgjmyekQHOzf0OLoj4=/1200x630/filters:focal(1573x745:1583x755)/cloudfront-eu-central-1.images.arcpublishing.com/lexpress/YGRDBMYD5ND7HN3H7II3YKWW6I.jpg,2024-04-16T09:26:47Z,,"La tradition avait été rompue par Donald Trump. Elle est remise au goût du jour par Joe Biden, qui en fait un argument de confiance dans sa campagne face à Donald Trump. Le candidat démocrate a rendu… [+2318 chars]",,fr,'Jill Biden'
https://www.lemonde.fr/idees/article/2024/04/16/olaf-scholz-en-chine-les-dangers-du-chacun-pour-soi_6228137_3232.html,https://www.lemonde.fr/idees/article/2024/04/16/olaf-scholz-en-chine-les-dangers-du-chacun-pour-soi_6228137_3232.html,0,www.lemonde.fr,Olaf Scholz en Chine : les dangers du chacun pour soi,"En plaidant en Chine pour une compétition « ouverte et juste », le chancelier allemand semble ignorer que Pékin ne connaît que le rapport de force. Les Européens prennent le risque de s’affaiblir s’ils ne jouent pas groupés.",https://img.lemde.fr/2024/04/15/0/0/4999/3333/1440/960/60/0/cb68935_503e1f900a304ce5aba43ac4ba277ae1-0-d2ba41869e004332b9a218119f10342a.jpg,2024-04-16T10:00:06Z,,"La visite du chancelier allemand Olaf Scholz en Chine du dimanche 14 au mardi 16 avril, à la tête dune importante délégation économique, le prouve. Lorsquil sagit des relations avec lempire du Milieu… [+3302 chars]",,fr,'Olaf Scholz'
https://lignesdedefense.blogs.ouest-france.fr/archive/2024/04/16/ukraine-24564.html,https://lignesdedefense.blogs.ouest-france.fr/archive/2024/04/16/ukraine-24564.html,0,lignesdedefense.blogs.ouest-france.fr,Des aides US pour l'Ukraine: la Chambre des représentants des Etats-Unis décidera cette semaine,"Après des mois de différends politiques entre l'administration du démocrate Joe Biden et ses opposants républicains, la Chambre des représentants...",https://size.blogspirit.net/blogs.ouest-france.fr/lignesdedefense/560/media/02/01/1533364967.jpg,2024-04-16T11:29:33Z,https://web.archive.org/web/20240416134142/https://lignesdedefense.blogs.ouest-france.fr/archive/2024/04/16/ukraine-24564.html,"Après des mois de différends politiques entre l'administration du démocrate Joe Biden et ses opposants républicains, la Chambre des représentants des Etats-Unis votera dans les jours prochains sur de… [+1547 chars]",,fr,'Mike Johnson'
https://www.liberation.fr/international/la-russie-invitee-au-80e-anniversaire-du-debarquement-en-normandie-20240416_HARWSZHBH5BA5AVEJ6QCECSW2I/,https://www.liberation.fr/international/la-russie-invitee-au-80e-anniversaire-du-debarquement-en-normandie-20240416_HARWSZHBH5BA5AVEJ6QCECSW2I/,0,www.liberation.fr,La Russie invitée au 80e anniversaire du Débarquement en Normandie,"Comme en 2004 et 2014, le président russe Vladimir Poutine va recevoir un carton d’invitation pour l’évènement qui aura lieu le 6 juin prochain malgré le contexte de guerre en Ukraine.",https://www.liberation.fr/resizer/Nypgxi6HntBN9P_-an7gvb2HRuQ=/1200x630/filters:format(jpg):quality(70)/cloudfront-eu-central-1.images.arcpublishing.com/liberation/7C7DFLG7I5EOBKCFH5X7HFWWLU.jpg,2024-04-16T12:01:32Z,,"Malgré la guerre, la Russie reste la bienvenue. Selon une information dEurope 1, lElysée a prévu dinviter Vladimir Poutine ou lun de ses représentants à la cérémonie internationale organisée le 6 jui… [+1928 chars]",,fr,'Vladimir Poutine'
https://www.fark.com/comments/13223362/Mike-Johnson-grows-a-pair,https://www.fark.com/comments/13223362/Mike-Johnson-grows-a-pair,0,www.fark.com,Mike Johnson grows a pair [News],<table> <tr><td> </td><td> [link] [65 comments] </td></tr></table>,https://usrimg-full.fark.net/d/dC/fark_dCOF3VYNuq5rIDeD7SuqrOVHC4E.jpg?AWSAccessKeyId=JO3ELGV4BGLFW7Y3EZXN&Expires=1713758400&Signature=eEFJVzrdXwJwZErIouNQSYWNHKo%3D,2024-04-17T03:25:42Z,,"Three Crooked Squirrels:Three Crooked Squirrels: eurotrader: Three Crooked Squirrels: eurotrader: Three Crooked Squirrels: eurotrader: YabbaDabbaDouchebag: So far, this John Mikeson fellow has surpri… [+1136 chars]",,fr,'Mike Johnson'
https://www.ouest-france.fr/europe/ukraine/guerre-en-ukraine-conseil-otan-ukraine-des-obus-pour-kiev-le-point-sur-la-nuit-91ff3d45-e22e-4f1e-be54-e2579da669f5,https://www.ouest-france.fr/europe/ukraine/guerre-en-ukraine-conseil-otan-ukraine-des-obus-pour-kiev-le-point-sur-la-nuit-91ff3d45-e22e-4f1e-be54-e2579da669f5,0,www.ouest-france.fr,"Guerre en Ukraine. Conseil Otan-Ukraine, des obus pour Kiev… Le point sur la nuit",Le président ukrainien Volodymyr Zelensky a annoncé ce mardi 16 avril qu’il allait convoquer le conseil Otan-Ukraine pour évoquer la défense aérienne du pays. La République Tchèque affirme qu’une vingtaine de pays se sont engagés à acheter 500 000 obus à l’Uk…,https://media.ouest-france.fr/v1/pictures/MjAyNDA0ZjNlMTA2YjVlOWVkMTBhMTA0NWRiNWQ3ZTgwMmE3ZDM?width=1260&height=708&focuspoint=50%2C25&cropresize=1&client_id=bpeditorial&sign=253faaba07bc79b8ac3f92379164a3f594df203b1c6de84d21fd229a5d34f3b7,2024-04-17T03:47:59Z,https://web.archive.org/web/20240417053636/https://www.ouest-france.fr/europe/ukraine/guerre-en-ukraine-conseil-otan-ukraine-des-obus-pour-kiev-le-point-sur-la-nuit-91ff3d45-e22e-4f1e-be54-e2579da669f5,"Le jour se lève en Europe et un 784e jour de conflit armé souvre en Ukraine après le début de linvasion russe le 24 février 2022.
Ce mardi, Volodymyr Zelensky a une nouvelle fois réclamé une protect… [+5375 chars]",,fr,'Volodymyr Zelensky'
https://www.journaldugeek.com/2024/04/17/momox-amazon-vinted-vos-livres-doccasion-vont-bientot-couter-plus-cher/,https://www.journaldugeek.com/2024/04/17/momox-amazon-vinted-vos-livres-doccasion-vont-bientot-couter-plus-cher/,0,www.journaldugeek.com,"Momox, Amazon, Vinted… vos livres d’occasion vont bientôt coûter plus cher",Emmanuel Macron a annoncé sa volonté d'instaurer une taxe supplémentaire sur la vente de livres de seconde main.,https://www.journaldugeek.com/app/uploads/2024/04/livres.jpeg,2024-04-17T13:08:01Z,,"Après les frais de port obligatoires sur les livres neufs, la France veut porter un nouveau coup au marché de l’édition. Pendant sa visite au Festival du livre de Paris, qui sest terminé ce dimanche … [+3577 chars]",,fr,'Emmanuel Macron'
https://www.huffingtonpost.fr/politique/article/gabriel-attal-a-matignon-depuis-100-jours-ces-trois-defis-qui-l-attendent-pour-les-100-prochains_232713.html,https://www.huffingtonpost.fr/politique/article/gabriel-attal-a-matignon-depuis-100-jours-ces-trois-defis-qui-l-attendent-pour-les-100-prochains_232713.html,0,www.huffingtonpost.fr,"Gabriel Attal à Matignon depuis 100 jours, ces trois défis qui l’attendent pour les 100 prochains","Le Premier ministre avait promis « des actes rapides et concrets » après sa nomination. Trois mois plus tard, le bilan est en demi-teinte et l’avenir encore plus compliqué.",https://huffpost-focus.sirius.press/2024/04/17/282/0/5406/3040/1820/1023/75/0/2e4d48e_1713345271942-000-34nd9rb.jpg,2024-04-17T13:56:14Z,,"POLITIQUE - Pas « de belles paroles, de grandes tirades ou de beaux discours » mais « des actes rapides et concrets ». Voici ce que déclarait le Premier ministre Gabriel Attal le 30 janvier dernier d… [+6937 chars]",,fr,'Gabriel Attal'
https://www.lalibre.be/international/moyen-orient/2024/04/17/guerre-israel-hamas-netanyahu-dement-une-famine-a-gaza-reitere-le-droit-disrael-a-se-proteger-S3G5EHPNT5FSTM2EQUO275ZUSU/,https://www.lalibre.be/international/moyen-orient/2024/04/17/guerre-israel-hamas-netanyahu-dement-une-famine-a-gaza-reitere-le-droit-disrael-a-se-proteger-S3G5EHPNT5FSTM2EQUO275ZUSU/,0,www.lalibre.be,"Guerre Israël-Hamas: Netanyahu dément une famine à Gaza, réitère ""le droit"" d'Israël ""à se protéger""","Le Premier ministre israélien, Benjamin Netanyahu, a récusé mercredi toute ""allégation"" de famine dans la bande de Gaza et a réitéré ""le droit"" d'Israël ""à se protéger"", lors de rencontres avec les chefs de la diplomatie britannique et allemande à Jérusalem. …",https://www.lalibre.be/resizer/v2/ZV3RTF2MMZDDZIUSX7RBHBG64Q.jpg?auth=1ac21734accc451b00e34fa6e4bf175ca598466773acf70c41cd80dc11731cc1&width=1200&height=630&quality=85&focal=1500%2C1005&watermark=https%3A%2F%2Fcloudfront-eu-central-1.images.arcpublishing.com%2Fipmgroup%2F3R4IDPARFVEO3L2LC5OCCXQ5RM.png%3A100%3A0%2C557,2024-04-17T14:20:02Z,,"M. Netanyahu a aussi ""récusé les allégations des organisations internationales sur une famine à Gaza et a affirmé qu'Israël fait tout son possible sur la question humanitaire"".
La Belgique participe… [+1175 chars]",,fr,'Premier ministre'
https://www.courrierinternational.com/article/vu-de-l-etranger-la-russie-invitee-aux-commemorations-du-debarquement-en-france-mais-pas-vladimir-poutine,https://www.courrierinternational.com/article/vu-de-l-etranger-la-russie-invitee-aux-commemorations-du-debarquement-en-france-mais-pas-vladimir-poutine,0,www.courrierinternational.com,"La Russie invitée aux commémorations du débarquement en France, mais pas Vladimir Poutine","Les organisateurs des commémorations de la Libération ont fait savoir que le président russe n’était pas sur la liste des invités, mais que la Russie, en revanche, pourra être représentée. Rien de nouveau, pour les médias étrangers, qui rappellent que, depuis…",https://focus.courrierinternational.com/2024/04/17/0/0/4293/2545/1200/630/60/0/ad72812_1713347597552-000-dv1751869.jpg,2024-04-17T15:13:11Z,,"Emmanuel Macron était dans le Vercors, mardi 16 avril, pour rendre hommage aux maquisards, très actifs dans ce massif montagneux pendant la Seconde Guerre mondiale. Pour le président, il sagissait de… [+1087 chars]",,fr,'Poutine'
https://www.latribune.fr/economie/france/le-fmi-torpille-l-objectif-de-reduction-du-deficit-public-pour-2027-995543.html,https://www.latribune.fr/economie/france/le-fmi-torpille-l-objectif-de-reduction-du-deficit-public-pour-2027-995543.html,0,www.latribune.fr,Le FMI torpille l’objectif de réduction du déficit public pour 2027,"Alors que le gouvernement prévoit de faire passer le déficit public en dessous de 3% du PIB en 2027, le Fonds monétaire international (FMI) table sur un déficit de 4,3%. Après le carton rouge du Haut conseil des finances publiques (HCFÏP), c'est un nouveau ca…",https://static.latribune.fr/full_width/2356749/cazenave-le-maire.jpg,2024-04-17T15:35:00Z,,"Mauvaises nouvelles en cascade pour le gouvernement. Après des déficits plus élevés que prévus en 2023 et 2024, le Fonds monétaire international (FMI) et le Haut conseil des finances publiques (HCFP)… [+5899 chars]",,fr,'nan nan'
https://www.ledauphine.com/politique/2024/04/17/emmanuel-macron-a-vassieux-en-vercors-oui-j-etais-a-portee-de-baffes,https://www.ledauphine.com/politique/2024/04/17/emmanuel-macron-a-vassieux-en-vercors-oui-j-etais-a-portee-de-baffes,0,www.ledauphine.com,"Drôme. Emmanuel Macron à Vassieux-en-Vercors : « Oui, j'étais à portée de baffes... »","Ce mardi soir, juste après la commémoration des 80 ans de la Libération à Vassieux-en-Vercors, au moment de reprendre l'hélicoptère de l'armée de l'air qui patientait sur le terrain de rugby de la Chappelle-en-Vercors, le président Emmanuel Macron nous a acco…",https://cdn-s-www.ledauphine.com/images/2CE33168-C58E-4DEC-A364-FB0A53968183/FB1200/photo-1713368335.jpg,2024-04-17T15:36:00Z,,"Le Dauphiné Libéré, en tant que responsable de traitement, recueille dans ce formulaire des informations qui sont enregistrées dans un fichier informatisé par son Service Relations Clients, la finali… [+854 chars]",,fr,'Emmanuel Macron'
https://www.bfmtv.com/economie/economie-social/monde/conflit-au-proche-orient-emmanuel-macron-estime-que-l-ue-a-le-devoir-d-elargir-les-sanctions-contre-l-iran_AD-202404170784.html,https://www.bfmtv.com/economie/economie-social/monde/conflit-au-proche-orient-emmanuel-macron-estime-que-l-ue-a-le-devoir-d-elargir-les-sanctions-contre-l-iran_AD-202404170784.html,0,www.bfmtv.com,"Conflit au Proche-Orient: Emmanuel Macron estime que l'UE a le ""devoir"" d'élargir les sanctions contre l'Iran","""Nous sommes favorables à ce qu'il y ait des sanctions qui puissent viser aussi l'ensemble de ceux qui aident à faire des missiles, des drones qui ont été utilisés lors de l'attaque de samedi à dimanche"", a déclaré le président français.",https://images.bfmtv.com/iLv8pz7Xd_l0rpbYjqQkn3We7ig=/0x23:2032x1166/2032x0/images/Macron-1844308.jpg,2024-04-17T16:29:05Z,,"""Nous sommes favorables à ce qu'il y ait des sanctions qui puissent viser aussi l'ensemble de ceux qui aident à faire des missiles, des drones qui ont été utilisés lors de l'attaque de samedi à diman… [+657 chars]",,fr,'Emmanuel Macron'
https://www.bfmtv.com/politique/elections/europeennes/europeennes-le-pen-invite-a-son-tour-macron-a-dissoudre-l-assemblee-en-cas-d-echec-electoral_AV-202404170802.html,https://www.bfmtv.com/politique/elections/europeennes/europeennes-le-pen-invite-a-son-tour-macron-a-dissoudre-l-assemblee-en-cas-d-echec-electoral_AV-202404170802.html,0,www.bfmtv.com,"Européennes: Le Pen invite à son tour Macron à dissoudre l'Assemblée en cas d'""échec électoral""","Le président du Rassemblement national, Jordan Bardella a assuré ce mercredi matin sur BFMTV-RMC qu'il demanderait la dissolution de l'Assemblée nationale, s'il arrivait en tête des élections européennes le 9 juin prochain. Une position que partage la cheffe …",https://images.bfmtv.com/X1pP9FiaAbJHkQnfLL24VEHADJQ=/0x0:1920x1080/1920x0/images/La-presidente-du-groupe-Rassemblement-national-a-l-Assemblee-nationale-Marine-Le-Pen-le-17-avril-2024-a-La-Reunion-1846265.jpg,2024-04-17T16:39:43Z,,"Le président du Rassemblement national, Jordan Bardella a assuré ce mercredi matin sur BFMTV-RMC qu'il demanderait la dissolution de l'Assemblée nationale, s'il arrivait en tête des élections europée… [+1726 chars]",,fr,'Emmanuel Macron'
https://www.lexpress.fr/economie/deficit-public-moscovici-tacle-les-promesses-de-baisse-dimpots-de-macron-2EUPVV5A7ZEYFG3LKI6UN4TK5U/,https://www.lexpress.fr/economie/deficit-public-moscovici-tacle-les-promesses-de-baisse-dimpots-de-macron-2EUPVV5A7ZEYFG3LKI6UN4TK5U/,0,www.lexpress.fr,Déficit public : Moscovici tacle les promesses de baisse d’impôts de Macron,"Le gouvernement n'a ""pas les moyens"" de réaliser des baisses d'impôts sèches, selon le président du Haut Conseil des finances publiques (HCFP).",https://www.lexpress.fr/resizer/2VlwEphshx_MXczUBDcK8fZRtHc=/1200x630/filters:focal(1117x479:1127x489)/cloudfront-eu-central-1.images.arcpublishing.com/lexpress/JPNZ4O23WFDYXLZOJDALZYLMZA.jpg,2024-04-17T16:48:01Z,,"Pierre Moscovici, président du Haut Conseil des finances publiques (HCFP), a estimé ce mercredi 17 avril que le gouvernement ""navait pas les moyens"" au vu de létat de ses finances publiques, de faire… [+2102 chars]",,fr,'nan nan'
https://www.bfmtv.com/politique/elysee/emmanuel-macron-veut-une-grande-concertation-sur-les-violences-des-mineurs_AN-202404170824.html,https://www.bfmtv.com/politique/elysee/emmanuel-macron-veut-une-grande-concertation-sur-les-violences-des-mineurs_AN-202404170824.html,0,www.bfmtv.com,"Emmanuel Macron veut une ""grande concertation sur les violences des mineurs""","Lors du Conseil des ministres, le président a annoncé sa volonté de lancé un ""Grenelle"" sur la violence des mineurs. Gabriel Attal devrait en donner tous les détails ce jeudi lors d'un discours sur l'autorité.",https://images.bfmtv.com/ejWtclW4PAkBs4VK75kUTDLPZy4=/0x40:768x472/768x0/images/Le-president-francais-Emmanuel-Macron-ors-d-un-deplacement-a-Bergerac-dans-le-sud-ouest-de-la-France-le-11-avril-2024-1844081.jpg,2024-04-17T16:53:27Z,,"Lors du Conseil des ministres, le président a annoncé sa volonté de lancé un ""Grenelle"" sur la violence des mineurs. Gabriel Attal devrait en donner tous les détails ce jeudi lors d'un discours sur l… [+1797 chars]",,fr,'Gabriel Attal'
https://www.bfmtv.com/economie/economie-social/france/budget-2024-pas-besoin-de-loi-de-finances-rectificative-selon-thomas-cazenave_AD-202404170877.html,https://www.bfmtv.com/economie/economie-social/france/budget-2024-pas-besoin-de-loi-de-finances-rectificative-selon-thomas-cazenave_AD-202404170877.html,0,www.bfmtv.com,"Budget 2024: ""Pas besoin de loi de finances rectificative"" selon Thomas Cazenave",Certains parlementaires d'opposition plaidaient pour un projet de loi de finances rectificative afin de pouvoir voter sur les dix milliards d'euros d'économies supplémentaires décidés par le gouvernement pour redresser les finances publiques.,https://images.bfmtv.com/TU8raOdb_TxkzXOaG66DIHfbt-w=/0x47:768x479/768x0/images/Le-ministre-de-l-Economie-Bruno-Le-Maire-gauche-et-celui-des-Comptes-publics-Thomas-Cazenave-le-27-septembre-2023-a-l-Elysee-a-Paris-1758495.jpg,2024-04-17T17:45:10Z,,Certains parlementaires d'opposition plaidaient pour un projet de loi de finances rectificative afin de pouvoir voter sur les dix milliards d'euros d'économies supplémentaires décidés par le gouverne… [+2562 chars],,fr,'Emmanuel Macron'
https://www.huffingtonpost.fr/politique/article/emmanuel-macron-souhaite-un-grenelle-sur-les-violences-des-mineurs-apres-celui-sur-les-violences-conjugales_232786.html,https://www.huffingtonpost.fr/politique/article/emmanuel-macron-souhaite-un-grenelle-sur-les-violences-des-mineurs-apres-celui-sur-les-violences-conjugales_232786.html,0,www.huffingtonpost.fr,Emmanuel Macron souhaite un Grenelle sur les violences des mineurs après celui sur les violences conjugales,"La mort de Shamseddine et la violente agression de Samara au début du mois, le gouvernement planche sur un format similaire à celui expérimenté en 2019.",https://huffpost-focus.sirius.press/2024/04/17/150/0/8061/4534/1820/1023/75/0/cfa730b_1713376230863-000-34nn77k.jpg,2024-04-17T17:59:41Z,,"POLITIQUE - Un format qui inspire le chef de lÉtat. Après plusieurs semaines marquées par des drames impliquant des actes de violences entre mineurs, Emmanuel Macron a décidé de prendre le problème à… [+2796 chars]",,fr,'Emmanuel Macron'
https://www.francetvinfo.fr/politique/emmanuel-macron/violence-des-mineurs-emmanuel-macron-a-demande-a-gabriel-attal-de-lancer-une-grande-concertation_6492491.html,https://www.francetvinfo.fr/politique/emmanuel-macron/violence-des-mineurs-emmanuel-macron-a-demande-a-gabriel-attal-de-lancer-une-grande-concertation_6492491.html,0,www.francetvinfo.fr,Violence des mineurs : Emmanuel Macron a demandé à Gabriel Attal de lancer une grande concertation,"Le président de la République veut que cette concertation commence jeudi, alors que plusieurs faits divers impliquant des jeunes ont marqué les esprits ces dernières semaines.",https://www.francetvinfo.fr/pictures/dPLr1MHfFjey6mpJBiGt1HXna-0/1500x843/2024/02/19/000-34j93mv-65d309ab0a2a5979821162.jpg,2024-04-17T18:00:14Z,,"Lors du Conseil des ministres de ce mercredi, Emmanuel Macron a demandé à Gabriel Attal de lancer une grande concertation sur la question de la violence des mineurs, a appris mercredi 17 avril le ser… [+1382 chars]",,fr,'président de la République'
https://www.huffingtonpost.fr/politique/article/europeennes-2024-jordan-bardella-demandera-la-dissolution-si-le-rn-est-en-tete-des-elections_232787.html,https://www.huffingtonpost.fr/politique/article/europeennes-2024-jordan-bardella-demandera-la-dissolution-si-le-rn-est-en-tete-des-elections_232787.html,0,www.huffingtonpost.fr,Européennes 2024 : Jordan Bardella demandera la dissolution si le RN est en tête des élections,La tête de liste du Rassemblement national veut dissoudre l’Assemblée nationale si l’extrême arrive devant la liste macroniste.,https://huffpost-focus.sirius.press/2024/04/17/0/0/5768/3244/1820/1023/75/0/94fa997_1713378489505-000-34m39yw.jpg,2024-04-17T18:31:04Z,,"POLITIQUE - La menace est là. Jordan Bardella, qui conduit la liste du RN pour les élections européennes, et Marine Le Pen ont indiqué ce mercredi 17 avril quils réclameraient une dissolution de lAss… [+2099 chars]",,fr,'Emmanuel Macron'
https://www.lemonde.fr/elections-europeennes/article/2024/04/17/elections-europeennes-emmanuel-macron-denonce-l-hypocrisie-du-rn_6228404_1168667.html,https://www.lemonde.fr/elections-europeennes/article/2024/04/17/elections-europeennes-emmanuel-macron-denonce-l-hypocrisie-du-rn_6228404_1168667.html,0,www.lemonde.fr,Elections européennes : Emmanuel Macron dénonce « l’hypocrisie » du RN,"Le chef de l’Etat a déploré mercredi depuis Bruxelles que les « peurs profitent aux réponses les plus simplistes » dans la campagne pour le scrutin du 9 juin, fustigeant ceux qui dénoncent l’Union européenne tout en engrangeant les « dividendes silencieux ».",https://img.lemde.fr/2024/04/17/0/0/7253/4835/1440/960/60/0/c3df941_5223520-01-06.jpg,2024-04-17T18:55:51Z,,"Le président français Emmanuel Macron (à droite), à côté de la présidente du groupe Renew Europe et tête de liste de Renaissance aux élections européennes Valérie Hayer (à gauche), sadresse à la pres… [+3375 chars]",,fr,'Emmanuel Macron'
https://www.liberation.fr/politique/emmanuel-macron-demande-un-grenelle-sur-la-violence-des-mineurs-20240417_46Q7UXUTMBABPKRFNDUCTHFLOM/,https://www.liberation.fr/politique/emmanuel-macron-demande-un-grenelle-sur-la-violence-des-mineurs-20240417_46Q7UXUTMBABPKRFNDUCTHFLOM/,0,www.liberation.fr,Emmanuel Macron demande un Grenelle sur la violence des mineurs,"Selon «le Parisien», le chef de l’Etat veut lancer une  grande concertation pour lutter contre les violences des mineurs. Le Premier ministre doit lancer «un cycle de concertations» pour cela a annoncé le Président en conseil des ministres.",https://www.liberation.fr/resizer/kh2Uthge4H2g0sFbwHaAaI3iwhA=/1200x630/filters:format(jpg):quality(70)/cloudfront-eu-central-1.images.arcpublishing.com/liberation/L2QDQXAIBBHJ5O7BYVIQKPC5XU.jpg,2024-04-17T19:32:00Z,,"Emmanuel Macron a demandé mercredi à son gouvernement de lancer une grande concertation pour trouver des solutions au «surgissement de lultraviolence», en particulier parmi les plus jeunes, après plu… [+2038 chars]",,fr,'Emmanuel Macron'
https://www.lemonde.fr/politique/article/2024/04/17/emmanuel-macron-demande-une-concertation-sur-la-violence-des-mineurs-avant-un-deplacement-de-gabriel-attal_6228407_823448.html,https://www.lemonde.fr/politique/article/2024/04/17/emmanuel-macron-demande-une-concertation-sur-la-violence-des-mineurs-avant-un-deplacement-de-gabriel-attal_6228407_823448.html,0,www.lemonde.fr,Emmanuel Macron demande une concertation sur la violence des mineurs avant un déplacement de Gabriel Attal,"« Le surgissement de l’ultraviolence (…) chez des citoyens de plus en plus jeunes, exige un travail de temps long », a déclaré le président, mercredi. Il a annoncé que le premier ministre lancera jeudi un « cycle de concertations » avec « tous les acteurs », …",https://img.lemde.fr/2024/04/17/3/0/3616/2410/1440/960/60/0/c378245_2024-04-17t181829z-1130352472-rc2i87a4v5kb-rtrmadp-3-eu-summit.JPG,2024-04-17T19:35:29Z,,"Après plusieurs événements tragiques impliquant des mineurs, Emmanuel Macron a demandé à son gouvernement de lancer une grande concertation pour trouver des solutions au « surgissement de lultraviole… [+1981 chars]",,fr,'Gabriel Attal'
https://www.francetvinfo.fr/elections/europeennes/elections-europeennes-emmanuel-macron-met-un-pied-dans-la-campagne-au-cote-de-valerie-hayer_6492698.html,https://www.francetvinfo.fr/elections/europeennes/elections-europeennes-emmanuel-macron-met-un-pied-dans-la-campagne-au-cote-de-valerie-hayer_6492698.html,0,www.francetvinfo.fr,Elections européennes : Emmanuel Macron met un pied dans la campagne au côté de Valérie Hayer,Le camp présidentiel est suspendu à son entrée en campagne pour donner un nouvel élan à Valérie Hayer.,https://www.francetvinfo.fr/pictures/_xmFBZU8C8mHkuTASP-638T9mMc/1500x843/2024/04/17/000-34pn2fb-662036dc0c530853848497.jpg,2024-04-17T20:54:43Z,,"Un échange en tête-à-tête, concentré et complice. Emmanuel Macron s'est affiché pour la première fois, mercredi 17 avril, à Bruxelles, au côté de la candidate de son camp aux élections européennes, V… [+1050 chars]",,fr,'Valérie Hayer'
