index,url,valid,domain,title,description,image,published,archive,content,quote,language,keyword
https://www.francetvinfo.fr/politique/gouvernement-de-michel-barnier/declaration-de-politique-generale-de-michel-barnier-pourquoi-le-gouvernement-va-avoir-du-mal-a-mener-des-reformes-d-ampleur_6797473.html,https://www.francetvinfo.fr/politique/gouvernement-de-michel-barnier/declaration-de-politique-generale-de-michel-barnier-pourquoi-le-gouvernement-va-avoir-du-mal-a-mener-des-reformes-d-ampleur_6797473.html,0,www.francetvinfo.fr,Déclaration de politique générale de Michel Barnier : pourquoi le gouvernement va avoir du mal à mener des réformes d'ampleur,"Sans majorité et avec une Assemblée divisée en trois blocs, le nouveau Premier ministre dispose d'une marge de manœuvre très réduite pour faire voter des textes.",https://www.francetvinfo.fr/pictures/ALTv-reV6iOSvQGUbxM4W_dTVzc/0x0:3840x2160/1500x843/2024/09/25/montage-barnier-budget-66f4047b8c9a0946055550.jpg,2024-10-01T03:58:00Z,https://web.archive.org/web/20241001045355/https://www.francetvinfo.fr/politique/gouvernement-de-michel-barnier/declaration-de-politique-generale-de-michel-barnier-pourquoi-le-gouvernement-va-avoir-du-mal-a-mener-des-reformes-d-ampleur_6797473.html,"""C'est un CDD de trois ou six mois."" Voilà résumée, dans la bouche d'un député LR, l'idée que se font de nombreux parlementaires d'un poste au gouvernement. Michel Barnier est finalement parvenu à co… [+7410 chars]",,fr,'Yaël Braun-Pivet'
https://www.lexpress.fr/monde/amerique/kamala-harris-sa-soeur-maya-si-secrete-et-pourtant-si-influente-HPPW46MCEFCIFJXZENV56MX4DI/,https://www.lexpress.fr/monde/amerique/kamala-harris-sa-soeur-maya-si-secrete-et-pourtant-si-influente-HPPW46MCEFCIFJXZENV56MX4DI/,0,www.lexpress.fr,"Kamala Harris : sa soeur Maya, si secrète et pourtant si influente","Sœur unique de la candidate démocrate, elle dirige toutes ses campagnes depuis vingt ans. Extrêmement influente, marquée à gauche, exigeante voire autoritaire, Maya joue un rôle central pour comprendre Kamala.",https://www.lexpress.fr/resizer/v2/HAQCPMFTBNBALLWLOBOMYYHVUQ.jpg?auth=ea1c9b5a3552da65f2300306130a721f3ac0840cf10599fa470a7d618ff2b5ca&width=1200&height=630&quality=85&focal=1828%2C1500,2024-10-01T04:15:00Z,http://archive.md/20241001161717/https://www.lexpress.fr/monde/amerique/kamala-harris-sa-soeur-maya-si-secrete-et-pourtant-si-influente-HPPW46MCEFCIFJXZENV56MX4DI/,"Ce soir-là, la conseillère de lombre a pris toute la lumière. Tailleur rose bonbon, menton haut, verbe tranchant. Une légère émotion dans la voix juste ce quil faut au moment dévoquer lhistoire ""si a… [+13109 chars]",,fr,'James Biden'
https://www.latribune.fr/economie/politique/declaration-de-politique-generale-nouvelle-heure-de-verite-pour-michel-barnier-1007797.html,https://www.latribune.fr/economie/politique/declaration-de-politique-generale-nouvelle-heure-de-verite-pour-michel-barnier-1007797.html,0,www.latribune.fr,Déclaration de politique générale : nouvelle heure de vérité pour Michel Barnier,"Impôts, immigration, proportionnelle : Michel Barnier descend dans l'arène ce mardi pour présenter sa feuille de route. Il n'en a jusqu'ici rien livré tant le point d'équilibre est difficile à trouver pour ce Premier ministre sans majorité, entre les exigence…",https://static.latribune.fr/full_width/2443024/michel-barnier-premier-ministre.jpg,2024-10-01T04:46:00Z,https://web.archive.org/web/20241001053327/https://www.latribune.fr/economie/politique/declaration-de-politique-generale-nouvelle-heure-de-verite-pour-michel-barnier-1007797.html,"C'est son premier grand oral. Près d'un mois après sa nomination, enfin doté d'un gouvernement, le Premier ministre Michel Barnier prononcera sa déclaration de politique générale (DPG) à 15h00 devant… [+4774 chars]",,fr,'Premier ministre'
https://www.lavenir.net/actu/monde/2024/10/01/lancien-president-americain-jimmy-carter-fete-ses-100-ans-R7WJBU6ZXNDOVGSPDVVYEZS3JU/,https://www.lavenir.net/actu/monde/2024/10/01/lancien-president-americain-jimmy-carter-fete-ses-100-ans-R7WJBU6ZXNDOVGSPDVVYEZS3JU/,0,www.lavenir.net,L’ancien président américain Jimmy Carter fête ses 100 ans,"Jimmy Carter célébrera ce mardi 1er octobre son centenaire à son domicile, dans la petite ville de Plains, où il bénéficie de soins de fin de vie depuis février 2023. ...",https://www.lavenir.net/resizer/v2/PSZVVTGV25BZBNZAQZMFIRAVMM.jpg?auth=2df1201e4a6192e4558c4ba914017b539cafe3ca142ea588fc02ed0823a64795&width=1200&height=630&quality=85&focal=980%2C612&watermark=https%3A%2F%2Fcloudfront-eu-central-1.images.arcpublishing.com%2Fipmgroup%2FUVYY255VT5BDBHOGCTGBCGI364.png%3A100%3A0%2C558,2024-10-01T05:54:18Z,https://web.archive.org/web/20241002015324/https://www.lavenir.net/actu/monde/2024/10/01/lancien-president-americain-jimmy-carter-fete-ses-100-ans-R7WJBU6ZXNDOVGSPDVVYEZS3JU/,"Né le 1er octobre 1924 dans cette petite bourgade rurale de Géorgie, d'environ 600 habitants, l'ancien dirigeant y avait un temps fait pousser de l'arachide avant de se tourner vers la politique.
Ap… [+1589 chars]",,fr,'Jimmy Carter'
https://www.lalibre.be/culture/musique/2024/10/01/bruce-springsteen-revient-en-europe-avec-un-concert-a-deux-pas-de-la-belgique-TELHYQYD4VFOJCE23Z46WS2RJQ/,https://www.lalibre.be/culture/musique/2024/10/01/bruce-springsteen-revient-en-europe-avec-un-concert-a-deux-pas-de-la-belgique-TELHYQYD4VFOJCE23Z46WS2RJQ/,0,www.lalibre.be,Bruce Springsteen revient en Europe avec un concert à deux pas de la Belgique,"Le célèbre chanteur va une nouvelle fois se produire sur le Vieux Continent. Après être venu à deux reprises à Werchter (en 2023 et 2024), il sera présent à Lille avec son groupe E Street Band en 2025. ...",https://www.lalibre.be/resizer/v2/H72PFGRMEZCPJBTACHMC2IBRZU.jpg?auth=1778e599baaabee73e97680442f89fa8842cdfcac873f7f07e023e359537e011&width=1200&height=630&quality=85&focal=2199%2C1466&watermark=https%3A%2F%2Fcloudfront-eu-central-1.images.arcpublishing.com%2Fipmgroup%2F3R4IDPARFVEO3L2LC5OCCXQ5RM.png%3A100%3A0%2C557,2024-10-01T06:00:02Z,http://archive.md/20241001061052/https://www.lalibre.be/culture/musique/2024/10/01/bruce-springsteen-revient-en-europe-avec-un-concert-a-deux-pas-de-la-belgique-TELHYQYD4VFOJCE23Z46WS2RJQ/,"À Werchter, Bruce Springsteen nous a rendus heureux d'être en viePas de date belge
D'autres dates européennes doivent être communiquées d'ici quelques heures mais il n'y aura pas de concert en Belgi… [+1366 chars]",,fr,'Bruce Springsteen'
https://www.dhnet.be/medias/musique/2024/10/01/bruce-springsteen-prolonge-sa-tournee-europeenne-il-ne-viendra-pas-en-belgique-mais-pas-loin-J3WXS2WTUFF3JEHAQO44ACAFB4/,https://www.dhnet.be/medias/musique/2024/10/01/bruce-springsteen-prolonge-sa-tournee-europeenne-il-ne-viendra-pas-en-belgique-mais-pas-loin-J3WXS2WTUFF3JEHAQO44ACAFB4/,0,www.dhnet.be,Bruce Springsteen prolonge sa tournée européenne: il ne viendra pas en Belgique... mais pas loin !,"Bruce Springsteen and The E Street Band prolonge leur tournée européenne 2025, mais il n'y aura pas de date prévue en Belgique. ...",https://www.dhnet.be/resizer/v2/IAZQNIAE3JBA5FSI7YX4XFLVLA.jpg?auth=246e12cfbbb656c0ca816cea404e6927cf144931de6945222de4381b80a150a5&width=1200&height=630&quality=85&focal=1535%2C1062&watermark=https%3A%2F%2Fcloudfront-eu-central-1.images.arcpublishing.com%2Fipmgroup%2FDZNGDE46VVGXRGHD3TEI5RB3GM.png%3A100%3A0%2C559,2024-10-01T06:04:06Z,https://web.archive.org/web/20241001072312/https://www.dhnet.be/medias/musique/2024/10/01/bruce-springsteen-prolonge-sa-tournee-europeenne-il-ne-viendra-pas-en-belgique-mais-pas-loin-J3WXS2WTUFF3JEHAQO44ACAFB4/,"Le groupe entamera à la fin du mois d'octobre sa tournée au Canada.
En 2025, Bruce Springsteen and The E Street Band se produiront également à Marseille, Prague et Milan notamment.
Les tickets pour… [+100 chars]",,fr,'Bruce Springsteen'
https://www.sudinfo.be/id890400/article/2024-10-01/lancien-president-americain-jimmy-carter-fete-ses-100-ans,https://www.sudinfo.be/id890400/article/2024-10-01/lancien-president-americain-jimmy-carter-fete-ses-100-ans,0,www.sudinfo.be,L’ancien président américain Jimmy Carter fête ses 100 ans,"Défilé aérien, concert, cérémonie: la petite ville de Plains, dans le sud-est des Etats-Unis, se prépare à fêter mardi en grande pompe les 100 ans de son «héros» Jimmy Carter, ancien président américain et prix Nobel de la Paix.",https://spgeng.rosselcdn.net/sites/default/files/dpistyles_v2/FirstImageUrl/2024/10/01/node_890400/55915065/public/2024/10/01/26826517.jpeg?itok=sRHlX49g1727762873,2024-10-01T06:07:31Z,https://web.archive.org/web/20241001112228/https://www.sudinfo.be/id890400/article/2024-10-01/lancien-president-americain-jimmy-carter-fete-ses-100-ans,"Né le 1er octobre 1924 dans cette petite bourgade rurale de Géorgie, denviron 600 habitants, lancien dirigeant y avait un temps fait pousser de larachide avant de se tourner vers la politique.
 Aprè… [+936 chars]",,fr,'Jimmy Carter'
https://www.sudinfo.be/id890407/article/2024-10-01/de-nouvelles-dates-pour-les-concerts-de-bruce-springsteen-dont-une,https://www.sudinfo.be/id890407/article/2024-10-01/de-nouvelles-dates-pour-les-concerts-de-bruce-springsteen-dont-une,0,www.sudinfo.be,"De nouvelles dates pour les concerts de Bruce Springsteen, dont une représentation à Lille","Bruce Springsteen and The E Street Band prolonge leur tournée européenne 2025, mais il n’y aura pas de date prévue en Belgique.",https://spgeng.rosselcdn.net/sites/default/files/dpistyles_v2/FirstImageUrl/2024/07/31/node_890407/55760522/public/2024/07/31/22226493.jpeg?itok=VEdePp5L1727763963,2024-10-01T06:25:57Z,https://web.archive.org/web/20241001072246/https://www.sudinfo.be/id890407/article/2024-10-01/de-nouvelles-dates-pour-les-concerts-de-bruce-springsteen-dont-une,"Bruce Springsteen and The E Street Band prolonge leur tournée européenne 2025, mais il ny aura pas de date prévue en Belgique.
Ils ajoutent sept nouveaux concerts et parmi eux une représentation à L… [+383 chars]",,fr,'Bruce Springsteen'
https://www.dhnet.be/medias/musique/2024/10/01/apres-avoir-joue-deux-annees-de-suite-a-werchter-bruce-springsteen-revient-en-2025-aux-portes-de-la-belgique-MYEPHHKIR5HRBLIC6DVRGPMYKI/,https://www.dhnet.be/medias/musique/2024/10/01/apres-avoir-joue-deux-annees-de-suite-a-werchter-bruce-springsteen-revient-en-2025-aux-portes-de-la-belgique-MYEPHHKIR5HRBLIC6DVRGPMYKI/,0,www.dhnet.be,"Après avoir joué deux années de suite à Werchter, Bruce Springsteen revient en 2025 aux portes de la Belgique","Bruce Springsteen bientôt de retour en Europe avec son groupe E Street Band: concert au stade Mauroy de Lille le 24 mai 2025, prévente ce lundi 7 octobre. ...",https://www.dhnet.be/resizer/v2/IAZQNIAE3JBA5FSI7YX4XFLVLA.jpg?auth=246e12cfbbb656c0ca816cea404e6927cf144931de6945222de4381b80a150a5&width=1200&height=630&quality=85&focal=1535%2C1062&watermark=https%3A%2F%2Fcloudfront-eu-central-1.images.arcpublishing.com%2Fipmgroup%2FDZNGDE46VVGXRGHD3TEI5RB3GM.png%3A100%3A0%2C559,2024-10-01T06:29:59Z,https://web.archive.org/web/20241001080716/https://www.dhnet.be/medias/musique/2024/10/01/apres-avoir-joue-deux-annees-de-suite-a-werchter-bruce-springsteen-revient-en-2025-aux-portes-de-la-belgique-MYEPHHKIR5HRBLIC6DVRGPMYKI/,"Pas de date belge
D'autres dates européennes doivent être communiquées d'ici quelques heures mais il n'y aura pas de concert en Belgique. Le samedi 31 mai, soit une semaine après Lille, le Boss se p… [+1453 chars]",,fr,'Bruce Springsteen'
https://www.lavenir.net/culture/musique/2024/10/01/bruce-springsteen-ajoute-7-nouvelles-dates-a-sa-tournee-europeenne-dont-un-concert-a-la-frontiere-belge-AVMXDHBIYFHPXBP6ON6CKS7PUQ/,https://www.lavenir.net/culture/musique/2024/10/01/bruce-springsteen-ajoute-7-nouvelles-dates-a-sa-tournee-europeenne-dont-un-concert-a-la-frontiere-belge-AVMXDHBIYFHPXBP6ON6CKS7PUQ/,0,www.lavenir.net,"Bruce Springsteen ajoute 7 nouvelles dates à sa tournée européenne, dont un concert à la frontière belge","Les fans belges de Bruce Springsteen vont encore avoir une nouvelle occasion de voir ""The Boss"" en concert. Le chanteur américain et son groupe ont ajouté 7 nouvelles dates à leur tournée européenne, dont une à Villeneuve-d'Ascq (Lille). Ce sera le 24 mai 202…",https://www.lavenir.net/resizer/v2/LGTNWY6IXREGBALR5MT5PRNPTY.jpg?auth=1a72f41d43f4f71a8075e350b344beb3e15e4c21d98222536a42e7d48f5f0aa8&width=1200&height=630&quality=85&focal=1316%2C877&watermark=https%3A%2F%2Fcloudfront-eu-central-1.images.arcpublishing.com%2Fipmgroup%2FUVYY255VT5BDBHOGCTGBCGI364.png%3A100%3A0%2C558,2024-10-01T06:37:00Z,https://web.archive.org/web/20241002020626/https://www.lavenir.net/culture/musique/2024/10/01/bruce-springsteen-ajoute-7-nouvelles-dates-a-sa-tournee-europeenne-dont-un-concert-a-la-frontiere-belge-AVMXDHBIYFHPXBP6ON6CKS7PUQ/,"Le groupe - qui vient de terminer sa tournée américaine avec une date à Asbury Park (New Jersey) - entamera à la fin du mois d'octobre sa tournée au Canada.
Le concert du Boss à Lille sera le 114e d… [+469 chars]",,fr,'Bruce Springsteen'
https://www.lalibre.be/international/asie/2024/10/01/kim-jong-un-risque-la-fin-de-son-regime-sil-utilise-larme-nucleaire-IEVC5WLJYNCDJBEUJ5HZYPUSJM/,https://www.lalibre.be/international/asie/2024/10/01/kim-jong-un-risque-la-fin-de-son-regime-sil-utilise-larme-nucleaire-IEVC5WLJYNCDJBEUJ5HZYPUSJM/,0,www.lalibre.be,"Kim Jong Un risque la ""fin de son régime"" s'il utilise l'arme nucléaire""","Kim Jong Un risquerait la fin de son régime s'il en venait à utiliser l'arme nucléaire contre la Corée du Sud, a déclaré le président sud-coréen Yoon Suk Yeol, lors d'un événement marquant l'anniversaire de la fondation des forces armées du pays. ...",https://www.lalibre.be/resizer/v2/TZSVIKX4SFHJ3DCQZWOJMXH6VM.jpg?auth=90d5207c808a1eb940f03871ae173b4af407eef40fd074d8cbe63c43e473cf9f&width=1200&height=630&quality=85&focal=2784%2C1856&watermark=https%3A%2F%2Fcloudfront-eu-central-1.images.arcpublishing.com%2Fipmgroup%2F3R4IDPARFVEO3L2LC5OCCXQ5RM.png%3A100%3A0%2C557,2024-10-01T06:54:55Z,https://web.archive.org/web/20241002011701/https://www.lalibre.be/international/asie/2024/10/01/kim-jong-un-risque-la-fin-de-son-regime-sil-utilise-larme-nucleaire-IEVC5WLJYNCDJBEUJ5HZYPUSJM/,"""Ce jour marquera la fin du régime nord-coréen"", a-t-il ajouté, soulignant la force de l'alliance de sécurité du pays avec les États-Unis, qui y stationnent des dizaines de milliers de soldats.
La C… [+1199 chars]",,fr,'Kim Yo Jong'
https://www.sudinfo.be/id890418/article/2024-10-01/la-nouvelle-qui-va-rejouir-les-fans-de-bruce-springsteen-de-bon-matin,https://www.sudinfo.be/id890418/article/2024-10-01/la-nouvelle-qui-va-rejouir-les-fans-de-bruce-springsteen-de-bon-matin,0,www.sudinfo.be,La nouvelle qui va réjouir les fans de Bruce Springsteen de bon matin !,"Bruce Springsteen (et son E Street Band) prolonge sa tournée européenne 2025. Pas de date en Belgique, mais une date à Lille.",https://spgeng.rosselcdn.net/sites/default/files/dpistyles_v2/FirstImageUrl/2024/10/01/node_890418/55915150/public/2024/10/01/26828518.jpeg?itok=AEoK8CI01727766403,2024-10-01T07:06:16Z,https://web.archive.org/web/20241001072249/https://www.sudinfo.be/id890418/article/2024-10-01/la-nouvelle-qui-va-rejouir-les-fans-de-bruce-springsteen-de-bon-matin,"Bruce Springsteen and The E Street Band prolonge leur tournée européenne 2025, mais il ny aura pas de date prévue en Belgique. Ils ajoutent sept nouveaux concerts et parmi eux une représentation à Li… [+475 chars]",,fr,'Bruce Springsteen'
https://www.20minutes.fr/sport/basketball/nba/4112920-20241001-nba-joie-pure-lebron-james-heureux-comme-jamais-entrainer-fiston-lakers,https://www.20minutes.fr/sport/basketball/nba/4112920-20241001-nba-joie-pure-lebron-james-heureux-comme-jamais-entrainer-fiston-lakers,0,www.20minutes.fr,NBA : « De la joie pure »… LeBron James heureux comme jamais de s’entraîner avec son fiston aux Lakers,"LeBron et Bronny James sont réunis pour participer au camp d'entraînement des Lakers, à un mois de la reprise de la NBA",https://img.20mn.fr/kt13-MyNTY6Tr9Sy0KYo9yk/1444x920_los-angeles-lakers-le-bron-james-right-looks-at-his-son-bronny-james-jr-during-the-nba-basketball-team-s-media-day-in-el-segundo-calif-monday-sept-30-2024-ap-photo-jae-c-hong-cajh116-24274770807719-2409302330,2024-10-01T07:10:38Z,,"Au nom du père, du fils et de la Sainte NBA. A moins dun mois de la reprise du basket aux Etats-Unis, la star LeBron James vit un rêve éveillé, celui de sentraîner avec son fils Bronny, avec lequel i… [+2342 chars]",,fr,'LeBron James'
https://www.lalibre.be/international/amerique/2024/10/01/lancien-president-americain-jimmy-carter-fete-ses-100-ans-QHTZ3MCU6JDQHLIAWWA5IGXBGM/,https://www.lalibre.be/international/amerique/2024/10/01/lancien-president-americain-jimmy-carter-fete-ses-100-ans-QHTZ3MCU6JDQHLIAWWA5IGXBGM/,0,www.lalibre.be,L'ancien président américain Jimmy Carter fête ses 100 ans,"Défilé aérien, concert, cérémonie: la petite ville de Plains, dans le sud-est des Etats-Unis, se prépare à fêter mardi en grande pompe les 100 ans de son ""héros"" Jimmy Carter, ancien président américain et prix Nobel de la Paix. ...",https://www.lalibre.be/resizer/v2/VPTAEWCIGZHCPFFPMPCJCYRELM.jpg?auth=6b655b8de506e6ebf7ca9067482999ce61c61894ff7ef8e3229e6fb406b281bf&width=1200&height=630&quality=85&focal=1100%2C734&watermark=https%3A%2F%2Fcloudfront-eu-central-1.images.arcpublishing.com%2Fipmgroup%2F3R4IDPARFVEO3L2LC5OCCXQ5RM.png%3A100%3A0%2C557,2024-10-01T08:22:56Z,https://web.archive.org/web/20241002011805/https://www.lalibre.be/international/amerique/2024/10/01/lancien-president-americain-jimmy-carter-fete-ses-100-ans-QHTZ3MCU6JDQHLIAWWA5IGXBGM/,"Après son départ de la Maison Blanche, battu dans sa tentative de réélection par le candidat républicain Ronald Reagan, il est retourné y vivre et célébrera mardi en famille son centenaire à son domi… [+3338 chars]",,fr,'Jimmy Carter'
https://www.lepoint.fr/politique/etat-de-droit-bruno-retailleau-denonce-une-instrumentalisation-de-ses-propos-01-10-2024-2571597_20.php,https://www.lepoint.fr/politique/etat-de-droit-bruno-retailleau-denonce-une-instrumentalisation-de-ses-propos-01-10-2024-2571597_20.php,0,www.lepoint.fr,« État de droit » : Bruno Retailleau dénonce une instrumentalisation de ses propos,"Le ministre de l'Interieur, pris au coeur d'une polemique apres deux interviews dimanche, s'est fendu d'un communique pour repreciser sa pensee.",https://static.lpnt.fr/images/2024/10/01/26881456lpw-26881467-mega-une-jpg_10555191.jpg,2024-10-01T10:05:00Z,https://web.archive.org/web/20241001112504/https://www.lepoint.fr/politique/etat-de-droit-bruno-retailleau-denonce-une-instrumentalisation-de-ses-propos-01-10-2024-2571597_20.php,"Il regrette de « faux débats ». Bruno Retailleau, le nouveau ministre de l'Intérieur du gouvernement de Michel Barnier, a déclaré ce mardi 1er octobre que l'État de droit est au « fondement de notre … [+3990 chars]",,fr,'Bruno Retailleau'
https://www.courrierinternational.com/article/etats-unis-a-100-ans-jimmy-carter-n-a-pas-encore-dit-son-dernier-mot_222829,https://www.courrierinternational.com/article/etats-unis-a-100-ans-jimmy-carter-n-a-pas-encore-dit-son-dernier-mot_222829,0,www.courrierinternational.com,"À 100 ans, Jimmy Carter n’a pas encore dit son dernier mot",L’ancien président démocrate célèbre ce 1er octobre son centenaire et entre dans l’histoire en tant que premier locataire de la Maison-Blanche avec une telle longévité. Il ne compte pas en rester là et espère bien glisser un bulletin dans l’urne le 5 novembre…,https://focus.courrierinternational.com/2024/09/28/0/0/3943/2628/1200/630/60/0/5a23dde_2174256644.jpg,2024-10-01T10:05:59Z,https://web.archive.org/web/20241001113719/https://www.courrierinternational.com/article/etats-unis-a-100-ans-jimmy-carter-n-a-pas-encore-dit-son-dernier-mot_222829,"Lorsque Jimmy Carter a commencé les soins palliatifs dans sa maison de Géorgie lannée dernière, sa famille et ses amis pensaient quil ne lui restait que quelques jours à vivre. Plus de dix-neuf mois … [+1856 chars]",,fr,'Jimmy Carter'
https://www.camer.be/86670/26:23/lex-president-francais-nicolas-sarkozy-declare-persona-non-grata-au-cameroun-cameroon.html,https://www.camer.be/86670/26:23/lex-president-francais-nicolas-sarkozy-declare-persona-non-grata-au-cameroun-cameroon.html,0,www.camer.be,L’ex-président français Nicolas Sarkozy déclaré persona non grata au Cameroun :: CAMEROON,"La rumeur d’une visite au Cameroun de l’ex-président français,
en tant qu&#039;avocat d’affaires, se fait de plus en plus persistante.
Aussi, le cabinet Intermède, s...",https://www.camer.be/storage/photos/shares/Monde/Nicolas-Sarkozy270924500.jpg,2024-10-01T10:09:45Z,,"La rumeur d’une visite au Cameroun de l’ex-président français, en tant qu'avocat d’affaires, se fait de plus en plus persistante. Aussi, le cabinet Intermède, structure de lobbying et de prestations … [+2154 chars]",,fr,'Paul Biya'
https://www.konbini.com/lifestyle/la-belle-image-de-la-reprise-nba-lebron-james-et-son-fils-coequipier-bronny-se-chamaillent-en-conference-de-presse/,https://www.konbini.com/lifestyle/la-belle-image-de-la-reprise-nba-lebron-james-et-son-fils-coequipier-bronny-se-chamaillent-en-conference-de-presse/,0,www.konbini.com,La belle image de la reprise NBA : LeBron James et son fils/coéquipier Bronny se chamaillent en conférence de presse,"La NBA fait sa rentrée. Avant le début de la saison, toutes les franchises organisent leur journée presse et celle des Los Angeles Lakers ce lundi était une des plus attendues à cause de LeBron...",https://cdn-www.konbini.com/files/2024/10/LeBron-James-Bronny-James-Lakers.jpg,2024-10-01T10:35:48Z,,"La NBA fait sa rentrée. Avant le début de la saison, toutes les franchises organisent leur journée presse et celle des Los Angeles Lakers ce lundi était une des plus attendues à cause de LeBron James… [+894 chars]",,fr,'LeBron James'
https://www.dhnet.be/medias/cinema/2024/10/01/que-penser-de-joker-folie-a-deux-avec-lady-gaga-le-film-le-plus-attendu-de-la-mostra-decouvrez-notre-critique-NBC67A6M5NEGTONEIXTFH2R4WE/,https://www.dhnet.be/medias/cinema/2024/10/01/que-penser-de-joker-folie-a-deux-avec-lady-gaga-le-film-le-plus-attendu-de-la-mostra-decouvrez-notre-critique-NBC67A6M5NEGTONEIXTFH2R4WE/,0,www.dhnet.be,"Que penser de ""Joker : folie à deux"" avec Lady Gaga, le film le plus attendu de la Mostra? Découvrez notre critique","Mercredi soir, accompagnées du réalisateur Todd Phillips, les deux stars américaines présentaient le film le plus attendu de cette 81e édition du Festival de Venise. La suite, cinq ans après, de “Joker”, Lion d’or 2019, avant de dépasser le milliard de dollar…",https://www.dhnet.be/resizer/v2/QVPE543J3ZES3GUPNNYIB3IKIA.jpg?auth=6a8355df3ad9ef40043efd8fe8375ce8b04b9fc94cb5d5c3a7b7a1531265ced3&width=1200&height=630&quality=85&focal=1771%2C925&watermark=https%3A%2F%2Fcloudfront-eu-central-1.images.arcpublishing.com%2Fipmgroup%2FDZNGDE46VVGXRGHD3TEI5RB3GM.png%3A100%3A0%2C559,2024-10-01T11:47:45Z,,"Toute l'actu de la 81e Mostra de VeniseIntitulée Joker : folie à deux (en français dans le texte), celle-ci a été dévoilée mercredi soir en Compétition de la 81e Mostra de Venise. Et Joaquin Phoenix … [+3948 chars]",,fr,'Bradley Cooper'
https://www.lavenir.net/actu/monde/2024/10/01/michel-barnier-sexprime-devant-lassemblee-nationale-la-veritable-epee-de-damocles-cest-notre-dette-qui-est-colossale-D2WBHPUAGJF2HLVLJXTOOFSLKM/,https://www.lavenir.net/actu/monde/2024/10/01/michel-barnier-sexprime-devant-lassemblee-nationale-la-veritable-epee-de-damocles-cest-notre-dette-qui-est-colossale-D2WBHPUAGJF2HLVLJXTOOFSLKM/,0,www.lavenir.net,"Michel Barnier s'exprime devant l'Assemblée nationale: ""La véritable épée de Damoclès, c'est notre dette"" qui est ""colossale""",Le Premier ministre Michel Barnier effectue sa déclaration très attendue de politique générale devant les députés de l'Assemblée nationale ce mardi 1er octobre 2024. ...,https://www.lavenir.net/resizer/v2/XW6EMCNLQ5FF7NRSEE35IOD37A.jpg?auth=5609da7643b48e24ec980267a09665ca5d69fab3a372e9bf7a42dbf8b6ff74c7&width=1200&height=630&quality=85&focal=1860%2C1240&watermark=https%3A%2F%2Fcloudfront-eu-central-1.images.arcpublishing.com%2Fipmgroup%2FUVYY255VT5BDBHOGCTGBCGI364.png%3A100%3A0%2C558,2024-10-01T13:33:58Z,https://web.archive.org/web/20241002015200/https://www.lavenir.net/actu/monde/2024/10/01/michel-barnier-sexprime-devant-lassemblee-nationale-la-veritable-epee-de-damocles-cest-notre-dette-qui-est-colossale-D2WBHPUAGJF2HLVLJXTOOFSLKM/,"""Nous sommes collectivement sur une ligne de crête"". Le  Premier ministre françasi Michel Barnier s'est pour la première fois exprimé mardi devant l'Assemblée nationale, en prononçant une déclaration… [+7247 chars]",,fr,'Premier ministre'
