index,url,valid,domain,title,description,image,published,archive,content,quote,language,keyword
https://www.lemonde.fr/international/live/2024/10/11/en-direct-le-carnet-de-campagne-de-l-election-presidentielle-americaine_6348289_3210.html,https://www.lemonde.fr/international/live/2024/10/11/en-direct-le-carnet-de-campagne-de-l-election-presidentielle-americaine_6348289_3210.html,0,www.lemonde.fr,"En direct, le carnet de campagne de l’élection présidentielle américaine","A Detroit, la capitale de l’industrie automobile dans le Michigan, Donald Trump a mené une offensive protectionniste. Kamala Harris s’est, elle, rendue dans le Nevada et l’Arizona où elle a cherché à engranger le soutien latino et amérindien.",https://img.lemde.fr/2024/10/11/1077/2/6452/3226/1440/720/60/0/26a7d66_5931024-01-06.jpg,2024-10-11T04:40:22Z,,"Donald Trump a déclaré sur son réseau Truth Social que CBS devrait perdre sa licence après la diffusion sur ses antennes dun entretien réalisé avec Kamala Harris.
Accusant la chaîne américaine de pe… [+2933 chars]",,fr,'Kamala Harris'
https://iphoneaddict.fr/post/news-395350-apple-don-secours-apres-devastations-louragan-milton,https://iphoneaddict.fr/post/news-395350-apple-don-secours-apres-devastations-louragan-milton,0,iphoneaddict.fr,Apple va faire un don pour les secours après les dévastations de l’ouragan Milton,"Apple a annoncé il y a quelques heures son intention de faire un don (d’un montant non divulgué) aux secours et personnels humanitaires pour les personnes touchées par l’ouragan Milton. Tim Cook a annoncé ce don sur son compte X, comme cela est le cas pour ch…",https://static.iphoneaddict.fr/wp-content/uploads/2024/10/Milton.jpg,2024-10-11T07:45:40Z,,Apple a annoncé il y a quelques heures son intention de faire un don (d’un montant non divulgué) aux secours et personnels humanitaires pour les personnes touchées par l’ouragan Milton. Tim Cook a an… [+1125 chars],,fr,'Tim Cook'
https://www.lemonde.fr/international/live/2024/10/11/en-direct-presidentielle-americaine-les-dernieres-informations-et-les-reponses-a-vos-questions_6348289_3210.html,https://www.lemonde.fr/international/live/2024/10/11/en-direct-presidentielle-americaine-les-dernieres-informations-et-les-reponses-a-vos-questions_6348289_3210.html,0,www.lemonde.fr,"En direct, présidentielle américaine : les dernières informations et les réponses à vos questions","A Detroit, la capitale de l’industrie automobile dans le Michigan, Donald Trump a tenu un discours assez protectionniste. Kamala Harris s’est, elle, rendue dans le Nevada et l’Arizona pour engranger le soutien de l’électorat latino et amérindien.",https://img.lemde.fr/2024/09/13/250/0/3000/1500/1440/720/60/0/147cc1a_1726223722219-us-2024-whitehouse-istock.jpg,2024-10-11T07:58:20Z,,"Donald Trump a déclaré sur son réseau Truth Social que CBS devrait perdre sa licence après la diffusion sur ses antennes dun entretien réalisé avec Kamala Harris.
Accusant la chaîne américaine de pe… [+2933 chars]",,fr,'Kamala Harris'
https://www.lemonde.fr/international/live/2024/10/11/en-direct-presidentielle-americaine-pourquoi-donald-trump-fait-il-campagne-dans-des-etats-qu-il-n-a-aucune-chance-de-gagner_6348289_3210.html,https://www.lemonde.fr/international/live/2024/10/11/en-direct-presidentielle-americaine-pourquoi-donald-trump-fait-il-campagne-dans-des-etats-qu-il-n-a-aucune-chance-de-gagner_6348289_3210.html,0,www.lemonde.fr,"En direct, présidentielle américaine : pourquoi Donald Trump fait-il campagne dans des Etats qu’il n’a aucune chance de gagner ?","Le chemin vers la Maison Blanche passe par les sept « swing states » qui peuvent basculer dans un camp comme dans l’autre. A moins d’un mois de l’élection, l’équipe de Donald Trump a pourtant annoncé des meetings dans trois Etats très loin d’être compétitifs.",https://img.lemde.fr/2024/09/13/250/0/3000/1500/1440/720/60/0/a007b98_1726222160944-us-2024-trump-harris2-afp.jpg,2024-10-11T11:55:21Z,,"Donald Trump a déclaré sur son réseau Truth Social que CBS devrait perdre sa licence après la diffusion sur ses antennes dun entretien réalisé avec Kamala Harris.
Accusant la chaîne américaine de pe… [+2933 chars]",,fr,'Donald Trump'
https://www.courrierinternational.com/article/vu-de-russie-ukraine-boris-johnson-donne-enfin-sa-version-sur-les-fameux-accords-d-istanbul_223303,https://www.courrierinternational.com/article/vu-de-russie-ukraine-boris-johnson-donne-enfin-sa-version-sur-les-fameux-accords-d-istanbul_223303,0,www.courrierinternational.com,"Ukraine : Boris Johnson donne, enfin, sa version sur les fameux “accords d’Istanbul”","Dans son autobiographie parue le 10 octobre au Royaume-Uni, l’ancien Premier ministre britannique livre sa version sur un épisode particulièrement controversé – et instrumentalisé par Moscou – du début de la guerre en Ukraine.",https://focus.courrierinternational.com/2024/10/10/1/0/7997/5331/1200/630/60/0/a3c1637_afp-36jt9wg.jpg,2024-10-11T12:52:32Z,http://archive.md/20241013045111/https://www.courrierinternational.com/article/vu-de-russie-ukraine-boris-johnson-donne-enfin-sa-version-sur-les-fameux-accords-d-istanbul_223303,"Depuis le jeudi 10 octobre, louvrage autobiographique de Boris Johnson intitulé Unleashed (que lon peut traduire par Déchaîné) est disponible dans les librairies du Royaume-Uni. Parue aux éditions Ha… [+1029 chars]",,fr,'Boris Johnson'
https://www.courrierinternational.com/une/une-du-jour-viktor-orban-argentier-de-l-extreme-droite-europeenne_223289,https://www.courrierinternational.com/une/une-du-jour-viktor-orban-argentier-de-l-extreme-droite-europeenne_223289,0,www.courrierinternational.com,"Viktor Orban, argentier de l’extrême droite européenne","Après Marine Le Pen en 2022, Viktor Orban épaule le parti espagnol Vox et le FPÖ autrichien par l’intermédiaire de la banque d’un oligarque proche du dirigeant hongrois. L’hebdomadaire “HVG” se penche sur cette stratégie visant à “favoriser la poussée des nat…",https://focus.courrierinternational.com/2024/10/11/145/0/435/290/1200/630/60/0/92f0f9f_1728642335905-01994415-0003-4b22-8868-13ab7a2f5529-1.jpg,2024-10-11T13:52:37Z,,"Orban, le banquier de lextrême droite européenne, tacle le sous-titre de couverture de HVG du 10 octobre 2024. Le magazine joue avec les mots et souligne la montée des extrêmes en Europe en titrant U… [+2444 chars]",,fr,'Matteo Salvini'
https://www.lexpress.fr/economie/politique-economique/seduire-les-agences-de-notation-lautre-defi-du-gouvernement-barnier-ORUTFX7IQRCIVCUBN6WPSBHYRA/,https://www.lexpress.fr/economie/politique-economique/seduire-les-agences-de-notation-lautre-defi-du-gouvernement-barnier-ORUTFX7IQRCIVCUBN6WPSBHYRA/,0,www.lexpress.fr,"Séduire les agences de notation, l’autre défi du gouvernement Barnier","Au lendemain de la présentation du projet de loi de finances, l’agence de notation Fitch mettra à jour ce vendredi soir la note de crédit de la France. Moody’s se prononcera dans deux semaines.",https://www.lexpress.fr/resizer/v2/WYFXK6RXWBCXLFDYNE23WUTYWU.jpg?auth=d5d7484d7a8ae741021a43f28e1778ec3f229bf75dba3ef170244973b9f1d205&width=1200&height=630&quality=85&focal=705%2C314,2024-10-11T14:36:15Z,http://archive.md/20241011212729/https://www.lexpress.fr/economie/politique-economique/seduire-les-agences-de-notation-lautre-defi-du-gouvernement-barnier-ORUTFX7IQRCIVCUBN6WPSBHYRA/,"A peine présenté le projet de loi de finances pour 2025, le gouvernement Barnier se confronte dès ce vendredi soir à un premier test. Fitch communiquera, après clôture de Wall Street, la mise à jour … [+5464 chars]",,fr,'nan nan'
https://www.sudinfo.be/id895934/article/2024-10-11/bonne-nouvelle-pour-les-fans-bruce-springsteen-ajoute-une-deuxieme-date-lille-le,https://www.sudinfo.be/id895934/article/2024-10-11/bonne-nouvelle-pour-les-fans-bruce-springsteen-ajoute-une-deuxieme-date-lille-le,0,www.sudinfo.be,"Bonne nouvelle pour les fans : Bruce Springsteen ajoute une deuxième date à Lille, le 27 mai","Un deuxième concert de Bruce Springsteen est programmée au Stade Pierre Mauroy de Lille, le 27 mai. L’artiste ne jouera pas en Belgique mais les Belges représentent plus de 30 % du public de la première date (samedi 24 mai 2025) prévue à Lille.",https://spgeng.rosselcdn.net/sites/default/files/dpistyles_v2/FirstImageUrl/2024/10/01/node_895934/55944403/public/2024/10/01/26828518.jpeg?itok=AEoK8CI01728658837,2024-10-11T15:00:00Z,,"Springsteen ne jouera pas en Belgique dans le cadre de sa tournée européenne. Mais il ne faudra pas aller très loin pour aller applaudir le « boss » : il se produira à Lille, au Stade Pierre Mauroy, … [+233 chars]",,fr,'Bruce Springsteen'
https://www.lavenir.net/culture/musique/2024/10/11/bruce-sprinsgteen-annonce-une-nouvelle-date-de-concert-a-lille-I5UUNKYP5JC3HBZDYW5AWOWI6Y/,https://www.lavenir.net/culture/musique/2024/10/11/bruce-sprinsgteen-annonce-une-nouvelle-date-de-concert-a-lille-I5UUNKYP5JC3HBZDYW5AWOWI6Y/,0,www.lavenir.net,Bruce Sprinsgteen annonce une nouvelle date de concert à Lille,Bonne nouvelle pour les fans de Bruce Springsteen qui n’avaient pas réussi à se procurer de billets pour la venue du “Boss” à Lille fin mai 2025 : une nouvelle date est programmée. ...,https://www.lavenir.net/resizer/v2/GZS7HCE32VAOTNS24CQTEZGCQY.jpg?auth=e514625742715c7dd94bf344184562600d530f24a231f35a8d3142e47f077a45&width=1200&height=630&quality=85&focal=2132%2C616&watermark=https%3A%2F%2Fcloudfront-eu-central-1.images.arcpublishing.com%2Fipmgroup%2FUVYY255VT5BDBHOGCTGBCGI364.png%3A100%3A0%2C558,2024-10-11T15:00:00Z,,"Springsteen sera en effet sur la scène du Stade Pierre Mauroy de Lille fin mai 2025. Une première date, le 24 mai était prévue depuis le début du mois d'octobre, et environ 30 % des billets ont d'ail… [+550 chars]",,fr,'Bruce Springsteen'
https://www.lesoir.be/628785/article/2024-10-11/bruce-springsteen-ajoute-une-nouvelle-date-lille,https://www.lesoir.be/628785/article/2024-10-11/bruce-springsteen-ajoute-une-nouvelle-date-lille,0,www.lesoir.be,Bruce Springsteen ajoute une nouvelle date à Lille,"Le Boss montera sur scène le mardi 27 mai 2025 au Stade Pierre Mauroy de Lille, après une première date déjà prévue le samedi 24 mai.",https://leseng.rosselcdn.net/sites/default/files/dpistyles_v2/ena_16_9_extra_big/2024/10/11/node_628785/31632875/public/2024/10/11/27464547.jpeg?itok=iepYQekD1728658854,2024-10-11T15:00:00Z,,"Un deuxième concert de Bruce Springsteen est annoncé au Stade Pierre Mauroy de Lille. Le Boss montera sur scène le mardi 27 mai 2025, après une première date déjà prévue le samedi 24 mai.
À lire aus… [+363 chars]",,fr,'Bruce Springsteen'
https://www.dhnet.be/medias/musique/2024/10/11/la-passe-de-deux-pour-bruce-springsteen-a-lille-GCDOWQP4RFHRLPDUHQQCXRA3MU/,https://www.dhnet.be/medias/musique/2024/10/11/la-passe-de-deux-pour-bruce-springsteen-a-lille-GCDOWQP4RFHRLPDUHQQCXRA3MU/,0,www.dhnet.be,La passe de deux pour Bruce Springsteen à Lille,Le Boss gâte ses fans même si les Belges devront faire le déplacement pour l’applaudir. ...,https://www.dhnet.be/resizer/v2/IAZQNIAE3JBA5FSI7YX4XFLVLA.jpg?auth=246e12cfbbb656c0ca816cea404e6927cf144931de6945222de4381b80a150a5&width=1200&height=630&quality=85&focal=1535%2C1062&watermark=https%3A%2F%2Fcloudfront-eu-central-1.images.arcpublishing.com%2Fipmgroup%2FDZNGDE46VVGXRGHD3TEI5RB3GM.png%3A100%3A0%2C559,2024-10-11T15:33:56Z,,"L'an prochain, le Boss sillonnera à nouveau l'Europe avec son E Street Band. Après avoir squatté la plaine de Werchter en juin 2023 et en juillet 2024, le chanteur fait l'impasse sur la Belgique. Cel… [+1027 chars]",,fr,'Bruce Springsteen'
https://www.ledauphine.com/faits-divers-justice/2024/10/11/affaire-diddy-le-point-sur-les-rumeurs-et-les-stars-(vraiment)-impliquees,https://www.ledauphine.com/faits-divers-justice/2024/10/11/affaire-diddy-le-point-sur-les-rumeurs-et-les-stars-(vraiment)-impliquees,0,www.ledauphine.com,Violences sexuelles. Affaire Diddy : le point sur les rumeurs et les stars (vraiment) impliquées,"Le rappeur Sean « Diddy » Combs (anciennement Puff Daddy) sera jugé le 5 mai 2025. Soirées « freak off », Justin Bieber, Beyoncé, Kamala Harris... Le point sur les accusations... et les nombreuses rumeurs.",https://cdn-s-www.ledauphine.com/images/BBFD7AF3-EB80-4CCD-8343-88D6B1E5CEC2/FB1200/photo-1728647141.jpg,2024-10-11T16:20:00Z,,"Linfluent rappeur et producteur Sean « Diddy » Combs sera jugé le 5 mai 2025, a annoncé ce jeudi le juge Arun Subramanian, de Manhattan. La star internationale est au cur dune affaire tentaculaire, a… [+9921 chars]",,fr,'Jimmy Carter'
https://www.20minutes.fr/monde/election-presidentielle-americaine/4115228-20241012-election-americaine-2024-trump-prend-nouveau-migrants-harris-tente-encore-seduire-electeurs-moderes,https://www.20minutes.fr/monde/election-presidentielle-americaine/4115228-20241012-election-americaine-2024-trump-prend-nouveau-migrants-harris-tente-encore-seduire-electeurs-moderes,0,www.20minutes.fr,"Election américaine 2024 : Trump s’en prend à nouveau aux migrants, Harris tente encore de séduire les électeurs modérés","Donald Trump promet la « libération » d’une « Amérique occupée » par la criminalité liée aux migrants s’il est réélu. De son côté, Kamala Harris, cherche à séduire centristes et modérés",https://img.20mn.fr/UnvJrSCJRNGpNC_KjBAJyik/1444x920_this-combination-photo-shows-democratic-presidential-nominee-vice-president-kamala-harris-at-a-rally-in-flint-mich-oct-4-2024-left-and-republican-presidential-nominee-former-president-donald-trump-at-a-campaign-rally-in-walker-mich-sept-27-2024-ap-photo-wx506-24280680729904-combination-photo-no-sales-2410070605,2024-10-12T00:05:07Z,,"Donald Trump a de nouveau intensifié sa rhétorique anti-immigration, promettant lors dun meeting au Colorado que son retour à la Maison Blanche marquerait la « libération » dune « Amérique occupée ».… [+2700 chars]",,fr,'Donald Trump'
https://www.lemonde.fr/international/live/2024/10/12/presidentielle-americaine-le-geste-de-kamala-harris-les-discours-antimigrants-de-donald-trump-ce-qu-il-ne-fallait-pas-rater_6348289_3210.html,https://www.lemonde.fr/international/live/2024/10/12/presidentielle-americaine-le-geste-de-kamala-harris-les-discours-antimigrants-de-donald-trump-ce-qu-il-ne-fallait-pas-rater_6348289_3210.html,0,www.lemonde.fr,"Présidentielle américaine : le geste de Kamala Harris, les discours antimigrants de Donald Trump... Ce qu’il ne fallait pas rater","La candidate démocrate a promis de nommer un ou une ministre du parti républicain en cas de victoire le 5 novembre, mais aussi de créer à la Maison Blanche un conseil mixte, constitué de représentants des deux camps.",https://img.lemde.fr/2024/10/11/0/0/3033/1516/1440/720/60/0/98aef5b_2024-10-11t201053z-1012564210-rc2giaatkan4-rtrmadp-3-usa-election-harris.JPG,2024-10-12T05:37:17Z,,"Donald Trump était jeudi à Detroit, la capitale de lindustrie automobile dans le Michigan, où devant un groupe économique, il a mené une offensive protectionniste. Il y a dénoncé le fait que les Etat… [+2354 chars]",,fr,'Donald Trump'
https://atlantico.fr/article/decryptage/varoufakis-vs-hollande-qui-a-vraiment-sauve-la-grece-en-2015-europe-dette-bce-union-europeenne-crise-financiere-jean-luc-demarty,https://atlantico.fr/article/decryptage/varoufakis-vs-hollande-qui-a-vraiment-sauve-la-grece-en-2015-europe-dette-bce-union-europeenne-crise-financiere-jean-luc-demarty,0,atlantico.fr,Varoufakis vs Hollande : qui a vraiment sauvé la Grèce en 2015 ?,"François Holland estime qu'il a ""sauvé la Grèce"" lors de la crise de 2015 en ""dépit des efforts"" de Yanis Varoufakis, l'ancien ministre des Finances grec.",https://atlantico.codexcdn.net/assets/as9YTtPcHu52WgjpM.jpg?width=650&height=500&quality=75,2024-10-12T07:47:46Z,,"Jean-Luc Demarty est ancien Directeur Général du Commerce Extérieur de la Commission Européenne (2011-2019), ancien Directeur Général Adjoint et Directeur Général de l'Agriculture de la Commission Eu… [+93 chars]",,fr,'Yanis Varoufakis'
https://www.lalibre.be/international/europe/guerre-ukraine-russie/2024/10/12/certains-militaires-se-posent-des-questions-poutine-devrait-se-mefier-de-son-etat-major-ZUBM3OMUPFFABFXCDE7VHNP5KM/,https://www.lalibre.be/international/europe/guerre-ukraine-russie/2024/10/12/certains-militaires-se-posent-des-questions-poutine-devrait-se-mefier-de-son-etat-major-ZUBM3OMUPFFABFXCDE7VHNP5KM/,0,www.lalibre.be,"""Certains militaires se posent des questions, Poutine devrait se méfier de son état-major""","Anne Godart (UMons) voit approcher un ""moment de basculement"", que Vladimir Poutine garde en ligne de mire. ...",https://www.lalibre.be/resizer/v2/JYIBKITAGNCTHLUTLSQTPOZXRY.png?auth=5339793ba4d2869f3b4ed2cbd3503240b11a5d58d8410854773631a313cfb5aa&width=1200&height=630&quality=85&focal=420%2C280&watermark=https%3A%2F%2Fcloudfront-eu-central-1.images.arcpublishing.com%2Fipmgroup%2F3R4IDPARFVEO3L2LC5OCCXQ5RM.png%3A100%3A0%2C557,2024-10-12T09:45:00Z,,"Quelle attitude va adopter Vladimir Poutine par rapport au sommet de Ramnstein qui devait initialement se tenir ce samedi mais qui a été repoussé ?
Il est certain qu'il va suivre de près tout ce qui… [+10866 chars]",,fr,'Vladimir Poutine'
https://www.20minutes.fr/high-tech/by-the-web/4115247-20241012-marionnette-zelensky-pro-immigration-bots-anti-kamala-harris-proliferent-x,https://www.20minutes.fr/high-tech/by-the-web/4115247-20241012-marionnette-zelensky-pro-immigration-bots-anti-kamala-harris-proliferent-x,0,www.20minutes.fr,"« Marionnette » de Zelensky, « pro-immigration »… Les bots anti-Kamala Harris prolifèrent sur X","Ces comptes diffusent massivement de la propagande favorable au Kremlin, des contenus soutenant Donald Trump et de fausses informations concernant Kamala Harris",https://img.20mn.fr/Nd02nIR2Rb6qA-4Kn0JS_yk/1444x920_in-this-photo-illustration-a-web-browser-displays-the-url-www-twitter-com-while-displaying-x-com-on-may-18-2024-in-the-social-media-platform-formerly-known-as-twitter-transitioned-to-x-com-ur-ls-elon-musk-acquired-twitter-in-2022-and-promptly-rebranded-the-company-as-x-yassine-mahjoub-sipa-mahjoubyassine-mahjoub2176-credit-yassine-mahjoub-sipa-2405181446,2024-10-12T10:00:26Z,,"Ils prolifèrent depuis quelques semaines. Des centaines de « bots » pro-russes diffusent des fausses informations sur la candidate démocrate à lélection présidentielle américaine, Kamala Harris sur l… [+2702 chars]",,fr,'nan nan'
https://www.liberation.fr/international/amerique/presidentielle-americaine-kamala-harris-joue-la-carte-de-lage-face-a-donald-trump-20241012_5RI76I7CBFEYBDWYUKUP6WGXJE/,https://www.liberation.fr/international/amerique/presidentielle-americaine-kamala-harris-joue-la-carte-de-lage-face-a-donald-trump-20241012_5RI76I7CBFEYBDWYUKUP6WGXJE/,0,www.liberation.fr,Présidentielle américaine : Kamala Harris joue la carte de l’âge face à Donald Trump,"La candidate démocrate, âgée de 59 ans, voudrait lancer un débat sur les facultés physiques et l’acuité mentale du Républicain, âgé de 78 ans. Mais selon les sondages, l’âge de Trump n’est pas un sujet pour les électeurs.",https://www.liberation.fr/resizer/XMKOeq_mLL5wxbpLtmfGasGyTGE=/1200x630/filters:format(jpg):quality(70):focal(932x1116:942x1126)/cloudfront-eu-central-1.images.arcpublishing.com/liberation/GMGJOVIC5FEWJJ7IDXXB7XGIFM.jpg,2024-10-12T10:23:33Z,,"Lâge de Donald Trump, un argument de campagne pour Kamala Harris ? Agée de 59 ans, la vice-présidente va publier samedi un rapport médical concluant quelle a «la résistance physique et mentale nécess… [+2096 chars]",,fr,'Donald Trump'
https://www.liberation.fr/international/europe/navalny-en-prison-je-mourrai-ici-il-ny-aura-personne-a-qui-dire-au-revoir-20241012_6ZLMTGAO2JFKNCVLR33VBE3EMA/,https://www.liberation.fr/international/europe/navalny-en-prison-je-mourrai-ici-il-ny-aura-personne-a-qui-dire-au-revoir-20241012_6ZLMTGAO2JFKNCVLR33VBE3EMA/,0,www.liberation.fr,"Navalny en prison : «Je mourrai ici, il n’y aura personne à qui dire au revoir»","Avant la publication d’un livre le 22 octobre, le magazine «The New Yorker» publie des extraits, lucides et poignants, du journal de prison de l’opposant russe mort empoisonné en février dans une geôle de Poutine.",https://www.liberation.fr/resizer/uCIwbZ7eUu5ng5akwuaDW2tqTl4=/1200x630/filters:format(jpg):quality(70):focal(2017x2329:2027x2339)/cloudfront-eu-central-1.images.arcpublishing.com/liberation/A2WT2GZRUJHYNBGJK4M6WEDXGE.jpg,2024-10-12T14:01:27Z,,"Il ne se faisait guère dillusion sur son sort et de lissue ultime qui lattendait. «Je passerai le restant de mes jours en prison et je mourrai ici», écrivait en mars 2022 Alexeï Navalny, selon des ex… [+4535 chars]",,fr,'Poutine'
https://www.huffingtonpost.fr/international/article/pourquoi-la-russie-ajoute-ces-journalistes-etrangers-a-sa-liste-des-personnes-recherchees_240794.html,https://www.huffingtonpost.fr/international/article/pourquoi-la-russie-ajoute-ces-journalistes-etrangers-a-sa-liste-des-personnes-recherchees_240794.html,0,www.huffingtonpost.fr,Pourquoi la Russie ajoute ces journalistes étrangers à sa « liste des personnes recherchées »,Une dizaine de journalistes étrangers sont accusés par le régime de Vladimir Poutine d’être entrés illégalement en Russie début août.,https://huffpost-focus.sirius.press/2024/10/12/302/0/3758/2113/1820/1023/75/0/11463e4_1728736683650-000-9pu62n.jpg,2024-10-12T14:45:10Z,,"INTERNATIONAL - Ces dernières semaines, la Russie a multiplié les enquêtes contre des journalistes étrangers. Une dizaine dentre eux sont ainsi accusés davoir pénétré dans le pays lors de lavancée de… [+4103 chars]",,fr,'Poutine'
https://www.bfmtv.com/international/asie/coree-nord/coree-du-nord-la-soeur-de-kim-jong-un-menace-seoul-accuse-d-envoyer-des-drones-charges-de-propagande_AD-202410120421.html,https://www.bfmtv.com/international/asie/coree-nord/coree-du-nord-la-soeur-de-kim-jong-un-menace-seoul-accuse-d-envoyer-des-drones-charges-de-propagande_AD-202410120421.html,0,www.bfmtv.com,"Corée du Nord: la soeur de Kim Jong Un menace Séoul, accusé d'envoyer des drones chargés de propagande","Kim Yo Jong, l'une des porte-parole les plus importantes du régime nord-coréen, a averti la Corée du Sud d'un ""horrible désastre"" si Séoul continuait à envoyer des drones chargés de propagande.",https://images.bfmtv.com/A8UQIDV5ORCjZEQPWXvP9Mi5wtU=/0x40:768x472/768x0/images/Kim-Yo-Jong-soeur-du-dirigeant-nord-coreen-Kim-Jong-Un-le-2-mars-2019-lors-dune-visite-officielle-a-Hanoi-au-Vietnam-374682.jpg,2024-10-12T19:28:24Z,,"Kim Yo Jong, l'une des porte-parole les plus importantes du régime nord-coréen, a averti la Corée du Sud d'un ""horrible désastre"" si Séoul continuait à envoyer des drones chargés de propagande.
L'in… [+2347 chars]",,fr,'Kim Yo Jong'
https://rmcsport.bfmtv.com/football/equipe-portugal/portugal-le-beau-geste-de-cristiano-ronaldo-qui-permet-a-un-envahisseur-de-terrain-de-faire-son-selfie_AV-202410120461.html,https://rmcsport.bfmtv.com/football/equipe-portugal/portugal-le-beau-geste-de-cristiano-ronaldo-qui-permet-a-un-envahisseur-de-terrain-de-faire-son-selfie_AV-202410120461.html,0,rmcsport.bfmtv.com,Portugal: le beau geste de Cristiano Ronaldo qui permet à un envahisseur de terrain de faire son selfie,"Alors qu'il s'apprêtait à se faire sortir par les stadiers, ce jeune intrus a eu la chance de pouvoir faire un selfie avec Cristiano Ronaldo, samedi soir en pleine rencontre entre le Portugal et la Pologne. Un moment dont il se souviendra longtemps.",https://images.bfmtv.com/QzcLuwvsLu2syjuWDeS92rc5xwk=/0x20:2048x1172/images/Cristiano-Ronaldo-1955470.jpg,2024-10-12T22:14:33Z,,"Alors qu'il s'apprêtait à se faire sortir par les stadiers, ce jeune intrus a eu la chance de pouvoir faire un selfie avec Cristiano Ronaldo, samedi soir en pleine rencontre entre le Portugal et la P… [+1310 chars]",,fr,'Cristiano Ronaldo'
https://www.lalibre.be/international/amerique/elections-us/2024/10/13/presidentielle-americaine-a-la-rencontre-des-270-000-americains-qui-detiennent-le-sort-de-donald-trump-et-kamala-harris-S4LSNZTOBZDLHL6TBOMMUEVK3I/,https://www.lalibre.be/international/amerique/elections-us/2024/10/13/presidentielle-americaine-a-la-rencontre-des-270-000-americains-qui-detiennent-le-sort-de-donald-trump-et-kamala-harris-S4LSNZTOBZDLHL6TBOMMUEVK3I/,0,www.lalibre.be,Présidentielle américaine : à la rencontre des 270 000 Américains qui détiennent le sort de Donald Trump et Kamala Harris,"Le comté d’Érié, dans le nord-ouest de cet État clé, a voté pour les vainqueurs des élections présidentielles depuis 2008. Donald Trump y était en meeting fin septembre. Kamala Harris s'y rend ce 14 octobre. Qui choisira-t-il en novembre ? ...",https://www.lalibre.be/resizer/v2/5MASZRTTYBF3VMWHP5Z6LAVUHY.jpg?auth=bdba9b4d315984378bdd7121c498117f40a7d8d3b316cab328dd2b45ee3fa59f&width=1200&height=630&quality=85&focal=4128%2C2752&watermark=https%3A%2F%2Fcloudfront-eu-central-1.images.arcpublishing.com%2Fipmgroup%2F3R4IDPARFVEO3L2LC5OCCXQ5RM.png%3A100%3A0%2C557,2024-10-13T09:44:27Z,,"Mélange de zones urbaines, industrielles, rurales et résidentielles, ce territoire a un super-pouvoir : ses habitants ont voté pour tous les vainqueurs des élections présidentielles ces seize dernièr… [+5527 chars]",,fr,'James Biden'
